,state,Latitude,Longitude,question_id,poll_id,cycle,pollster_id,pollster,sponsor_ids,sponsors,display_name,pollster_rating_id,pollster_rating_name,fte_grade,sample_size,population,population_full,methodology,office_type,start_date,end_date,sponsor_candidate,internal,partisan,tracking,nationwide_batch,created_at,notes,url,stage,party,answer,candidate_id,candidate_name,pct,Date
0,Alabama,32.806671,-86.79113000000001,93813.0,57768.0,2020.0,1365.0,Change Research,,,Change Research,48.0,Change Research,C,1200.0,lv,lv-d,Online,U.S. President,3/20/19,3/23/19,,False,,False,False,3/26/19 22:13,,https://docsend.com/view/ursdyec,primary,DEM,Buttigieg,13345.0,Pete Buttigieg,3.0,2019-03-20
1,Alabama,32.806671,-86.79113000000001,119495.0,64693.0,2020.0,1515.0,Data for Progress,,,Data for Progress,522.0,Data for Progress,B/C,237.0,lv,lv-d,Online/Text,U.S. President,2/27/20,3/2/20,,False,,False,False,3/3/20 06:21,,https://www.dataforprogress.org/memos/super-tuesday-final-polling,primary,DEM,Bloomberg,13289.0,Michael Bloomberg,18.0,2020-02-27
2,Alabama,32.806671,-86.79113000000001,119495.0,64693.0,2020.0,1515.0,Data for Progress,,,Data for Progress,522.0,Data for Progress,B/C,237.0,lv,lv-d,Online/Text,U.S. President,2/27/20,3/2/20,,False,,False,False,3/3/20 06:21,,https://www.dataforprogress.org/memos/super-tuesday-final-polling,primary,DEM,Buttigieg,13345.0,Pete Buttigieg,0.0,2020-02-27
3,Alabama,32.806671,-86.79113000000001,119495.0,64693.0,2020.0,1515.0,Data for Progress,,,Data for Progress,522.0,Data for Progress,B/C,237.0,lv,lv-d,Online/Text,U.S. President,2/27/20,3/2/20,,False,,False,False,3/3/20 06:21,,https://www.dataforprogress.org/memos/super-tuesday-final-polling,primary,DEM,Steyer,13327.0,Tom Steyer,0.0,2020-02-27
4,Alabama,32.806671,-86.79113000000001,119495.0,64693.0,2020.0,1515.0,Data for Progress,,,Data for Progress,522.0,Data for Progress,B/C,237.0,lv,lv-d,Online/Text,U.S. President,2/27/20,3/2/20,,False,,False,False,3/3/20 06:21,,https://www.dataforprogress.org/memos/super-tuesday-final-polling,primary,DEM,Gabbard,13343.0,Tulsi Gabbard,2.0,2020-02-27
5,Alabama,32.806671,-86.79113000000001,93813.0,57768.0,2020.0,1365.0,Change Research,,,Change Research,48.0,Change Research,C,1200.0,lv,lv-d,Online,U.S. President,3/20/19,3/23/19,,False,,False,False,3/26/19 22:13,,https://docsend.com/view/ursdyec,primary,DEM,Warren,13258.0,Elizabeth Warren,6.0,2019-03-20
6,Alabama,32.806671,-86.79113000000001,93813.0,57768.0,2020.0,1365.0,Change Research,,,Change Research,48.0,Change Research,C,1200.0,lv,lv-d,Online,U.S. President,3/20/19,3/23/19,,False,,False,False,3/26/19 22:13,,https://docsend.com/view/ursdyec,primary,DEM,Klobuchar,13310.0,Amy Klobuchar,1.0,2019-03-20
7,Alabama,32.806671,-86.79113000000001,93813.0,57768.0,2020.0,1365.0,Change Research,,,Change Research,48.0,Change Research,C,1200.0,lv,lv-d,Online,U.S. President,3/20/19,3/23/19,,False,,False,False,3/26/19 22:13,,https://docsend.com/view/ursdyec,primary,DEM,Yang,13329.0,Andrew Yang,1.0,2019-03-20
8,Alabama,32.806671,-86.79113000000001,93813.0,57768.0,2020.0,1365.0,Change Research,,,Change Research,48.0,Change Research,C,1200.0,lv,lv-d,Online,U.S. President,3/20/19,3/23/19,,False,,False,False,3/26/19 22:13,,https://docsend.com/view/ursdyec,primary,DEM,Castro,13316.0,Julián Castro,1.0,2019-03-20
9,Alabama,32.806671,-86.79113000000001,93813.0,57768.0,2020.0,1365.0,Change Research,,,Change Research,48.0,Change Research,C,1200.0,lv,lv-d,Online,U.S. President,3/20/19,3/23/19,,False,,False,False,3/26/19 22:13,,https://docsend.com/view/ursdyec,primary,DEM,Moulton,13322.0,Seth Moulton,1.0,2019-03-20
10,Alabama,32.806671,-86.79113000000001,119495.0,64693.0,2020.0,1515.0,Data for Progress,,,Data for Progress,522.0,Data for Progress,B/C,237.0,lv,lv-d,Online/Text,U.S. President,2/27/20,3/2/20,,False,,False,False,3/3/20 06:21,,https://www.dataforprogress.org/memos/super-tuesday-final-polling,primary,DEM,Biden,13256.0,Joseph R. Biden Jr.,47.0,2020-02-27
11,Alabama,32.806671,-86.79113000000001,99478.0,58691.0,2020.0,1193.0,SurveyMonkey,132,NBC News,SurveyMonkey,324.0,SurveyMonkey,D-,257.0,rv,rv-d,Online,U.S. President,7/2/19,7/16/19,,False,,False,False,7/19/19 08:49,,https://www.documentcloud.org/documents/6206538-NBC-News-SurveyMonkey-Alabama-Poll-7-19.html,primary,DEM,Biden,13256.0,Joseph R. Biden Jr.,36.0,2019-07-02
12,Alabama,32.806671,-86.79113000000001,93813.0,57768.0,2020.0,1365.0,Change Research,,,Change Research,48.0,Change Research,C,1200.0,lv,lv-d,Online,U.S. President,3/20/19,3/23/19,,False,,False,False,3/26/19 22:13,,https://docsend.com/view/ursdyec,primary,DEM,Inslee,13324.0,Jay Robert Inslee,0.0,2019-03-20
13,Alabama,32.806671,-86.79113000000001,93813.0,57768.0,2020.0,1365.0,Change Research,,,Change Research,48.0,Change Research,C,1200.0,lv,lv-d,Online,U.S. President,3/20/19,3/23/19,,False,,False,False,3/26/19 22:13,,https://docsend.com/view/ursdyec,primary,DEM,Gillibrand,13311.0,Kirsten E. Gillibrand,0.0,2019-03-20
14,Alabama,32.806671,-86.79113000000001,93813.0,57768.0,2020.0,1365.0,Change Research,,,Change Research,48.0,Change Research,C,1200.0,lv,lv-d,Online,U.S. President,3/20/19,3/23/19,,False,,False,False,3/26/19 22:13,,https://docsend.com/view/ursdyec,primary,DEM,Hickenlooper,13326.0,John Hickenlooper,0.0,2019-03-20
15,Alabama,32.806671,-86.79113000000001,93813.0,57768.0,2020.0,1365.0,Change Research,,,Change Research,48.0,Change Research,C,1200.0,lv,lv-d,Online,U.S. President,3/20/19,3/23/19,,False,,False,False,3/26/19 22:13,,https://docsend.com/view/ursdyec,primary,DEM,de Blasio,13335.0,Bill de Blasio,0.0,2019-03-20
16,Alabama,32.806671,-86.79113000000001,93813.0,57768.0,2020.0,1365.0,Change Research,,,Change Research,48.0,Change Research,C,1200.0,lv,lv-d,Online,U.S. President,3/20/19,3/23/19,,False,,False,False,3/26/19 22:13,,https://docsend.com/view/ursdyec,primary,DEM,Messam,13357.0,Wayne Messam,0.0,2019-03-20
17,Alabama,32.806671,-86.79113000000001,93812.0,57768.0,2020.0,1365.0,Change Research,,,Change Research,48.0,Change Research,C,1200.0,lv,lv-d,Online,U.S. President,3/20/19,3/23/19,,False,,False,False,3/26/19 22:13,,https://docsend.com/view/ursdyec,primary,DEM,Buttigieg,13345.0,Pete Buttigieg,4.0,2019-03-20
18,Alabama,32.806671,-86.79113000000001,93813.0,57768.0,2020.0,1365.0,Change Research,,,Change Research,48.0,Change Research,C,1200.0,lv,lv-d,Online,U.S. President,3/20/19,3/23/19,,False,,False,False,3/26/19 22:13,,https://docsend.com/view/ursdyec,primary,DEM,Bullock,13320.0,Steve Bullock,0.0,2019-03-20
19,Alabama,32.806671,-86.79113000000001,93813.0,57768.0,2020.0,1365.0,Change Research,,,Change Research,48.0,Change Research,C,1200.0,lv,lv-d,Online,U.S. President,3/20/19,3/23/19,,False,,False,False,3/26/19 22:13,,https://docsend.com/view/ursdyec,primary,DEM,Cuomo,13313.0,Andrew Cuomo,0.0,2019-03-20
20,Alabama,32.806671,-86.79113000000001,93813.0,57768.0,2020.0,1365.0,Change Research,,,Change Research,48.0,Change Research,C,1200.0,lv,lv-d,Online,U.S. President,3/20/19,3/23/19,,False,,False,False,3/26/19 22:13,,https://docsend.com/view/ursdyec,primary,DEM,Delaney,13314.0,John K. Delaney,0.0,2019-03-20
21,Alabama,32.806671,-86.79113000000001,93813.0,57768.0,2020.0,1365.0,Change Research,,,Change Research,48.0,Change Research,C,1200.0,lv,lv-d,Online,U.S. President,3/20/19,3/23/19,,False,,False,False,3/26/19 22:13,,https://docsend.com/view/ursdyec,primary,DEM,Gabbard,13343.0,Tulsi Gabbard,0.0,2019-03-20
22,Alabama,32.806671,-86.79113000000001,93813.0,57768.0,2020.0,1365.0,Change Research,,,Change Research,48.0,Change Research,C,1200.0,lv,lv-d,Online,U.S. President,3/20/19,3/23/19,,False,,False,False,3/26/19 22:13,,https://docsend.com/view/ursdyec,primary,DEM,Bennet,13352.0,Michael F. Bennet,0.0,2019-03-20
23,Alabama,32.806671,-86.79113000000001,119495.0,64693.0,2020.0,1515.0,Data for Progress,,,Data for Progress,522.0,Data for Progress,B/C,237.0,lv,lv-d,Online/Text,U.S. President,2/27/20,3/2/20,,False,,False,False,3/3/20 06:21,,https://www.dataforprogress.org/memos/super-tuesday-final-polling,primary,DEM,Warren,13258.0,Elizabeth Warren,12.0,2020-02-27
24,Alabama,32.806671,-86.79113000000001,119495.0,64693.0,2020.0,1515.0,Data for Progress,,,Data for Progress,522.0,Data for Progress,B/C,237.0,lv,lv-d,Online/Text,U.S. President,2/27/20,3/2/20,,False,,False,False,3/3/20 06:21,,https://www.dataforprogress.org/memos/super-tuesday-final-polling,primary,DEM,Klobuchar,13310.0,Amy Klobuchar,0.0,2020-02-27
25,Alabama,32.806671,-86.79113000000001,93812.0,57768.0,2020.0,1365.0,Change Research,,,Change Research,48.0,Change Research,C,1200.0,lv,lv-d,Online,U.S. President,3/20/19,3/23/19,,False,,False,False,3/26/19 22:13,,https://docsend.com/view/ursdyec,primary,DEM,Warren,13258.0,Elizabeth Warren,12.0,2019-03-20
26,Alabama,32.806671,-86.79113000000001,93812.0,57768.0,2020.0,1365.0,Change Research,,,Change Research,48.0,Change Research,C,1200.0,lv,lv-d,Online,U.S. President,3/20/19,3/23/19,,False,,False,False,3/26/19 22:13,,https://docsend.com/view/ursdyec,primary,DEM,Booker,13287.0,Cory A. Booker,14.0,2019-03-20
27,Alabama,32.806671,-86.79113000000001,93812.0,57768.0,2020.0,1365.0,Change Research,,,Change Research,48.0,Change Research,C,1200.0,lv,lv-d,Online,U.S. President,3/20/19,3/23/19,,False,,False,False,3/26/19 22:13,,https://docsend.com/view/ursdyec,primary,DEM,Harris,13288.0,Kamala D. Harris,16.0,2019-03-20
28,Alabama,32.806671,-86.79113000000001,93812.0,57768.0,2020.0,1365.0,Change Research,,,Change Research,48.0,Change Research,C,1200.0,lv,lv-d,Online,U.S. President,3/20/19,3/23/19,,False,,False,False,3/26/19 22:13,,https://docsend.com/view/ursdyec,primary,DEM,O'Rourke,13276.0,Beto O'Rourke,17.0,2019-03-20
29,Alabama,32.806671,-86.79113000000001,93812.0,57768.0,2020.0,1365.0,Change Research,,,Change Research,48.0,Change Research,C,1200.0,lv,lv-d,Online,U.S. President,3/20/19,3/23/19,,False,,False,False,3/26/19 22:13,,https://docsend.com/view/ursdyec,primary,DEM,Sanders,13257.0,Bernard Sanders,27.0,2019-03-20
30,Alabama,32.806671,-86.79113000000001,93812.0,57768.0,2020.0,1365.0,Change Research,,,Change Research,48.0,Change Research,C,1200.0,lv,lv-d,Online,U.S. President,3/20/19,3/23/19,,False,,False,False,3/26/19 22:13,,https://docsend.com/view/ursdyec,primary,DEM,Klobuchar,13310.0,Amy Klobuchar,2.0,2019-03-20
31,Alabama,32.806671,-86.79113000000001,93812.0,57768.0,2020.0,1365.0,Change Research,,,Change Research,48.0,Change Research,C,1200.0,lv,lv-d,Online,U.S. President,3/20/19,3/23/19,,False,,False,False,3/26/19 22:13,,https://docsend.com/view/ursdyec,primary,DEM,Hickenlooper,13326.0,John Hickenlooper,1.0,2019-03-20
32,Alabama,32.806671,-86.79113000000001,93812.0,57768.0,2020.0,1365.0,Change Research,,,Change Research,48.0,Change Research,C,1200.0,lv,lv-d,Online,U.S. President,3/20/19,3/23/19,,False,,False,False,3/26/19 22:13,,https://docsend.com/view/ursdyec,primary,DEM,Yang,13329.0,Andrew Yang,1.0,2019-03-20
33,Alabama,32.806671,-86.79113000000001,93812.0,57768.0,2020.0,1365.0,Change Research,,,Change Research,48.0,Change Research,C,1200.0,lv,lv-d,Online,U.S. President,3/20/19,3/23/19,,False,,False,False,3/26/19 22:13,,https://docsend.com/view/ursdyec,primary,DEM,Castro,13316.0,Julián Castro,1.0,2019-03-20
34,Alabama,32.806671,-86.79113000000001,119495.0,64693.0,2020.0,1515.0,Data for Progress,,,Data for Progress,522.0,Data for Progress,B/C,237.0,lv,lv-d,Online/Text,U.S. President,2/27/20,3/2/20,,False,,False,False,3/3/20 06:21,,https://www.dataforprogress.org/memos/super-tuesday-final-polling,primary,DEM,Sanders,13257.0,Bernard Sanders,22.0,2020-02-27
35,Alabama,32.806671,-86.79113000000001,93812.0,57768.0,2020.0,1365.0,Change Research,,,Change Research,48.0,Change Research,C,1200.0,lv,lv-d,Online,U.S. President,3/20/19,3/23/19,,False,,False,False,3/26/19 22:13,,https://docsend.com/view/ursdyec,primary,DEM,Gabbard,13343.0,Tulsi Gabbard,1.0,2019-03-20
36,Alabama,32.806671,-86.79113000000001,93812.0,57768.0,2020.0,1365.0,Change Research,,,Change Research,48.0,Change Research,C,1200.0,lv,lv-d,Online,U.S. President,3/20/19,3/23/19,,False,,False,False,3/26/19 22:13,,https://docsend.com/view/ursdyec,primary,DEM,Inslee,13324.0,Jay Robert Inslee,1.0,2019-03-20
37,Alabama,32.806671,-86.79113000000001,93812.0,57768.0,2020.0,1365.0,Change Research,,,Change Research,48.0,Change Research,C,1200.0,lv,lv-d,Online,U.S. President,3/20/19,3/23/19,,False,,False,False,3/26/19 22:13,,https://docsend.com/view/ursdyec,primary,DEM,Delaney,13314.0,John K. Delaney,1.0,2019-03-20
38,Alabama,32.806671,-86.79113000000001,93812.0,57768.0,2020.0,1365.0,Change Research,,,Change Research,48.0,Change Research,C,1200.0,lv,lv-d,Online,U.S. President,3/20/19,3/23/19,,False,,False,False,3/26/19 22:13,,https://docsend.com/view/ursdyec,primary,DEM,Williamson,13350.0,Marianne Williamson,0.0,2019-03-20
39,Alabama,32.806671,-86.79113000000001,93812.0,57768.0,2020.0,1365.0,Change Research,,,Change Research,48.0,Change Research,C,1200.0,lv,lv-d,Online,U.S. President,3/20/19,3/23/19,,False,,False,False,3/26/19 22:13,,https://docsend.com/view/ursdyec,primary,DEM,Messam,13357.0,Wayne Messam,0.0,2019-03-20
40,Alabama,32.806671,-86.79113000000001,93813.0,57768.0,2020.0,1365.0,Change Research,,,Change Research,48.0,Change Research,C,1200.0,lv,lv-d,Online,U.S. President,3/20/19,3/23/19,,False,,False,False,3/26/19 22:13,,https://docsend.com/view/ursdyec,primary,DEM,Biden,13256.0,Joseph R. Biden Jr.,42.0,2019-03-20
41,Alabama,32.806671,-86.79113000000001,93813.0,57768.0,2020.0,1365.0,Change Research,,,Change Research,48.0,Change Research,C,1200.0,lv,lv-d,Online,U.S. President,3/20/19,3/23/19,,False,,False,False,3/26/19 22:13,,https://docsend.com/view/ursdyec,primary,DEM,Sanders,13257.0,Bernard Sanders,13.0,2019-03-20
42,Alabama,32.806671,-86.79113000000001,93813.0,57768.0,2020.0,1365.0,Change Research,,,Change Research,48.0,Change Research,C,1200.0,lv,lv-d,Online,U.S. President,3/20/19,3/23/19,,False,,False,False,3/26/19 22:13,,https://docsend.com/view/ursdyec,primary,DEM,Harris,13288.0,Kamala D. Harris,12.0,2019-03-20
43,Alabama,32.806671,-86.79113000000001,93813.0,57768.0,2020.0,1365.0,Change Research,,,Change Research,48.0,Change Research,C,1200.0,lv,lv-d,Online,U.S. President,3/20/19,3/23/19,,False,,False,False,3/26/19 22:13,,https://docsend.com/view/ursdyec,primary,DEM,O'Rourke,13276.0,Beto O'Rourke,10.0,2019-03-20
44,Alabama,32.806671,-86.79113000000001,93813.0,57768.0,2020.0,1365.0,Change Research,,,Change Research,48.0,Change Research,C,1200.0,lv,lv-d,Online,U.S. President,3/20/19,3/23/19,,False,,False,False,3/26/19 22:13,,https://docsend.com/view/ursdyec,primary,DEM,Booker,13287.0,Cory A. Booker,9.0,2019-03-20
45,Alabama,32.806671,-86.79113000000001,93812.0,57768.0,2020.0,1365.0,Change Research,,,Change Research,48.0,Change Research,C,1200.0,lv,lv-d,Online,U.S. President,3/20/19,3/23/19,,False,,False,False,3/26/19 22:13,,https://docsend.com/view/ursdyec,primary,DEM,Gillibrand,13311.0,Kirsten E. Gillibrand,1.0,2019-03-20
46,Alabama,32.806671,-86.79113000000001,93813.0,57768.0,2020.0,1365.0,Change Research,,,Change Research,48.0,Change Research,C,1200.0,lv,lv-d,Online,U.S. President,3/20/19,3/23/19,,False,,False,False,3/26/19 22:13,,https://docsend.com/view/ursdyec,primary,DEM,Williamson,13350.0,Marianne Williamson,0.0,2019-03-20
47,Alabama,32.806671,-86.79113000000001,93813.0,57768.0,2020.0,1365.0,Change Research,,,Change Research,48.0,Change Research,C,1200.0,lv,lv-d,Online,U.S. President,3/20/19,3/23/19,,False,,False,False,3/26/19 22:13,,https://docsend.com/view/ursdyec,primary,DEM,Swalwell,13328.0,Eric Swalwell,0.0,2019-03-20
48,Alabama,32.806671,-86.79113000000001,99478.0,58691.0,2020.0,1193.0,SurveyMonkey,132,NBC News,SurveyMonkey,324.0,SurveyMonkey,D-,257.0,rv,rv-d,Online,U.S. President,7/2/19,7/16/19,,False,,False,False,7/19/19 08:49,,https://www.documentcloud.org/documents/6206538-NBC-News-SurveyMonkey-Alabama-Poll-7-19.html,primary,DEM,Klobuchar,13310.0,Amy Klobuchar,0.0,2019-07-02
49,Alabama,32.806671,-86.79113000000001,99478.0,58691.0,2020.0,1193.0,SurveyMonkey,132,NBC News,SurveyMonkey,324.0,SurveyMonkey,D-,257.0,rv,rv-d,Online,U.S. President,7/2/19,7/16/19,,False,,False,False,7/19/19 08:49,,https://www.documentcloud.org/documents/6206538-NBC-News-SurveyMonkey-Alabama-Poll-7-19.html,primary,DEM,O'Rourke,13276.0,Beto O'Rourke,1.0,2019-07-02
50,Alabama,32.806671,-86.79113000000001,99478.0,58691.0,2020.0,1193.0,SurveyMonkey,132,NBC News,SurveyMonkey,324.0,SurveyMonkey,D-,257.0,rv,rv-d,Online,U.S. President,7/2/19,7/16/19,,False,,False,False,7/19/19 08:49,,https://www.documentcloud.org/documents/6206538-NBC-News-SurveyMonkey-Alabama-Poll-7-19.html,primary,DEM,Delaney,13314.0,John K. Delaney,1.0,2019-07-02
51,Alabama,32.806671,-86.79113000000001,99478.0,58691.0,2020.0,1193.0,SurveyMonkey,132,NBC News,SurveyMonkey,324.0,SurveyMonkey,D-,257.0,rv,rv-d,Online,U.S. President,7/2/19,7/16/19,,False,,False,False,7/19/19 08:49,,https://www.documentcloud.org/documents/6206538-NBC-News-SurveyMonkey-Alabama-Poll-7-19.html,primary,DEM,Castro,13316.0,Julián Castro,0.0,2019-07-02
52,Alabama,32.806671,-86.79113000000001,99478.0,58691.0,2020.0,1193.0,SurveyMonkey,132,NBC News,SurveyMonkey,324.0,SurveyMonkey,D-,257.0,rv,rv-d,Online,U.S. President,7/2/19,7/16/19,,False,,False,False,7/19/19 08:49,,https://www.documentcloud.org/documents/6206538-NBC-News-SurveyMonkey-Alabama-Poll-7-19.html,primary,DEM,Ryan,13358.0,Tim Ryan,0.0,2019-07-02
53,Alabama,32.806671,-86.79113000000001,99478.0,58691.0,2020.0,1193.0,SurveyMonkey,132,NBC News,SurveyMonkey,324.0,SurveyMonkey,D-,257.0,rv,rv-d,Online,U.S. President,7/2/19,7/16/19,,False,,False,False,7/19/19 08:49,,https://www.documentcloud.org/documents/6206538-NBC-News-SurveyMonkey-Alabama-Poll-7-19.html,primary,DEM,Gabbard,13343.0,Tulsi Gabbard,0.0,2019-07-02
54,Alabama,32.806671,-86.79113000000001,119473.0,64671.0,2020.0,1522.0,Swayable,,,Swayable,543.0,Swayable,,949.0,lv,lv-d,Online,U.S. President,3/1/20,3/2/20,,False,,False,False,3/3/20 06:18,,https://swayable.com/insights/democratic-primaries-2020-super-tuesday-polling,primary,DEM,Gabbard,13343.0,Tulsi Gabbard,0.3,2020-03-01
55,Alabama,32.806671,-86.79113000000001,119473.0,64671.0,2020.0,1522.0,Swayable,,,Swayable,543.0,Swayable,,949.0,lv,lv-d,Online,U.S. President,3/1/20,3/2/20,,False,,False,False,3/3/20 06:18,,https://swayable.com/insights/democratic-primaries-2020-super-tuesday-polling,primary,DEM,Klobuchar,13310.0,Amy Klobuchar,0.5,2020-03-01
56,Alabama,32.806671,-86.79113000000001,119473.0,64671.0,2020.0,1522.0,Swayable,,,Swayable,543.0,Swayable,,949.0,lv,lv-d,Online,U.S. President,3/1/20,3/2/20,,False,,False,False,3/3/20 06:18,,https://swayable.com/insights/democratic-primaries-2020-super-tuesday-polling,primary,DEM,Steyer,13327.0,Tom Steyer,1.5,2020-03-01
57,Alabama,32.806671,-86.79113000000001,119473.0,64671.0,2020.0,1522.0,Swayable,,,Swayable,543.0,Swayable,,949.0,lv,lv-d,Online,U.S. President,3/1/20,3/2/20,,False,,False,False,3/3/20 06:18,,https://swayable.com/insights/democratic-primaries-2020-super-tuesday-polling,primary,DEM,Buttigieg,13345.0,Pete Buttigieg,3.2,2020-03-01
58,Alabama,32.806671,-86.79113000000001,119473.0,64671.0,2020.0,1522.0,Swayable,,,Swayable,543.0,Swayable,,949.0,lv,lv-d,Online,U.S. President,3/1/20,3/2/20,,False,,False,False,3/3/20 06:18,,https://swayable.com/insights/democratic-primaries-2020-super-tuesday-polling,primary,DEM,Warren,13258.0,Elizabeth Warren,9.5,2020-03-01
59,Alabama,32.806671,-86.79113000000001,119473.0,64671.0,2020.0,1522.0,Swayable,,,Swayable,543.0,Swayable,,949.0,lv,lv-d,Online,U.S. President,3/1/20,3/2/20,,False,,False,False,3/3/20 06:18,,https://swayable.com/insights/democratic-primaries-2020-super-tuesday-polling,primary,DEM,Bloomberg,13289.0,Michael Bloomberg,18.4,2020-03-01
60,Alabama,32.806671,-86.79113000000001,119473.0,64671.0,2020.0,1522.0,Swayable,,,Swayable,543.0,Swayable,,949.0,lv,lv-d,Online,U.S. President,3/1/20,3/2/20,,False,,False,False,3/3/20 06:18,,https://swayable.com/insights/democratic-primaries-2020-super-tuesday-polling,primary,DEM,Sanders,13257.0,Bernard Sanders,19.8,2020-03-01
61,Alabama,32.806671,-86.79113000000001,119473.0,64671.0,2020.0,1522.0,Swayable,,,Swayable,543.0,Swayable,,949.0,lv,lv-d,Online,U.S. President,3/1/20,3/2/20,,False,,False,False,3/3/20 06:18,,https://swayable.com/insights/democratic-primaries-2020-super-tuesday-polling,primary,DEM,Biden,13256.0,Joseph R. Biden Jr.,42.3,2020-03-01
62,Alabama,32.806671,-86.79113000000001,99478.0,58691.0,2020.0,1193.0,SurveyMonkey,132,NBC News,SurveyMonkey,324.0,SurveyMonkey,D-,257.0,rv,rv-d,Online,U.S. President,7/2/19,7/16/19,,False,,False,False,7/19/19 08:49,,https://www.documentcloud.org/documents/6206538-NBC-News-SurveyMonkey-Alabama-Poll-7-19.html,primary,DEM,Gillibrand,13311.0,Kirsten E. Gillibrand,0.0,2019-07-02
63,Alabama,32.806671,-86.79113000000001,99478.0,58691.0,2020.0,1193.0,SurveyMonkey,132,NBC News,SurveyMonkey,324.0,SurveyMonkey,D-,257.0,rv,rv-d,Online,U.S. President,7/2/19,7/16/19,,False,,False,False,7/19/19 08:49,,https://www.documentcloud.org/documents/6206538-NBC-News-SurveyMonkey-Alabama-Poll-7-19.html,primary,DEM,Gravel,13359.0,Mike Gravel,0.0,2019-07-02
64,Alabama,32.806671,-86.79113000000001,99478.0,58691.0,2020.0,1193.0,SurveyMonkey,132,NBC News,SurveyMonkey,324.0,SurveyMonkey,D-,257.0,rv,rv-d,Online,U.S. President,7/2/19,7/16/19,,False,,False,False,7/19/19 08:49,,https://www.documentcloud.org/documents/6206538-NBC-News-SurveyMonkey-Alabama-Poll-7-19.html,primary,DEM,Hickenlooper,13326.0,John Hickenlooper,0.0,2019-07-02
65,Alabama,32.806671,-86.79113000000001,99478.0,58691.0,2020.0,1193.0,SurveyMonkey,132,NBC News,SurveyMonkey,324.0,SurveyMonkey,D-,257.0,rv,rv-d,Online,U.S. President,7/2/19,7/16/19,,False,,False,False,7/19/19 08:49,,https://www.documentcloud.org/documents/6206538-NBC-News-SurveyMonkey-Alabama-Poll-7-19.html,primary,DEM,Inslee,13324.0,Jay Robert Inslee,0.0,2019-07-02
66,Alabama,32.806671,-86.79113000000001,99478.0,58691.0,2020.0,1193.0,SurveyMonkey,132,NBC News,SurveyMonkey,324.0,SurveyMonkey,D-,257.0,rv,rv-d,Online,U.S. President,7/2/19,7/16/19,,False,,False,False,7/19/19 08:49,,https://www.documentcloud.org/documents/6206538-NBC-News-SurveyMonkey-Alabama-Poll-7-19.html,primary,DEM,Messam,13357.0,Wayne Messam,0.0,2019-07-02
67,Alabama,32.806671,-86.79113000000001,99478.0,58691.0,2020.0,1193.0,SurveyMonkey,132,NBC News,SurveyMonkey,324.0,SurveyMonkey,D-,257.0,rv,rv-d,Online,U.S. President,7/2/19,7/16/19,,False,,False,False,7/19/19 08:49,,https://www.documentcloud.org/documents/6206538-NBC-News-SurveyMonkey-Alabama-Poll-7-19.html,primary,DEM,de Blasio,13335.0,Bill de Blasio,1.0,2019-07-02
68,Alabama,32.806671,-86.79113000000001,99478.0,58691.0,2020.0,1193.0,SurveyMonkey,132,NBC News,SurveyMonkey,324.0,SurveyMonkey,D-,257.0,rv,rv-d,Online,U.S. President,7/2/19,7/16/19,,False,,False,False,7/19/19 08:49,,https://www.documentcloud.org/documents/6206538-NBC-News-SurveyMonkey-Alabama-Poll-7-19.html,primary,DEM,Williamson,13350.0,Marianne Williamson,1.0,2019-07-02
69,Alabama,32.806671,-86.79113000000001,99478.0,58691.0,2020.0,1193.0,SurveyMonkey,132,NBC News,SurveyMonkey,324.0,SurveyMonkey,D-,257.0,rv,rv-d,Online,U.S. President,7/2/19,7/16/19,,False,,False,False,7/19/19 08:49,,https://www.documentcloud.org/documents/6206538-NBC-News-SurveyMonkey-Alabama-Poll-7-19.html,primary,DEM,Bullock,13320.0,Steve Bullock,1.0,2019-07-02
70,Alabama,32.806671,-86.79113000000001,99478.0,58691.0,2020.0,1193.0,SurveyMonkey,132,NBC News,SurveyMonkey,324.0,SurveyMonkey,D-,257.0,rv,rv-d,Online,U.S. President,7/2/19,7/16/19,,False,,False,False,7/19/19 08:49,,https://www.documentcloud.org/documents/6206538-NBC-News-SurveyMonkey-Alabama-Poll-7-19.html,primary,DEM,Sanders,13257.0,Bernard Sanders,15.0,2019-07-02
71,Alabama,32.806671,-86.79113000000001,99478.0,58691.0,2020.0,1193.0,SurveyMonkey,132,NBC News,SurveyMonkey,324.0,SurveyMonkey,D-,257.0,rv,rv-d,Online,U.S. President,7/2/19,7/16/19,,False,,False,False,7/19/19 08:49,,https://www.documentcloud.org/documents/6206538-NBC-News-SurveyMonkey-Alabama-Poll-7-19.html,primary,DEM,Harris,13288.0,Kamala D. Harris,13.0,2019-07-02
72,Alabama,32.806671,-86.79113000000001,99478.0,58691.0,2020.0,1193.0,SurveyMonkey,132,NBC News,SurveyMonkey,324.0,SurveyMonkey,D-,257.0,rv,rv-d,Online,U.S. President,7/2/19,7/16/19,,False,,False,False,7/19/19 08:49,,https://www.documentcloud.org/documents/6206538-NBC-News-SurveyMonkey-Alabama-Poll-7-19.html,primary,DEM,Warren,13258.0,Elizabeth Warren,9.0,2019-07-02
73,Alabama,32.806671,-86.79113000000001,99478.0,58691.0,2020.0,1193.0,SurveyMonkey,132,NBC News,SurveyMonkey,324.0,SurveyMonkey,D-,257.0,rv,rv-d,Online,U.S. President,7/2/19,7/16/19,,False,,False,False,7/19/19 08:49,,https://www.documentcloud.org/documents/6206538-NBC-News-SurveyMonkey-Alabama-Poll-7-19.html,primary,DEM,Buttigieg,13345.0,Pete Buttigieg,5.0,2019-07-02
74,Alabama,32.806671,-86.79113000000001,99478.0,58691.0,2020.0,1193.0,SurveyMonkey,132,NBC News,SurveyMonkey,324.0,SurveyMonkey,D-,257.0,rv,rv-d,Online,U.S. President,7/2/19,7/16/19,,False,,False,False,7/19/19 08:49,,https://www.documentcloud.org/documents/6206538-NBC-News-SurveyMonkey-Alabama-Poll-7-19.html,primary,DEM,Sestak,13381.0,Joe Sestak,3.0,2019-07-02
75,Alabama,32.806671,-86.79113000000001,99478.0,58691.0,2020.0,1193.0,SurveyMonkey,132,NBC News,SurveyMonkey,324.0,SurveyMonkey,D-,257.0,rv,rv-d,Online,U.S. President,7/2/19,7/16/19,,False,,False,False,7/19/19 08:49,,https://www.documentcloud.org/documents/6206538-NBC-News-SurveyMonkey-Alabama-Poll-7-19.html,primary,DEM,Yang,13329.0,Andrew Yang,1.0,2019-07-02
76,Alabama,32.806671,-86.79113000000001,99478.0,58691.0,2020.0,1193.0,SurveyMonkey,132,NBC News,SurveyMonkey,324.0,SurveyMonkey,D-,257.0,rv,rv-d,Online,U.S. President,7/2/19,7/16/19,,False,,False,False,7/19/19 08:49,,https://www.documentcloud.org/documents/6206538-NBC-News-SurveyMonkey-Alabama-Poll-7-19.html,primary,DEM,Booker,13287.0,Cory A. Booker,2.0,2019-07-02
77,Alabama,32.806671,-86.79113000000001,99478.0,58691.0,2020.0,1193.0,SurveyMonkey,132,NBC News,SurveyMonkey,324.0,SurveyMonkey,D-,257.0,rv,rv-d,Online,U.S. President,7/2/19,7/16/19,,False,,False,False,7/19/19 08:49,,https://www.documentcloud.org/documents/6206538-NBC-News-SurveyMonkey-Alabama-Poll-7-19.html,primary,DEM,Bennet,13352.0,Michael F. Bennet,2.0,2019-07-02
78,Alabama,32.806671,-86.79113000000001,99478.0,58691.0,2020.0,1193.0,SurveyMonkey,132,NBC News,SurveyMonkey,324.0,SurveyMonkey,D-,257.0,rv,rv-d,Online,U.S. President,7/2/19,7/16/19,,False,,False,False,7/19/19 08:49,,https://www.documentcloud.org/documents/6206538-NBC-News-SurveyMonkey-Alabama-Poll-7-19.html,primary,DEM,Moulton,13322.0,Seth Moulton,0.0,2019-07-02
79,Alaska,61.370716,-152.404419,,,,,,,,,,,,,,,,,,,,,,,,,,,,,,,,,
80,Arizona,33.729759,-111.431221,112408.0,62508.0,2020.0,1102.0,Emerson College,,,Emerson College,88.0,Emerson College,A-,339.0,lv,lv-d,IVR/Online,U.S. President,10/25/19,10/28/19,,False,,False,False,10/29/19 12:15,,http://emersonpolling.com/2019/10/29/arizona-poll-toss-ups-in-presidential-and-senate-races-biden-holds-small-lead-in-democratic-primary-with-warren-and-sanders-tied-for-second/,primary,DEM,Williamson,13350.0,Marianne Williamson,0.0,2019-10-25
81,Arizona,33.729759,-111.431221,97911.0,58455.0,2020.0,573.0,Zogby Interactive/JZ Analytics,,,Zogby Analytics,395.0,Zogby Interactive/JZ Analytics,C,197.0,lv,lv-d,Online,U.S. President,5/23/19,5/29/19,,False,,False,False,6/14/19 12:13,,https://projects.fivethirtyeight.com/polls/20190615_National.xlsx,primary,DEM,Delaney,13314.0,John K. Delaney,1.6,2019-05-23
82,Arizona,33.729759,-111.431221,112408.0,62508.0,2020.0,1102.0,Emerson College,,,Emerson College,88.0,Emerson College,A-,339.0,lv,lv-d,IVR/Online,U.S. President,10/25/19,10/28/19,,False,,False,False,10/29/19 12:15,,http://emersonpolling.com/2019/10/29/arizona-poll-toss-ups-in-presidential-and-senate-races-biden-holds-small-lead-in-democratic-primary-with-warren-and-sanders-tied-for-second/,primary,DEM,Delaney,13314.0,John K. Delaney,0.0,2019-10-25
83,Arizona,33.729759,-111.431221,112408.0,62508.0,2020.0,1102.0,Emerson College,,,Emerson College,88.0,Emerson College,A-,339.0,lv,lv-d,IVR/Online,U.S. President,10/25/19,10/28/19,,False,,False,False,10/29/19 12:15,,http://emersonpolling.com/2019/10/29/arizona-poll-toss-ups-in-presidential-and-senate-races-biden-holds-small-lead-in-democratic-primary-with-warren-and-sanders-tied-for-second/,primary,DEM,Castro,13316.0,Julián Castro,0.0,2019-10-25
84,Arizona,33.729759,-111.431221,112408.0,62508.0,2020.0,1102.0,Emerson College,,,Emerson College,88.0,Emerson College,A-,339.0,lv,lv-d,IVR/Online,U.S. President,10/25/19,10/28/19,,False,,False,False,10/29/19 12:15,,http://emersonpolling.com/2019/10/29/arizona-poll-toss-ups-in-presidential-and-senate-races-biden-holds-small-lead-in-democratic-primary-with-warren-and-sanders-tied-for-second/,primary,DEM,Booker,13287.0,Cory A. Booker,0.0,2019-10-25
85,Arizona,33.729759,-111.431221,112406.0,62508.0,2020.0,1102.0,Emerson College,,,Emerson College,88.0,Emerson College,A-,367.0,lv,lv-r,IVR/Online,U.S. President,10/25/19,10/28/19,,False,,False,False,10/29/19 12:14,,http://emersonpolling.com/2019/10/29/arizona-poll-toss-ups-in-presidential-and-senate-races-biden-holds-small-lead-in-democratic-primary-with-warren-and-sanders-tied-for-second/,primary,REP,Trump,13254.0,Donald Trump,88.2,2019-10-25
86,Arizona,33.729759,-111.431221,112406.0,62508.0,2020.0,1102.0,Emerson College,,,Emerson College,88.0,Emerson College,A-,367.0,lv,lv-r,IVR/Online,U.S. President,10/25/19,10/28/19,,False,,False,False,10/29/19 12:14,,http://emersonpolling.com/2019/10/29/arizona-poll-toss-ups-in-presidential-and-senate-races-biden-holds-small-lead-in-democratic-primary-with-warren-and-sanders-tied-for-second/,primary,REP,Weld,13351.0,William F. Weld,3.9,2019-10-25
87,Arizona,33.729759,-111.431221,97911.0,58455.0,2020.0,573.0,Zogby Interactive/JZ Analytics,,,Zogby Analytics,395.0,Zogby Interactive/JZ Analytics,C,197.0,lv,lv-d,Online,U.S. President,5/23/19,5/29/19,,False,,False,False,6/14/19 12:13,,https://projects.fivethirtyeight.com/polls/20190615_National.xlsx,primary,DEM,Inslee,13324.0,Jay Robert Inslee,0.3,2019-05-23
88,Arizona,33.729759,-111.431221,97911.0,58455.0,2020.0,573.0,Zogby Interactive/JZ Analytics,,,Zogby Analytics,395.0,Zogby Interactive/JZ Analytics,C,197.0,lv,lv-d,Online,U.S. President,5/23/19,5/29/19,,False,,False,False,6/14/19 12:13,,https://projects.fivethirtyeight.com/polls/20190615_National.xlsx,primary,DEM,Gabbard,13343.0,Tulsi Gabbard,1.1,2019-05-23
89,Arizona,33.729759,-111.431221,97911.0,58455.0,2020.0,573.0,Zogby Interactive/JZ Analytics,,,Zogby Analytics,395.0,Zogby Interactive/JZ Analytics,C,197.0,lv,lv-d,Online,U.S. President,5/23/19,5/29/19,,False,,False,False,6/14/19 12:13,,https://projects.fivethirtyeight.com/polls/20190615_National.xlsx,primary,DEM,Castro,13316.0,Julián Castro,2.4,2019-05-23
90,Arizona,33.729759,-111.431221,97911.0,58455.0,2020.0,573.0,Zogby Interactive/JZ Analytics,,,Zogby Analytics,395.0,Zogby Interactive/JZ Analytics,C,197.0,lv,lv-d,Online,U.S. President,5/23/19,5/29/19,,False,,False,False,6/14/19 12:13,,https://projects.fivethirtyeight.com/polls/20190615_National.xlsx,primary,DEM,Gillibrand,13311.0,Kirsten E. Gillibrand,1.0,2019-05-23
91,Arizona,33.729759,-111.431221,112406.0,62508.0,2020.0,1102.0,Emerson College,,,Emerson College,88.0,Emerson College,A-,367.0,lv,lv-r,IVR/Online,U.S. President,10/25/19,10/28/19,,False,,False,False,10/29/19 12:14,,http://emersonpolling.com/2019/10/29/arizona-poll-toss-ups-in-presidential-and-senate-races-biden-holds-small-lead-in-democratic-primary-with-warren-and-sanders-tied-for-second/,primary,REP,Walsh,13482.0,Joe Walsh,3.4,2019-10-25
92,Arizona,33.729759,-111.431221,112408.0,62508.0,2020.0,1102.0,Emerson College,,,Emerson College,88.0,Emerson College,A-,339.0,lv,lv-d,IVR/Online,U.S. President,10/25/19,10/28/19,,False,,False,False,10/29/19 12:15,,http://emersonpolling.com/2019/10/29/arizona-poll-toss-ups-in-presidential-and-senate-races-biden-holds-small-lead-in-democratic-primary-with-warren-and-sanders-tied-for-second/,primary,DEM,Buttigieg,13345.0,Pete Buttigieg,11.9,2019-10-25
93,Arizona,33.729759,-111.431221,112408.0,62508.0,2020.0,1102.0,Emerson College,,,Emerson College,88.0,Emerson College,A-,339.0,lv,lv-d,IVR/Online,U.S. President,10/25/19,10/28/19,,False,,False,False,10/29/19 12:15,,http://emersonpolling.com/2019/10/29/arizona-poll-toss-ups-in-presidential-and-senate-races-biden-holds-small-lead-in-democratic-primary-with-warren-and-sanders-tied-for-second/,primary,DEM,Harris,13288.0,Kamala D. Harris,3.8,2019-10-25
94,Arizona,33.729759,-111.431221,112408.0,62508.0,2020.0,1102.0,Emerson College,,,Emerson College,88.0,Emerson College,A-,339.0,lv,lv-d,IVR/Online,U.S. President,10/25/19,10/28/19,,False,,False,False,10/29/19 12:15,,http://emersonpolling.com/2019/10/29/arizona-poll-toss-ups-in-presidential-and-senate-races-biden-holds-small-lead-in-democratic-primary-with-warren-and-sanders-tied-for-second/,primary,DEM,Bennet,13352.0,Michael F. Bennet,0.4,2019-10-25
95,Arizona,33.729759,-111.431221,112408.0,62508.0,2020.0,1102.0,Emerson College,,,Emerson College,88.0,Emerson College,A-,339.0,lv,lv-d,IVR/Online,U.S. President,10/25/19,10/28/19,,False,,False,False,10/29/19 12:15,,http://emersonpolling.com/2019/10/29/arizona-poll-toss-ups-in-presidential-and-senate-races-biden-holds-small-lead-in-democratic-primary-with-warren-and-sanders-tied-for-second/,primary,DEM,Sestak,13381.0,Joe Sestak,0.9,2019-10-25
96,Arizona,33.729759,-111.431221,112408.0,62508.0,2020.0,1102.0,Emerson College,,,Emerson College,88.0,Emerson College,A-,339.0,lv,lv-d,IVR/Online,U.S. President,10/25/19,10/28/19,,False,,False,False,10/29/19 12:15,,http://emersonpolling.com/2019/10/29/arizona-poll-toss-ups-in-presidential-and-senate-races-biden-holds-small-lead-in-democratic-primary-with-warren-and-sanders-tied-for-second/,primary,DEM,Bullock,13320.0,Steve Bullock,0.2,2019-10-25
97,Arizona,33.729759,-111.431221,112408.0,62508.0,2020.0,1102.0,Emerson College,,,Emerson College,88.0,Emerson College,A-,339.0,lv,lv-d,IVR/Online,U.S. President,10/25/19,10/28/19,,False,,False,False,10/29/19 12:15,,http://emersonpolling.com/2019/10/29/arizona-poll-toss-ups-in-presidential-and-senate-races-biden-holds-small-lead-in-democratic-primary-with-warren-and-sanders-tied-for-second/,primary,DEM,Steyer,13327.0,Tom Steyer,0.1,2019-10-25
98,Arizona,33.729759,-111.431221,112408.0,62508.0,2020.0,1102.0,Emerson College,,,Emerson College,88.0,Emerson College,A-,339.0,lv,lv-d,IVR/Online,U.S. President,10/25/19,10/28/19,,False,,False,False,10/29/19 12:15,,http://emersonpolling.com/2019/10/29/arizona-poll-toss-ups-in-presidential-and-senate-races-biden-holds-small-lead-in-democratic-primary-with-warren-and-sanders-tied-for-second/,primary,DEM,Gabbard,13343.0,Tulsi Gabbard,2.3,2019-10-25
99,Arizona,33.729759,-111.431221,112408.0,62508.0,2020.0,1102.0,Emerson College,,,Emerson College,88.0,Emerson College,A-,339.0,lv,lv-d,IVR/Online,U.S. President,10/25/19,10/28/19,,False,,False,False,10/29/19 12:15,,http://emersonpolling.com/2019/10/29/arizona-poll-toss-ups-in-presidential-and-senate-races-biden-holds-small-lead-in-democratic-primary-with-warren-and-sanders-tied-for-second/,primary,DEM,Klobuchar,13310.0,Amy Klobuchar,1.8,2019-10-25
100,Arizona,33.729759,-111.431221,112408.0,62508.0,2020.0,1102.0,Emerson College,,,Emerson College,88.0,Emerson College,A-,339.0,lv,lv-d,IVR/Online,U.S. President,10/25/19,10/28/19,,False,,False,False,10/29/19 12:15,,http://emersonpolling.com/2019/10/29/arizona-poll-toss-ups-in-presidential-and-senate-races-biden-holds-small-lead-in-democratic-primary-with-warren-and-sanders-tied-for-second/,primary,DEM,Yang,13329.0,Andrew Yang,5.1,2019-10-25
101,Arizona,33.729759,-111.431221,112408.0,62508.0,2020.0,1102.0,Emerson College,,,Emerson College,88.0,Emerson College,A-,339.0,lv,lv-d,IVR/Online,U.S. President,10/25/19,10/28/19,,False,,False,False,10/29/19 12:15,,http://emersonpolling.com/2019/10/29/arizona-poll-toss-ups-in-presidential-and-senate-races-biden-holds-small-lead-in-democratic-primary-with-warren-and-sanders-tied-for-second/,primary,DEM,O'Rourke,13276.0,Beto O'Rourke,1.7,2019-10-25
102,Arizona,33.729759,-111.431221,112408.0,62508.0,2020.0,1102.0,Emerson College,,,Emerson College,88.0,Emerson College,A-,339.0,lv,lv-d,IVR/Online,U.S. President,10/25/19,10/28/19,,False,,False,False,10/29/19 12:15,,http://emersonpolling.com/2019/10/29/arizona-poll-toss-ups-in-presidential-and-senate-races-biden-holds-small-lead-in-democratic-primary-with-warren-and-sanders-tied-for-second/,primary,DEM,Biden,13256.0,Joseph R. Biden Jr.,27.9,2019-10-25
103,Arizona,33.729759,-111.431221,112408.0,62508.0,2020.0,1102.0,Emerson College,,,Emerson College,88.0,Emerson College,A-,339.0,lv,lv-d,IVR/Online,U.S. President,10/25/19,10/28/19,,False,,False,False,10/29/19 12:15,,http://emersonpolling.com/2019/10/29/arizona-poll-toss-ups-in-presidential-and-senate-races-biden-holds-small-lead-in-democratic-primary-with-warren-and-sanders-tied-for-second/,primary,DEM,Sanders,13257.0,Bernard Sanders,20.9,2019-10-25
104,Arizona,33.729759,-111.431221,112408.0,62508.0,2020.0,1102.0,Emerson College,,,Emerson College,88.0,Emerson College,A-,339.0,lv,lv-d,IVR/Online,U.S. President,10/25/19,10/28/19,,False,,False,False,10/29/19 12:15,,http://emersonpolling.com/2019/10/29/arizona-poll-toss-ups-in-presidential-and-senate-races-biden-holds-small-lead-in-democratic-primary-with-warren-and-sanders-tied-for-second/,primary,DEM,Warren,13258.0,Elizabeth Warren,21.3,2019-10-25
105,Arizona,33.729759,-111.431221,112406.0,62508.0,2020.0,1102.0,Emerson College,,,Emerson College,88.0,Emerson College,A-,367.0,lv,lv-r,IVR/Online,U.S. President,10/25/19,10/28/19,,False,,False,False,10/29/19 12:14,,http://emersonpolling.com/2019/10/29/arizona-poll-toss-ups-in-presidential-and-senate-races-biden-holds-small-lead-in-democratic-primary-with-warren-and-sanders-tied-for-second/,primary,REP,Sanford,13384.0,Mark Sanford,4.6,2019-10-25
106,Arizona,33.729759,-111.431221,102799.0,59598.0,2020.0,1329.0,Bendixen & Amandi International,1182,SMART Local 359,Bendixen & Amandi International,29.0,Bendixen & Amandi International,B/C,250.0,rv,rv-d,Live Phone,U.S. President,9/9/19,9/12/19,,False,,False,False,9/18/19 07:43,,https://www.politico.com/f/?id=0000016d-410e-d547-a36f-67df39db0001,primary,DEM,Buttigieg,13345.0,Pete Buttigieg,5.0,2019-09-09
107,Arizona,33.729759,-111.431221,112851.0,62548.0,2020.0,1424.0,Siena College/New York Times Upshot,,,Siena College/New York Times Upshot,448.0,Siena College/New York Times Upshot,A+,209.0,rv,rv-d,Live Phone,U.S. President,10/13/19,10/23/19,,False,,False,False,11/8/19 07:58,,https://scri.siena.edu/wp-content/uploads/2019/11/AZ1019-CrosstabsALL.pdf,primary,DEM,Biden,13256.0,Joseph R. Biden Jr.,24.0,2019-10-13
108,Arizona,33.729759,-111.431221,112851.0,62548.0,2020.0,1424.0,Siena College/New York Times Upshot,,,Siena College/New York Times Upshot,448.0,Siena College/New York Times Upshot,A+,209.0,rv,rv-d,Live Phone,U.S. President,10/13/19,10/23/19,,False,,False,False,11/8/19 07:58,,https://scri.siena.edu/wp-content/uploads/2019/11/AZ1019-CrosstabsALL.pdf,primary,DEM,Sanders,13257.0,Bernard Sanders,16.0,2019-10-13
109,Arizona,33.729759,-111.431221,102799.0,59598.0,2020.0,1329.0,Bendixen & Amandi International,1182,SMART Local 359,Bendixen & Amandi International,29.0,Bendixen & Amandi International,B/C,250.0,rv,rv-d,Live Phone,U.S. President,9/9/19,9/12/19,,False,,False,False,9/18/19 07:43,,https://www.politico.com/f/?id=0000016d-410e-d547-a36f-67df39db0001,primary,DEM,Harris,13288.0,Kamala D. Harris,4.0,2019-09-09
110,Arizona,33.729759,-111.431221,102799.0,59598.0,2020.0,1329.0,Bendixen & Amandi International,1182,SMART Local 359,Bendixen & Amandi International,29.0,Bendixen & Amandi International,B/C,250.0,rv,rv-d,Live Phone,U.S. President,9/9/19,9/12/19,,False,,False,False,9/18/19 07:43,,https://www.politico.com/f/?id=0000016d-410e-d547-a36f-67df39db0001,primary,DEM,O'Rourke,13276.0,Beto O'Rourke,4.0,2019-09-09
111,Arizona,33.729759,-111.431221,102799.0,59598.0,2020.0,1329.0,Bendixen & Amandi International,1182,SMART Local 359,Bendixen & Amandi International,29.0,Bendixen & Amandi International,B/C,250.0,rv,rv-d,Live Phone,U.S. President,9/9/19,9/12/19,,False,,False,False,9/18/19 07:43,,https://www.politico.com/f/?id=0000016d-410e-d547-a36f-67df39db0001,primary,DEM,Yang,13329.0,Andrew Yang,2.0,2019-09-09
112,Arizona,33.729759,-111.431221,102799.0,59598.0,2020.0,1329.0,Bendixen & Amandi International,1182,SMART Local 359,Bendixen & Amandi International,29.0,Bendixen & Amandi International,B/C,250.0,rv,rv-d,Live Phone,U.S. President,9/9/19,9/12/19,,False,,False,False,9/18/19 07:43,,https://www.politico.com/f/?id=0000016d-410e-d547-a36f-67df39db0001,primary,DEM,Castro,13316.0,Julián Castro,1.0,2019-09-09
113,Arizona,33.729759,-111.431221,102799.0,59598.0,2020.0,1329.0,Bendixen & Amandi International,1182,SMART Local 359,Bendixen & Amandi International,29.0,Bendixen & Amandi International,B/C,250.0,rv,rv-d,Live Phone,U.S. President,9/9/19,9/12/19,,False,,False,False,9/18/19 07:43,,https://www.politico.com/f/?id=0000016d-410e-d547-a36f-67df39db0001,primary,DEM,Klobuchar,13310.0,Amy Klobuchar,1.0,2019-09-09
114,Arizona,33.729759,-111.431221,102799.0,59598.0,2020.0,1329.0,Bendixen & Amandi International,1182,SMART Local 359,Bendixen & Amandi International,29.0,Bendixen & Amandi International,B/C,250.0,rv,rv-d,Live Phone,U.S. President,9/9/19,9/12/19,,False,,False,False,9/18/19 07:43,,https://www.politico.com/f/?id=0000016d-410e-d547-a36f-67df39db0001,primary,DEM,Williamson,13350.0,Marianne Williamson,1.0,2019-09-09
115,Arizona,33.729759,-111.431221,102799.0,59598.0,2020.0,1329.0,Bendixen & Amandi International,1182,SMART Local 359,Bendixen & Amandi International,29.0,Bendixen & Amandi International,B/C,250.0,rv,rv-d,Live Phone,U.S. President,9/9/19,9/12/19,,False,,False,False,9/18/19 07:43,,https://www.politico.com/f/?id=0000016d-410e-d547-a36f-67df39db0001,primary,DEM,Booker,13287.0,Cory A. Booker,0.0,2019-09-09
116,Arizona,33.729759,-111.431221,102799.0,59598.0,2020.0,1329.0,Bendixen & Amandi International,1182,SMART Local 359,Bendixen & Amandi International,29.0,Bendixen & Amandi International,B/C,250.0,rv,rv-d,Live Phone,U.S. President,9/9/19,9/12/19,,False,,False,False,9/18/19 07:43,,https://www.politico.com/f/?id=0000016d-410e-d547-a36f-67df39db0001,primary,DEM,Warren,13258.0,Elizabeth Warren,24.0,2019-09-09
117,Arizona,33.729759,-111.431221,102799.0,59598.0,2020.0,1329.0,Bendixen & Amandi International,1182,SMART Local 359,Bendixen & Amandi International,29.0,Bendixen & Amandi International,B/C,250.0,rv,rv-d,Live Phone,U.S. President,9/9/19,9/12/19,,False,,False,False,9/18/19 07:43,,https://www.politico.com/f/?id=0000016d-410e-d547-a36f-67df39db0001,primary,DEM,Biden,13256.0,Joseph R. Biden Jr.,29.0,2019-09-09
118,Arizona,33.729759,-111.431221,103715.0,59778.0,2020.0,1365.0,Change Research,1155,Crooked Media,Change Research,48.0,Change Research,C,396.0,lv,lv-d,Online,U.S. President,9/27/19,9/28/19,,False,,False,False,10/3/19 08:32,,https://www.changeresearch.com/crooked-change-arizona-poll,primary,DEM,Warren,13258.0,Elizabeth Warren,35.0,2019-09-27
119,Arizona,33.729759,-111.431221,103715.0,59778.0,2020.0,1365.0,Change Research,1155,Crooked Media,Change Research,48.0,Change Research,C,396.0,lv,lv-d,Online,U.S. President,9/27/19,9/28/19,,False,,False,False,10/3/19 08:32,,https://www.changeresearch.com/crooked-change-arizona-poll,primary,DEM,Sanders,13257.0,Bernard Sanders,19.0,2019-09-27
120,Arizona,33.729759,-111.431221,103715.0,59778.0,2020.0,1365.0,Change Research,1155,Crooked Media,Change Research,48.0,Change Research,C,396.0,lv,lv-d,Online,U.S. President,9/27/19,9/28/19,,False,,False,False,10/3/19 08:32,,https://www.changeresearch.com/crooked-change-arizona-poll,primary,DEM,Biden,13256.0,Joseph R. Biden Jr.,15.0,2019-09-27
121,Arizona,33.729759,-111.431221,103715.0,59778.0,2020.0,1365.0,Change Research,1155,Crooked Media,Change Research,48.0,Change Research,C,396.0,lv,lv-d,Online,U.S. President,9/27/19,9/28/19,,False,,False,False,10/3/19 08:32,,https://www.changeresearch.com/crooked-change-arizona-poll,primary,DEM,Buttigieg,13345.0,Pete Buttigieg,13.0,2019-09-27
122,Arizona,33.729759,-111.431221,103715.0,59778.0,2020.0,1365.0,Change Research,1155,Crooked Media,Change Research,48.0,Change Research,C,396.0,lv,lv-d,Online,U.S. President,9/27/19,9/28/19,,False,,False,False,10/3/19 08:32,,https://www.changeresearch.com/crooked-change-arizona-poll,primary,DEM,Yang,13329.0,Andrew Yang,8.0,2019-09-27
123,Arizona,33.729759,-111.431221,103715.0,59778.0,2020.0,1365.0,Change Research,1155,Crooked Media,Change Research,48.0,Change Research,C,396.0,lv,lv-d,Online,U.S. President,9/27/19,9/28/19,,False,,False,False,10/3/19 08:32,,https://www.changeresearch.com/crooked-change-arizona-poll,primary,DEM,Harris,13288.0,Kamala D. Harris,4.0,2019-09-27
124,Arizona,33.729759,-111.431221,103715.0,59778.0,2020.0,1365.0,Change Research,1155,Crooked Media,Change Research,48.0,Change Research,C,396.0,lv,lv-d,Online,U.S. President,9/27/19,9/28/19,,False,,False,False,10/3/19 08:32,,https://www.changeresearch.com/crooked-change-arizona-poll,primary,DEM,O'Rourke,13276.0,Beto O'Rourke,3.0,2019-09-27
125,Arizona,33.729759,-111.431221,103715.0,59778.0,2020.0,1365.0,Change Research,1155,Crooked Media,Change Research,48.0,Change Research,C,396.0,lv,lv-d,Online,U.S. President,9/27/19,9/28/19,,False,,False,False,10/3/19 08:32,,https://www.changeresearch.com/crooked-change-arizona-poll,primary,DEM,Gabbard,13343.0,Tulsi Gabbard,1.0,2019-09-27
126,Arizona,33.729759,-111.431221,112851.0,62548.0,2020.0,1424.0,Siena College/New York Times Upshot,,,Siena College/New York Times Upshot,448.0,Siena College/New York Times Upshot,A+,209.0,rv,rv-d,Live Phone,U.S. President,10/13/19,10/23/19,,False,,False,False,11/8/19 07:58,,https://scri.siena.edu/wp-content/uploads/2019/11/AZ1019-CrosstabsALL.pdf,primary,DEM,Buttigieg,13345.0,Pete Buttigieg,5.0,2019-10-13
127,Arizona,33.729759,-111.431221,112851.0,62548.0,2020.0,1424.0,Siena College/New York Times Upshot,,,Siena College/New York Times Upshot,448.0,Siena College/New York Times Upshot,A+,209.0,rv,rv-d,Live Phone,U.S. President,10/13/19,10/23/19,,False,,False,False,11/8/19 07:58,,https://scri.siena.edu/wp-content/uploads/2019/11/AZ1019-CrosstabsALL.pdf,primary,DEM,Klobuchar,13310.0,Amy Klobuchar,1.0,2019-10-13
128,Arizona,33.729759,-111.431221,112851.0,62548.0,2020.0,1424.0,Siena College/New York Times Upshot,,,Siena College/New York Times Upshot,448.0,Siena College/New York Times Upshot,A+,209.0,rv,rv-d,Live Phone,U.S. President,10/13/19,10/23/19,,False,,False,False,11/8/19 07:58,,https://scri.siena.edu/wp-content/uploads/2019/11/AZ1019-CrosstabsALL.pdf,primary,DEM,Harris,13288.0,Kamala D. Harris,3.0,2019-10-13
129,Arizona,33.729759,-111.431221,112851.0,62548.0,2020.0,1424.0,Siena College/New York Times Upshot,,,Siena College/New York Times Upshot,448.0,Siena College/New York Times Upshot,A+,209.0,rv,rv-d,Live Phone,U.S. President,10/13/19,10/23/19,,False,,False,False,11/8/19 07:58,,https://scri.siena.edu/wp-content/uploads/2019/11/AZ1019-CrosstabsALL.pdf,primary,DEM,Gabbard,13343.0,Tulsi Gabbard,0.0,2019-10-13
130,Arizona,33.729759,-111.431221,112851.0,62548.0,2020.0,1424.0,Siena College/New York Times Upshot,,,Siena College/New York Times Upshot,448.0,Siena College/New York Times Upshot,A+,209.0,rv,rv-d,Live Phone,U.S. President,10/13/19,10/23/19,,False,,False,False,11/8/19 07:58,,https://scri.siena.edu/wp-content/uploads/2019/11/AZ1019-CrosstabsALL.pdf,primary,DEM,Yang,13329.0,Andrew Yang,1.0,2019-10-13
131,Arizona,33.729759,-111.431221,112851.0,62548.0,2020.0,1424.0,Siena College/New York Times Upshot,,,Siena College/New York Times Upshot,448.0,Siena College/New York Times Upshot,A+,209.0,rv,rv-d,Live Phone,U.S. President,10/13/19,10/23/19,,False,,False,False,11/8/19 07:58,,https://scri.siena.edu/wp-content/uploads/2019/11/AZ1019-CrosstabsALL.pdf,primary,DEM,Booker,13287.0,Cory A. Booker,0.0,2019-10-13
132,Arizona,33.729759,-111.431221,112851.0,62548.0,2020.0,1424.0,Siena College/New York Times Upshot,,,Siena College/New York Times Upshot,448.0,Siena College/New York Times Upshot,A+,209.0,rv,rv-d,Live Phone,U.S. President,10/13/19,10/23/19,,False,,False,False,11/8/19 07:58,,https://scri.siena.edu/wp-content/uploads/2019/11/AZ1019-CrosstabsALL.pdf,primary,DEM,Warren,13258.0,Elizabeth Warren,15.0,2019-10-13
133,Arizona,33.729759,-111.431221,112851.0,62548.0,2020.0,1424.0,Siena College/New York Times Upshot,,,Siena College/New York Times Upshot,448.0,Siena College/New York Times Upshot,A+,209.0,rv,rv-d,Live Phone,U.S. President,10/13/19,10/23/19,,False,,False,False,11/8/19 07:58,,https://scri.siena.edu/wp-content/uploads/2019/11/AZ1019-CrosstabsALL.pdf,primary,DEM,O'Rourke,13276.0,Beto O'Rourke,0.0,2019-10-13
134,Arizona,33.729759,-111.431221,112851.0,62548.0,2020.0,1424.0,Siena College/New York Times Upshot,,,Siena College/New York Times Upshot,448.0,Siena College/New York Times Upshot,A+,209.0,rv,rv-d,Live Phone,U.S. President,10/13/19,10/23/19,,False,,False,False,11/8/19 07:58,,https://scri.siena.edu/wp-content/uploads/2019/11/AZ1019-CrosstabsALL.pdf,primary,DEM,Castro,13316.0,Julián Castro,0.0,2019-10-13
135,Arizona,33.729759,-111.431221,97911.0,58455.0,2020.0,573.0,Zogby Interactive/JZ Analytics,,,Zogby Analytics,395.0,Zogby Interactive/JZ Analytics,C,197.0,lv,lv-d,Online,U.S. President,5/23/19,5/29/19,,False,,False,False,6/14/19 12:13,,https://projects.fivethirtyeight.com/polls/20190615_National.xlsx,primary,DEM,Yang,13329.0,Andrew Yang,0.4,2019-05-23
136,Arizona,33.729759,-111.431221,103715.0,59778.0,2020.0,1365.0,Change Research,1155,Crooked Media,Change Research,48.0,Change Research,C,396.0,lv,lv-d,Online,U.S. President,9/27/19,9/28/19,,False,,False,False,10/3/19 08:32,,https://www.changeresearch.com/crooked-change-arizona-poll,primary,DEM,Steyer,13327.0,Tom Steyer,0.0,2019-09-27
137,Arizona,33.729759,-111.431221,103715.0,59778.0,2020.0,1365.0,Change Research,1155,Crooked Media,Change Research,48.0,Change Research,C,396.0,lv,lv-d,Online,U.S. President,9/27/19,9/28/19,,False,,False,False,10/3/19 08:32,,https://www.changeresearch.com/crooked-change-arizona-poll,primary,DEM,Booker,13287.0,Cory A. Booker,1.0,2019-09-27
138,Arizona,33.729759,-111.431221,103715.0,59778.0,2020.0,1365.0,Change Research,1155,Crooked Media,Change Research,48.0,Change Research,C,396.0,lv,lv-d,Online,U.S. President,9/27/19,9/28/19,,False,,False,False,10/3/19 08:32,,https://www.changeresearch.com/crooked-change-arizona-poll,primary,DEM,Klobuchar,13310.0,Amy Klobuchar,1.0,2019-09-27
139,Arizona,33.729759,-111.431221,103715.0,59778.0,2020.0,1365.0,Change Research,1155,Crooked Media,Change Research,48.0,Change Research,C,396.0,lv,lv-d,Online,U.S. President,9/27/19,9/28/19,,False,,False,False,10/3/19 08:32,,https://www.changeresearch.com/crooked-change-arizona-poll,primary,DEM,Castro,13316.0,Julián Castro,1.0,2019-09-27
140,Arizona,33.729759,-111.431221,112851.0,62548.0,2020.0,1424.0,Siena College/New York Times Upshot,,,Siena College/New York Times Upshot,448.0,Siena College/New York Times Upshot,A+,209.0,rv,rv-d,Live Phone,U.S. President,10/13/19,10/23/19,,False,,False,False,11/8/19 07:58,,https://scri.siena.edu/wp-content/uploads/2019/11/AZ1019-CrosstabsALL.pdf,primary,DEM,Steyer,13327.0,Tom Steyer,0.0,2019-10-13
141,Arizona,33.729759,-111.431221,97911.0,58455.0,2020.0,573.0,Zogby Interactive/JZ Analytics,,,Zogby Analytics,395.0,Zogby Interactive/JZ Analytics,C,197.0,lv,lv-d,Online,U.S. President,5/23/19,5/29/19,,False,,False,False,6/14/19 12:13,,https://projects.fivethirtyeight.com/polls/20190615_National.xlsx,primary,DEM,Hickenlooper,13326.0,John Hickenlooper,0.5,2019-05-23
142,Arizona,33.729759,-111.431221,102799.0,59598.0,2020.0,1329.0,Bendixen & Amandi International,1182,SMART Local 359,Bendixen & Amandi International,29.0,Bendixen & Amandi International,B/C,250.0,rv,rv-d,Live Phone,U.S. President,9/9/19,9/12/19,,False,,False,False,9/18/19 07:43,,https://www.politico.com/f/?id=0000016d-410e-d547-a36f-67df39db0001,primary,DEM,Sanders,13257.0,Bernard Sanders,18.0,2019-09-09
143,Arizona,33.729759,-111.431221,113213.0,62660.0,2020.0,1293.0,OH Predictive Insights/MBQF,,,OH Predictive Insights,235.0,OH Predictive Insights/MBQF,B/C,260.0,lv,lv-d,Online,U.S. President,10/31/19,11/8/19,,False,,False,False,11/19/19 07:51,,https://ohpredictive.com/press-releases/democratic-primary-2020/,primary,DEM,Booker,13287.0,Cory A. Booker,2.0,2019-10-31
144,Arizona,33.729759,-111.431221,113213.0,62660.0,2020.0,1293.0,OH Predictive Insights/MBQF,,,OH Predictive Insights,235.0,OH Predictive Insights/MBQF,B/C,260.0,lv,lv-d,Online,U.S. President,10/31/19,11/8/19,,False,,False,False,11/19/19 07:51,,https://ohpredictive.com/press-releases/democratic-primary-2020/,primary,DEM,Sanders,13257.0,Bernard Sanders,16.0,2019-10-31
145,Arizona,33.729759,-111.431221,113213.0,62660.0,2020.0,1293.0,OH Predictive Insights/MBQF,,,OH Predictive Insights,235.0,OH Predictive Insights/MBQF,B/C,260.0,lv,lv-d,Online,U.S. President,10/31/19,11/8/19,,False,,False,False,11/19/19 07:51,,https://ohpredictive.com/press-releases/democratic-primary-2020/,primary,DEM,O'Rourke,13276.0,Beto O'Rourke,1.0,2019-10-31
146,Arizona,33.729759,-111.431221,113213.0,62660.0,2020.0,1293.0,OH Predictive Insights/MBQF,,,OH Predictive Insights,235.0,OH Predictive Insights/MBQF,B/C,260.0,lv,lv-d,Online,U.S. President,10/31/19,11/8/19,,False,,False,False,11/19/19 07:51,,https://ohpredictive.com/press-releases/democratic-primary-2020/,primary,DEM,Steyer,13327.0,Tom Steyer,1.0,2019-10-31
147,Arizona,33.729759,-111.431221,113213.0,62660.0,2020.0,1293.0,OH Predictive Insights/MBQF,,,OH Predictive Insights,235.0,OH Predictive Insights/MBQF,B/C,260.0,lv,lv-d,Online,U.S. President,10/31/19,11/8/19,,False,,False,False,11/19/19 07:51,,https://ohpredictive.com/press-releases/democratic-primary-2020/,primary,DEM,Warren,13258.0,Elizabeth Warren,18.0,2019-10-31
148,Arizona,33.729759,-111.431221,113213.0,62660.0,2020.0,1293.0,OH Predictive Insights/MBQF,,,OH Predictive Insights,235.0,OH Predictive Insights/MBQF,B/C,260.0,lv,lv-d,Online,U.S. President,10/31/19,11/8/19,,False,,False,False,11/19/19 07:51,,https://ohpredictive.com/press-releases/democratic-primary-2020/,primary,DEM,Biden,13256.0,Joseph R. Biden Jr.,29.0,2019-10-31
149,Arizona,33.729759,-111.431221,113213.0,62660.0,2020.0,1293.0,OH Predictive Insights/MBQF,,,OH Predictive Insights,235.0,OH Predictive Insights/MBQF,B/C,260.0,lv,lv-d,Online,U.S. President,10/31/19,11/8/19,,False,,False,False,11/19/19 07:51,,https://ohpredictive.com/press-releases/democratic-primary-2020/,primary,DEM,Delaney,13314.0,John K. Delaney,0.0,2019-10-31
150,Arizona,33.729759,-111.431221,113213.0,62660.0,2020.0,1293.0,OH Predictive Insights/MBQF,,,OH Predictive Insights,235.0,OH Predictive Insights/MBQF,B/C,260.0,lv,lv-d,Online,U.S. President,10/31/19,11/8/19,,False,,False,False,11/19/19 07:51,,https://ohpredictive.com/press-releases/democratic-primary-2020/,primary,DEM,Yang,13329.0,Andrew Yang,4.0,2019-10-31
151,Arizona,33.729759,-111.431221,113213.0,62660.0,2020.0,1293.0,OH Predictive Insights/MBQF,,,OH Predictive Insights,235.0,OH Predictive Insights/MBQF,B/C,260.0,lv,lv-d,Online,U.S. President,10/31/19,11/8/19,,False,,False,False,11/19/19 07:51,,https://ohpredictive.com/press-releases/democratic-primary-2020/,primary,DEM,Castro,13316.0,Julián Castro,2.0,2019-10-31
152,Arizona,33.729759,-111.431221,113213.0,62660.0,2020.0,1293.0,OH Predictive Insights/MBQF,,,OH Predictive Insights,235.0,OH Predictive Insights/MBQF,B/C,260.0,lv,lv-d,Online,U.S. President,10/31/19,11/8/19,,False,,False,False,11/19/19 07:51,,https://ohpredictive.com/press-releases/democratic-primary-2020/,primary,DEM,Williamson,13350.0,Marianne Williamson,0.0,2019-10-31
153,Arizona,33.729759,-111.431221,113213.0,62660.0,2020.0,1293.0,OH Predictive Insights/MBQF,,,OH Predictive Insights,235.0,OH Predictive Insights/MBQF,B/C,260.0,lv,lv-d,Online,U.S. President,10/31/19,11/8/19,,False,,False,False,11/19/19 07:51,,https://ohpredictive.com/press-releases/democratic-primary-2020/,primary,DEM,Bennet,13352.0,Michael F. Bennet,1.0,2019-10-31
154,Arizona,33.729759,-111.431221,113213.0,62660.0,2020.0,1293.0,OH Predictive Insights/MBQF,,,OH Predictive Insights,235.0,OH Predictive Insights/MBQF,B/C,260.0,lv,lv-d,Online,U.S. President,10/31/19,11/8/19,,False,,False,False,11/19/19 07:51,,https://ohpredictive.com/press-releases/democratic-primary-2020/,primary,DEM,Buttigieg,13345.0,Pete Buttigieg,9.0,2019-10-31
155,Arizona,33.729759,-111.431221,97911.0,58455.0,2020.0,573.0,Zogby Interactive/JZ Analytics,,,Zogby Analytics,395.0,Zogby Interactive/JZ Analytics,C,197.0,lv,lv-d,Online,U.S. President,5/23/19,5/29/19,,False,,False,False,6/14/19 12:13,,https://projects.fivethirtyeight.com/polls/20190615_National.xlsx,primary,DEM,Biden,13256.0,Joseph R. Biden Jr.,34.6,2019-05-23
156,Arizona,33.729759,-111.431221,97911.0,58455.0,2020.0,573.0,Zogby Interactive/JZ Analytics,,,Zogby Analytics,395.0,Zogby Interactive/JZ Analytics,C,197.0,lv,lv-d,Online,U.S. President,5/23/19,5/29/19,,False,,False,False,6/14/19 12:13,,https://projects.fivethirtyeight.com/polls/20190615_National.xlsx,primary,DEM,Sanders,13257.0,Bernard Sanders,15.7,2019-05-23
157,Arizona,33.729759,-111.431221,113213.0,62660.0,2020.0,1293.0,OH Predictive Insights/MBQF,,,OH Predictive Insights,235.0,OH Predictive Insights/MBQF,B/C,260.0,lv,lv-d,Online,U.S. President,10/31/19,11/8/19,,False,,False,False,11/19/19 07:51,,https://ohpredictive.com/press-releases/democratic-primary-2020/,primary,DEM,Bullock,13320.0,Steve Bullock,0.0,2019-10-31
158,Arizona,33.729759,-111.431221,113213.0,62660.0,2020.0,1293.0,OH Predictive Insights/MBQF,,,OH Predictive Insights,235.0,OH Predictive Insights/MBQF,B/C,260.0,lv,lv-d,Online,U.S. President,10/31/19,11/8/19,,False,,False,False,11/19/19 07:51,,https://ohpredictive.com/press-releases/democratic-primary-2020/,primary,DEM,Harris,13288.0,Kamala D. Harris,5.0,2019-10-31
159,Arizona,33.729759,-111.431221,113213.0,62660.0,2020.0,1293.0,OH Predictive Insights/MBQF,,,OH Predictive Insights,235.0,OH Predictive Insights/MBQF,B/C,260.0,lv,lv-d,Online,U.S. President,10/31/19,11/8/19,,False,,False,False,11/19/19 07:51,,https://ohpredictive.com/press-releases/democratic-primary-2020/,primary,DEM,Klobuchar,13310.0,Amy Klobuchar,2.0,2019-10-31
160,Arizona,33.729759,-111.431221,113213.0,62660.0,2020.0,1293.0,OH Predictive Insights/MBQF,,,OH Predictive Insights,235.0,OH Predictive Insights/MBQF,B/C,260.0,lv,lv-d,Online,U.S. President,10/31/19,11/8/19,,False,,False,False,11/19/19 07:51,,https://ohpredictive.com/press-releases/democratic-primary-2020/,primary,DEM,Gabbard,13343.0,Tulsi Gabbard,1.0,2019-10-31
161,Arizona,33.729759,-111.431221,97911.0,58455.0,2020.0,573.0,Zogby Interactive/JZ Analytics,,,Zogby Analytics,395.0,Zogby Interactive/JZ Analytics,C,197.0,lv,lv-d,Online,U.S. President,5/23/19,5/29/19,,False,,False,False,6/14/19 12:13,,https://projects.fivethirtyeight.com/polls/20190615_National.xlsx,primary,DEM,Harris,13288.0,Kamala D. Harris,3.7,2019-05-23
162,Arizona,33.729759,-111.431221,97911.0,58455.0,2020.0,573.0,Zogby Interactive/JZ Analytics,,,Zogby Analytics,395.0,Zogby Interactive/JZ Analytics,C,197.0,lv,lv-d,Online,U.S. President,5/23/19,5/29/19,,False,,False,False,6/14/19 12:13,,https://projects.fivethirtyeight.com/polls/20190615_National.xlsx,primary,DEM,Klobuchar,13310.0,Amy Klobuchar,0.3,2019-05-23
163,Arizona,33.729759,-111.431221,97911.0,58455.0,2020.0,573.0,Zogby Interactive/JZ Analytics,,,Zogby Analytics,395.0,Zogby Interactive/JZ Analytics,C,197.0,lv,lv-d,Online,U.S. President,5/23/19,5/29/19,,False,,False,False,6/14/19 12:13,,https://projects.fivethirtyeight.com/polls/20190615_National.xlsx,primary,DEM,Booker,13287.0,Cory A. Booker,1.5,2019-05-23
164,Arizona,33.729759,-111.431221,97911.0,58455.0,2020.0,573.0,Zogby Interactive/JZ Analytics,,,Zogby Analytics,395.0,Zogby Interactive/JZ Analytics,C,197.0,lv,lv-d,Online,U.S. President,5/23/19,5/29/19,,False,,False,False,6/14/19 12:13,,https://projects.fivethirtyeight.com/polls/20190615_National.xlsx,primary,DEM,Warren,13258.0,Elizabeth Warren,9.8,2019-05-23
165,Arizona,33.729759,-111.431221,97911.0,58455.0,2020.0,573.0,Zogby Interactive/JZ Analytics,,,Zogby Analytics,395.0,Zogby Interactive/JZ Analytics,C,197.0,lv,lv-d,Online,U.S. President,5/23/19,5/29/19,,False,,False,False,6/14/19 12:13,,https://projects.fivethirtyeight.com/polls/20190615_National.xlsx,primary,DEM,Buttigieg,13345.0,Pete Buttigieg,5.6,2019-05-23
166,Arizona,33.729759,-111.431221,97911.0,58455.0,2020.0,573.0,Zogby Interactive/JZ Analytics,,,Zogby Analytics,395.0,Zogby Interactive/JZ Analytics,C,197.0,lv,lv-d,Online,U.S. President,5/23/19,5/29/19,,False,,False,False,6/14/19 12:13,,https://projects.fivethirtyeight.com/polls/20190615_National.xlsx,primary,DEM,O'Rourke,13276.0,Beto O'Rourke,1.9,2019-05-23
167,Arkansas,34.969704,-92.37312299999999,119496.0,64694.0,2020.0,1515.0,Data for Progress,,,Data for Progress,522.0,Data for Progress,B/C,300.0,lv,lv-d,Online/Text,U.S. President,2/27/20,3/2/20,,False,,False,False,3/3/20 06:22,,https://www.dataforprogress.org/memos/super-tuesday-final-polling,primary,DEM,Biden,13256.0,Joseph R. Biden Jr.,36.0,2020-02-27
168,Arkansas,34.969704,-92.37312299999999,119496.0,64694.0,2020.0,1515.0,Data for Progress,,,Data for Progress,522.0,Data for Progress,B/C,300.0,lv,lv-d,Online/Text,U.S. President,2/27/20,3/2/20,,False,,False,False,3/3/20 06:22,,https://www.dataforprogress.org/memos/super-tuesday-final-polling,primary,DEM,Warren,13258.0,Elizabeth Warren,15.0,2020-02-27
169,Arkansas,34.969704,-92.37312299999999,119496.0,64694.0,2020.0,1515.0,Data for Progress,,,Data for Progress,522.0,Data for Progress,B/C,300.0,lv,lv-d,Online/Text,U.S. President,2/27/20,3/2/20,,False,,False,False,3/3/20 06:22,,https://www.dataforprogress.org/memos/super-tuesday-final-polling,primary,DEM,Sanders,13257.0,Bernard Sanders,23.0,2020-02-27
170,Arkansas,34.969704,-92.37312299999999,116882.0,63520.0,2020.0,211.0,Hendrix College,1002,Talk Business & Politics,Hendrix College,138.0,Hendrix College,B/C,496.0,lv,lv-d,Text,U.S. President,2/6/20,2/7/20,,False,,False,False,2/11/20 18:10,,https://talkbusiness.net/2020/02/poll-bloomberg-holds-slim-lead-among-logjam-in-arkansas-democratic-presidential-primary/,primary,DEM,Biden,13256.0,Joseph R. Biden Jr.,18.5,2020-02-06
171,Arkansas,34.969704,-92.37312299999999,119474.0,64672.0,2020.0,1522.0,Swayable,,,Swayable,543.0,Swayable,,714.0,lv,lv-d,Online,U.S. President,3/1/20,3/2/20,,False,,False,False,3/3/20 06:18,,https://swayable.com/insights/democratic-primaries-2020-super-tuesday-polling,primary,DEM,Warren,13258.0,Elizabeth Warren,10.3,2020-03-01
172,Arkansas,34.969704,-92.37312299999999,119496.0,64694.0,2020.0,1515.0,Data for Progress,,,Data for Progress,522.0,Data for Progress,B/C,300.0,lv,lv-d,Online/Text,U.S. President,2/27/20,3/2/20,,False,,False,False,3/3/20 06:22,,https://www.dataforprogress.org/memos/super-tuesday-final-polling,primary,DEM,Klobuchar,13310.0,Amy Klobuchar,1.0,2020-02-27
173,Arkansas,34.969704,-92.37312299999999,116882.0,63520.0,2020.0,211.0,Hendrix College,1002,Talk Business & Politics,Hendrix College,138.0,Hendrix College,B/C,496.0,lv,lv-d,Text,U.S. President,2/6/20,2/7/20,,False,,False,False,2/11/20 18:10,,https://talkbusiness.net/2020/02/poll-bloomberg-holds-slim-lead-among-logjam-in-arkansas-democratic-presidential-primary/,primary,DEM,Warren,13258.0,Elizabeth Warren,8.9,2020-02-06
174,Arkansas,34.969704,-92.37312299999999,116882.0,63520.0,2020.0,211.0,Hendrix College,1002,Talk Business & Politics,Hendrix College,138.0,Hendrix College,B/C,496.0,lv,lv-d,Text,U.S. President,2/6/20,2/7/20,,False,,False,False,2/11/20 18:10,,https://talkbusiness.net/2020/02/poll-bloomberg-holds-slim-lead-among-logjam-in-arkansas-democratic-presidential-primary/,primary,DEM,Yang,13329.0,Andrew Yang,2.0,2020-02-06
175,Arkansas,34.969704,-92.37312299999999,116882.0,63520.0,2020.0,211.0,Hendrix College,1002,Talk Business & Politics,Hendrix College,138.0,Hendrix College,B/C,496.0,lv,lv-d,Text,U.S. President,2/6/20,2/7/20,,False,,False,False,2/11/20 18:10,,https://talkbusiness.net/2020/02/poll-bloomberg-holds-slim-lead-among-logjam-in-arkansas-democratic-presidential-primary/,primary,DEM,Buttigieg,13345.0,Pete Buttigieg,15.5,2020-02-06
176,Arkansas,34.969704,-92.37312299999999,116882.0,63520.0,2020.0,211.0,Hendrix College,1002,Talk Business & Politics,Hendrix College,138.0,Hendrix College,B/C,496.0,lv,lv-d,Text,U.S. President,2/6/20,2/7/20,,False,,False,False,2/11/20 18:10,,https://talkbusiness.net/2020/02/poll-bloomberg-holds-slim-lead-among-logjam-in-arkansas-democratic-presidential-primary/,primary,DEM,Klobuchar,13310.0,Amy Klobuchar,4.8,2020-02-06
177,Arkansas,34.969704,-92.37312299999999,116882.0,63520.0,2020.0,211.0,Hendrix College,1002,Talk Business & Politics,Hendrix College,138.0,Hendrix College,B/C,496.0,lv,lv-d,Text,U.S. President,2/6/20,2/7/20,,False,,False,False,2/11/20 18:10,,https://talkbusiness.net/2020/02/poll-bloomberg-holds-slim-lead-among-logjam-in-arkansas-democratic-presidential-primary/,primary,DEM,Sanders,13257.0,Bernard Sanders,16.4,2020-02-06
178,Arkansas,34.969704,-92.37312299999999,119496.0,64694.0,2020.0,1515.0,Data for Progress,,,Data for Progress,522.0,Data for Progress,B/C,300.0,lv,lv-d,Online/Text,U.S. President,2/27/20,3/2/20,,False,,False,False,3/3/20 06:22,,https://www.dataforprogress.org/memos/super-tuesday-final-polling,primary,DEM,Bloomberg,13289.0,Michael Bloomberg,22.0,2020-02-27
179,Arkansas,34.969704,-92.37312299999999,119474.0,64672.0,2020.0,1522.0,Swayable,,,Swayable,543.0,Swayable,,714.0,lv,lv-d,Online,U.S. President,3/1/20,3/2/20,,False,,False,False,3/3/20 06:18,,https://swayable.com/insights/democratic-primaries-2020-super-tuesday-polling,primary,DEM,Biden,13256.0,Joseph R. Biden Jr.,27.8,2020-03-01
180,Arkansas,34.969704,-92.37312299999999,116882.0,63520.0,2020.0,211.0,Hendrix College,1002,Talk Business & Politics,Hendrix College,138.0,Hendrix College,B/C,496.0,lv,lv-d,Text,U.S. President,2/6/20,2/7/20,,False,,False,False,2/11/20 18:10,,https://talkbusiness.net/2020/02/poll-bloomberg-holds-slim-lead-among-logjam-in-arkansas-democratic-presidential-primary/,primary,DEM,Bloomberg,13289.0,Michael Bloomberg,19.6,2020-02-06
181,Arkansas,34.969704,-92.37312299999999,119474.0,64672.0,2020.0,1522.0,Swayable,,,Swayable,543.0,Swayable,,714.0,lv,lv-d,Online,U.S. President,3/1/20,3/2/20,,False,,False,False,3/3/20 06:18,,https://swayable.com/insights/democratic-primaries-2020-super-tuesday-polling,primary,DEM,Sanders,13257.0,Bernard Sanders,16.8,2020-03-01
182,Arkansas,34.969704,-92.37312299999999,119474.0,64672.0,2020.0,1522.0,Swayable,,,Swayable,543.0,Swayable,,714.0,lv,lv-d,Online,U.S. President,3/1/20,3/2/20,,False,,False,False,3/3/20 06:18,,https://swayable.com/insights/democratic-primaries-2020-super-tuesday-polling,primary,DEM,Buttigieg,13345.0,Pete Buttigieg,8.0,2020-03-01
183,Arkansas,34.969704,-92.37312299999999,119474.0,64672.0,2020.0,1522.0,Swayable,,,Swayable,543.0,Swayable,,714.0,lv,lv-d,Online,U.S. President,3/1/20,3/2/20,,False,,False,False,3/3/20 06:18,,https://swayable.com/insights/democratic-primaries-2020-super-tuesday-polling,primary,DEM,Klobuchar,13310.0,Amy Klobuchar,7.0,2020-03-01
184,Arkansas,34.969704,-92.37312299999999,119474.0,64672.0,2020.0,1522.0,Swayable,,,Swayable,543.0,Swayable,,714.0,lv,lv-d,Online,U.S. President,3/1/20,3/2/20,,False,,False,False,3/3/20 06:18,,https://swayable.com/insights/democratic-primaries-2020-super-tuesday-polling,primary,DEM,Steyer,13327.0,Tom Steyer,0.5,2020-03-01
185,Arkansas,34.969704,-92.37312299999999,119474.0,64672.0,2020.0,1522.0,Swayable,,,Swayable,543.0,Swayable,,714.0,lv,lv-d,Online,U.S. President,3/1/20,3/2/20,,False,,False,False,3/3/20 06:18,,https://swayable.com/insights/democratic-primaries-2020-super-tuesday-polling,primary,DEM,Gabbard,13343.0,Tulsi Gabbard,0.2,2020-03-01
186,Arkansas,34.969704,-92.37312299999999,119496.0,64694.0,2020.0,1515.0,Data for Progress,,,Data for Progress,522.0,Data for Progress,B/C,300.0,lv,lv-d,Online/Text,U.S. President,2/27/20,3/2/20,,False,,False,False,3/3/20 06:22,,https://www.dataforprogress.org/memos/super-tuesday-final-polling,primary,DEM,Buttigieg,13345.0,Pete Buttigieg,2.0,2020-02-27
187,Arkansas,34.969704,-92.37312299999999,119496.0,64694.0,2020.0,1515.0,Data for Progress,,,Data for Progress,522.0,Data for Progress,B/C,300.0,lv,lv-d,Online/Text,U.S. President,2/27/20,3/2/20,,False,,False,False,3/3/20 06:22,,https://www.dataforprogress.org/memos/super-tuesday-final-polling,primary,DEM,Steyer,13327.0,Tom Steyer,0.0,2020-02-27
188,Arkansas,34.969704,-92.37312299999999,119496.0,64694.0,2020.0,1515.0,Data for Progress,,,Data for Progress,522.0,Data for Progress,B/C,300.0,lv,lv-d,Online/Text,U.S. President,2/27/20,3/2/20,,False,,False,False,3/3/20 06:22,,https://www.dataforprogress.org/memos/super-tuesday-final-polling,primary,DEM,Gabbard,13343.0,Tulsi Gabbard,1.0,2020-02-27
189,Arkansas,34.969704,-92.37312299999999,119474.0,64672.0,2020.0,1522.0,Swayable,,,Swayable,543.0,Swayable,,714.0,lv,lv-d,Online,U.S. President,3/1/20,3/2/20,,False,,False,False,3/3/20 06:18,,https://swayable.com/insights/democratic-primaries-2020-super-tuesday-polling,primary,DEM,Bloomberg,13289.0,Michael Bloomberg,24.8,2020-03-01
190,California,36.116203000000006,-119.681564,99374.0,58676.0,2020.0,396.0,Quinnipiac University,,,Quinnipiac University,267.0,Quinnipiac University,B+,519.0,rv,rv-d,Live Phone,U.S. President,7/10/19,7/15/19,,False,,False,False,7/17/19 09:28,,https://poll.qu.edu/california/release-detail?ReleaseID=2632,primary,DEM,Klobuchar,13310.0,Amy Klobuchar,0.0,2019-07-10
191,California,36.116203000000006,-119.681564,99374.0,58676.0,2020.0,396.0,Quinnipiac University,,,Quinnipiac University,267.0,Quinnipiac University,B+,519.0,rv,rv-d,Live Phone,U.S. President,7/10/19,7/15/19,,False,,False,False,7/17/19 09:28,,https://poll.qu.edu/california/release-detail?ReleaseID=2632,primary,DEM,Harris,13288.0,Kamala D. Harris,23.0,2019-07-10
192,California,36.116203000000006,-119.681564,99374.0,58676.0,2020.0,396.0,Quinnipiac University,,,Quinnipiac University,267.0,Quinnipiac University,B+,519.0,rv,rv-d,Live Phone,U.S. President,7/10/19,7/15/19,,False,,False,False,7/17/19 09:28,,https://poll.qu.edu/california/release-detail?ReleaseID=2632,primary,DEM,Warren,13258.0,Elizabeth Warren,16.0,2019-07-10
193,California,36.116203000000006,-119.681564,99374.0,58676.0,2020.0,396.0,Quinnipiac University,,,Quinnipiac University,267.0,Quinnipiac University,B+,519.0,rv,rv-d,Live Phone,U.S. President,7/10/19,7/15/19,,False,,False,False,7/17/19 09:28,,https://poll.qu.edu/california/release-detail?ReleaseID=2632,primary,DEM,Booker,13287.0,Cory A. Booker,1.0,2019-07-10
194,California,36.116203000000006,-119.681564,99374.0,58676.0,2020.0,396.0,Quinnipiac University,,,Quinnipiac University,267.0,Quinnipiac University,B+,519.0,rv,rv-d,Live Phone,U.S. President,7/10/19,7/15/19,,False,,False,False,7/17/19 09:28,,https://poll.qu.edu/california/release-detail?ReleaseID=2632,primary,DEM,Castro,13316.0,Julián Castro,1.0,2019-07-10
195,California,36.116203000000006,-119.681564,99374.0,58676.0,2020.0,396.0,Quinnipiac University,,,Quinnipiac University,267.0,Quinnipiac University,B+,519.0,rv,rv-d,Live Phone,U.S. President,7/10/19,7/15/19,,False,,False,False,7/17/19 09:28,,https://poll.qu.edu/california/release-detail?ReleaseID=2632,primary,DEM,Gabbard,13343.0,Tulsi Gabbard,0.0,2019-07-10
196,California,36.116203000000006,-119.681564,99374.0,58676.0,2020.0,396.0,Quinnipiac University,,,Quinnipiac University,267.0,Quinnipiac University,B+,519.0,rv,rv-d,Live Phone,U.S. President,7/10/19,7/15/19,,False,,False,False,7/17/19 09:28,,https://poll.qu.edu/california/release-detail?ReleaseID=2632,primary,DEM,Gillibrand,13311.0,Kirsten E. Gillibrand,0.0,2019-07-10
197,California,36.116203000000006,-119.681564,94072.0,57869.0,2020.0,1365.0,Change Research,,,Change Research,48.0,Change Research,C,2003.0,lv,lv-d,Online,U.S. President,4/6/19,4/9/19,,False,,False,False,4/10/19 21:12,,https://docsend.com/view/i9876ha,primary,DEM,Sanders,13257.0,Bernard Sanders,28.0,2019-04-06
198,California,36.116203000000006,-119.681564,99374.0,58676.0,2020.0,396.0,Quinnipiac University,,,Quinnipiac University,267.0,Quinnipiac University,B+,519.0,rv,rv-d,Live Phone,U.S. President,7/10/19,7/15/19,,False,,False,False,7/17/19 09:28,,https://poll.qu.edu/california/release-detail?ReleaseID=2632,primary,DEM,Sanders,13257.0,Bernard Sanders,18.0,2019-07-10
199,California,36.116203000000006,-119.681564,118660.0,64473.0,2020.0,320.0,Monmouth University,,,Monmouth University,215.0,Monmouth University,A+,408.0,lv,lv-d,Live Phone,U.S. President,2/16/20,2/19/20,,False,,False,False,2/20/20 13:03,head-to-head poll,https://www.monmouth.edu/polling-institute/documents/monmouthpoll_ca_022020.pdf/,primary,DEM,Biden,13256.0,Joseph R. Biden Jr.,36.0,2020-02-16
200,California,36.116203000000006,-119.681564,118660.0,64473.0,2020.0,320.0,Monmouth University,,,Monmouth University,215.0,Monmouth University,A+,408.0,lv,lv-d,Live Phone,U.S. President,2/16/20,2/19/20,,False,,False,False,2/20/20 13:03,head-to-head poll,https://www.monmouth.edu/polling-institute/documents/monmouthpoll_ca_022020.pdf/,primary,DEM,Sanders,13257.0,Bernard Sanders,44.0,2020-02-16
201,California,36.116203000000006,-119.681564,118659.0,64473.0,2020.0,320.0,Monmouth University,,,Monmouth University,215.0,Monmouth University,A+,408.0,lv,lv-d,Live Phone,U.S. President,2/16/20,2/19/20,,False,,False,False,2/20/20 13:03,,https://www.monmouth.edu/polling-institute/documents/monmouthpoll_ca_022020.pdf/,primary,DEM,Gabbard,13343.0,Tulsi Gabbard,2.0,2020-02-16
202,California,36.116203000000006,-119.681564,118659.0,64473.0,2020.0,320.0,Monmouth University,,,Monmouth University,215.0,Monmouth University,A+,408.0,lv,lv-d,Live Phone,U.S. President,2/16/20,2/19/20,,False,,False,False,2/20/20 13:03,,https://www.monmouth.edu/polling-institute/documents/monmouthpoll_ca_022020.pdf/,primary,DEM,Klobuchar,13310.0,Amy Klobuchar,4.0,2020-02-16
203,California,36.116203000000006,-119.681564,118659.0,64473.0,2020.0,320.0,Monmouth University,,,Monmouth University,215.0,Monmouth University,A+,408.0,lv,lv-d,Live Phone,U.S. President,2/16/20,2/19/20,,False,,False,False,2/20/20 13:03,,https://www.monmouth.edu/polling-institute/documents/monmouthpoll_ca_022020.pdf/,primary,DEM,Steyer,13327.0,Tom Steyer,5.0,2020-02-16
204,California,36.116203000000006,-119.681564,118659.0,64473.0,2020.0,320.0,Monmouth University,,,Monmouth University,215.0,Monmouth University,A+,408.0,lv,lv-d,Live Phone,U.S. President,2/16/20,2/19/20,,False,,False,False,2/20/20 13:03,,https://www.monmouth.edu/polling-institute/documents/monmouthpoll_ca_022020.pdf/,primary,DEM,Buttigieg,13345.0,Pete Buttigieg,9.0,2020-02-16
205,California,36.116203000000006,-119.681564,118661.0,64473.0,2020.0,320.0,Monmouth University,,,Monmouth University,215.0,Monmouth University,A+,408.0,lv,lv-d,Live Phone,U.S. President,2/16/20,2/19/20,,False,,False,False,2/20/20 13:03,head-to-head poll,https://www.monmouth.edu/polling-institute/documents/monmouthpoll_ca_022020.pdf/,primary,DEM,Sanders,13257.0,Bernard Sanders,51.0,2020-02-16
206,California,36.116203000000006,-119.681564,118659.0,64473.0,2020.0,320.0,Monmouth University,,,Monmouth University,215.0,Monmouth University,A+,408.0,lv,lv-d,Live Phone,U.S. President,2/16/20,2/19/20,,False,,False,False,2/20/20 13:03,,https://www.monmouth.edu/polling-institute/documents/monmouthpoll_ca_022020.pdf/,primary,DEM,Warren,13258.0,Elizabeth Warren,10.0,2020-02-16
207,California,36.116203000000006,-119.681564,118659.0,64473.0,2020.0,320.0,Monmouth University,,,Monmouth University,215.0,Monmouth University,A+,408.0,lv,lv-d,Live Phone,U.S. President,2/16/20,2/19/20,,False,,False,False,2/20/20 13:03,,https://www.monmouth.edu/polling-institute/documents/monmouthpoll_ca_022020.pdf/,primary,DEM,Biden,13256.0,Joseph R. Biden Jr.,17.0,2020-02-16
208,California,36.116203000000006,-119.681564,118659.0,64473.0,2020.0,320.0,Monmouth University,,,Monmouth University,215.0,Monmouth University,A+,408.0,lv,lv-d,Live Phone,U.S. President,2/16/20,2/19/20,,False,,False,False,2/20/20 13:03,,https://www.monmouth.edu/polling-institute/documents/monmouthpoll_ca_022020.pdf/,primary,DEM,Sanders,13257.0,Bernard Sanders,24.0,2020-02-16
209,California,36.116203000000006,-119.681564,94059.0,57862.0,2020.0,396.0,Quinnipiac University,,,Quinnipiac University,267.0,Quinnipiac University,B+,482.0,rv,rv-d,Live Phone,U.S. President,4/3/19,4/8/19,,False,,False,False,4/10/19 08:16,,https://poll.qu.edu/california/release-detail?ReleaseID=2615,primary,DEM,Castro,13316.0,Julián Castro,2.0,2019-04-03
210,California,36.116203000000006,-119.681564,94059.0,57862.0,2020.0,396.0,Quinnipiac University,,,Quinnipiac University,267.0,Quinnipiac University,B+,482.0,rv,rv-d,Live Phone,U.S. President,4/3/19,4/8/19,,False,,False,False,4/10/19 08:16,,https://poll.qu.edu/california/release-detail?ReleaseID=2615,primary,DEM,Klobuchar,13310.0,Amy Klobuchar,2.0,2019-04-03
211,California,36.116203000000006,-119.681564,94059.0,57862.0,2020.0,396.0,Quinnipiac University,,,Quinnipiac University,267.0,Quinnipiac University,B+,482.0,rv,rv-d,Live Phone,U.S. President,4/3/19,4/8/19,,False,,False,False,4/10/19 08:16,,https://poll.qu.edu/california/release-detail?ReleaseID=2615,primary,DEM,Gillibrand,13311.0,Kirsten E. Gillibrand,0.0,2019-04-03
212,California,36.116203000000006,-119.681564,94059.0,57862.0,2020.0,396.0,Quinnipiac University,,,Quinnipiac University,267.0,Quinnipiac University,B+,482.0,rv,rv-d,Live Phone,U.S. President,4/3/19,4/8/19,,False,,False,False,4/10/19 08:16,,https://poll.qu.edu/california/release-detail?ReleaseID=2615,primary,DEM,Booker,13287.0,Cory A. Booker,2.0,2019-04-03
213,California,36.116203000000006,-119.681564,118659.0,64473.0,2020.0,320.0,Monmouth University,,,Monmouth University,215.0,Monmouth University,A+,408.0,lv,lv-d,Live Phone,U.S. President,2/16/20,2/19/20,,False,,False,False,2/20/20 13:03,,https://www.monmouth.edu/polling-institute/documents/monmouthpoll_ca_022020.pdf/,primary,DEM,Bloomberg,13289.0,Michael Bloomberg,13.0,2020-02-16
214,California,36.116203000000006,-119.681564,99374.0,58676.0,2020.0,396.0,Quinnipiac University,,,Quinnipiac University,267.0,Quinnipiac University,B+,519.0,rv,rv-d,Live Phone,U.S. President,7/10/19,7/15/19,,False,,False,False,7/17/19 09:28,,https://poll.qu.edu/california/release-detail?ReleaseID=2632,primary,DEM,O'Rourke,13276.0,Beto O'Rourke,1.0,2019-07-10
215,California,36.116203000000006,-119.681564,118661.0,64473.0,2020.0,320.0,Monmouth University,,,Monmouth University,215.0,Monmouth University,A+,408.0,lv,lv-d,Live Phone,U.S. President,2/16/20,2/19/20,,False,,False,False,2/20/20 13:03,head-to-head poll,https://www.monmouth.edu/polling-institute/documents/monmouthpoll_ca_022020.pdf/,primary,DEM,Buttigieg,13345.0,Pete Buttigieg,26.0,2020-02-16
216,California,36.116203000000006,-119.681564,118662.0,64473.0,2020.0,320.0,Monmouth University,,,Monmouth University,215.0,Monmouth University,A+,408.0,lv,lv-d,Live Phone,U.S. President,2/16/20,2/19/20,,False,,False,False,2/20/20 13:03,head-to-head poll,https://www.monmouth.edu/polling-institute/documents/monmouthpoll_ca_022020.pdf/,primary,DEM,Klobuchar,13310.0,Amy Klobuchar,24.0,2020-02-16
217,California,36.116203000000006,-119.681564,99374.0,58676.0,2020.0,396.0,Quinnipiac University,,,Quinnipiac University,267.0,Quinnipiac University,B+,519.0,rv,rv-d,Live Phone,U.S. President,7/10/19,7/15/19,,False,,False,False,7/17/19 09:28,,https://poll.qu.edu/california/release-detail?ReleaseID=2632,primary,DEM,Biden,13256.0,Joseph R. Biden Jr.,21.0,2019-07-10
218,California,36.116203000000006,-119.681564,103275.0,59708.0,2020.0,1363.0,"University of California, Berkeley",300,LA Times,"University of California, Berkeley",457.0,"University of California, Berkeley",B/C,2272.0,lv,lv-d,Online,U.S. President,9/13/19,9/18/19,,False,,False,False,9/25/19 08:29,,https://escholarship.org/uc/item/2v9530s0,primary,DEM,Bennet,13352.0,Michael F. Bennet,0.6,2019-09-13
219,California,36.116203000000006,-119.681564,103275.0,59708.0,2020.0,1363.0,"University of California, Berkeley",300,LA Times,"University of California, Berkeley",457.0,"University of California, Berkeley",B/C,2272.0,lv,lv-d,Online,U.S. President,9/13/19,9/18/19,,False,,False,False,9/25/19 08:29,,https://escholarship.org/uc/item/2v9530s0,primary,DEM,Castro,13316.0,Julián Castro,0.8,2019-09-13
220,California,36.116203000000006,-119.681564,99374.0,58676.0,2020.0,396.0,Quinnipiac University,,,Quinnipiac University,267.0,Quinnipiac University,B+,519.0,rv,rv-d,Live Phone,U.S. President,7/10/19,7/15/19,,False,,False,False,7/17/19 09:28,,https://poll.qu.edu/california/release-detail?ReleaseID=2632,primary,DEM,Inslee,13324.0,Jay Robert Inslee,1.0,2019-07-10
221,California,36.116203000000006,-119.681564,94059.0,57862.0,2020.0,396.0,Quinnipiac University,,,Quinnipiac University,267.0,Quinnipiac University,B+,482.0,rv,rv-d,Live Phone,U.S. President,4/3/19,4/8/19,,False,,False,False,4/10/19 08:16,,https://poll.qu.edu/california/release-detail?ReleaseID=2615,primary,DEM,Messam,13357.0,Wayne Messam,0.0,2019-04-03
222,California,36.116203000000006,-119.681564,94059.0,57862.0,2020.0,396.0,Quinnipiac University,,,Quinnipiac University,267.0,Quinnipiac University,B+,482.0,rv,rv-d,Live Phone,U.S. President,4/3/19,4/8/19,,False,,False,False,4/10/19 08:16,,https://poll.qu.edu/california/release-detail?ReleaseID=2615,primary,DEM,Williamson,13350.0,Marianne Williamson,0.0,2019-04-03
223,California,36.116203000000006,-119.681564,118662.0,64473.0,2020.0,320.0,Monmouth University,,,Monmouth University,215.0,Monmouth University,A+,408.0,lv,lv-d,Live Phone,U.S. President,2/16/20,2/19/20,,False,,False,False,2/20/20 13:03,head-to-head poll,https://www.monmouth.edu/polling-institute/documents/monmouthpoll_ca_022020.pdf/,primary,DEM,Sanders,13257.0,Bernard Sanders,54.0,2020-02-16
224,California,36.116203000000006,-119.681564,94059.0,57862.0,2020.0,396.0,Quinnipiac University,,,Quinnipiac University,267.0,Quinnipiac University,B+,482.0,rv,rv-d,Live Phone,U.S. President,4/3/19,4/8/19,,False,,False,False,4/10/19 08:16,,https://poll.qu.edu/california/release-detail?ReleaseID=2615,primary,DEM,Yang,13329.0,Andrew Yang,1.0,2019-04-03
225,California,36.116203000000006,-119.681564,94059.0,57862.0,2020.0,396.0,Quinnipiac University,,,Quinnipiac University,267.0,Quinnipiac University,B+,482.0,rv,rv-d,Live Phone,U.S. President,4/3/19,4/8/19,,False,,False,False,4/10/19 08:16,,https://poll.qu.edu/california/release-detail?ReleaseID=2615,primary,DEM,Delaney,13314.0,John K. Delaney,0.0,2019-04-03
226,California,36.116203000000006,-119.681564,94059.0,57862.0,2020.0,396.0,Quinnipiac University,,,Quinnipiac University,267.0,Quinnipiac University,B+,482.0,rv,rv-d,Live Phone,U.S. President,4/3/19,4/8/19,,False,,False,False,4/10/19 08:16,,https://poll.qu.edu/california/release-detail?ReleaseID=2615,primary,DEM,Hickenlooper,13326.0,John Hickenlooper,0.0,2019-04-03
227,California,36.116203000000006,-119.681564,94059.0,57862.0,2020.0,396.0,Quinnipiac University,,,Quinnipiac University,267.0,Quinnipiac University,B+,482.0,rv,rv-d,Live Phone,U.S. President,4/3/19,4/8/19,,False,,False,False,4/10/19 08:16,,https://poll.qu.edu/california/release-detail?ReleaseID=2615,primary,DEM,Inslee,13324.0,Jay Robert Inslee,1.0,2019-04-03
228,California,36.116203000000006,-119.681564,94059.0,57862.0,2020.0,396.0,Quinnipiac University,,,Quinnipiac University,267.0,Quinnipiac University,B+,482.0,rv,rv-d,Live Phone,U.S. President,4/3/19,4/8/19,,False,,False,False,4/10/19 08:16,,https://poll.qu.edu/california/release-detail?ReleaseID=2615,primary,DEM,Gabbard,13343.0,Tulsi Gabbard,1.0,2019-04-03
229,California,36.116203000000006,-119.681564,118663.0,64473.0,2020.0,320.0,Monmouth University,,,Monmouth University,215.0,Monmouth University,A+,408.0,lv,lv-d,Live Phone,U.S. President,2/16/20,2/19/20,,False,,False,False,2/20/20 13:03,head-to-head poll,https://www.monmouth.edu/polling-institute/documents/monmouthpoll_ca_022020.pdf/,primary,DEM,Bloomberg,13289.0,Michael Bloomberg,31.0,2020-02-16
230,California,36.116203000000006,-119.681564,118663.0,64473.0,2020.0,320.0,Monmouth University,,,Monmouth University,215.0,Monmouth University,A+,408.0,lv,lv-d,Live Phone,U.S. President,2/16/20,2/19/20,,False,,False,False,2/20/20 13:03,head-to-head poll,https://www.monmouth.edu/polling-institute/documents/monmouthpoll_ca_022020.pdf/,primary,DEM,Sanders,13257.0,Bernard Sanders,48.0,2020-02-16
231,California,36.116203000000006,-119.681564,94059.0,57862.0,2020.0,396.0,Quinnipiac University,,,Quinnipiac University,267.0,Quinnipiac University,B+,482.0,rv,rv-d,Live Phone,U.S. President,4/3/19,4/8/19,,False,,False,False,4/10/19 08:16,,https://poll.qu.edu/california/release-detail?ReleaseID=2615,primary,DEM,Buttigieg,13345.0,Pete Buttigieg,7.0,2019-04-03
232,California,36.116203000000006,-119.681564,99374.0,58676.0,2020.0,396.0,Quinnipiac University,,,Quinnipiac University,267.0,Quinnipiac University,B+,519.0,rv,rv-d,Live Phone,U.S. President,7/10/19,7/15/19,,False,,False,False,7/17/19 09:28,,https://poll.qu.edu/california/release-detail?ReleaseID=2632,primary,DEM,Hickenlooper,13326.0,John Hickenlooper,0.0,2019-07-10
233,California,36.116203000000006,-119.681564,99315.0,58660.0,2020.0,1365.0,Change Research,,,Change Research,48.0,Change Research,C,1609.0,lv,lv-d,Online,U.S. President,7/9/19,7/11/19,,False,,False,False,7/15/19 15:57,,https://www.changeresearch.com/california-poll-july-9-11-2019,primary,DEM,Sanders,13257.0,Bernard Sanders,20.0,2019-07-09
234,California,36.116203000000006,-119.681564,99374.0,58676.0,2020.0,396.0,Quinnipiac University,,,Quinnipiac University,267.0,Quinnipiac University,B+,519.0,rv,rv-d,Live Phone,U.S. President,7/10/19,7/15/19,,False,,False,False,7/17/19 09:28,,https://poll.qu.edu/california/release-detail?ReleaseID=2632,primary,DEM,Buttigieg,13345.0,Pete Buttigieg,3.0,2019-07-10
235,California,36.116203000000006,-119.681564,99315.0,58660.0,2020.0,1365.0,Change Research,,,Change Research,48.0,Change Research,C,1609.0,lv,lv-d,Online,U.S. President,7/9/19,7/11/19,,False,,False,False,7/15/19 15:57,,https://www.changeresearch.com/california-poll-july-9-11-2019,primary,DEM,Inslee,13324.0,Jay Robert Inslee,1.0,2019-07-09
236,California,36.116203000000006,-119.681564,99315.0,58660.0,2020.0,1365.0,Change Research,,,Change Research,48.0,Change Research,C,1609.0,lv,lv-d,Online,U.S. President,7/9/19,7/11/19,,False,,False,False,7/15/19 15:57,,https://www.changeresearch.com/california-poll-july-9-11-2019,primary,DEM,Williamson,13350.0,Marianne Williamson,0.0,2019-07-09
237,California,36.116203000000006,-119.681564,99315.0,58660.0,2020.0,1365.0,Change Research,,,Change Research,48.0,Change Research,C,1609.0,lv,lv-d,Online,U.S. President,7/9/19,7/11/19,,False,,False,False,7/15/19 15:57,,https://www.changeresearch.com/california-poll-july-9-11-2019,primary,DEM,Steyer,13327.0,Tom Steyer,0.0,2019-07-09
238,California,36.116203000000006,-119.681564,99315.0,58660.0,2020.0,1365.0,Change Research,,,Change Research,48.0,Change Research,C,1609.0,lv,lv-d,Online,U.S. President,7/9/19,7/11/19,,False,,False,False,7/15/19 15:57,,https://www.changeresearch.com/california-poll-july-9-11-2019,primary,DEM,Delaney,13314.0,John K. Delaney,0.0,2019-07-09
239,California,36.116203000000006,-119.681564,99315.0,58660.0,2020.0,1365.0,Change Research,,,Change Research,48.0,Change Research,C,1609.0,lv,lv-d,Online,U.S. President,7/9/19,7/11/19,,False,,False,False,7/15/19 15:57,,https://www.changeresearch.com/california-poll-july-9-11-2019,primary,DEM,Hickenlooper,13326.0,John Hickenlooper,0.0,2019-07-09
240,California,36.116203000000006,-119.681564,99315.0,58660.0,2020.0,1365.0,Change Research,,,Change Research,48.0,Change Research,C,1609.0,lv,lv-d,Online,U.S. President,7/9/19,7/11/19,,False,,False,False,7/15/19 15:57,,https://www.changeresearch.com/california-poll-july-9-11-2019,primary,DEM,de Blasio,13335.0,Bill de Blasio,0.0,2019-07-09
241,California,36.116203000000006,-119.681564,99315.0,58660.0,2020.0,1365.0,Change Research,,,Change Research,48.0,Change Research,C,1609.0,lv,lv-d,Online,U.S. President,7/9/19,7/11/19,,False,,False,False,7/15/19 15:57,,https://www.changeresearch.com/california-poll-july-9-11-2019,primary,DEM,Gravel,13359.0,Mike Gravel,0.0,2019-07-09
242,California,36.116203000000006,-119.681564,99315.0,58660.0,2020.0,1365.0,Change Research,,,Change Research,48.0,Change Research,C,1609.0,lv,lv-d,Online,U.S. President,7/9/19,7/11/19,,False,,False,False,7/15/19 15:57,,https://www.changeresearch.com/california-poll-july-9-11-2019,primary,DEM,Gillibrand,13311.0,Kirsten E. Gillibrand,0.0,2019-07-09
243,California,36.116203000000006,-119.681564,99315.0,58660.0,2020.0,1365.0,Change Research,,,Change Research,48.0,Change Research,C,1609.0,lv,lv-d,Online,U.S. President,7/9/19,7/11/19,,False,,False,False,7/15/19 15:57,,https://www.changeresearch.com/california-poll-july-9-11-2019,primary,DEM,Ryan,13358.0,Tim Ryan,0.0,2019-07-09
244,California,36.116203000000006,-119.681564,99315.0,58660.0,2020.0,1365.0,Change Research,,,Change Research,48.0,Change Research,C,1609.0,lv,lv-d,Online,U.S. President,7/9/19,7/11/19,,False,,False,False,7/15/19 15:57,,https://www.changeresearch.com/california-poll-july-9-11-2019,primary,DEM,Messam,13357.0,Wayne Messam,0.0,2019-07-09
245,California,36.116203000000006,-119.681564,99315.0,58660.0,2020.0,1365.0,Change Research,,,Change Research,48.0,Change Research,C,1609.0,lv,lv-d,Online,U.S. President,7/9/19,7/11/19,,False,,False,False,7/15/19 15:57,,https://www.changeresearch.com/california-poll-july-9-11-2019,primary,DEM,Bennet,13352.0,Michael F. Bennet,0.0,2019-07-09
246,California,36.116203000000006,-119.681564,99315.0,58660.0,2020.0,1365.0,Change Research,,,Change Research,48.0,Change Research,C,1609.0,lv,lv-d,Online,U.S. President,7/9/19,7/11/19,,False,,False,False,7/15/19 15:57,,https://www.changeresearch.com/california-poll-july-9-11-2019,primary,DEM,Sestak,13381.0,Joe Sestak,0.0,2019-07-09
247,California,36.116203000000006,-119.681564,118361.0,64349.0,2020.0,382.0,Public Policy Institute of California,,,Public Policy Institute of California,262.0,Public Policy Institute of California,A/B,573.0,lv,lv-d,Live Phone,U.S. President,2/7/20,2/17/20,,False,,False,False,2/18/20 19:37,,https://www.ppic.org/wp-content/uploads/crosstabs-time-trends-methodology-0220.pdf,primary,DEM,Bloomberg,13289.0,Michael Bloomberg,12.0,2020-02-07
248,California,36.116203000000006,-119.681564,115961.0,63320.0,2020.0,495.0,Tulchin Research,"1226,1227",USC Rossier | Policy Analysis for California Education,Tulchin Research,340.0,Tulchin Research,B/C,1121.0,lv,lv-d,Online,U.S. President,1/3/20,1/10/20,,False,,False,False,1/22/20 06:48,,https://projects.fivethirtyeight.com/polls/20200122_CA.pdf,primary,DEM,Bloomberg,13289.0,Michael Bloomberg,7.0,2020-01-03
249,California,36.116203000000006,-119.681564,115961.0,63320.0,2020.0,495.0,Tulchin Research,"1226,1227",USC Rossier | Policy Analysis for California Education,Tulchin Research,340.0,Tulchin Research,B/C,1121.0,lv,lv-d,Online,U.S. President,1/3/20,1/10/20,,False,,False,False,1/22/20 06:48,,https://projects.fivethirtyeight.com/polls/20200122_CA.pdf,primary,DEM,Steyer,13327.0,Tom Steyer,3.0,2020-01-03
250,California,36.116203000000006,-119.681564,115961.0,63320.0,2020.0,495.0,Tulchin Research,"1226,1227",USC Rossier | Policy Analysis for California Education,Tulchin Research,340.0,Tulchin Research,B/C,1121.0,lv,lv-d,Online,U.S. President,1/3/20,1/10/20,,False,,False,False,1/22/20 06:48,,https://projects.fivethirtyeight.com/polls/20200122_CA.pdf,primary,DEM,Klobuchar,13310.0,Amy Klobuchar,2.0,2020-01-03
251,California,36.116203000000006,-119.681564,115961.0,63320.0,2020.0,495.0,Tulchin Research,"1226,1227",USC Rossier | Policy Analysis for California Education,Tulchin Research,340.0,Tulchin Research,B/C,1121.0,lv,lv-d,Online,U.S. President,1/3/20,1/10/20,,False,,False,False,1/22/20 06:48,,https://projects.fivethirtyeight.com/polls/20200122_CA.pdf,primary,DEM,Booker,13287.0,Cory A. Booker,1.0,2020-01-03
252,California,36.116203000000006,-119.681564,103275.0,59708.0,2020.0,1363.0,"University of California, Berkeley",300,LA Times,"University of California, Berkeley",457.0,"University of California, Berkeley",B/C,2272.0,lv,lv-d,Online,U.S. President,9/13/19,9/18/19,,False,,False,False,9/25/19 08:29,,https://escholarship.org/uc/item/2v9530s0,primary,DEM,Williamson,13350.0,Marianne Williamson,0.3,2019-09-13
253,California,36.116203000000006,-119.681564,103275.0,59708.0,2020.0,1363.0,"University of California, Berkeley",300,LA Times,"University of California, Berkeley",457.0,"University of California, Berkeley",B/C,2272.0,lv,lv-d,Online,U.S. President,9/13/19,9/18/19,,False,,False,False,9/25/19 08:29,,https://escholarship.org/uc/item/2v9530s0,primary,DEM,Bullock,13320.0,Steve Bullock,0.2,2019-09-13
254,California,36.116203000000006,-119.681564,103275.0,59708.0,2020.0,1363.0,"University of California, Berkeley",300,LA Times,"University of California, Berkeley",457.0,"University of California, Berkeley",B/C,2272.0,lv,lv-d,Online,U.S. President,9/13/19,9/18/19,,False,,False,False,9/25/19 08:29,,https://escholarship.org/uc/item/2v9530s0,primary,DEM,Steyer,13327.0,Tom Steyer,0.1,2019-09-13
255,California,36.116203000000006,-119.681564,103275.0,59708.0,2020.0,1363.0,"University of California, Berkeley",300,LA Times,"University of California, Berkeley",457.0,"University of California, Berkeley",B/C,2272.0,lv,lv-d,Online,U.S. President,9/13/19,9/18/19,,False,,False,False,9/25/19 08:29,,https://escholarship.org/uc/item/2v9530s0,primary,DEM,Delaney,13314.0,John K. Delaney,0.1,2019-09-13
256,California,36.116203000000006,-119.681564,103275.0,59708.0,2020.0,1363.0,"University of California, Berkeley",300,LA Times,"University of California, Berkeley",457.0,"University of California, Berkeley",B/C,2272.0,lv,lv-d,Online,U.S. President,9/13/19,9/18/19,,False,,False,False,9/25/19 08:29,,https://escholarship.org/uc/item/2v9530s0,primary,DEM,de Blasio,13335.0,Bill de Blasio,0.0,2019-09-13
257,California,36.116203000000006,-119.681564,103275.0,59708.0,2020.0,1363.0,"University of California, Berkeley",300,LA Times,"University of California, Berkeley",457.0,"University of California, Berkeley",B/C,2272.0,lv,lv-d,Online,U.S. President,9/13/19,9/18/19,,False,,False,False,9/25/19 08:29,,https://escholarship.org/uc/item/2v9530s0,primary,DEM,Messam,13357.0,Wayne Messam,0.0,2019-09-13
258,California,36.116203000000006,-119.681564,103275.0,59708.0,2020.0,1363.0,"University of California, Berkeley",300,LA Times,"University of California, Berkeley",457.0,"University of California, Berkeley",B/C,2272.0,lv,lv-d,Online,U.S. President,9/13/19,9/18/19,,False,,False,False,9/25/19 08:29,,https://escholarship.org/uc/item/2v9530s0,primary,DEM,Ryan,13358.0,Tim Ryan,0.0,2019-09-13
259,California,36.116203000000006,-119.681564,103275.0,59708.0,2020.0,1363.0,"University of California, Berkeley",300,LA Times,"University of California, Berkeley",457.0,"University of California, Berkeley",B/C,2272.0,lv,lv-d,Online,U.S. President,9/13/19,9/18/19,,False,,False,False,9/25/19 08:29,,https://escholarship.org/uc/item/2v9530s0,primary,DEM,Sestak,13381.0,Joe Sestak,0.0,2019-09-13
260,California,36.116203000000006,-119.681564,94682.0,58166.0,2020.0,1365.0,Change Research,,,Change Research,48.0,Change Research,C,1649.0,lv,lv-d,Online,U.S. President,5/25/19,5/28/19,,False,,False,False,5/31/19 10:39,,https://www.changeresearch.com/california-poll-may-25-28-2019,primary,DEM,Castro,13316.0,Julián Castro,1.0,2019-05-25
261,California,36.116203000000006,-119.681564,115961.0,63320.0,2020.0,495.0,Tulchin Research,"1226,1227",USC Rossier | Policy Analysis for California Education,Tulchin Research,340.0,Tulchin Research,B/C,1121.0,lv,lv-d,Online,U.S. President,1/3/20,1/10/20,,False,,False,False,1/22/20 06:48,,https://projects.fivethirtyeight.com/polls/20200122_CA.pdf,primary,DEM,Yang,13329.0,Andrew Yang,5.0,2020-01-03
262,California,36.116203000000006,-119.681564,99374.0,58676.0,2020.0,396.0,Quinnipiac University,,,Quinnipiac University,267.0,Quinnipiac University,B+,519.0,rv,rv-d,Live Phone,U.S. President,7/10/19,7/15/19,,False,,False,False,7/17/19 09:28,,https://poll.qu.edu/california/release-detail?ReleaseID=2632,primary,DEM,Delaney,13314.0,John K. Delaney,0.0,2019-07-10
263,California,36.116203000000006,-119.681564,118361.0,64349.0,2020.0,382.0,Public Policy Institute of California,,,Public Policy Institute of California,262.0,Public Policy Institute of California,A/B,573.0,lv,lv-d,Live Phone,U.S. President,2/7/20,2/17/20,,False,,False,False,2/18/20 19:37,,https://www.ppic.org/wp-content/uploads/crosstabs-time-trends-methodology-0220.pdf,primary,DEM,Gabbard,13343.0,Tulsi Gabbard,1.0,2020-02-07
264,California,36.116203000000006,-119.681564,118361.0,64349.0,2020.0,382.0,Public Policy Institute of California,,,Public Policy Institute of California,262.0,Public Policy Institute of California,A/B,573.0,lv,lv-d,Live Phone,U.S. President,2/7/20,2/17/20,,False,,False,False,2/18/20 19:37,,https://www.ppic.org/wp-content/uploads/crosstabs-time-trends-methodology-0220.pdf,primary,DEM,Warren,13258.0,Elizabeth Warren,13.0,2020-02-07
265,California,36.116203000000006,-119.681564,99374.0,58676.0,2020.0,396.0,Quinnipiac University,,,Quinnipiac University,267.0,Quinnipiac University,B+,519.0,rv,rv-d,Live Phone,U.S. President,7/10/19,7/15/19,,False,,False,False,7/17/19 09:28,,https://poll.qu.edu/california/release-detail?ReleaseID=2632,primary,DEM,Yang,13329.0,Andrew Yang,2.0,2019-07-10
266,California,36.116203000000006,-119.681564,99374.0,58676.0,2020.0,396.0,Quinnipiac University,,,Quinnipiac University,267.0,Quinnipiac University,B+,519.0,rv,rv-d,Live Phone,U.S. President,7/10/19,7/15/19,,False,,False,False,7/17/19 09:28,,https://poll.qu.edu/california/release-detail?ReleaseID=2632,primary,DEM,Williamson,13350.0,Marianne Williamson,0.0,2019-07-10
267,California,36.116203000000006,-119.681564,99374.0,58676.0,2020.0,396.0,Quinnipiac University,,,Quinnipiac University,267.0,Quinnipiac University,B+,519.0,rv,rv-d,Live Phone,U.S. President,7/10/19,7/15/19,,False,,False,False,7/17/19 09:28,,https://poll.qu.edu/california/release-detail?ReleaseID=2632,primary,DEM,Messam,13357.0,Wayne Messam,0.0,2019-07-10
268,California,36.116203000000006,-119.681564,99374.0,58676.0,2020.0,396.0,Quinnipiac University,,,Quinnipiac University,267.0,Quinnipiac University,B+,519.0,rv,rv-d,Live Phone,U.S. President,7/10/19,7/15/19,,False,,False,False,7/17/19 09:28,,https://poll.qu.edu/california/release-detail?ReleaseID=2632,primary,DEM,Ryan,13358.0,Tim Ryan,0.0,2019-07-10
269,California,36.116203000000006,-119.681564,99374.0,58676.0,2020.0,396.0,Quinnipiac University,,,Quinnipiac University,267.0,Quinnipiac University,B+,519.0,rv,rv-d,Live Phone,U.S. President,7/10/19,7/15/19,,False,,False,False,7/17/19 09:28,,https://poll.qu.edu/california/release-detail?ReleaseID=2632,primary,DEM,Moulton,13322.0,Seth Moulton,0.0,2019-07-10
270,California,36.116203000000006,-119.681564,99374.0,58676.0,2020.0,396.0,Quinnipiac University,,,Quinnipiac University,267.0,Quinnipiac University,B+,519.0,rv,rv-d,Live Phone,U.S. President,7/10/19,7/15/19,,False,,False,False,7/17/19 09:28,,https://poll.qu.edu/california/release-detail?ReleaseID=2632,primary,DEM,Bennet,13352.0,Michael F. Bennet,0.0,2019-07-10
271,California,36.116203000000006,-119.681564,99374.0,58676.0,2020.0,396.0,Quinnipiac University,,,Quinnipiac University,267.0,Quinnipiac University,B+,519.0,rv,rv-d,Live Phone,U.S. President,7/10/19,7/15/19,,False,,False,False,7/17/19 09:28,,https://poll.qu.edu/california/release-detail?ReleaseID=2632,primary,DEM,Bullock,13320.0,Steve Bullock,0.0,2019-07-10
272,California,36.116203000000006,-119.681564,99374.0,58676.0,2020.0,396.0,Quinnipiac University,,,Quinnipiac University,267.0,Quinnipiac University,B+,519.0,rv,rv-d,Live Phone,U.S. President,7/10/19,7/15/19,,False,,False,False,7/17/19 09:28,,https://poll.qu.edu/california/release-detail?ReleaseID=2632,primary,DEM,de Blasio,13335.0,Bill de Blasio,0.0,2019-07-10
273,California,36.116203000000006,-119.681564,99374.0,58676.0,2020.0,396.0,Quinnipiac University,,,Quinnipiac University,267.0,Quinnipiac University,B+,519.0,rv,rv-d,Live Phone,U.S. President,7/10/19,7/15/19,,False,,False,False,7/17/19 09:28,,https://poll.qu.edu/california/release-detail?ReleaseID=2632,primary,DEM,Gravel,13359.0,Mike Gravel,0.0,2019-07-10
274,California,36.116203000000006,-119.681564,99374.0,58676.0,2020.0,396.0,Quinnipiac University,,,Quinnipiac University,267.0,Quinnipiac University,B+,519.0,rv,rv-d,Live Phone,U.S. President,7/10/19,7/15/19,,False,,False,False,7/17/19 09:28,,https://poll.qu.edu/california/release-detail?ReleaseID=2632,primary,DEM,Sestak,13381.0,Joe Sestak,0.0,2019-07-10
275,California,36.116203000000006,-119.681564,99374.0,58676.0,2020.0,396.0,Quinnipiac University,,,Quinnipiac University,267.0,Quinnipiac University,B+,519.0,rv,rv-d,Live Phone,U.S. President,7/10/19,7/15/19,,False,,False,False,7/17/19 09:28,,https://poll.qu.edu/california/release-detail?ReleaseID=2632,primary,DEM,Steyer,13327.0,Tom Steyer,0.0,2019-07-10
276,California,36.116203000000006,-119.681564,99315.0,58660.0,2020.0,1365.0,Change Research,,,Change Research,48.0,Change Research,C,1609.0,lv,lv-d,Online,U.S. President,7/9/19,7/11/19,,False,,False,False,7/15/19 15:57,,https://www.changeresearch.com/california-poll-july-9-11-2019,primary,DEM,Harris,13288.0,Kamala D. Harris,23.0,2019-07-09
277,California,36.116203000000006,-119.681564,118361.0,64349.0,2020.0,382.0,Public Policy Institute of California,,,Public Policy Institute of California,262.0,Public Policy Institute of California,A/B,573.0,lv,lv-d,Live Phone,U.S. President,2/7/20,2/17/20,,False,,False,False,2/18/20 19:37,,https://www.ppic.org/wp-content/uploads/crosstabs-time-trends-methodology-0220.pdf,primary,DEM,Klobuchar,13310.0,Amy Klobuchar,5.0,2020-02-07
278,California,36.116203000000006,-119.681564,99315.0,58660.0,2020.0,1365.0,Change Research,,,Change Research,48.0,Change Research,C,1609.0,lv,lv-d,Online,U.S. President,7/9/19,7/11/19,,False,,False,False,7/15/19 15:57,,https://www.changeresearch.com/california-poll-july-9-11-2019,primary,DEM,Warren,13258.0,Elizabeth Warren,22.0,2019-07-09
279,California,36.116203000000006,-119.681564,99315.0,58660.0,2020.0,1365.0,Change Research,,,Change Research,48.0,Change Research,C,1609.0,lv,lv-d,Online,U.S. President,7/9/19,7/11/19,,False,,False,False,7/15/19 15:57,,https://www.changeresearch.com/california-poll-july-9-11-2019,primary,DEM,Biden,13256.0,Joseph R. Biden Jr.,17.0,2019-07-09
280,California,36.116203000000006,-119.681564,99315.0,58660.0,2020.0,1365.0,Change Research,,,Change Research,48.0,Change Research,C,1609.0,lv,lv-d,Online,U.S. President,7/9/19,7/11/19,,False,,False,False,7/15/19 15:57,,https://www.changeresearch.com/california-poll-july-9-11-2019,primary,DEM,Buttigieg,13345.0,Pete Buttigieg,8.0,2019-07-09
281,California,36.116203000000006,-119.681564,99315.0,58660.0,2020.0,1365.0,Change Research,,,Change Research,48.0,Change Research,C,1609.0,lv,lv-d,Online,U.S. President,7/9/19,7/11/19,,False,,False,False,7/15/19 15:57,,https://www.changeresearch.com/california-poll-july-9-11-2019,primary,DEM,O'Rourke,13276.0,Beto O'Rourke,2.0,2019-07-09
282,California,36.116203000000006,-119.681564,99315.0,58660.0,2020.0,1365.0,Change Research,,,Change Research,48.0,Change Research,C,1609.0,lv,lv-d,Online,U.S. President,7/9/19,7/11/19,,False,,False,False,7/15/19 15:57,,https://www.changeresearch.com/california-poll-july-9-11-2019,primary,DEM,Gabbard,13343.0,Tulsi Gabbard,2.0,2019-07-09
283,California,36.116203000000006,-119.681564,99315.0,58660.0,2020.0,1365.0,Change Research,,,Change Research,48.0,Change Research,C,1609.0,lv,lv-d,Online,U.S. President,7/9/19,7/11/19,,False,,False,False,7/15/19 15:57,,https://www.changeresearch.com/california-poll-july-9-11-2019,primary,DEM,Yang,13329.0,Andrew Yang,2.0,2019-07-09
284,California,36.116203000000006,-119.681564,99315.0,58660.0,2020.0,1365.0,Change Research,,,Change Research,48.0,Change Research,C,1609.0,lv,lv-d,Online,U.S. President,7/9/19,7/11/19,,False,,False,False,7/15/19 15:57,,https://www.changeresearch.com/california-poll-july-9-11-2019,primary,DEM,Castro,13316.0,Julián Castro,1.0,2019-07-09
285,California,36.116203000000006,-119.681564,99315.0,58660.0,2020.0,1365.0,Change Research,,,Change Research,48.0,Change Research,C,1609.0,lv,lv-d,Online,U.S. President,7/9/19,7/11/19,,False,,False,False,7/15/19 15:57,,https://www.changeresearch.com/california-poll-july-9-11-2019,primary,DEM,Klobuchar,13310.0,Amy Klobuchar,1.0,2019-07-09
286,California,36.116203000000006,-119.681564,99315.0,58660.0,2020.0,1365.0,Change Research,,,Change Research,48.0,Change Research,C,1609.0,lv,lv-d,Online,U.S. President,7/9/19,7/11/19,,False,,False,False,7/15/19 15:57,,https://www.changeresearch.com/california-poll-july-9-11-2019,primary,DEM,Booker,13287.0,Cory A. Booker,1.0,2019-07-09
287,California,36.116203000000006,-119.681564,118361.0,64349.0,2020.0,382.0,Public Policy Institute of California,,,Public Policy Institute of California,262.0,Public Policy Institute of California,A/B,573.0,lv,lv-d,Live Phone,U.S. President,2/7/20,2/17/20,,False,,False,False,2/18/20 19:37,,https://www.ppic.org/wp-content/uploads/crosstabs-time-trends-methodology-0220.pdf,primary,DEM,Biden,13256.0,Joseph R. Biden Jr.,14.0,2020-02-07
288,California,36.116203000000006,-119.681564,118361.0,64349.0,2020.0,382.0,Public Policy Institute of California,,,Public Policy Institute of California,262.0,Public Policy Institute of California,A/B,573.0,lv,lv-d,Live Phone,U.S. President,2/7/20,2/17/20,,False,,False,False,2/18/20 19:37,,https://www.ppic.org/wp-content/uploads/crosstabs-time-trends-methodology-0220.pdf,primary,DEM,Buttigieg,13345.0,Pete Buttigieg,12.0,2020-02-07
289,California,36.116203000000006,-119.681564,118361.0,64349.0,2020.0,382.0,Public Policy Institute of California,,,Public Policy Institute of California,262.0,Public Policy Institute of California,A/B,573.0,lv,lv-d,Live Phone,U.S. President,2/7/20,2/17/20,,False,,False,False,2/18/20 19:37,,https://www.ppic.org/wp-content/uploads/crosstabs-time-trends-methodology-0220.pdf,primary,DEM,Sanders,13257.0,Bernard Sanders,32.0,2020-02-07
290,California,36.116203000000006,-119.681564,118361.0,64349.0,2020.0,382.0,Public Policy Institute of California,,,Public Policy Institute of California,262.0,Public Policy Institute of California,A/B,573.0,lv,lv-d,Live Phone,U.S. President,2/7/20,2/17/20,,False,,False,False,2/18/20 19:37,,https://www.ppic.org/wp-content/uploads/crosstabs-time-trends-methodology-0220.pdf,primary,DEM,Steyer,13327.0,Tom Steyer,3.0,2020-02-07
291,California,36.116203000000006,-119.681564,94059.0,57862.0,2020.0,396.0,Quinnipiac University,,,Quinnipiac University,267.0,Quinnipiac University,B+,482.0,rv,rv-d,Live Phone,U.S. President,4/3/19,4/8/19,,False,,False,False,4/10/19 08:16,,https://poll.qu.edu/california/release-detail?ReleaseID=2615,primary,DEM,Warren,13258.0,Elizabeth Warren,7.0,2019-04-03
292,California,36.116203000000006,-119.681564,94059.0,57862.0,2020.0,396.0,Quinnipiac University,,,Quinnipiac University,267.0,Quinnipiac University,B+,482.0,rv,rv-d,Live Phone,U.S. President,4/3/19,4/8/19,,False,,False,False,4/10/19 08:16,,https://poll.qu.edu/california/release-detail?ReleaseID=2615,primary,DEM,Harris,13288.0,Kamala D. Harris,17.0,2019-04-03
293,California,36.116203000000006,-119.681564,94071.0,57869.0,2020.0,1365.0,Change Research,,,Change Research,48.0,Change Research,C,2003.0,lv,lv-d,Online,U.S. President,4/6/19,4/9/19,,False,,False,False,4/10/19 21:12,,https://docsend.com/view/i9876ha,primary,DEM,Harris,13288.0,Kamala D. Harris,19.0,2019-04-06
294,California,36.116203000000006,-119.681564,94059.0,57862.0,2020.0,396.0,Quinnipiac University,,,Quinnipiac University,267.0,Quinnipiac University,B+,482.0,rv,rv-d,Live Phone,U.S. President,4/3/19,4/8/19,,False,,False,False,4/10/19 08:16,,https://poll.qu.edu/california/release-detail?ReleaseID=2615,primary,DEM,Sanders,13257.0,Bernard Sanders,18.0,2019-04-03
295,California,36.116203000000006,-119.681564,118744.0,64493.0,2020.0,1234.0,University of Massachusetts Lowell,,,University of Massachusetts Lowell,355.0,University of Massachusetts Lowell,A/B,450.0,lv,lv-d,Online,U.S. President,2/12/20,2/20/20,,False,,False,False,2/21/20 14:59,,https://www.uml.edu/docs/2020-California-topline_tcm18-322536.pdf,primary,DEM,Steyer,13327.0,Tom Steyer,2.0,2020-02-12
296,California,36.116203000000006,-119.681564,114006.0,62980.0,2020.0,460.0,SurveyUSA,"443,804",KGTV-TV (California) | San Diego Union-Tribune,SurveyUSA,325.0,SurveyUSA,A,558.0,lv,lv-d,Online,U.S. President,11/20/19,11/22/19,,False,,False,False,11/26/19 21:22,,http://www.surveyusa.com/client/PollReport.aspx?g=bdcd277b-f00f-48eb-a393-bf59bb2a0fab,primary,DEM,Castro,13316.0,Julián Castro,1.0,2019-11-20
297,California,36.116203000000006,-119.681564,94071.0,57869.0,2020.0,1365.0,Change Research,,,Change Research,48.0,Change Research,C,2003.0,lv,lv-d,Online,U.S. President,4/6/19,4/9/19,,False,,False,False,4/10/19 21:12,,https://docsend.com/view/i9876ha,primary,DEM,Bennet,13352.0,Michael F. Bennet,0.0,2019-04-06
298,California,36.116203000000006,-119.681564,94071.0,57869.0,2020.0,1365.0,Change Research,,,Change Research,48.0,Change Research,C,2003.0,lv,lv-d,Online,U.S. President,4/6/19,4/9/19,,False,,False,False,4/10/19 21:12,,https://docsend.com/view/i9876ha,primary,DEM,Williamson,13350.0,Marianne Williamson,0.0,2019-04-06
299,California,36.116203000000006,-119.681564,94071.0,57869.0,2020.0,1365.0,Change Research,,,Change Research,48.0,Change Research,C,2003.0,lv,lv-d,Online,U.S. President,4/6/19,4/9/19,,False,,False,False,4/10/19 21:12,,https://docsend.com/view/i9876ha,primary,DEM,Hickenlooper,13326.0,John Hickenlooper,0.0,2019-04-06
300,California,36.116203000000006,-119.681564,94071.0,57869.0,2020.0,1365.0,Change Research,,,Change Research,48.0,Change Research,C,2003.0,lv,lv-d,Online,U.S. President,4/6/19,4/9/19,,False,,False,False,4/10/19 21:12,,https://docsend.com/view/i9876ha,primary,DEM,Delaney,13314.0,John K. Delaney,0.0,2019-04-06
301,California,36.116203000000006,-119.681564,94071.0,57869.0,2020.0,1365.0,Change Research,,,Change Research,48.0,Change Research,C,2003.0,lv,lv-d,Online,U.S. President,4/6/19,4/9/19,,False,,False,False,4/10/19 21:12,,https://docsend.com/view/i9876ha,primary,DEM,Ryan,13358.0,Tim Ryan,0.0,2019-04-06
302,California,36.116203000000006,-119.681564,94071.0,57869.0,2020.0,1365.0,Change Research,,,Change Research,48.0,Change Research,C,2003.0,lv,lv-d,Online,U.S. President,4/6/19,4/9/19,,False,,False,False,4/10/19 21:12,,https://docsend.com/view/i9876ha,primary,DEM,Inslee,13324.0,Jay Robert Inslee,1.0,2019-04-06
303,California,36.116203000000006,-119.681564,94071.0,57869.0,2020.0,1365.0,Change Research,,,Change Research,48.0,Change Research,C,2003.0,lv,lv-d,Online,U.S. President,4/6/19,4/9/19,,False,,False,False,4/10/19 21:12,,https://docsend.com/view/i9876ha,primary,DEM,Gabbard,13343.0,Tulsi Gabbard,1.0,2019-04-06
304,California,36.116203000000006,-119.681564,94071.0,57869.0,2020.0,1365.0,Change Research,,,Change Research,48.0,Change Research,C,2003.0,lv,lv-d,Online,U.S. President,4/6/19,4/9/19,,False,,False,False,4/10/19 21:12,,https://docsend.com/view/i9876ha,primary,DEM,Swalwell,13328.0,Eric Swalwell,1.0,2019-04-06
305,California,36.116203000000006,-119.681564,94071.0,57869.0,2020.0,1365.0,Change Research,,,Change Research,48.0,Change Research,C,2003.0,lv,lv-d,Online,U.S. President,4/6/19,4/9/19,,False,,False,False,4/10/19 21:12,,https://docsend.com/view/i9876ha,primary,DEM,Klobuchar,13310.0,Amy Klobuchar,1.0,2019-04-06
306,California,36.116203000000006,-119.681564,118744.0,64493.0,2020.0,1234.0,University of Massachusetts Lowell,,,University of Massachusetts Lowell,355.0,University of Massachusetts Lowell,A/B,450.0,lv,lv-d,Online,U.S. President,2/12/20,2/20/20,,False,,False,False,2/21/20 14:59,,https://www.uml.edu/docs/2020-California-topline_tcm18-322536.pdf,primary,DEM,Sanders,13257.0,Bernard Sanders,24.0,2020-02-12
307,California,36.116203000000006,-119.681564,98009.0,57869.0,2020.0,1365.0,Change Research,,,Change Research,48.0,Change Research,C,853.0,lv,lv-r,Online,U.S. President,4/6/19,4/9/19,,False,,False,False,6/16/19 08:47,,https://docs.wixstatic.com/ugd/d4a2c5_312447668050463d9f66d029b96e7737.pdf,primary,REP,Trump,13254.0,Donald Trump,83.0,2019-04-06
308,California,36.116203000000006,-119.681564,115961.0,63320.0,2020.0,495.0,Tulchin Research,"1226,1227",USC Rossier | Policy Analysis for California Education,Tulchin Research,340.0,Tulchin Research,B/C,1121.0,lv,lv-d,Online,U.S. President,1/3/20,1/10/20,,False,,False,False,1/22/20 06:48,,https://projects.fivethirtyeight.com/polls/20200122_CA.pdf,primary,DEM,Buttigieg,13345.0,Pete Buttigieg,8.0,2020-01-03
309,California,36.116203000000006,-119.681564,115961.0,63320.0,2020.0,495.0,Tulchin Research,"1226,1227",USC Rossier | Policy Analysis for California Education,Tulchin Research,340.0,Tulchin Research,B/C,1121.0,lv,lv-d,Online,U.S. President,1/3/20,1/10/20,,False,,False,False,1/22/20 06:48,,https://projects.fivethirtyeight.com/polls/20200122_CA.pdf,primary,DEM,Warren,13258.0,Elizabeth Warren,12.0,2020-01-03
310,California,36.116203000000006,-119.681564,115961.0,63320.0,2020.0,495.0,Tulchin Research,"1226,1227",USC Rossier | Policy Analysis for California Education,Tulchin Research,340.0,Tulchin Research,B/C,1121.0,lv,lv-d,Online,U.S. President,1/3/20,1/10/20,,False,,False,False,1/22/20 06:48,,https://projects.fivethirtyeight.com/polls/20200122_CA.pdf,primary,DEM,Biden,13256.0,Joseph R. Biden Jr.,25.0,2020-01-03
311,California,36.116203000000006,-119.681564,115961.0,63320.0,2020.0,495.0,Tulchin Research,"1226,1227",USC Rossier | Policy Analysis for California Education,Tulchin Research,340.0,Tulchin Research,B/C,1121.0,lv,lv-d,Online,U.S. President,1/3/20,1/10/20,,False,,False,False,1/22/20 06:48,,https://projects.fivethirtyeight.com/polls/20200122_CA.pdf,primary,DEM,Sanders,13257.0,Bernard Sanders,29.0,2020-01-03
312,California,36.116203000000006,-119.681564,115664.0,63266.0,2020.0,382.0,Public Policy Institute of California,,,Public Policy Institute of California,262.0,Public Policy Institute of California,A/B,530.0,lv,lv-d,Live Phone,U.S. President,1/3/20,1/12/20,,False,,False,False,1/13/20 19:42,,https://www.ppic.org/wp-content/uploads/ppic-statewide-survey-californians-and-their-government-january-2020.pdf,primary,DEM,Bloomberg,13289.0,Michael Bloomberg,1.0,2020-01-03
313,California,36.116203000000006,-119.681564,115664.0,63266.0,2020.0,382.0,Public Policy Institute of California,,,Public Policy Institute of California,262.0,Public Policy Institute of California,A/B,530.0,lv,lv-d,Live Phone,U.S. President,1/3/20,1/12/20,,False,,False,False,1/13/20 19:42,,https://www.ppic.org/wp-content/uploads/ppic-statewide-survey-californians-and-their-government-january-2020.pdf,primary,DEM,Yang,13329.0,Andrew Yang,3.0,2020-01-03
314,California,36.116203000000006,-119.681564,115664.0,63266.0,2020.0,382.0,Public Policy Institute of California,,,Public Policy Institute of California,262.0,Public Policy Institute of California,A/B,530.0,lv,lv-d,Live Phone,U.S. President,1/3/20,1/12/20,,False,,False,False,1/13/20 19:42,,https://www.ppic.org/wp-content/uploads/ppic-statewide-survey-californians-and-their-government-january-2020.pdf,primary,DEM,Klobuchar,13310.0,Amy Klobuchar,4.0,2020-01-03
315,California,36.116203000000006,-119.681564,94682.0,58166.0,2020.0,1365.0,Change Research,,,Change Research,48.0,Change Research,C,1649.0,lv,lv-d,Online,U.S. President,5/25/19,5/28/19,,False,,False,False,5/31/19 10:39,,https://www.changeresearch.com/california-poll-may-25-28-2019,primary,DEM,Gillibrand,13311.0,Kirsten E. Gillibrand,0.0,2019-05-25
316,California,36.116203000000006,-119.681564,94682.0,58166.0,2020.0,1365.0,Change Research,,,Change Research,48.0,Change Research,C,1649.0,lv,lv-d,Online,U.S. President,5/25/19,5/28/19,,False,,False,False,5/31/19 10:39,,https://www.changeresearch.com/california-poll-may-25-28-2019,primary,DEM,Hickenlooper,13326.0,John Hickenlooper,0.0,2019-05-25
317,California,36.116203000000006,-119.681564,94682.0,58166.0,2020.0,1365.0,Change Research,,,Change Research,48.0,Change Research,C,1649.0,lv,lv-d,Online,U.S. President,5/25/19,5/28/19,,False,,False,False,5/31/19 10:39,,https://www.changeresearch.com/california-poll-may-25-28-2019,primary,DEM,Ryan,13358.0,Tim Ryan,0.0,2019-05-25
318,California,36.116203000000006,-119.681564,94682.0,58166.0,2020.0,1365.0,Change Research,,,Change Research,48.0,Change Research,C,1649.0,lv,lv-d,Online,U.S. President,5/25/19,5/28/19,,False,,False,False,5/31/19 10:39,,https://www.changeresearch.com/california-poll-may-25-28-2019,primary,DEM,Gravel,13359.0,Mike Gravel,0.0,2019-05-25
319,California,36.116203000000006,-119.681564,98009.0,57869.0,2020.0,1365.0,Change Research,,,Change Research,48.0,Change Research,C,853.0,lv,lv-r,Online,U.S. President,4/6/19,4/9/19,,False,,False,False,6/16/19 08:47,,https://docs.wixstatic.com/ugd/d4a2c5_312447668050463d9f66d029b96e7737.pdf,primary,REP,Haley,13279.0,Nimrata R. Haley,5.0,2019-04-06
320,California,36.116203000000006,-119.681564,94682.0,58166.0,2020.0,1365.0,Change Research,,,Change Research,48.0,Change Research,C,1649.0,lv,lv-d,Online,U.S. President,5/25/19,5/28/19,,False,,False,False,5/31/19 10:39,,https://www.changeresearch.com/california-poll-may-25-28-2019,primary,DEM,Moulton,13322.0,Seth Moulton,0.0,2019-05-25
321,California,36.116203000000006,-119.681564,118744.0,64493.0,2020.0,1234.0,University of Massachusetts Lowell,,,University of Massachusetts Lowell,355.0,University of Massachusetts Lowell,A/B,450.0,lv,lv-d,Online,U.S. President,2/12/20,2/20/20,,False,,False,False,2/21/20 14:59,,https://www.uml.edu/docs/2020-California-topline_tcm18-322536.pdf,primary,DEM,Klobuchar,13310.0,Amy Klobuchar,7.0,2020-02-12
322,California,36.116203000000006,-119.681564,118744.0,64493.0,2020.0,1234.0,University of Massachusetts Lowell,,,University of Massachusetts Lowell,355.0,University of Massachusetts Lowell,A/B,450.0,lv,lv-d,Online,U.S. President,2/12/20,2/20/20,,False,,False,False,2/21/20 14:59,,https://www.uml.edu/docs/2020-California-topline_tcm18-322536.pdf,primary,DEM,Buttigieg,13345.0,Pete Buttigieg,12.0,2020-02-12
323,California,36.116203000000006,-119.681564,94072.0,57869.0,2020.0,1365.0,Change Research,,,Change Research,48.0,Change Research,C,2003.0,lv,lv-d,Online,U.S. President,4/6/19,4/9/19,,False,,False,False,4/10/19 21:12,,https://docsend.com/view/i9876ha,primary,DEM,Harris,13288.0,Kamala D. Harris,27.0,2019-04-06
324,California,36.116203000000006,-119.681564,94072.0,57869.0,2020.0,1365.0,Change Research,,,Change Research,48.0,Change Research,C,2003.0,lv,lv-d,Online,U.S. President,4/6/19,4/9/19,,False,,False,False,4/10/19 21:12,,https://docsend.com/view/i9876ha,primary,DEM,O'Rourke,13276.0,Beto O'Rourke,16.0,2019-04-06
325,California,36.116203000000006,-119.681564,94072.0,57869.0,2020.0,1365.0,Change Research,,,Change Research,48.0,Change Research,C,2003.0,lv,lv-d,Online,U.S. President,4/6/19,4/9/19,,False,,False,False,4/10/19 21:12,,https://docsend.com/view/i9876ha,primary,DEM,Buttigieg,13345.0,Pete Buttigieg,11.0,2019-04-06
326,California,36.116203000000006,-119.681564,94072.0,57869.0,2020.0,1365.0,Change Research,,,Change Research,48.0,Change Research,C,2003.0,lv,lv-d,Online,U.S. President,4/6/19,4/9/19,,False,,False,False,4/10/19 21:12,,https://docsend.com/view/i9876ha,primary,DEM,Warren,13258.0,Elizabeth Warren,9.0,2019-04-06
327,California,36.116203000000006,-119.681564,94072.0,57869.0,2020.0,1365.0,Change Research,,,Change Research,48.0,Change Research,C,2003.0,lv,lv-d,Online,U.S. President,4/6/19,4/9/19,,False,,False,False,4/10/19 21:12,,https://docsend.com/view/i9876ha,primary,DEM,Booker,13287.0,Cory A. Booker,5.0,2019-04-06
328,California,36.116203000000006,-119.681564,103711.0,59776.0,2020.0,382.0,Public Policy Institute of California,,,Public Policy Institute of California,262.0,Public Policy Institute of California,A/B,692.0,lv,lv-d,Live Phone,U.S. President,9/16/19,9/25/19,,False,,False,False,10/3/19 00:04,,https://www.ppic.org/wp-content/uploads/ppic-statewide-survey-californians-and-their-government-september-2019.pdf,primary,DEM,Klobuchar,13310.0,Amy Klobuchar,1.0,2019-09-16
329,California,36.116203000000006,-119.681564,94071.0,57869.0,2020.0,1365.0,Change Research,,,Change Research,48.0,Change Research,C,2003.0,lv,lv-d,Online,U.S. President,4/6/19,4/9/19,,False,,False,False,4/10/19 21:12,,https://docsend.com/view/i9876ha,primary,DEM,Messam,13357.0,Wayne Messam,0.0,2019-04-06
330,California,36.116203000000006,-119.681564,103711.0,59776.0,2020.0,382.0,Public Policy Institute of California,,,Public Policy Institute of California,262.0,Public Policy Institute of California,A/B,692.0,lv,lv-d,Live Phone,U.S. President,9/16/19,9/25/19,,False,,False,False,10/3/19 00:04,,https://www.ppic.org/wp-content/uploads/ppic-statewide-survey-californians-and-their-government-september-2019.pdf,primary,DEM,O'Rourke,13276.0,Beto O'Rourke,1.0,2019-09-16
331,California,36.116203000000006,-119.681564,103711.0,59776.0,2020.0,382.0,Public Policy Institute of California,,,Public Policy Institute of California,262.0,Public Policy Institute of California,A/B,692.0,lv,lv-d,Live Phone,U.S. President,9/16/19,9/25/19,,False,,False,False,10/3/19 00:04,,https://www.ppic.org/wp-content/uploads/ppic-statewide-survey-californians-and-their-government-september-2019.pdf,primary,DEM,Steyer,13327.0,Tom Steyer,1.0,2019-09-16
332,California,36.116203000000006,-119.681564,94072.0,57869.0,2020.0,1365.0,Change Research,,,Change Research,48.0,Change Research,C,2003.0,lv,lv-d,Online,U.S. President,4/6/19,4/9/19,,False,,False,False,4/10/19 21:12,,https://docsend.com/view/i9876ha,primary,DEM,Castro,13316.0,Julián Castro,2.0,2019-04-06
333,California,36.116203000000006,-119.681564,94072.0,57869.0,2020.0,1365.0,Change Research,,,Change Research,48.0,Change Research,C,2003.0,lv,lv-d,Online,U.S. President,4/6/19,4/9/19,,False,,False,False,4/10/19 21:12,,https://docsend.com/view/i9876ha,primary,DEM,Klobuchar,13310.0,Amy Klobuchar,1.0,2019-04-06
334,California,36.116203000000006,-119.681564,118744.0,64493.0,2020.0,1234.0,University of Massachusetts Lowell,,,University of Massachusetts Lowell,355.0,University of Massachusetts Lowell,A/B,450.0,lv,lv-d,Online,U.S. President,2/12/20,2/20/20,,False,,False,False,2/21/20 14:59,,https://www.uml.edu/docs/2020-California-topline_tcm18-322536.pdf,primary,DEM,Gabbard,13343.0,Tulsi Gabbard,4.0,2020-02-12
335,California,36.116203000000006,-119.681564,94072.0,57869.0,2020.0,1365.0,Change Research,,,Change Research,48.0,Change Research,C,2003.0,lv,lv-d,Online,U.S. President,4/6/19,4/9/19,,False,,False,False,4/10/19 21:12,,https://docsend.com/view/i9876ha,primary,DEM,Yang,13329.0,Andrew Yang,1.0,2019-04-06
336,California,36.116203000000006,-119.681564,94072.0,57869.0,2020.0,1365.0,Change Research,,,Change Research,48.0,Change Research,C,2003.0,lv,lv-d,Online,U.S. President,4/6/19,4/9/19,,False,,False,False,4/10/19 21:12,,https://docsend.com/view/i9876ha,primary,DEM,Ryan,13358.0,Tim Ryan,1.0,2019-04-06
337,California,36.116203000000006,-119.681564,94072.0,57869.0,2020.0,1365.0,Change Research,,,Change Research,48.0,Change Research,C,2003.0,lv,lv-d,Online,U.S. President,4/6/19,4/9/19,,False,,False,False,4/10/19 21:12,,https://docsend.com/view/i9876ha,primary,DEM,Inslee,13324.0,Jay Robert Inslee,0.0,2019-04-06
338,California,36.116203000000006,-119.681564,94072.0,57869.0,2020.0,1365.0,Change Research,,,Change Research,48.0,Change Research,C,2003.0,lv,lv-d,Online,U.S. President,4/6/19,4/9/19,,False,,False,False,4/10/19 21:12,,https://docsend.com/view/i9876ha,primary,DEM,Gillibrand,13311.0,Kirsten E. Gillibrand,0.0,2019-04-06
339,California,36.116203000000006,-119.681564,94072.0,57869.0,2020.0,1365.0,Change Research,,,Change Research,48.0,Change Research,C,2003.0,lv,lv-d,Online,U.S. President,4/6/19,4/9/19,,False,,False,False,4/10/19 21:12,,https://docsend.com/view/i9876ha,primary,DEM,Delaney,13314.0,John K. Delaney,0.0,2019-04-06
340,California,36.116203000000006,-119.681564,94072.0,57869.0,2020.0,1365.0,Change Research,,,Change Research,48.0,Change Research,C,2003.0,lv,lv-d,Online,U.S. President,4/6/19,4/9/19,,False,,False,False,4/10/19 21:12,,https://docsend.com/view/i9876ha,primary,DEM,Williamson,13350.0,Marianne Williamson,0.0,2019-04-06
341,California,36.116203000000006,-119.681564,94072.0,57869.0,2020.0,1365.0,Change Research,,,Change Research,48.0,Change Research,C,2003.0,lv,lv-d,Online,U.S. President,4/6/19,4/9/19,,False,,False,False,4/10/19 21:12,,https://docsend.com/view/i9876ha,primary,DEM,Hickenlooper,13326.0,John Hickenlooper,0.0,2019-04-06
342,California,36.116203000000006,-119.681564,94072.0,57869.0,2020.0,1365.0,Change Research,,,Change Research,48.0,Change Research,C,2003.0,lv,lv-d,Online,U.S. President,4/6/19,4/9/19,,False,,False,False,4/10/19 21:12,,https://docsend.com/view/i9876ha,primary,DEM,Messam,13357.0,Wayne Messam,0.0,2019-04-06
343,California,36.116203000000006,-119.681564,98008.0,57869.0,2020.0,1365.0,Change Research,,,Change Research,48.0,Change Research,C,853.0,lv,lv-r,Online,U.S. President,4/6/19,4/9/19,,False,,False,False,6/16/19 08:47,,https://docs.wixstatic.com/ugd/d4a2c5_312447668050463d9f66d029b96e7737.pdf,primary,REP,Trump,13254.0,Donald Trump,83.0,2019-04-06
344,California,36.116203000000006,-119.681564,98008.0,57869.0,2020.0,1365.0,Change Research,,,Change Research,48.0,Change Research,C,853.0,lv,lv-r,Online,U.S. President,4/6/19,4/9/19,,False,,False,False,6/16/19 08:47,,https://docs.wixstatic.com/ugd/d4a2c5_312447668050463d9f66d029b96e7737.pdf,primary,REP,Kasich,13278.0,John Richard Kasich,4.0,2019-04-06
345,California,36.116203000000006,-119.681564,118744.0,64493.0,2020.0,1234.0,University of Massachusetts Lowell,,,University of Massachusetts Lowell,355.0,University of Massachusetts Lowell,A/B,450.0,lv,lv-d,Online,U.S. President,2/12/20,2/20/20,,False,,False,False,2/21/20 14:59,,https://www.uml.edu/docs/2020-California-topline_tcm18-322536.pdf,primary,DEM,Biden,13256.0,Joseph R. Biden Jr.,13.0,2020-02-12
346,California,36.116203000000006,-119.681564,118744.0,64493.0,2020.0,1234.0,University of Massachusetts Lowell,,,University of Massachusetts Lowell,355.0,University of Massachusetts Lowell,A/B,450.0,lv,lv-d,Online,U.S. President,2/12/20,2/20/20,,False,,False,False,2/21/20 14:59,,https://www.uml.edu/docs/2020-California-topline_tcm18-322536.pdf,primary,DEM,Bloomberg,13289.0,Michael Bloomberg,12.0,2020-02-12
347,California,36.116203000000006,-119.681564,94072.0,57869.0,2020.0,1365.0,Change Research,,,Change Research,48.0,Change Research,C,2003.0,lv,lv-d,Online,U.S. President,4/6/19,4/9/19,,False,,False,False,4/10/19 21:12,,https://docsend.com/view/i9876ha,primary,DEM,Gabbard,13343.0,Tulsi Gabbard,1.0,2019-04-06
348,California,36.116203000000006,-119.681564,94059.0,57862.0,2020.0,396.0,Quinnipiac University,,,Quinnipiac University,267.0,Quinnipiac University,B+,482.0,rv,rv-d,Live Phone,U.S. President,4/3/19,4/8/19,,False,,False,False,4/10/19 08:16,,https://poll.qu.edu/california/release-detail?ReleaseID=2615,primary,DEM,O'Rourke,13276.0,Beto O'Rourke,4.0,2019-04-03
349,California,36.116203000000006,-119.681564,94682.0,58166.0,2020.0,1365.0,Change Research,,,Change Research,48.0,Change Research,C,1649.0,lv,lv-d,Online,U.S. President,5/25/19,5/28/19,,False,,False,False,5/31/19 10:39,,https://www.changeresearch.com/california-poll-may-25-28-2019,primary,DEM,Bennet,13352.0,Michael F. Bennet,0.0,2019-05-25
350,California,36.116203000000006,-119.681564,94682.0,58166.0,2020.0,1365.0,Change Research,,,Change Research,48.0,Change Research,C,1649.0,lv,lv-d,Online,U.S. President,5/25/19,5/28/19,,False,,False,False,5/31/19 10:39,,https://www.changeresearch.com/california-poll-may-25-28-2019,primary,DEM,Abrams,13349.0,Stacey Yvonne Abrams,0.0,2019-05-25
351,California,36.116203000000006,-119.681564,94059.0,57862.0,2020.0,396.0,Quinnipiac University,,,Quinnipiac University,267.0,Quinnipiac University,B+,482.0,rv,rv-d,Live Phone,U.S. President,4/3/19,4/8/19,,False,,False,False,4/10/19 08:16,,https://poll.qu.edu/california/release-detail?ReleaseID=2615,primary,DEM,Biden,13256.0,Joseph R. Biden Jr.,26.0,2019-04-03
352,California,36.116203000000006,-119.681564,118924.0,64529.0,2020.0,1365.0,Change Research,1186,KQED,Change Research,48.0,Change Research,C,1069.0,lv,lv-d,Online,U.S. President,2/20/20,2/23/20,,False,,False,False,2/26/20 07:28,,https://www.changeresearch.com/post/democratic-primary-california-kqed-poll-february,primary,DEM,De La Fuente,13656.0,Roque De La Fuente,0.0,2020-02-20
353,California,36.116203000000006,-119.681564,118924.0,64529.0,2020.0,1365.0,Change Research,1186,KQED,Change Research,48.0,Change Research,C,1069.0,lv,lv-d,Online,U.S. President,2/20/20,2/23/20,,False,,False,False,2/26/20 07:28,,https://www.changeresearch.com/post/democratic-primary-california-kqed-poll-february,primary,DEM,Boyd,14482.0,Mosie Boyd,0.0,2020-02-20
354,California,36.116203000000006,-119.681564,118924.0,64529.0,2020.0,1365.0,Change Research,1186,KQED,Change Research,48.0,Change Research,C,1069.0,lv,lv-d,Online,U.S. President,2/20/20,2/23/20,,False,,False,False,2/26/20 07:28,,https://www.changeresearch.com/post/democratic-primary-california-kqed-poll-february,primary,DEM,Ellinger,14481.0,Michael Ellinger,0.0,2020-02-20
355,California,36.116203000000006,-119.681564,118924.0,64529.0,2020.0,1365.0,Change Research,1186,KQED,Change Research,48.0,Change Research,C,1069.0,lv,lv-d,Online,U.S. President,2/20/20,2/23/20,,False,,False,False,2/26/20 07:28,,https://www.changeresearch.com/post/democratic-primary-california-kqed-poll-february,primary,DEM,Stewart Greenstein,14094.0,Mark Stewart Greenstein,0.0,2020-02-20
356,California,36.116203000000006,-119.681564,94071.0,57869.0,2020.0,1365.0,Change Research,,,Change Research,48.0,Change Research,C,2003.0,lv,lv-d,Online,U.S. President,4/6/19,4/9/19,,False,,False,False,4/10/19 21:12,,https://docsend.com/view/i9876ha,primary,DEM,O'Rourke,13276.0,Beto O'Rourke,10.0,2019-04-06
357,California,36.116203000000006,-119.681564,94071.0,57869.0,2020.0,1365.0,Change Research,,,Change Research,48.0,Change Research,C,2003.0,lv,lv-d,Online,U.S. President,4/6/19,4/9/19,,False,,False,False,4/10/19 21:12,,https://docsend.com/view/i9876ha,primary,DEM,Gillibrand,13311.0,Kirsten E. Gillibrand,0.0,2019-04-06
358,California,36.116203000000006,-119.681564,94071.0,57869.0,2020.0,1365.0,Change Research,,,Change Research,48.0,Change Research,C,2003.0,lv,lv-d,Online,U.S. President,4/6/19,4/9/19,,False,,False,False,4/10/19 21:12,,https://docsend.com/view/i9876ha,primary,DEM,Biden,13256.0,Joseph R. Biden Jr.,21.0,2019-04-06
359,California,36.116203000000006,-119.681564,94071.0,57869.0,2020.0,1365.0,Change Research,,,Change Research,48.0,Change Research,C,2003.0,lv,lv-d,Online,U.S. President,4/6/19,4/9/19,,False,,False,False,4/10/19 21:12,,https://docsend.com/view/i9876ha,primary,DEM,Sanders,13257.0,Bernard Sanders,22.0,2019-04-06
360,California,36.116203000000006,-119.681564,118924.0,64529.0,2020.0,1365.0,Change Research,1186,KQED,Change Research,48.0,Change Research,C,1069.0,lv,lv-d,Online,U.S. President,2/20/20,2/23/20,,False,,False,False,2/26/20 07:28,,https://www.changeresearch.com/post/democratic-primary-california-kqed-poll-february,primary,DEM,Delaney,13314.0,John K. Delaney,0.0,2020-02-20
361,California,36.116203000000006,-119.681564,118924.0,64529.0,2020.0,1365.0,Change Research,1186,KQED,Change Research,48.0,Change Research,C,1069.0,lv,lv-d,Online,U.S. President,2/20/20,2/23/20,,False,,False,False,2/26/20 07:28,,https://www.changeresearch.com/post/democratic-primary-california-kqed-poll-february,primary,DEM,Sestak,13381.0,Joe Sestak,0.0,2020-02-20
362,California,36.116203000000006,-119.681564,103275.0,59708.0,2020.0,1363.0,"University of California, Berkeley",300,LA Times,"University of California, Berkeley",457.0,"University of California, Berkeley",B/C,2272.0,lv,lv-d,Online,U.S. President,9/13/19,9/18/19,,False,,False,False,9/25/19 08:29,,https://escholarship.org/uc/item/2v9530s0,primary,DEM,Booker,13287.0,Cory A. Booker,0.9,2019-09-13
363,California,36.116203000000006,-119.681564,118924.0,64529.0,2020.0,1365.0,Change Research,1186,KQED,Change Research,48.0,Change Research,C,1069.0,lv,lv-d,Online,U.S. President,2/20/20,2/23/20,,False,,False,False,2/26/20 07:28,,https://www.changeresearch.com/post/democratic-primary-california-kqed-poll-february,primary,DEM,Patrick,13315.0,Deval Patrick,0.0,2020-02-20
364,California,36.116203000000006,-119.681564,118924.0,64529.0,2020.0,1365.0,Change Research,1186,KQED,Change Research,48.0,Change Research,C,1069.0,lv,lv-d,Online,U.S. President,2/20/20,2/23/20,,False,,False,False,2/26/20 07:28,,https://www.changeresearch.com/post/democratic-primary-california-kqed-poll-february,primary,DEM,Bennet,13352.0,Michael F. Bennet,0.0,2020-02-20
365,California,36.116203000000006,-119.681564,118924.0,64529.0,2020.0,1365.0,Change Research,1186,KQED,Change Research,48.0,Change Research,C,1069.0,lv,lv-d,Online,U.S. President,2/20/20,2/23/20,,False,,False,False,2/26/20 07:28,,https://www.changeresearch.com/post/democratic-primary-california-kqed-poll-february,primary,DEM,Castro,13316.0,Julián Castro,1.0,2020-02-20
366,California,36.116203000000006,-119.681564,118924.0,64529.0,2020.0,1365.0,Change Research,1186,KQED,Change Research,48.0,Change Research,C,1069.0,lv,lv-d,Online,U.S. President,2/20/20,2/23/20,,False,,False,False,2/26/20 07:28,,https://www.changeresearch.com/post/democratic-primary-california-kqed-poll-february,primary,DEM,Yang,13329.0,Andrew Yang,4.0,2020-02-20
367,California,36.116203000000006,-119.681564,118924.0,64529.0,2020.0,1365.0,Change Research,1186,KQED,Change Research,48.0,Change Research,C,1069.0,lv,lv-d,Online,U.S. President,2/20/20,2/23/20,,False,,False,False,2/26/20 07:28,,https://www.changeresearch.com/post/democratic-primary-california-kqed-poll-february,primary,DEM,Gabbard,13343.0,Tulsi Gabbard,2.0,2020-02-20
368,California,36.116203000000006,-119.681564,118924.0,64529.0,2020.0,1365.0,Change Research,1186,KQED,Change Research,48.0,Change Research,C,1069.0,lv,lv-d,Online,U.S. President,2/20/20,2/23/20,,False,,False,False,2/26/20 07:28,,https://www.changeresearch.com/post/democratic-primary-california-kqed-poll-february,primary,DEM,Steyer,13327.0,Tom Steyer,3.0,2020-02-20
369,California,36.116203000000006,-119.681564,118924.0,64529.0,2020.0,1365.0,Change Research,1186,KQED,Change Research,48.0,Change Research,C,1069.0,lv,lv-d,Online,U.S. President,2/20/20,2/23/20,,False,,False,False,2/26/20 07:28,,https://www.changeresearch.com/post/democratic-primary-california-kqed-poll-february,primary,DEM,Klobuchar,13310.0,Amy Klobuchar,5.0,2020-02-20
370,California,36.116203000000006,-119.681564,118924.0,64529.0,2020.0,1365.0,Change Research,1186,KQED,Change Research,48.0,Change Research,C,1069.0,lv,lv-d,Online,U.S. President,2/20/20,2/23/20,,False,,False,False,2/26/20 07:28,,https://www.changeresearch.com/post/democratic-primary-california-kqed-poll-february,primary,DEM,Bloomberg,13289.0,Michael Bloomberg,6.0,2020-02-20
371,California,36.116203000000006,-119.681564,118924.0,64529.0,2020.0,1365.0,Change Research,1186,KQED,Change Research,48.0,Change Research,C,1069.0,lv,lv-d,Online,U.S. President,2/20/20,2/23/20,,False,,False,False,2/26/20 07:28,,https://www.changeresearch.com/post/democratic-primary-california-kqed-poll-february,primary,DEM,Buttigieg,13345.0,Pete Buttigieg,11.0,2020-02-20
372,California,36.116203000000006,-119.681564,118924.0,64529.0,2020.0,1365.0,Change Research,1186,KQED,Change Research,48.0,Change Research,C,1069.0,lv,lv-d,Online,U.S. President,2/20/20,2/23/20,,False,,False,False,2/26/20 07:28,,https://www.changeresearch.com/post/democratic-primary-california-kqed-poll-february,primary,DEM,Biden,13256.0,Joseph R. Biden Jr.,12.0,2020-02-20
373,California,36.116203000000006,-119.681564,118924.0,64529.0,2020.0,1365.0,Change Research,1186,KQED,Change Research,48.0,Change Research,C,1069.0,lv,lv-d,Online,U.S. President,2/20/20,2/23/20,,False,,False,False,2/26/20 07:28,,https://www.changeresearch.com/post/democratic-primary-california-kqed-poll-february,primary,DEM,Warren,13258.0,Elizabeth Warren,20.0,2020-02-20
374,California,36.116203000000006,-119.681564,118924.0,64529.0,2020.0,1365.0,Change Research,1186,KQED,Change Research,48.0,Change Research,C,1069.0,lv,lv-d,Online,U.S. President,2/20/20,2/23/20,,False,,False,False,2/26/20 07:28,,https://www.changeresearch.com/post/democratic-primary-california-kqed-poll-february,primary,DEM,Sanders,13257.0,Bernard Sanders,37.0,2020-02-20
375,California,36.116203000000006,-119.681564,118924.0,64529.0,2020.0,1365.0,Change Research,1186,KQED,Change Research,48.0,Change Research,C,1069.0,lv,lv-d,Online,U.S. President,2/20/20,2/23/20,,False,,False,False,2/26/20 07:28,,https://www.changeresearch.com/post/democratic-primary-california-kqed-poll-february,primary,DEM,Williamson,13350.0,Marianne Williamson,0.0,2020-02-20
376,California,36.116203000000006,-119.681564,94682.0,58166.0,2020.0,1365.0,Change Research,,,Change Research,48.0,Change Research,C,1649.0,lv,lv-d,Online,U.S. President,5/25/19,5/28/19,,False,,False,False,5/31/19 10:39,,https://www.changeresearch.com/california-poll-may-25-28-2019,primary,DEM,Klobuchar,13310.0,Amy Klobuchar,0.0,2019-05-25
377,California,36.116203000000006,-119.681564,103275.0,59708.0,2020.0,1363.0,"University of California, Berkeley",300,LA Times,"University of California, Berkeley",457.0,"University of California, Berkeley",B/C,2272.0,lv,lv-d,Online,U.S. President,9/13/19,9/18/19,,False,,False,False,9/25/19 08:29,,https://escholarship.org/uc/item/2v9530s0,primary,DEM,Gabbard,13343.0,Tulsi Gabbard,1.2,2019-09-13
378,California,36.116203000000006,-119.681564,103711.0,59776.0,2020.0,382.0,Public Policy Institute of California,,,Public Policy Institute of California,262.0,Public Policy Institute of California,A/B,692.0,lv,lv-d,Live Phone,U.S. President,9/16/19,9/25/19,,False,,False,False,10/3/19 00:04,,https://www.ppic.org/wp-content/uploads/ppic-statewide-survey-californians-and-their-government-september-2019.pdf,primary,DEM,Biden,13256.0,Joseph R. Biden Jr.,22.0,2019-09-16
379,California,36.116203000000006,-119.681564,94682.0,58166.0,2020.0,1365.0,Change Research,,,Change Research,48.0,Change Research,C,1649.0,lv,lv-d,Online,U.S. President,5/25/19,5/28/19,,False,,False,False,5/31/19 10:39,,https://www.changeresearch.com/california-poll-may-25-28-2019,primary,DEM,Swalwell,13328.0,Eric Swalwell,0.0,2019-05-25
380,California,36.116203000000006,-119.681564,94682.0,58166.0,2020.0,1365.0,Change Research,,,Change Research,48.0,Change Research,C,1649.0,lv,lv-d,Online,U.S. President,5/25/19,5/28/19,,False,,False,False,5/31/19 10:39,,https://www.changeresearch.com/california-poll-may-25-28-2019,primary,DEM,Williamson,13350.0,Marianne Williamson,0.0,2019-05-25
381,California,36.116203000000006,-119.681564,94682.0,58166.0,2020.0,1365.0,Change Research,,,Change Research,48.0,Change Research,C,1649.0,lv,lv-d,Online,U.S. President,5/25/19,5/28/19,,False,,False,False,5/31/19 10:39,,https://www.changeresearch.com/california-poll-may-25-28-2019,primary,DEM,Inslee,13324.0,Jay Robert Inslee,0.0,2019-05-25
382,California,36.116203000000006,-119.681564,94682.0,58166.0,2020.0,1365.0,Change Research,,,Change Research,48.0,Change Research,C,1649.0,lv,lv-d,Online,U.S. President,5/25/19,5/28/19,,False,,False,False,5/31/19 10:39,,https://www.changeresearch.com/california-poll-may-25-28-2019,primary,DEM,Booker,13287.0,Cory A. Booker,1.0,2019-05-25
383,California,36.116203000000006,-119.681564,103275.0,59708.0,2020.0,1363.0,"University of California, Berkeley",300,LA Times,"University of California, Berkeley",457.0,"University of California, Berkeley",B/C,2272.0,lv,lv-d,Online,U.S. President,9/13/19,9/18/19,,False,,False,False,9/25/19 08:29,,https://escholarship.org/uc/item/2v9530s0,primary,DEM,Warren,13258.0,Elizabeth Warren,28.6,2019-09-13
384,California,36.116203000000006,-119.681564,103275.0,59708.0,2020.0,1363.0,"University of California, Berkeley",300,LA Times,"University of California, Berkeley",457.0,"University of California, Berkeley",B/C,2272.0,lv,lv-d,Online,U.S. President,9/13/19,9/18/19,,False,,False,False,9/25/19 08:29,,https://escholarship.org/uc/item/2v9530s0,primary,DEM,Biden,13256.0,Joseph R. Biden Jr.,19.6,2019-09-13
385,California,36.116203000000006,-119.681564,94071.0,57869.0,2020.0,1365.0,Change Research,,,Change Research,48.0,Change Research,C,2003.0,lv,lv-d,Online,U.S. President,4/6/19,4/9/19,,False,,False,False,4/10/19 21:12,,https://docsend.com/view/i9876ha,primary,DEM,Yang,13329.0,Andrew Yang,1.0,2019-04-06
386,California,36.116203000000006,-119.681564,94071.0,57869.0,2020.0,1365.0,Change Research,,,Change Research,48.0,Change Research,C,2003.0,lv,lv-d,Online,U.S. President,4/6/19,4/9/19,,False,,False,False,4/10/19 21:12,,https://docsend.com/view/i9876ha,primary,DEM,Abrams,13349.0,Stacey Yvonne Abrams,1.0,2019-04-06
387,California,36.116203000000006,-119.681564,94071.0,57869.0,2020.0,1365.0,Change Research,,,Change Research,48.0,Change Research,C,2003.0,lv,lv-d,Online,U.S. President,4/6/19,4/9/19,,False,,False,False,4/10/19 21:12,,https://docsend.com/view/i9876ha,primary,DEM,Castro,13316.0,Julián Castro,2.0,2019-04-06
388,California,36.116203000000006,-119.681564,94071.0,57869.0,2020.0,1365.0,Change Research,,,Change Research,48.0,Change Research,C,2003.0,lv,lv-d,Online,U.S. President,4/6/19,4/9/19,,False,,False,False,4/10/19 21:12,,https://docsend.com/view/i9876ha,primary,DEM,Booker,13287.0,Cory A. Booker,3.0,2019-04-06
389,California,36.116203000000006,-119.681564,94071.0,57869.0,2020.0,1365.0,Change Research,,,Change Research,48.0,Change Research,C,2003.0,lv,lv-d,Online,U.S. President,4/6/19,4/9/19,,False,,False,False,4/10/19 21:12,,https://docsend.com/view/i9876ha,primary,DEM,Warren,13258.0,Elizabeth Warren,8.0,2019-04-06
390,California,36.116203000000006,-119.681564,103711.0,59776.0,2020.0,382.0,Public Policy Institute of California,,,Public Policy Institute of California,262.0,Public Policy Institute of California,A/B,692.0,lv,lv-d,Live Phone,U.S. President,9/16/19,9/25/19,,False,,False,False,10/3/19 00:04,,https://www.ppic.org/wp-content/uploads/ppic-statewide-survey-californians-and-their-government-september-2019.pdf,primary,DEM,Warren,13258.0,Elizabeth Warren,23.0,2019-09-16
391,California,36.116203000000006,-119.681564,94071.0,57869.0,2020.0,1365.0,Change Research,,,Change Research,48.0,Change Research,C,2003.0,lv,lv-d,Online,U.S. President,4/6/19,4/9/19,,False,,False,False,4/10/19 21:12,,https://docsend.com/view/i9876ha,primary,DEM,Buttigieg,13345.0,Pete Buttigieg,9.0,2019-04-06
392,California,36.116203000000006,-119.681564,103711.0,59776.0,2020.0,382.0,Public Policy Institute of California,,,Public Policy Institute of California,262.0,Public Policy Institute of California,A/B,692.0,lv,lv-d,Live Phone,U.S. President,9/16/19,9/25/19,,False,,False,False,10/3/19 00:04,,https://www.ppic.org/wp-content/uploads/ppic-statewide-survey-californians-and-their-government-september-2019.pdf,primary,DEM,Booker,13287.0,Cory A. Booker,2.0,2019-09-16
393,California,36.116203000000006,-119.681564,103275.0,59708.0,2020.0,1363.0,"University of California, Berkeley",300,LA Times,"University of California, Berkeley",457.0,"University of California, Berkeley",B/C,2272.0,lv,lv-d,Online,U.S. President,9/13/19,9/18/19,,False,,False,False,9/25/19 08:29,,https://escholarship.org/uc/item/2v9530s0,primary,DEM,Sanders,13257.0,Bernard Sanders,18.9,2019-09-13
394,California,36.116203000000006,-119.681564,103275.0,59708.0,2020.0,1363.0,"University of California, Berkeley",300,LA Times,"University of California, Berkeley",457.0,"University of California, Berkeley",B/C,2272.0,lv,lv-d,Online,U.S. President,9/13/19,9/18/19,,False,,False,False,9/25/19 08:29,,https://escholarship.org/uc/item/2v9530s0,primary,DEM,Harris,13288.0,Kamala D. Harris,8.3,2019-09-13
395,California,36.116203000000006,-119.681564,103275.0,59708.0,2020.0,1363.0,"University of California, Berkeley",300,LA Times,"University of California, Berkeley",457.0,"University of California, Berkeley",B/C,2272.0,lv,lv-d,Online,U.S. President,9/13/19,9/18/19,,False,,False,False,9/25/19 08:29,,https://escholarship.org/uc/item/2v9530s0,primary,DEM,Buttigieg,13345.0,Pete Buttigieg,6.1,2019-09-13
396,California,36.116203000000006,-119.681564,103275.0,59708.0,2020.0,1363.0,"University of California, Berkeley",300,LA Times,"University of California, Berkeley",457.0,"University of California, Berkeley",B/C,2272.0,lv,lv-d,Online,U.S. President,9/13/19,9/18/19,,False,,False,False,9/25/19 08:29,,https://escholarship.org/uc/item/2v9530s0,primary,DEM,O'Rourke,13276.0,Beto O'Rourke,2.5,2019-09-13
397,California,36.116203000000006,-119.681564,103275.0,59708.0,2020.0,1363.0,"University of California, Berkeley",300,LA Times,"University of California, Berkeley",457.0,"University of California, Berkeley",B/C,2272.0,lv,lv-d,Online,U.S. President,9/13/19,9/18/19,,False,,False,False,9/25/19 08:29,,https://escholarship.org/uc/item/2v9530s0,primary,DEM,Yang,13329.0,Andrew Yang,1.8,2019-09-13
398,California,36.116203000000006,-119.681564,103275.0,59708.0,2020.0,1363.0,"University of California, Berkeley",300,LA Times,"University of California, Berkeley",457.0,"University of California, Berkeley",B/C,2272.0,lv,lv-d,Online,U.S. President,9/13/19,9/18/19,,False,,False,False,9/25/19 08:29,,https://escholarship.org/uc/item/2v9530s0,primary,DEM,Klobuchar,13310.0,Amy Klobuchar,1.6,2019-09-13
399,California,36.116203000000006,-119.681564,103711.0,59776.0,2020.0,382.0,Public Policy Institute of California,,,Public Policy Institute of California,262.0,Public Policy Institute of California,A/B,692.0,lv,lv-d,Live Phone,U.S. President,9/16/19,9/25/19,,False,,False,False,10/3/19 00:04,,https://www.ppic.org/wp-content/uploads/ppic-statewide-survey-californians-and-their-government-september-2019.pdf,primary,DEM,Yang,13329.0,Andrew Yang,3.0,2019-09-16
400,California,36.116203000000006,-119.681564,103711.0,59776.0,2020.0,382.0,Public Policy Institute of California,,,Public Policy Institute of California,262.0,Public Policy Institute of California,A/B,692.0,lv,lv-d,Live Phone,U.S. President,9/16/19,9/25/19,,False,,False,False,10/3/19 00:04,,https://www.ppic.org/wp-content/uploads/ppic-statewide-survey-californians-and-their-government-september-2019.pdf,primary,DEM,Buttigieg,13345.0,Pete Buttigieg,6.0,2019-09-16
401,California,36.116203000000006,-119.681564,103711.0,59776.0,2020.0,382.0,Public Policy Institute of California,,,Public Policy Institute of California,262.0,Public Policy Institute of California,A/B,692.0,lv,lv-d,Live Phone,U.S. President,9/16/19,9/25/19,,False,,False,False,10/3/19 00:04,,https://www.ppic.org/wp-content/uploads/ppic-statewide-survey-californians-and-their-government-september-2019.pdf,primary,DEM,Harris,13288.0,Kamala D. Harris,8.0,2019-09-16
402,California,36.116203000000006,-119.681564,103711.0,59776.0,2020.0,382.0,Public Policy Institute of California,,,Public Policy Institute of California,262.0,Public Policy Institute of California,A/B,692.0,lv,lv-d,Live Phone,U.S. President,9/16/19,9/25/19,,False,,False,False,10/3/19 00:04,,https://www.ppic.org/wp-content/uploads/ppic-statewide-survey-californians-and-their-government-september-2019.pdf,primary,DEM,Sanders,13257.0,Bernard Sanders,21.0,2019-09-16
403,California,36.116203000000006,-119.681564,103711.0,59776.0,2020.0,382.0,Public Policy Institute of California,,,Public Policy Institute of California,262.0,Public Policy Institute of California,A/B,692.0,lv,lv-d,Live Phone,U.S. President,9/16/19,9/25/19,,False,,False,False,10/3/19 00:04,,https://www.ppic.org/wp-content/uploads/ppic-statewide-survey-californians-and-their-government-september-2019.pdf,primary,DEM,Castro,13316.0,Julián Castro,2.0,2019-09-16
404,California,36.116203000000006,-119.681564,118744.0,64493.0,2020.0,1234.0,University of Massachusetts Lowell,,,University of Massachusetts Lowell,355.0,University of Massachusetts Lowell,A/B,450.0,lv,lv-d,Online,U.S. President,2/12/20,2/20/20,,False,,False,False,2/21/20 14:59,,https://www.uml.edu/docs/2020-California-topline_tcm18-322536.pdf,primary,DEM,Warren,13258.0,Elizabeth Warren,16.0,2020-02-12
405,California,36.116203000000006,-119.681564,104535.0,60094.0,2020.0,1491.0,Capitol Weekly,,,Capitol Weekly,510.0,Capitol Weekly,,590.0,lv,lv-d,Online,U.S. President,10/1/19,10/14/19,,False,,False,False,10/15/19 16:19,,https://www.dropbox.com/s/0e1g0eat9otgvpl/Oct%202019%20Presidential%20Primary%20Tracking%20Poll%20Toplines%20and%20Crosstabs.xlsx,primary,DEM,de Blasio,13335.0,Bill de Blasio,0.0,2019-10-01
406,California,36.116203000000006,-119.681564,115574.0,63243.0,2020.0,1491.0,Capitol Weekly,,,Capitol Weekly,510.0,Capitol Weekly,,1053.0,lv,lv-d,Online,U.S. President,1/3/20,1/9/20,,False,,False,False,1/9/20 15:50,,https://www.dropbox.com/s/5w1aofozhv4iwl5/Jan%202020%20Presidential%20Primary%20Tracking%20Poll%20Toplines%20and%20Crosstabs.xlsx,primary,DEM,Warren,13258.0,Elizabeth Warren,21.0,2020-01-03
407,California,36.116203000000006,-119.681564,115121.0,63112.0,2020.0,1491.0,Capitol Weekly,,,Capitol Weekly,510.0,Capitol Weekly,,581.0,lv,lv-d,Online,U.S. President,12/3/19,12/7/19,,False,,False,False,12/23/19 00:24,,https://www.dropbox.com/sh/lpg315ervjbhxkm/AAA_T1gWN9oYedzp5LpIr-sNa?dl=0&preview=Dec+2019+Presidential+Primary+Tracking+Poll+Toplines+and+Crosstabs+with+Kamala.xlsx,primary,DEM,Yang,13329.0,Andrew Yang,5.0,2019-12-03
408,California,36.116203000000006,-119.681564,115121.0,63112.0,2020.0,1491.0,Capitol Weekly,,,Capitol Weekly,510.0,Capitol Weekly,,581.0,lv,lv-d,Online,U.S. President,12/3/19,12/7/19,,False,,False,False,12/23/19 00:24,,https://www.dropbox.com/sh/lpg315ervjbhxkm/AAA_T1gWN9oYedzp5LpIr-sNa?dl=0&preview=Dec+2019+Presidential+Primary+Tracking+Poll+Toplines+and+Crosstabs+with+Kamala.xlsx,primary,DEM,Bloomberg,13289.0,Michael Bloomberg,5.0,2019-12-03
409,California,36.116203000000006,-119.681564,115121.0,63112.0,2020.0,1491.0,Capitol Weekly,,,Capitol Weekly,510.0,Capitol Weekly,,581.0,lv,lv-d,Online,U.S. President,12/3/19,12/7/19,,False,,False,False,12/23/19 00:24,,https://www.dropbox.com/sh/lpg315ervjbhxkm/AAA_T1gWN9oYedzp5LpIr-sNa?dl=0&preview=Dec+2019+Presidential+Primary+Tracking+Poll+Toplines+and+Crosstabs+with+Kamala.xlsx,primary,DEM,Buttigieg,13345.0,Pete Buttigieg,13.0,2019-12-03
410,California,36.116203000000006,-119.681564,115121.0,63112.0,2020.0,1491.0,Capitol Weekly,,,Capitol Weekly,510.0,Capitol Weekly,,581.0,lv,lv-d,Online,U.S. President,12/3/19,12/7/19,,False,,False,False,12/23/19 00:24,,https://www.dropbox.com/sh/lpg315ervjbhxkm/AAA_T1gWN9oYedzp5LpIr-sNa?dl=0&preview=Dec+2019+Presidential+Primary+Tracking+Poll+Toplines+and+Crosstabs+with+Kamala.xlsx,primary,DEM,Biden,13256.0,Joseph R. Biden Jr.,19.0,2019-12-03
411,California,36.116203000000006,-119.681564,115121.0,63112.0,2020.0,1491.0,Capitol Weekly,,,Capitol Weekly,510.0,Capitol Weekly,,581.0,lv,lv-d,Online,U.S. President,12/3/19,12/7/19,,False,,False,False,12/23/19 00:24,,https://www.dropbox.com/sh/lpg315ervjbhxkm/AAA_T1gWN9oYedzp5LpIr-sNa?dl=0&preview=Dec+2019+Presidential+Primary+Tracking+Poll+Toplines+and+Crosstabs+with+Kamala.xlsx,primary,DEM,Sanders,13257.0,Bernard Sanders,19.0,2019-12-03
412,California,36.116203000000006,-119.681564,115121.0,63112.0,2020.0,1491.0,Capitol Weekly,,,Capitol Weekly,510.0,Capitol Weekly,,581.0,lv,lv-d,Online,U.S. President,12/3/19,12/7/19,,False,,False,False,12/23/19 00:24,,https://www.dropbox.com/sh/lpg315ervjbhxkm/AAA_T1gWN9oYedzp5LpIr-sNa?dl=0&preview=Dec+2019+Presidential+Primary+Tracking+Poll+Toplines+and+Crosstabs+with+Kamala.xlsx,primary,DEM,Warren,13258.0,Elizabeth Warren,21.0,2019-12-03
413,California,36.116203000000006,-119.681564,115121.0,63112.0,2020.0,1491.0,Capitol Weekly,,,Capitol Weekly,510.0,Capitol Weekly,,581.0,lv,lv-d,Online,U.S. President,12/3/19,12/7/19,,False,,False,False,12/23/19 00:24,,https://www.dropbox.com/sh/lpg315ervjbhxkm/AAA_T1gWN9oYedzp5LpIr-sNa?dl=0&preview=Dec+2019+Presidential+Primary+Tracking+Poll+Toplines+and+Crosstabs+with+Kamala.xlsx,primary,DEM,Klobuchar,13310.0,Amy Klobuchar,4.0,2019-12-03
414,California,36.116203000000006,-119.681564,114884.0,63112.0,2020.0,1491.0,Capitol Weekly,,,Capitol Weekly,510.0,Capitol Weekly,,581.0,lv,lv-d,Online,U.S. President,12/3/19,12/7/19,,False,,False,False,12/13/19 10:50,,https://www.dropbox.com/sh/lpg315ervjbhxkm/AAA_T1gWN9oYedzp5LpIr-sNa?dl=0&preview=Dec+2019+Presidential+Primary+Tracking+Poll+Toplines+and+Crosstabs.xlsx,primary,DEM,Patrick,13315.0,Deval Patrick,0.0,2019-12-03
415,California,36.116203000000006,-119.681564,114884.0,63112.0,2020.0,1491.0,Capitol Weekly,,,Capitol Weekly,510.0,Capitol Weekly,,581.0,lv,lv-d,Online,U.S. President,12/3/19,12/7/19,,False,,False,False,12/13/19 10:50,,https://www.dropbox.com/sh/lpg315ervjbhxkm/AAA_T1gWN9oYedzp5LpIr-sNa?dl=0&preview=Dec+2019+Presidential+Primary+Tracking+Poll+Toplines+and+Crosstabs.xlsx,primary,DEM,Inslee,13324.0,Jay Robert Inslee,0.0,2019-12-03
416,California,36.116203000000006,-119.681564,114884.0,63112.0,2020.0,1491.0,Capitol Weekly,,,Capitol Weekly,510.0,Capitol Weekly,,581.0,lv,lv-d,Online,U.S. President,12/3/19,12/7/19,,False,,False,False,12/13/19 10:50,,https://www.dropbox.com/sh/lpg315ervjbhxkm/AAA_T1gWN9oYedzp5LpIr-sNa?dl=0&preview=Dec+2019+Presidential+Primary+Tracking+Poll+Toplines+and+Crosstabs.xlsx,primary,DEM,de Blasio,13335.0,Bill de Blasio,0.0,2019-12-03
417,California,36.116203000000006,-119.681564,114884.0,63112.0,2020.0,1491.0,Capitol Weekly,,,Capitol Weekly,510.0,Capitol Weekly,,581.0,lv,lv-d,Online,U.S. President,12/3/19,12/7/19,,False,,False,False,12/13/19 10:50,,https://www.dropbox.com/sh/lpg315ervjbhxkm/AAA_T1gWN9oYedzp5LpIr-sNa?dl=0&preview=Dec+2019+Presidential+Primary+Tracking+Poll+Toplines+and+Crosstabs.xlsx,primary,DEM,O'Rourke,13276.0,Beto O'Rourke,0.0,2019-12-03
418,California,36.116203000000006,-119.681564,114884.0,63112.0,2020.0,1491.0,Capitol Weekly,,,Capitol Weekly,510.0,Capitol Weekly,,581.0,lv,lv-d,Online,U.S. President,12/3/19,12/7/19,,False,,False,False,12/13/19 10:50,,https://www.dropbox.com/sh/lpg315ervjbhxkm/AAA_T1gWN9oYedzp5LpIr-sNa?dl=0&preview=Dec+2019+Presidential+Primary+Tracking+Poll+Toplines+and+Crosstabs.xlsx,primary,DEM,Delaney,13314.0,John K. Delaney,0.0,2019-12-03
419,California,36.116203000000006,-119.681564,114884.0,63112.0,2020.0,1491.0,Capitol Weekly,,,Capitol Weekly,510.0,Capitol Weekly,,581.0,lv,lv-d,Online,U.S. President,12/3/19,12/7/19,,False,,False,False,12/13/19 10:50,,https://www.dropbox.com/sh/lpg315ervjbhxkm/AAA_T1gWN9oYedzp5LpIr-sNa?dl=0&preview=Dec+2019+Presidential+Primary+Tracking+Poll+Toplines+and+Crosstabs.xlsx,primary,DEM,Williamson,13350.0,Marianne Williamson,1.0,2019-12-03
420,California,36.116203000000006,-119.681564,114884.0,63112.0,2020.0,1491.0,Capitol Weekly,,,Capitol Weekly,510.0,Capitol Weekly,,581.0,lv,lv-d,Online,U.S. President,12/3/19,12/7/19,,False,,False,False,12/13/19 10:50,,https://www.dropbox.com/sh/lpg315ervjbhxkm/AAA_T1gWN9oYedzp5LpIr-sNa?dl=0&preview=Dec+2019+Presidential+Primary+Tracking+Poll+Toplines+and+Crosstabs.xlsx,primary,DEM,Steyer,13327.0,Tom Steyer,1.0,2019-12-03
421,California,36.116203000000006,-119.681564,114884.0,63112.0,2020.0,1491.0,Capitol Weekly,,,Capitol Weekly,510.0,Capitol Weekly,,581.0,lv,lv-d,Online,U.S. President,12/3/19,12/7/19,,False,,False,False,12/13/19 10:50,,https://www.dropbox.com/sh/lpg315ervjbhxkm/AAA_T1gWN9oYedzp5LpIr-sNa?dl=0&preview=Dec+2019+Presidential+Primary+Tracking+Poll+Toplines+and+Crosstabs.xlsx,primary,DEM,Ryan,13358.0,Tim Ryan,0.0,2019-12-03
422,California,36.116203000000006,-119.681564,114884.0,63112.0,2020.0,1491.0,Capitol Weekly,,,Capitol Weekly,510.0,Capitol Weekly,,581.0,lv,lv-d,Online,U.S. President,12/3/19,12/7/19,,False,,False,False,12/13/19 10:50,,https://www.dropbox.com/sh/lpg315ervjbhxkm/AAA_T1gWN9oYedzp5LpIr-sNa?dl=0&preview=Dec+2019+Presidential+Primary+Tracking+Poll+Toplines+and+Crosstabs.xlsx,primary,DEM,Castro,13316.0,Julián Castro,2.0,2019-12-03
423,California,36.116203000000006,-119.681564,115121.0,63112.0,2020.0,1491.0,Capitol Weekly,,,Capitol Weekly,510.0,Capitol Weekly,,581.0,lv,lv-d,Online,U.S. President,12/3/19,12/7/19,,False,,False,False,12/23/19 00:24,,https://www.dropbox.com/sh/lpg315ervjbhxkm/AAA_T1gWN9oYedzp5LpIr-sNa?dl=0&preview=Dec+2019+Presidential+Primary+Tracking+Poll+Toplines+and+Crosstabs+with+Kamala.xlsx,primary,DEM,Gabbard,13343.0,Tulsi Gabbard,4.0,2019-12-03
424,California,36.116203000000006,-119.681564,115121.0,63112.0,2020.0,1491.0,Capitol Weekly,,,Capitol Weekly,510.0,Capitol Weekly,,581.0,lv,lv-d,Online,U.S. President,12/3/19,12/7/19,,False,,False,False,12/23/19 00:24,,https://www.dropbox.com/sh/lpg315ervjbhxkm/AAA_T1gWN9oYedzp5LpIr-sNa?dl=0&preview=Dec+2019+Presidential+Primary+Tracking+Poll+Toplines+and+Crosstabs+with+Kamala.xlsx,primary,DEM,Booker,13287.0,Cory A. Booker,2.0,2019-12-03
425,California,36.116203000000006,-119.681564,114267.0,63015.0,2020.0,1363.0,"University of California, Berkeley",300,LA Times,"University of California, Berkeley",457.0,"University of California, Berkeley",B/C,1694.0,lv,lv-d,Online,U.S. President,11/21/19,11/27/19,,False,,False,False,12/5/19 07:05,,https://escholarship.org/uc/item/4bn38460,primary,DEM,Harris,13288.0,Kamala D. Harris,7.4,2019-11-21
426,California,36.116203000000006,-119.681564,114267.0,63015.0,2020.0,1363.0,"University of California, Berkeley",300,LA Times,"University of California, Berkeley",457.0,"University of California, Berkeley",B/C,1694.0,lv,lv-d,Online,U.S. President,11/21/19,11/27/19,,False,,False,False,12/5/19 07:05,,https://escholarship.org/uc/item/4bn38460,primary,DEM,Buttigieg,13345.0,Pete Buttigieg,11.6,2019-11-21
427,California,36.116203000000006,-119.681564,114267.0,63015.0,2020.0,1363.0,"University of California, Berkeley",300,LA Times,"University of California, Berkeley",457.0,"University of California, Berkeley",B/C,1694.0,lv,lv-d,Online,U.S. President,11/21/19,11/27/19,,False,,False,False,12/5/19 07:05,,https://escholarship.org/uc/item/4bn38460,primary,DEM,Biden,13256.0,Joseph R. Biden Jr.,14.4,2019-11-21
428,California,36.116203000000006,-119.681564,114267.0,63015.0,2020.0,1363.0,"University of California, Berkeley",300,LA Times,"University of California, Berkeley",457.0,"University of California, Berkeley",B/C,1694.0,lv,lv-d,Online,U.S. President,11/21/19,11/27/19,,False,,False,False,12/5/19 07:05,,https://escholarship.org/uc/item/4bn38460,primary,DEM,Warren,13258.0,Elizabeth Warren,21.8,2019-11-21
429,California,36.116203000000006,-119.681564,114267.0,63015.0,2020.0,1363.0,"University of California, Berkeley",300,LA Times,"University of California, Berkeley",457.0,"University of California, Berkeley",B/C,1694.0,lv,lv-d,Online,U.S. President,11/21/19,11/27/19,,False,,False,False,12/5/19 07:05,,https://escholarship.org/uc/item/4bn38460,primary,DEM,Sanders,13257.0,Bernard Sanders,23.6,2019-11-21
430,California,36.116203000000006,-119.681564,115121.0,63112.0,2020.0,1491.0,Capitol Weekly,,,Capitol Weekly,510.0,Capitol Weekly,,581.0,lv,lv-d,Online,U.S. President,12/3/19,12/7/19,,False,,False,False,12/23/19 00:24,,https://www.dropbox.com/sh/lpg315ervjbhxkm/AAA_T1gWN9oYedzp5LpIr-sNa?dl=0&preview=Dec+2019+Presidential+Primary+Tracking+Poll+Toplines+and+Crosstabs+with+Kamala.xlsx,primary,DEM,Patrick,13315.0,Deval Patrick,0.0,2019-12-03
431,California,36.116203000000006,-119.681564,115121.0,63112.0,2020.0,1491.0,Capitol Weekly,,,Capitol Weekly,510.0,Capitol Weekly,,581.0,lv,lv-d,Online,U.S. President,12/3/19,12/7/19,,False,,False,False,12/23/19 00:24,,https://www.dropbox.com/sh/lpg315ervjbhxkm/AAA_T1gWN9oYedzp5LpIr-sNa?dl=0&preview=Dec+2019+Presidential+Primary+Tracking+Poll+Toplines+and+Crosstabs+with+Kamala.xlsx,primary,DEM,Harris,13288.0,Kamala D. Harris,4.0,2019-12-03
432,California,36.116203000000006,-119.681564,115121.0,63112.0,2020.0,1491.0,Capitol Weekly,,,Capitol Weekly,510.0,Capitol Weekly,,581.0,lv,lv-d,Online,U.S. President,12/3/19,12/7/19,,False,,False,False,12/23/19 00:24,,https://www.dropbox.com/sh/lpg315ervjbhxkm/AAA_T1gWN9oYedzp5LpIr-sNa?dl=0&preview=Dec+2019+Presidential+Primary+Tracking+Poll+Toplines+and+Crosstabs+with+Kamala.xlsx,primary,DEM,Ryan,13358.0,Tim Ryan,0.0,2019-12-03
433,California,36.116203000000006,-119.681564,115121.0,63112.0,2020.0,1491.0,Capitol Weekly,,,Capitol Weekly,510.0,Capitol Weekly,,581.0,lv,lv-d,Online,U.S. President,12/3/19,12/7/19,,False,,False,False,12/23/19 00:24,,https://www.dropbox.com/sh/lpg315ervjbhxkm/AAA_T1gWN9oYedzp5LpIr-sNa?dl=0&preview=Dec+2019+Presidential+Primary+Tracking+Poll+Toplines+and+Crosstabs+with+Kamala.xlsx,primary,DEM,de Blasio,13335.0,Bill de Blasio,0.0,2019-12-03
434,California,36.116203000000006,-119.681564,115121.0,63112.0,2020.0,1491.0,Capitol Weekly,,,Capitol Weekly,510.0,Capitol Weekly,,581.0,lv,lv-d,Online,U.S. President,12/3/19,12/7/19,,False,,False,False,12/23/19 00:24,,https://www.dropbox.com/sh/lpg315ervjbhxkm/AAA_T1gWN9oYedzp5LpIr-sNa?dl=0&preview=Dec+2019+Presidential+Primary+Tracking+Poll+Toplines+and+Crosstabs+with+Kamala.xlsx,primary,DEM,O'Rourke,13276.0,Beto O'Rourke,0.0,2019-12-03
435,California,36.116203000000006,-119.681564,115121.0,63112.0,2020.0,1491.0,Capitol Weekly,,,Capitol Weekly,510.0,Capitol Weekly,,581.0,lv,lv-d,Online,U.S. President,12/3/19,12/7/19,,False,,False,False,12/23/19 00:24,,https://www.dropbox.com/sh/lpg315ervjbhxkm/AAA_T1gWN9oYedzp5LpIr-sNa?dl=0&preview=Dec+2019+Presidential+Primary+Tracking+Poll+Toplines+and+Crosstabs+with+Kamala.xlsx,primary,DEM,Delaney,13314.0,John K. Delaney,0.0,2019-12-03
436,California,36.116203000000006,-119.681564,115121.0,63112.0,2020.0,1491.0,Capitol Weekly,,,Capitol Weekly,510.0,Capitol Weekly,,581.0,lv,lv-d,Online,U.S. President,12/3/19,12/7/19,,False,,False,False,12/23/19 00:24,,https://www.dropbox.com/sh/lpg315ervjbhxkm/AAA_T1gWN9oYedzp5LpIr-sNa?dl=0&preview=Dec+2019+Presidential+Primary+Tracking+Poll+Toplines+and+Crosstabs+with+Kamala.xlsx,primary,DEM,Williamson,13350.0,Marianne Williamson,1.0,2019-12-03
437,California,36.116203000000006,-119.681564,115121.0,63112.0,2020.0,1491.0,Capitol Weekly,,,Capitol Weekly,510.0,Capitol Weekly,,581.0,lv,lv-d,Online,U.S. President,12/3/19,12/7/19,,False,,False,False,12/23/19 00:24,,https://www.dropbox.com/sh/lpg315ervjbhxkm/AAA_T1gWN9oYedzp5LpIr-sNa?dl=0&preview=Dec+2019+Presidential+Primary+Tracking+Poll+Toplines+and+Crosstabs+with+Kamala.xlsx,primary,DEM,Castro,13316.0,Julián Castro,1.0,2019-12-03
438,California,36.116203000000006,-119.681564,115121.0,63112.0,2020.0,1491.0,Capitol Weekly,,,Capitol Weekly,510.0,Capitol Weekly,,581.0,lv,lv-d,Online,U.S. President,12/3/19,12/7/19,,False,,False,False,12/23/19 00:24,,https://www.dropbox.com/sh/lpg315ervjbhxkm/AAA_T1gWN9oYedzp5LpIr-sNa?dl=0&preview=Dec+2019+Presidential+Primary+Tracking+Poll+Toplines+and+Crosstabs+with+Kamala.xlsx,primary,DEM,Steyer,13327.0,Tom Steyer,1.0,2019-12-03
439,California,36.116203000000006,-119.681564,115121.0,63112.0,2020.0,1491.0,Capitol Weekly,,,Capitol Weekly,510.0,Capitol Weekly,,581.0,lv,lv-d,Online,U.S. President,12/3/19,12/7/19,,False,,False,False,12/23/19 00:24,,https://www.dropbox.com/sh/lpg315ervjbhxkm/AAA_T1gWN9oYedzp5LpIr-sNa?dl=0&preview=Dec+2019+Presidential+Primary+Tracking+Poll+Toplines+and+Crosstabs+with+Kamala.xlsx,primary,DEM,Inslee,13324.0,Jay Robert Inslee,0.0,2019-12-03
440,California,36.116203000000006,-119.681564,114884.0,63112.0,2020.0,1491.0,Capitol Weekly,,,Capitol Weekly,510.0,Capitol Weekly,,581.0,lv,lv-d,Online,U.S. President,12/3/19,12/7/19,,False,,False,False,12/13/19 10:50,,https://www.dropbox.com/sh/lpg315ervjbhxkm/AAA_T1gWN9oYedzp5LpIr-sNa?dl=0&preview=Dec+2019+Presidential+Primary+Tracking+Poll+Toplines+and+Crosstabs.xlsx,primary,DEM,Booker,13287.0,Cory A. Booker,2.0,2019-12-03
441,California,36.116203000000006,-119.681564,114884.0,63112.0,2020.0,1491.0,Capitol Weekly,,,Capitol Weekly,510.0,Capitol Weekly,,581.0,lv,lv-d,Online,U.S. President,12/3/19,12/7/19,,False,,False,False,12/13/19 10:50,,https://www.dropbox.com/sh/lpg315ervjbhxkm/AAA_T1gWN9oYedzp5LpIr-sNa?dl=0&preview=Dec+2019+Presidential+Primary+Tracking+Poll+Toplines+and+Crosstabs.xlsx,primary,DEM,Gabbard,13343.0,Tulsi Gabbard,4.0,2019-12-03
442,California,36.116203000000006,-119.681564,114884.0,63112.0,2020.0,1491.0,Capitol Weekly,,,Capitol Weekly,510.0,Capitol Weekly,,581.0,lv,lv-d,Online,U.S. President,12/3/19,12/7/19,,False,,False,False,12/13/19 10:50,,https://www.dropbox.com/sh/lpg315ervjbhxkm/AAA_T1gWN9oYedzp5LpIr-sNa?dl=0&preview=Dec+2019+Presidential+Primary+Tracking+Poll+Toplines+and+Crosstabs.xlsx,primary,DEM,Klobuchar,13310.0,Amy Klobuchar,4.0,2019-12-03
443,California,36.116203000000006,-119.681564,114827.0,63083.0,2020.0,1361.0,SSRS,143,CNN,CNN/SSRS,297.0,SSRS,A/B,508.0,lv,lv-d,Live Phone,U.S. President,12/4/19,12/8/19,,False,,False,False,12/11/19 13:16,,https://cdn.cnn.com/cnn/2019/images/12/11/rel1_ca.pdf,primary,DEM,Sanders,13257.0,Bernard Sanders,20.0,2019-12-04
444,California,36.116203000000006,-119.681564,114827.0,63083.0,2020.0,1361.0,SSRS,143,CNN,CNN/SSRS,297.0,SSRS,A/B,508.0,lv,lv-d,Live Phone,U.S. President,12/4/19,12/8/19,,False,,False,False,12/11/19 13:16,,https://cdn.cnn.com/cnn/2019/images/12/11/rel1_ca.pdf,primary,DEM,Biden,13256.0,Joseph R. Biden Jr.,21.0,2019-12-04
445,California,36.116203000000006,-119.681564,114817.0,63083.0,2020.0,1361.0,SSRS,143,CNN,CNN/SSRS,297.0,SSRS,A/B,298.0,lv,lv-r,Live Phone,U.S. President,12/4/19,12/8/19,,False,,False,False,12/11/19 13:11,,https://cdn.cnn.com/cnn/2019/images/12/11/rel1_ca.pdf,primary,REP,Weld,13351.0,William F. Weld,3.0,2019-12-04
446,California,36.116203000000006,-119.681564,114817.0,63083.0,2020.0,1361.0,SSRS,143,CNN,CNN/SSRS,297.0,SSRS,A/B,298.0,lv,lv-r,Live Phone,U.S. President,12/4/19,12/8/19,,False,,False,False,12/11/19 13:11,,https://cdn.cnn.com/cnn/2019/images/12/11/rel1_ca.pdf,primary,REP,Walsh,13482.0,Joe Walsh,3.0,2019-12-04
447,California,36.116203000000006,-119.681564,114817.0,63083.0,2020.0,1361.0,SSRS,143,CNN,CNN/SSRS,297.0,SSRS,A/B,298.0,lv,lv-r,Live Phone,U.S. President,12/4/19,12/8/19,,False,,False,False,12/11/19 13:11,,https://cdn.cnn.com/cnn/2019/images/12/11/rel1_ca.pdf,primary,REP,Trump,13254.0,Donald Trump,85.0,2019-12-04
448,California,36.116203000000006,-119.681564,97880.0,58445.0,2020.0,1363.0,"University of California, Berkeley",300,LA Times,"University of California, Berkeley",457.0,"University of California, Berkeley",B/C,2131.0,lv,lv-d,Online,U.S. President,6/4/19,6/10/19,,False,,False,False,6/13/19 08:30,,https://escholarship.org/uc/item/1g43j6tj,primary,DEM,Biden,13256.0,Joseph R. Biden Jr.,22.4,2019-06-04
449,California,36.116203000000006,-119.681564,114827.0,63083.0,2020.0,1361.0,SSRS,143,CNN,CNN/SSRS,297.0,SSRS,A/B,508.0,lv,lv-d,Live Phone,U.S. President,12/4/19,12/8/19,,False,,False,False,12/11/19 13:16,,https://cdn.cnn.com/cnn/2019/images/12/11/rel1_ca.pdf,primary,DEM,Warren,13258.0,Elizabeth Warren,17.0,2019-12-04
450,California,36.116203000000006,-119.681564,97880.0,58445.0,2020.0,1363.0,"University of California, Berkeley",300,LA Times,"University of California, Berkeley",457.0,"University of California, Berkeley",B/C,2131.0,lv,lv-d,Online,U.S. President,6/4/19,6/10/19,,False,,False,False,6/13/19 08:30,,https://escholarship.org/uc/item/1g43j6tj,primary,DEM,Warren,13258.0,Elizabeth Warren,18.0,2019-06-04
451,California,36.116203000000006,-119.681564,97880.0,58445.0,2020.0,1363.0,"University of California, Berkeley",300,LA Times,"University of California, Berkeley",457.0,"University of California, Berkeley",B/C,2131.0,lv,lv-d,Online,U.S. President,6/4/19,6/10/19,,False,,False,False,6/13/19 08:30,,https://escholarship.org/uc/item/1g43j6tj,primary,DEM,Harris,13288.0,Kamala D. Harris,13.4,2019-06-04
452,California,36.116203000000006,-119.681564,97880.0,58445.0,2020.0,1363.0,"University of California, Berkeley",300,LA Times,"University of California, Berkeley",457.0,"University of California, Berkeley",B/C,2131.0,lv,lv-d,Online,U.S. President,6/4/19,6/10/19,,False,,False,False,6/13/19 08:30,,https://escholarship.org/uc/item/1g43j6tj,primary,DEM,Buttigieg,13345.0,Pete Buttigieg,10.0,2019-06-04
453,California,36.116203000000006,-119.681564,99462.0,58681.0,2020.0,1491.0,Capitol Weekly,,,Capitol Weekly,510.0,Capitol Weekly,,703.0,lv,lv-d,Online,U.S. President,6/1/19,6/30/19,,False,,False,False,7/17/19 15:00,,https://public.tableau.com/profile/capitol.weekly#!/vizhome/2020PrimaryTrackingSurvey_15626518585990/CA120POLLSTORY,primary,DEM,Moulton,13322.0,Seth Moulton,0.3,2019-06-01
454,California,36.116203000000006,-119.681564,99462.0,58681.0,2020.0,1491.0,Capitol Weekly,,,Capitol Weekly,510.0,Capitol Weekly,,703.0,lv,lv-d,Online,U.S. President,6/1/19,6/30/19,,False,,False,False,7/17/19 15:00,,https://public.tableau.com/profile/capitol.weekly#!/vizhome/2020PrimaryTrackingSurvey_15626518585990/CA120POLLSTORY,primary,DEM,Delaney,13314.0,John K. Delaney,0.1,2019-06-01
455,California,36.116203000000006,-119.681564,99462.0,58681.0,2020.0,1491.0,Capitol Weekly,,,Capitol Weekly,510.0,Capitol Weekly,,703.0,lv,lv-d,Online,U.S. President,6/1/19,6/30/19,,False,,False,False,7/17/19 15:00,,https://public.tableau.com/profile/capitol.weekly#!/vizhome/2020PrimaryTrackingSurvey_15626518585990/CA120POLLSTORY,primary,DEM,de Blasio,13335.0,Bill de Blasio,0.1,2019-06-01
456,California,36.116203000000006,-119.681564,99462.0,58681.0,2020.0,1491.0,Capitol Weekly,,,Capitol Weekly,510.0,Capitol Weekly,,703.0,lv,lv-d,Online,U.S. President,6/1/19,6/30/19,,False,,False,False,7/17/19 15:00,,https://public.tableau.com/profile/capitol.weekly#!/vizhome/2020PrimaryTrackingSurvey_15626518585990/CA120POLLSTORY,primary,DEM,Bullock,13320.0,Steve Bullock,0.1,2019-06-01
457,California,36.116203000000006,-119.681564,97880.0,58445.0,2020.0,1363.0,"University of California, Berkeley",300,LA Times,"University of California, Berkeley",457.0,"University of California, Berkeley",B/C,2131.0,lv,lv-d,Online,U.S. President,6/4/19,6/10/19,,False,,False,False,6/13/19 08:30,,https://escholarship.org/uc/item/1g43j6tj,primary,DEM,Sanders,13257.0,Bernard Sanders,16.9,2019-06-04
458,California,36.116203000000006,-119.681564,114827.0,63083.0,2020.0,1361.0,SSRS,143,CNN,CNN/SSRS,297.0,SSRS,A/B,508.0,lv,lv-d,Live Phone,U.S. President,12/4/19,12/8/19,,False,,False,False,12/11/19 13:16,,https://cdn.cnn.com/cnn/2019/images/12/11/rel1_ca.pdf,primary,DEM,Buttigieg,13345.0,Pete Buttigieg,9.0,2019-12-04
459,California,36.116203000000006,-119.681564,114827.0,63083.0,2020.0,1361.0,SSRS,143,CNN,CNN/SSRS,297.0,SSRS,A/B,508.0,lv,lv-d,Live Phone,U.S. President,12/4/19,12/8/19,,False,,False,False,12/11/19 13:16,,https://cdn.cnn.com/cnn/2019/images/12/11/rel1_ca.pdf,primary,DEM,Yang,13329.0,Andrew Yang,6.0,2019-12-04
460,California,36.116203000000006,-119.681564,114827.0,63083.0,2020.0,1361.0,SSRS,143,CNN,CNN/SSRS,297.0,SSRS,A/B,508.0,lv,lv-d,Live Phone,U.S. President,12/4/19,12/8/19,,False,,False,False,12/11/19 13:16,,https://cdn.cnn.com/cnn/2019/images/12/11/rel1_ca.pdf,primary,DEM,Bloomberg,13289.0,Michael Bloomberg,5.0,2019-12-04
461,California,36.116203000000006,-119.681564,114884.0,63112.0,2020.0,1491.0,Capitol Weekly,,,Capitol Weekly,510.0,Capitol Weekly,,581.0,lv,lv-d,Online,U.S. President,12/3/19,12/7/19,,False,,False,False,12/13/19 10:50,,https://www.dropbox.com/sh/lpg315ervjbhxkm/AAA_T1gWN9oYedzp5LpIr-sNa?dl=0&preview=Dec+2019+Presidential+Primary+Tracking+Poll+Toplines+and+Crosstabs.xlsx,primary,DEM,Bloomberg,13289.0,Michael Bloomberg,5.0,2019-12-03
462,California,36.116203000000006,-119.681564,114884.0,63112.0,2020.0,1491.0,Capitol Weekly,,,Capitol Weekly,510.0,Capitol Weekly,,581.0,lv,lv-d,Online,U.S. President,12/3/19,12/7/19,,False,,False,False,12/13/19 10:50,,https://www.dropbox.com/sh/lpg315ervjbhxkm/AAA_T1gWN9oYedzp5LpIr-sNa?dl=0&preview=Dec+2019+Presidential+Primary+Tracking+Poll+Toplines+and+Crosstabs.xlsx,primary,DEM,Yang,13329.0,Andrew Yang,5.0,2019-12-03
463,California,36.116203000000006,-119.681564,114884.0,63112.0,2020.0,1491.0,Capitol Weekly,,,Capitol Weekly,510.0,Capitol Weekly,,581.0,lv,lv-d,Online,U.S. President,12/3/19,12/7/19,,False,,False,False,12/13/19 10:50,,https://www.dropbox.com/sh/lpg315ervjbhxkm/AAA_T1gWN9oYedzp5LpIr-sNa?dl=0&preview=Dec+2019+Presidential+Primary+Tracking+Poll+Toplines+and+Crosstabs.xlsx,primary,DEM,Buttigieg,13345.0,Pete Buttigieg,14.0,2019-12-03
464,California,36.116203000000006,-119.681564,114884.0,63112.0,2020.0,1491.0,Capitol Weekly,,,Capitol Weekly,510.0,Capitol Weekly,,581.0,lv,lv-d,Online,U.S. President,12/3/19,12/7/19,,False,,False,False,12/13/19 10:50,,https://www.dropbox.com/sh/lpg315ervjbhxkm/AAA_T1gWN9oYedzp5LpIr-sNa?dl=0&preview=Dec+2019+Presidential+Primary+Tracking+Poll+Toplines+and+Crosstabs.xlsx,primary,DEM,Biden,13256.0,Joseph R. Biden Jr.,19.0,2019-12-03
465,California,36.116203000000006,-119.681564,114884.0,63112.0,2020.0,1491.0,Capitol Weekly,,,Capitol Weekly,510.0,Capitol Weekly,,581.0,lv,lv-d,Online,U.S. President,12/3/19,12/7/19,,False,,False,False,12/13/19 10:50,,https://www.dropbox.com/sh/lpg315ervjbhxkm/AAA_T1gWN9oYedzp5LpIr-sNa?dl=0&preview=Dec+2019+Presidential+Primary+Tracking+Poll+Toplines+and+Crosstabs.xlsx,primary,DEM,Sanders,13257.0,Bernard Sanders,19.0,2019-12-03
466,California,36.116203000000006,-119.681564,114884.0,63112.0,2020.0,1491.0,Capitol Weekly,,,Capitol Weekly,510.0,Capitol Weekly,,581.0,lv,lv-d,Online,U.S. President,12/3/19,12/7/19,,False,,False,False,12/13/19 10:50,,https://www.dropbox.com/sh/lpg315ervjbhxkm/AAA_T1gWN9oYedzp5LpIr-sNa?dl=0&preview=Dec+2019+Presidential+Primary+Tracking+Poll+Toplines+and+Crosstabs.xlsx,primary,DEM,Warren,13258.0,Elizabeth Warren,23.0,2019-12-03
467,California,36.116203000000006,-119.681564,114827.0,63083.0,2020.0,1361.0,SSRS,143,CNN,CNN/SSRS,297.0,SSRS,A/B,508.0,lv,lv-d,Live Phone,U.S. President,12/4/19,12/8/19,,False,,False,False,12/11/19 13:16,,https://cdn.cnn.com/cnn/2019/images/12/11/rel1_ca.pdf,primary,DEM,Williamson,13350.0,Marianne Williamson,0.0,2019-12-04
468,California,36.116203000000006,-119.681564,114827.0,63083.0,2020.0,1361.0,SSRS,143,CNN,CNN/SSRS,297.0,SSRS,A/B,508.0,lv,lv-d,Live Phone,U.S. President,12/4/19,12/8/19,,False,,False,False,12/11/19 13:16,,https://cdn.cnn.com/cnn/2019/images/12/11/rel1_ca.pdf,primary,DEM,Patrick,13315.0,Deval Patrick,0.0,2019-12-04
469,California,36.116203000000006,-119.681564,114827.0,63083.0,2020.0,1361.0,SSRS,143,CNN,CNN/SSRS,297.0,SSRS,A/B,508.0,lv,lv-d,Live Phone,U.S. President,12/4/19,12/8/19,,False,,False,False,12/11/19 13:16,,https://cdn.cnn.com/cnn/2019/images/12/11/rel1_ca.pdf,primary,DEM,Delaney,13314.0,John K. Delaney,0.0,2019-12-04
470,California,36.116203000000006,-119.681564,114827.0,63083.0,2020.0,1361.0,SSRS,143,CNN,CNN/SSRS,297.0,SSRS,A/B,508.0,lv,lv-d,Live Phone,U.S. President,12/4/19,12/8/19,,False,,False,False,12/11/19 13:16,,https://cdn.cnn.com/cnn/2019/images/12/11/rel1_ca.pdf,primary,DEM,Bennet,13352.0,Michael F. Bennet,0.0,2019-12-04
471,California,36.116203000000006,-119.681564,114827.0,63083.0,2020.0,1361.0,SSRS,143,CNN,CNN/SSRS,297.0,SSRS,A/B,508.0,lv,lv-d,Live Phone,U.S. President,12/4/19,12/8/19,,False,,False,False,12/11/19 13:16,,https://cdn.cnn.com/cnn/2019/images/12/11/rel1_ca.pdf,primary,DEM,Steyer,13327.0,Tom Steyer,1.0,2019-12-04
472,California,36.116203000000006,-119.681564,114827.0,63083.0,2020.0,1361.0,SSRS,143,CNN,CNN/SSRS,297.0,SSRS,A/B,508.0,lv,lv-d,Live Phone,U.S. President,12/4/19,12/8/19,,False,,False,False,12/11/19 13:16,,https://cdn.cnn.com/cnn/2019/images/12/11/rel1_ca.pdf,primary,DEM,Castro,13316.0,Julián Castro,1.0,2019-12-04
473,California,36.116203000000006,-119.681564,114827.0,63083.0,2020.0,1361.0,SSRS,143,CNN,CNN/SSRS,297.0,SSRS,A/B,508.0,lv,lv-d,Live Phone,U.S. President,12/4/19,12/8/19,,False,,False,False,12/11/19 13:16,,https://cdn.cnn.com/cnn/2019/images/12/11/rel1_ca.pdf,primary,DEM,Klobuchar,13310.0,Amy Klobuchar,2.0,2019-12-04
474,California,36.116203000000006,-119.681564,114827.0,63083.0,2020.0,1361.0,SSRS,143,CNN,CNN/SSRS,297.0,SSRS,A/B,508.0,lv,lv-d,Live Phone,U.S. President,12/4/19,12/8/19,,False,,False,False,12/11/19 13:16,,https://cdn.cnn.com/cnn/2019/images/12/11/rel1_ca.pdf,primary,DEM,Gabbard,13343.0,Tulsi Gabbard,2.0,2019-12-04
475,California,36.116203000000006,-119.681564,114827.0,63083.0,2020.0,1361.0,SSRS,143,CNN,CNN/SSRS,297.0,SSRS,A/B,508.0,lv,lv-d,Live Phone,U.S. President,12/4/19,12/8/19,,False,,False,False,12/11/19 13:16,,https://cdn.cnn.com/cnn/2019/images/12/11/rel1_ca.pdf,primary,DEM,Booker,13287.0,Cory A. Booker,3.0,2019-12-04
476,California,36.116203000000006,-119.681564,114267.0,63015.0,2020.0,1363.0,"University of California, Berkeley",300,LA Times,"University of California, Berkeley",457.0,"University of California, Berkeley",B/C,1694.0,lv,lv-d,Online,U.S. President,11/21/19,11/27/19,,False,,False,False,12/5/19 07:05,,https://escholarship.org/uc/item/4bn38460,primary,DEM,Steyer,13327.0,Tom Steyer,1.1,2019-11-21
477,California,36.116203000000006,-119.681564,99462.0,58681.0,2020.0,1491.0,Capitol Weekly,,,Capitol Weekly,510.0,Capitol Weekly,,703.0,lv,lv-d,Online,U.S. President,6/1/19,6/30/19,,False,,False,False,7/17/19 15:00,,https://public.tableau.com/profile/capitol.weekly#!/vizhome/2020PrimaryTrackingSurvey_15626518585990/CA120POLLSTORY,primary,DEM,Bennet,13352.0,Michael F. Bennet,0.6,2019-06-01
478,California,36.116203000000006,-119.681564,114267.0,63015.0,2020.0,1363.0,"University of California, Berkeley",300,LA Times,"University of California, Berkeley",457.0,"University of California, Berkeley",B/C,1694.0,lv,lv-d,Online,U.S. President,11/21/19,11/27/19,,False,,False,False,12/5/19 07:05,,https://escholarship.org/uc/item/4bn38460,primary,DEM,Yang,13329.0,Andrew Yang,3.2,2019-11-21
479,California,36.116203000000006,-119.681564,114267.0,63015.0,2020.0,1363.0,"University of California, Berkeley",300,LA Times,"University of California, Berkeley",457.0,"University of California, Berkeley",B/C,1694.0,lv,lv-d,Online,U.S. President,11/21/19,11/27/19,,False,,False,False,12/5/19 07:05,,https://escholarship.org/uc/item/4bn38460,primary,DEM,Bloomberg,13289.0,Michael Bloomberg,2.1,2019-11-21
480,California,36.116203000000006,-119.681564,114005.0,62980.0,2020.0,460.0,SurveyUSA,"443,804",KGTV-TV (California) | San Diego Union-Tribune,SurveyUSA,325.0,SurveyUSA,A,558.0,lv,lv-d,Online,U.S. President,11/20/19,11/22/19,,False,,False,False,11/26/19 21:22,,http://www.surveyusa.com/client/PollReport.aspx?g=bdcd277b-f00f-48eb-a393-bf59bb2a0fab,primary,DEM,Harris,13288.0,Kamala D. Harris,10.0,2019-11-20
481,California,36.116203000000006,-119.681564,114005.0,62980.0,2020.0,460.0,SurveyUSA,"443,804",KGTV-TV (California) | San Diego Union-Tribune,SurveyUSA,325.0,SurveyUSA,A,558.0,lv,lv-d,Online,U.S. President,11/20/19,11/22/19,,False,,False,False,11/26/19 21:22,,http://www.surveyusa.com/client/PollReport.aspx?g=bdcd277b-f00f-48eb-a393-bf59bb2a0fab,primary,DEM,Warren,13258.0,Elizabeth Warren,13.0,2019-11-20
482,California,36.116203000000006,-119.681564,114005.0,62980.0,2020.0,460.0,SurveyUSA,"443,804",KGTV-TV (California) | San Diego Union-Tribune,SurveyUSA,325.0,SurveyUSA,A,558.0,lv,lv-d,Online,U.S. President,11/20/19,11/22/19,,False,,False,False,11/26/19 21:22,,http://www.surveyusa.com/client/PollReport.aspx?g=bdcd277b-f00f-48eb-a393-bf59bb2a0fab,primary,DEM,Sanders,13257.0,Bernard Sanders,19.0,2019-11-20
483,California,36.116203000000006,-119.681564,114005.0,62980.0,2020.0,460.0,SurveyUSA,"443,804",KGTV-TV (California) | San Diego Union-Tribune,SurveyUSA,325.0,SurveyUSA,A,558.0,lv,lv-d,Online,U.S. President,11/20/19,11/22/19,,False,,False,False,11/26/19 21:22,,http://www.surveyusa.com/client/PollReport.aspx?g=bdcd277b-f00f-48eb-a393-bf59bb2a0fab,primary,DEM,Biden,13256.0,Joseph R. Biden Jr.,30.0,2019-11-20
484,California,36.116203000000006,-119.681564,113209.0,62658.0,2020.0,382.0,Public Policy Institute of California,,,Public Policy Institute of California,262.0,Public Policy Institute of California,A/B,682.0,lv,lv-d,Live Phone,U.S. President,11/3/19,11/12/19,,False,,False,False,11/19/19 00:00,,https://www.ppic.org/wp-content/uploads/ppic-statewide-survey-californians-and-their-government-november-2019.pdf,primary,DEM,Biden,13256.0,Joseph R. Biden Jr.,24.0,2019-11-03
485,California,36.116203000000006,-119.681564,113209.0,62658.0,2020.0,382.0,Public Policy Institute of California,,,Public Policy Institute of California,262.0,Public Policy Institute of California,A/B,682.0,lv,lv-d,Live Phone,U.S. President,11/3/19,11/12/19,,False,,False,False,11/19/19 00:00,,https://www.ppic.org/wp-content/uploads/ppic-statewide-survey-californians-and-their-government-november-2019.pdf,primary,DEM,Warren,13258.0,Elizabeth Warren,23.0,2019-11-03
486,California,36.116203000000006,-119.681564,114005.0,62980.0,2020.0,460.0,SurveyUSA,"443,804",KGTV-TV (California) | San Diego Union-Tribune,SurveyUSA,325.0,SurveyUSA,A,558.0,lv,lv-d,Online,U.S. President,11/20/19,11/22/19,,False,,False,False,11/26/19 21:22,,http://www.surveyusa.com/client/PollReport.aspx?g=bdcd277b-f00f-48eb-a393-bf59bb2a0fab,primary,DEM,Buttigieg,13345.0,Pete Buttigieg,9.0,2019-11-20
487,California,36.116203000000006,-119.681564,113209.0,62658.0,2020.0,382.0,Public Policy Institute of California,,,Public Policy Institute of California,262.0,Public Policy Institute of California,A/B,682.0,lv,lv-d,Live Phone,U.S. President,11/3/19,11/12/19,,False,,False,False,11/19/19 00:00,,https://www.ppic.org/wp-content/uploads/ppic-statewide-survey-californians-and-their-government-november-2019.pdf,primary,DEM,Sanders,13257.0,Bernard Sanders,17.0,2019-11-03
488,California,36.116203000000006,-119.681564,113209.0,62658.0,2020.0,382.0,Public Policy Institute of California,,,Public Policy Institute of California,262.0,Public Policy Institute of California,A/B,682.0,lv,lv-d,Live Phone,U.S. President,11/3/19,11/12/19,,False,,False,False,11/19/19 00:00,,https://www.ppic.org/wp-content/uploads/ppic-statewide-survey-californians-and-their-government-november-2019.pdf,primary,DEM,Buttigieg,13345.0,Pete Buttigieg,7.0,2019-11-03
489,California,36.116203000000006,-119.681564,113209.0,62658.0,2020.0,382.0,Public Policy Institute of California,,,Public Policy Institute of California,262.0,Public Policy Institute of California,A/B,682.0,lv,lv-d,Live Phone,U.S. President,11/3/19,11/12/19,,False,,False,False,11/19/19 00:00,,https://www.ppic.org/wp-content/uploads/ppic-statewide-survey-californians-and-their-government-november-2019.pdf,primary,DEM,Yang,13329.0,Andrew Yang,5.0,2019-11-03
490,California,36.116203000000006,-119.681564,113209.0,62658.0,2020.0,382.0,Public Policy Institute of California,,,Public Policy Institute of California,262.0,Public Policy Institute of California,A/B,682.0,lv,lv-d,Live Phone,U.S. President,11/3/19,11/12/19,,False,,False,False,11/19/19 00:00,,https://www.ppic.org/wp-content/uploads/ppic-statewide-survey-californians-and-their-government-november-2019.pdf,primary,DEM,Booker,13287.0,Cory A. Booker,1.0,2019-11-03
491,California,36.116203000000006,-119.681564,113209.0,62658.0,2020.0,382.0,Public Policy Institute of California,,,Public Policy Institute of California,262.0,Public Policy Institute of California,A/B,682.0,lv,lv-d,Live Phone,U.S. President,11/3/19,11/12/19,,False,,False,False,11/19/19 00:00,,https://www.ppic.org/wp-content/uploads/ppic-statewide-survey-californians-and-their-government-november-2019.pdf,primary,DEM,Klobuchar,13310.0,Amy Klobuchar,1.0,2019-11-03
492,California,36.116203000000006,-119.681564,113209.0,62658.0,2020.0,382.0,Public Policy Institute of California,,,Public Policy Institute of California,262.0,Public Policy Institute of California,A/B,682.0,lv,lv-d,Live Phone,U.S. President,11/3/19,11/12/19,,False,,False,False,11/19/19 00:00,,https://www.ppic.org/wp-content/uploads/ppic-statewide-survey-californians-and-their-government-november-2019.pdf,primary,DEM,Steyer,13327.0,Tom Steyer,1.0,2019-11-03
493,California,36.116203000000006,-119.681564,113024.0,62619.0,2020.0,1491.0,Capitol Weekly,,,Capitol Weekly,510.0,Capitol Weekly,,695.0,lv,lv-d,Online,U.S. President,11/1/19,11/12/19,,False,,False,False,11/13/19 15:16,,https://www.dropbox.com/s/h2iww6q3elxeohl/Nov%202019%20Presidential%20Primary%20Tracking%20Poll%20Toplines%20and%20Crosstabs.xlsx,primary,DEM,Warren,13258.0,Elizabeth Warren,27.0,2019-11-01
494,California,36.116203000000006,-119.681564,113209.0,62658.0,2020.0,382.0,Public Policy Institute of California,,,Public Policy Institute of California,262.0,Public Policy Institute of California,A/B,682.0,lv,lv-d,Live Phone,U.S. President,11/3/19,11/12/19,,False,,False,False,11/19/19 00:00,,https://www.ppic.org/wp-content/uploads/ppic-statewide-survey-californians-and-their-government-november-2019.pdf,primary,DEM,Harris,13288.0,Kamala D. Harris,8.0,2019-11-03
495,California,36.116203000000006,-119.681564,113024.0,62619.0,2020.0,1491.0,Capitol Weekly,,,Capitol Weekly,510.0,Capitol Weekly,,695.0,lv,lv-d,Online,U.S. President,11/1/19,11/12/19,,False,,False,False,11/13/19 15:16,,https://www.dropbox.com/s/h2iww6q3elxeohl/Nov%202019%20Presidential%20Primary%20Tracking%20Poll%20Toplines%20and%20Crosstabs.xlsx,primary,DEM,Sanders,13257.0,Bernard Sanders,21.0,2019-11-01
496,California,36.116203000000006,-119.681564,114005.0,62980.0,2020.0,460.0,SurveyUSA,"443,804",KGTV-TV (California) | San Diego Union-Tribune,SurveyUSA,325.0,SurveyUSA,A,558.0,lv,lv-d,Online,U.S. President,11/20/19,11/22/19,,False,,False,False,11/26/19 21:22,,http://www.surveyusa.com/client/PollReport.aspx?g=bdcd277b-f00f-48eb-a393-bf59bb2a0fab,primary,DEM,Yang,13329.0,Andrew Yang,4.0,2019-11-20
497,California,36.116203000000006,-119.681564,114005.0,62980.0,2020.0,460.0,SurveyUSA,"443,804",KGTV-TV (California) | San Diego Union-Tribune,SurveyUSA,325.0,SurveyUSA,A,558.0,lv,lv-d,Online,U.S. President,11/20/19,11/22/19,,False,,False,False,11/26/19 21:22,,http://www.surveyusa.com/client/PollReport.aspx?g=bdcd277b-f00f-48eb-a393-bf59bb2a0fab,primary,DEM,Steyer,13327.0,Tom Steyer,2.0,2019-11-20
498,California,36.116203000000006,-119.681564,114006.0,62980.0,2020.0,460.0,SurveyUSA,"443,804",KGTV-TV (California) | San Diego Union-Tribune,SurveyUSA,325.0,SurveyUSA,A,558.0,lv,lv-d,Online,U.S. President,11/20/19,11/22/19,,False,,False,False,11/26/19 21:22,,http://www.surveyusa.com/client/PollReport.aspx?g=bdcd277b-f00f-48eb-a393-bf59bb2a0fab,primary,DEM,Gabbard,13343.0,Tulsi Gabbard,2.0,2019-11-20
499,California,36.116203000000006,-119.681564,114006.0,62980.0,2020.0,460.0,SurveyUSA,"443,804",KGTV-TV (California) | San Diego Union-Tribune,SurveyUSA,325.0,SurveyUSA,A,558.0,lv,lv-d,Online,U.S. President,11/20/19,11/22/19,,False,,False,False,11/26/19 21:22,,http://www.surveyusa.com/client/PollReport.aspx?g=bdcd277b-f00f-48eb-a393-bf59bb2a0fab,primary,DEM,Klobuchar,13310.0,Amy Klobuchar,1.0,2019-11-20
500,California,36.116203000000006,-119.681564,114006.0,62980.0,2020.0,460.0,SurveyUSA,"443,804",KGTV-TV (California) | San Diego Union-Tribune,SurveyUSA,325.0,SurveyUSA,A,558.0,lv,lv-d,Online,U.S. President,11/20/19,11/22/19,,False,,False,False,11/26/19 21:22,,http://www.surveyusa.com/client/PollReport.aspx?g=bdcd277b-f00f-48eb-a393-bf59bb2a0fab,primary,DEM,Steyer,13327.0,Tom Steyer,3.0,2019-11-20
501,California,36.116203000000006,-119.681564,114006.0,62980.0,2020.0,460.0,SurveyUSA,"443,804",KGTV-TV (California) | San Diego Union-Tribune,SurveyUSA,325.0,SurveyUSA,A,558.0,lv,lv-d,Online,U.S. President,11/20/19,11/22/19,,False,,False,False,11/26/19 21:22,,http://www.surveyusa.com/client/PollReport.aspx?g=bdcd277b-f00f-48eb-a393-bf59bb2a0fab,primary,DEM,Bloomberg,13289.0,Michael Bloomberg,3.0,2019-11-20
502,California,36.116203000000006,-119.681564,114006.0,62980.0,2020.0,460.0,SurveyUSA,"443,804",KGTV-TV (California) | San Diego Union-Tribune,SurveyUSA,325.0,SurveyUSA,A,558.0,lv,lv-d,Online,U.S. President,11/20/19,11/22/19,,False,,False,False,11/26/19 21:22,,http://www.surveyusa.com/client/PollReport.aspx?g=bdcd277b-f00f-48eb-a393-bf59bb2a0fab,primary,DEM,Booker,13287.0,Cory A. Booker,3.0,2019-11-20
503,California,36.116203000000006,-119.681564,114006.0,62980.0,2020.0,460.0,SurveyUSA,"443,804",KGTV-TV (California) | San Diego Union-Tribune,SurveyUSA,325.0,SurveyUSA,A,558.0,lv,lv-d,Online,U.S. President,11/20/19,11/22/19,,False,,False,False,11/26/19 21:22,,http://www.surveyusa.com/client/PollReport.aspx?g=bdcd277b-f00f-48eb-a393-bf59bb2a0fab,primary,DEM,Yang,13329.0,Andrew Yang,5.0,2019-11-20
504,California,36.116203000000006,-119.681564,114005.0,62980.0,2020.0,460.0,SurveyUSA,"443,804",KGTV-TV (California) | San Diego Union-Tribune,SurveyUSA,325.0,SurveyUSA,A,558.0,lv,lv-d,Online,U.S. President,11/20/19,11/22/19,,False,,False,False,11/26/19 21:22,,http://www.surveyusa.com/client/PollReport.aspx?g=bdcd277b-f00f-48eb-a393-bf59bb2a0fab,primary,DEM,Booker,13287.0,Cory A. Booker,3.0,2019-11-20
505,California,36.116203000000006,-119.681564,114006.0,62980.0,2020.0,460.0,SurveyUSA,"443,804",KGTV-TV (California) | San Diego Union-Tribune,SurveyUSA,325.0,SurveyUSA,A,558.0,lv,lv-d,Online,U.S. President,11/20/19,11/22/19,,False,,False,False,11/26/19 21:22,,http://www.surveyusa.com/client/PollReport.aspx?g=bdcd277b-f00f-48eb-a393-bf59bb2a0fab,primary,DEM,Buttigieg,13345.0,Pete Buttigieg,8.0,2019-11-20
506,California,36.116203000000006,-119.681564,114006.0,62980.0,2020.0,460.0,SurveyUSA,"443,804",KGTV-TV (California) | San Diego Union-Tribune,SurveyUSA,325.0,SurveyUSA,A,558.0,lv,lv-d,Online,U.S. President,11/20/19,11/22/19,,False,,False,False,11/26/19 21:22,,http://www.surveyusa.com/client/PollReport.aspx?g=bdcd277b-f00f-48eb-a393-bf59bb2a0fab,primary,DEM,Warren,13258.0,Elizabeth Warren,13.0,2019-11-20
507,California,36.116203000000006,-119.681564,114006.0,62980.0,2020.0,460.0,SurveyUSA,"443,804",KGTV-TV (California) | San Diego Union-Tribune,SurveyUSA,325.0,SurveyUSA,A,558.0,lv,lv-d,Online,U.S. President,11/20/19,11/22/19,,False,,False,False,11/26/19 21:22,,http://www.surveyusa.com/client/PollReport.aspx?g=bdcd277b-f00f-48eb-a393-bf59bb2a0fab,primary,DEM,Sanders,13257.0,Bernard Sanders,18.0,2019-11-20
508,California,36.116203000000006,-119.681564,114006.0,62980.0,2020.0,460.0,SurveyUSA,"443,804",KGTV-TV (California) | San Diego Union-Tribune,SurveyUSA,325.0,SurveyUSA,A,558.0,lv,lv-d,Online,U.S. President,11/20/19,11/22/19,,False,,False,False,11/26/19 21:22,,http://www.surveyusa.com/client/PollReport.aspx?g=bdcd277b-f00f-48eb-a393-bf59bb2a0fab,primary,DEM,Biden,13256.0,Joseph R. Biden Jr.,28.0,2019-11-20
509,California,36.116203000000006,-119.681564,114005.0,62980.0,2020.0,460.0,SurveyUSA,"443,804",KGTV-TV (California) | San Diego Union-Tribune,SurveyUSA,325.0,SurveyUSA,A,558.0,lv,lv-d,Online,U.S. President,11/20/19,11/22/19,,False,,False,False,11/26/19 21:22,,http://www.surveyusa.com/client/PollReport.aspx?g=bdcd277b-f00f-48eb-a393-bf59bb2a0fab,primary,DEM,Castro,13316.0,Julián Castro,1.0,2019-11-20
510,California,36.116203000000006,-119.681564,114005.0,62980.0,2020.0,460.0,SurveyUSA,"443,804",KGTV-TV (California) | San Diego Union-Tribune,SurveyUSA,325.0,SurveyUSA,A,558.0,lv,lv-d,Online,U.S. President,11/20/19,11/22/19,,False,,False,False,11/26/19 21:22,,http://www.surveyusa.com/client/PollReport.aspx?g=bdcd277b-f00f-48eb-a393-bf59bb2a0fab,primary,DEM,Klobuchar,13310.0,Amy Klobuchar,1.0,2019-11-20
511,California,36.116203000000006,-119.681564,114005.0,62980.0,2020.0,460.0,SurveyUSA,"443,804",KGTV-TV (California) | San Diego Union-Tribune,SurveyUSA,325.0,SurveyUSA,A,558.0,lv,lv-d,Online,U.S. President,11/20/19,11/22/19,,False,,False,False,11/26/19 21:22,,http://www.surveyusa.com/client/PollReport.aspx?g=bdcd277b-f00f-48eb-a393-bf59bb2a0fab,primary,DEM,Gabbard,13343.0,Tulsi Gabbard,2.0,2019-11-20
512,California,36.116203000000006,-119.681564,114006.0,62980.0,2020.0,460.0,SurveyUSA,"443,804",KGTV-TV (California) | San Diego Union-Tribune,SurveyUSA,325.0,SurveyUSA,A,558.0,lv,lv-d,Online,U.S. President,11/20/19,11/22/19,,False,,False,False,11/26/19 21:22,,http://www.surveyusa.com/client/PollReport.aspx?g=bdcd277b-f00f-48eb-a393-bf59bb2a0fab,primary,DEM,Harris,13288.0,Kamala D. Harris,10.0,2019-11-20
513,California,36.116203000000006,-119.681564,113024.0,62619.0,2020.0,1491.0,Capitol Weekly,,,Capitol Weekly,510.0,Capitol Weekly,,695.0,lv,lv-d,Online,U.S. President,11/1/19,11/12/19,,False,,False,False,11/13/19 15:16,,https://www.dropbox.com/s/h2iww6q3elxeohl/Nov%202019%20Presidential%20Primary%20Tracking%20Poll%20Toplines%20and%20Crosstabs.xlsx,primary,DEM,Biden,13256.0,Joseph R. Biden Jr.,18.0,2019-11-01
514,California,36.116203000000006,-119.681564,113024.0,62619.0,2020.0,1491.0,Capitol Weekly,,,Capitol Weekly,510.0,Capitol Weekly,,695.0,lv,lv-d,Online,U.S. President,11/1/19,11/12/19,,False,,False,False,11/13/19 15:16,,https://www.dropbox.com/s/h2iww6q3elxeohl/Nov%202019%20Presidential%20Primary%20Tracking%20Poll%20Toplines%20and%20Crosstabs.xlsx,primary,DEM,Buttigieg,13345.0,Pete Buttigieg,14.0,2019-11-01
515,California,36.116203000000006,-119.681564,113024.0,62619.0,2020.0,1491.0,Capitol Weekly,,,Capitol Weekly,510.0,Capitol Weekly,,695.0,lv,lv-d,Online,U.S. President,11/1/19,11/12/19,,False,,False,False,11/13/19 15:16,,https://www.dropbox.com/s/h2iww6q3elxeohl/Nov%202019%20Presidential%20Primary%20Tracking%20Poll%20Toplines%20and%20Crosstabs.xlsx,primary,DEM,Harris,13288.0,Kamala D. Harris,6.0,2019-11-01
516,California,36.116203000000006,-119.681564,116358.0,63395.0,2020.0,1365.0,Change Research,1186,KQED,Change Research,48.0,Change Research,C,1190.0,lv,lv-d,Online,U.S. President,1/25/20,1/27/20,,False,,False,False,1/30/20 07:46,,https://www.changeresearch.com/post/kqed-change-research-california-poll-january,primary,DEM,Klobuchar,13310.0,Amy Klobuchar,3.0,2020-01-25
517,California,36.116203000000006,-119.681564,116358.0,63395.0,2020.0,1365.0,Change Research,1186,KQED,Change Research,48.0,Change Research,C,1190.0,lv,lv-d,Online,U.S. President,1/25/20,1/27/20,,False,,False,False,1/30/20 07:46,,https://www.changeresearch.com/post/kqed-change-research-california-poll-january,primary,DEM,Steyer,13327.0,Tom Steyer,2.0,2020-01-25
518,California,36.116203000000006,-119.681564,116358.0,63395.0,2020.0,1365.0,Change Research,1186,KQED,Change Research,48.0,Change Research,C,1190.0,lv,lv-d,Online,U.S. President,1/25/20,1/27/20,,False,,False,False,1/30/20 07:46,,https://www.changeresearch.com/post/kqed-change-research-california-poll-january,primary,DEM,Bennet,13352.0,Michael F. Bennet,0.0,2020-01-25
519,California,36.116203000000006,-119.681564,116358.0,63395.0,2020.0,1365.0,Change Research,1186,KQED,Change Research,48.0,Change Research,C,1190.0,lv,lv-d,Online,U.S. President,1/25/20,1/27/20,,False,,False,False,1/30/20 07:46,,https://www.changeresearch.com/post/kqed-change-research-california-poll-january,primary,DEM,Delaney,13314.0,John K. Delaney,0.0,2020-01-25
520,California,36.116203000000006,-119.681564,116358.0,63395.0,2020.0,1365.0,Change Research,1186,KQED,Change Research,48.0,Change Research,C,1190.0,lv,lv-d,Online,U.S. President,1/25/20,1/27/20,,False,,False,False,1/30/20 07:46,,https://www.changeresearch.com/post/kqed-change-research-california-poll-january,primary,DEM,Patrick,13315.0,Deval Patrick,0.0,2020-01-25
521,California,36.116203000000006,-119.681564,114267.0,63015.0,2020.0,1363.0,"University of California, Berkeley",300,LA Times,"University of California, Berkeley",457.0,"University of California, Berkeley",B/C,1694.0,lv,lv-d,Online,U.S. President,11/21/19,11/27/19,,False,,False,False,12/5/19 07:05,,https://escholarship.org/uc/item/4bn38460,primary,DEM,Sestak,13381.0,Joe Sestak,0.0,2019-11-21
522,California,36.116203000000006,-119.681564,116358.0,63395.0,2020.0,1365.0,Change Research,1186,KQED,Change Research,48.0,Change Research,C,1190.0,lv,lv-d,Online,U.S. President,1/25/20,1/27/20,,False,,False,False,1/30/20 07:46,,https://www.changeresearch.com/post/kqed-change-research-california-poll-january,primary,DEM,Bloomberg,13289.0,Michael Bloomberg,4.0,2020-01-25
523,California,36.116203000000006,-119.681564,114267.0,63015.0,2020.0,1363.0,"University of California, Berkeley",300,LA Times,"University of California, Berkeley",457.0,"University of California, Berkeley",B/C,1694.0,lv,lv-d,Online,U.S. President,11/21/19,11/27/19,,False,,False,False,12/5/19 07:05,,https://escholarship.org/uc/item/4bn38460,primary,DEM,Delaney,13314.0,John K. Delaney,0.0,2019-11-21
524,California,36.116203000000006,-119.681564,114267.0,63015.0,2020.0,1363.0,"University of California, Berkeley",300,LA Times,"University of California, Berkeley",457.0,"University of California, Berkeley",B/C,1694.0,lv,lv-d,Online,U.S. President,11/21/19,11/27/19,,False,,False,False,12/5/19 07:05,,https://escholarship.org/uc/item/4bn38460,primary,DEM,Williamson,13350.0,Marianne Williamson,0.1,2019-11-21
525,California,36.116203000000006,-119.681564,114267.0,63015.0,2020.0,1363.0,"University of California, Berkeley",300,LA Times,"University of California, Berkeley",457.0,"University of California, Berkeley",B/C,1694.0,lv,lv-d,Online,U.S. President,11/21/19,11/27/19,,False,,False,False,12/5/19 07:05,,https://escholarship.org/uc/item/4bn38460,primary,DEM,Patrick,13315.0,Deval Patrick,0.1,2019-11-21
526,California,36.116203000000006,-119.681564,114267.0,63015.0,2020.0,1363.0,"University of California, Berkeley",300,LA Times,"University of California, Berkeley",457.0,"University of California, Berkeley",B/C,1694.0,lv,lv-d,Online,U.S. President,11/21/19,11/27/19,,False,,False,False,12/5/19 07:05,,https://escholarship.org/uc/item/4bn38460,primary,DEM,Bennet,13352.0,Michael F. Bennet,0.5,2019-11-21
527,California,36.116203000000006,-119.681564,114267.0,63015.0,2020.0,1363.0,"University of California, Berkeley",300,LA Times,"University of California, Berkeley",457.0,"University of California, Berkeley",B/C,1694.0,lv,lv-d,Online,U.S. President,11/21/19,11/27/19,,False,,False,False,12/5/19 07:05,,https://escholarship.org/uc/item/4bn38460,primary,DEM,Booker,13287.0,Cory A. Booker,0.6,2019-11-21
528,California,36.116203000000006,-119.681564,114267.0,63015.0,2020.0,1363.0,"University of California, Berkeley",300,LA Times,"University of California, Berkeley",457.0,"University of California, Berkeley",B/C,1694.0,lv,lv-d,Online,U.S. President,11/21/19,11/27/19,,False,,False,False,12/5/19 07:05,,https://escholarship.org/uc/item/4bn38460,primary,DEM,Castro,13316.0,Julián Castro,0.6,2019-11-21
529,California,36.116203000000006,-119.681564,114267.0,63015.0,2020.0,1363.0,"University of California, Berkeley",300,LA Times,"University of California, Berkeley",457.0,"University of California, Berkeley",B/C,1694.0,lv,lv-d,Online,U.S. President,11/21/19,11/27/19,,False,,False,False,12/5/19 07:05,,https://escholarship.org/uc/item/4bn38460,primary,DEM,Gabbard,13343.0,Tulsi Gabbard,1.0,2019-11-21
530,California,36.116203000000006,-119.681564,114267.0,63015.0,2020.0,1363.0,"University of California, Berkeley",300,LA Times,"University of California, Berkeley",457.0,"University of California, Berkeley",B/C,1694.0,lv,lv-d,Online,U.S. President,11/21/19,11/27/19,,False,,False,False,12/5/19 07:05,,https://escholarship.org/uc/item/4bn38460,primary,DEM,Bullock,13320.0,Steve Bullock,0.0,2019-11-21
531,California,36.116203000000006,-119.681564,116358.0,63395.0,2020.0,1365.0,Change Research,1186,KQED,Change Research,48.0,Change Research,C,1190.0,lv,lv-d,Online,U.S. President,1/25/20,1/27/20,,False,,False,False,1/30/20 07:46,,https://www.changeresearch.com/post/kqed-change-research-california-poll-january,primary,DEM,Gabbard,13343.0,Tulsi Gabbard,4.0,2020-01-25
532,California,36.116203000000006,-119.681564,116358.0,63395.0,2020.0,1365.0,Change Research,1186,KQED,Change Research,48.0,Change Research,C,1190.0,lv,lv-d,Online,U.S. President,1/25/20,1/27/20,,False,,False,False,1/30/20 07:46,,https://www.changeresearch.com/post/kqed-change-research-california-poll-january,primary,DEM,Yang,13329.0,Andrew Yang,5.0,2020-01-25
533,California,36.116203000000006,-119.681564,116358.0,63395.0,2020.0,1365.0,Change Research,1186,KQED,Change Research,48.0,Change Research,C,1190.0,lv,lv-d,Online,U.S. President,1/25/20,1/27/20,,False,,False,False,1/30/20 07:46,,https://www.changeresearch.com/post/kqed-change-research-california-poll-january,primary,DEM,Buttigieg,13345.0,Pete Buttigieg,8.0,2020-01-25
534,California,36.116203000000006,-119.681564,113024.0,62619.0,2020.0,1491.0,Capitol Weekly,,,Capitol Weekly,510.0,Capitol Weekly,,695.0,lv,lv-d,Online,U.S. President,11/1/19,11/12/19,,False,,False,False,11/13/19 15:16,,https://www.dropbox.com/s/h2iww6q3elxeohl/Nov%202019%20Presidential%20Primary%20Tracking%20Poll%20Toplines%20and%20Crosstabs.xlsx,primary,DEM,Yang,13329.0,Andrew Yang,4.0,2019-11-01
535,California,36.116203000000006,-119.681564,113024.0,62619.0,2020.0,1491.0,Capitol Weekly,,,Capitol Weekly,510.0,Capitol Weekly,,695.0,lv,lv-d,Online,U.S. President,11/1/19,11/12/19,,False,,False,False,11/13/19 15:16,,https://www.dropbox.com/s/h2iww6q3elxeohl/Nov%202019%20Presidential%20Primary%20Tracking%20Poll%20Toplines%20and%20Crosstabs.xlsx,primary,DEM,Klobuchar,13310.0,Amy Klobuchar,3.0,2019-11-01
536,California,36.116203000000006,-119.681564,113024.0,62619.0,2020.0,1491.0,Capitol Weekly,,,Capitol Weekly,510.0,Capitol Weekly,,695.0,lv,lv-d,Online,U.S. President,11/1/19,11/12/19,,False,,False,False,11/13/19 15:16,,https://www.dropbox.com/s/h2iww6q3elxeohl/Nov%202019%20Presidential%20Primary%20Tracking%20Poll%20Toplines%20and%20Crosstabs.xlsx,primary,DEM,Gabbard,13343.0,Tulsi Gabbard,3.0,2019-11-01
537,California,36.116203000000006,-119.681564,113024.0,62619.0,2020.0,1491.0,Capitol Weekly,,,Capitol Weekly,510.0,Capitol Weekly,,695.0,lv,lv-d,Online,U.S. President,11/1/19,11/12/19,,False,,False,False,11/13/19 15:16,,https://www.dropbox.com/s/h2iww6q3elxeohl/Nov%202019%20Presidential%20Primary%20Tracking%20Poll%20Toplines%20and%20Crosstabs.xlsx,primary,DEM,Steyer,13327.0,Tom Steyer,1.0,2019-11-01
538,California,36.116203000000006,-119.681564,113024.0,62619.0,2020.0,1491.0,Capitol Weekly,,,Capitol Weekly,510.0,Capitol Weekly,,695.0,lv,lv-d,Online,U.S. President,11/1/19,11/12/19,,False,,False,False,11/13/19 15:16,,https://www.dropbox.com/s/h2iww6q3elxeohl/Nov%202019%20Presidential%20Primary%20Tracking%20Poll%20Toplines%20and%20Crosstabs.xlsx,primary,DEM,Booker,13287.0,Cory A. Booker,1.0,2019-11-01
539,California,36.116203000000006,-119.681564,113024.0,62619.0,2020.0,1491.0,Capitol Weekly,,,Capitol Weekly,510.0,Capitol Weekly,,695.0,lv,lv-d,Online,U.S. President,11/1/19,11/12/19,,False,,False,False,11/13/19 15:16,,https://www.dropbox.com/s/h2iww6q3elxeohl/Nov%202019%20Presidential%20Primary%20Tracking%20Poll%20Toplines%20and%20Crosstabs.xlsx,primary,DEM,Williamson,13350.0,Marianne Williamson,1.0,2019-11-01
540,California,36.116203000000006,-119.681564,113024.0,62619.0,2020.0,1491.0,Capitol Weekly,,,Capitol Weekly,510.0,Capitol Weekly,,695.0,lv,lv-d,Online,U.S. President,11/1/19,11/12/19,,False,,False,False,11/13/19 15:16,,https://www.dropbox.com/s/h2iww6q3elxeohl/Nov%202019%20Presidential%20Primary%20Tracking%20Poll%20Toplines%20and%20Crosstabs.xlsx,primary,DEM,Delaney,13314.0,John K. Delaney,0.0,2019-11-01
541,California,36.116203000000006,-119.681564,113024.0,62619.0,2020.0,1491.0,Capitol Weekly,,,Capitol Weekly,510.0,Capitol Weekly,,695.0,lv,lv-d,Online,U.S. President,11/1/19,11/12/19,,False,,False,False,11/13/19 15:16,,https://www.dropbox.com/s/h2iww6q3elxeohl/Nov%202019%20Presidential%20Primary%20Tracking%20Poll%20Toplines%20and%20Crosstabs.xlsx,primary,DEM,Castro,13316.0,Julián Castro,0.0,2019-11-01
542,California,36.116203000000006,-119.681564,113024.0,62619.0,2020.0,1491.0,Capitol Weekly,,,Capitol Weekly,510.0,Capitol Weekly,,695.0,lv,lv-d,Online,U.S. President,11/1/19,11/12/19,,False,,False,False,11/13/19 15:16,,https://www.dropbox.com/s/h2iww6q3elxeohl/Nov%202019%20Presidential%20Primary%20Tracking%20Poll%20Toplines%20and%20Crosstabs.xlsx,primary,DEM,O'Rourke,13276.0,Beto O'Rourke,0.0,2019-11-01
543,California,36.116203000000006,-119.681564,113024.0,62619.0,2020.0,1491.0,Capitol Weekly,,,Capitol Weekly,510.0,Capitol Weekly,,695.0,lv,lv-d,Online,U.S. President,11/1/19,11/12/19,,False,,False,False,11/13/19 15:16,,https://www.dropbox.com/s/h2iww6q3elxeohl/Nov%202019%20Presidential%20Primary%20Tracking%20Poll%20Toplines%20and%20Crosstabs.xlsx,primary,DEM,de Blasio,13335.0,Bill de Blasio,0.0,2019-11-01
544,California,36.116203000000006,-119.681564,113024.0,62619.0,2020.0,1491.0,Capitol Weekly,,,Capitol Weekly,510.0,Capitol Weekly,,695.0,lv,lv-d,Online,U.S. President,11/1/19,11/12/19,,False,,False,False,11/13/19 15:16,,https://www.dropbox.com/s/h2iww6q3elxeohl/Nov%202019%20Presidential%20Primary%20Tracking%20Poll%20Toplines%20and%20Crosstabs.xlsx,primary,DEM,Inslee,13324.0,Jay Robert Inslee,0.0,2019-11-01
545,California,36.116203000000006,-119.681564,113024.0,62619.0,2020.0,1491.0,Capitol Weekly,,,Capitol Weekly,510.0,Capitol Weekly,,695.0,lv,lv-d,Online,U.S. President,11/1/19,11/12/19,,False,,False,False,11/13/19 15:16,,https://www.dropbox.com/s/h2iww6q3elxeohl/Nov%202019%20Presidential%20Primary%20Tracking%20Poll%20Toplines%20and%20Crosstabs.xlsx,primary,DEM,Ryan,13358.0,Tim Ryan,0.0,2019-11-01
546,California,36.116203000000006,-119.681564,116358.0,63395.0,2020.0,1365.0,Change Research,1186,KQED,Change Research,48.0,Change Research,C,1190.0,lv,lv-d,Online,U.S. President,1/25/20,1/27/20,,False,,False,False,1/30/20 07:46,,https://www.changeresearch.com/post/kqed-change-research-california-poll-january,primary,DEM,Sanders,13257.0,Bernard Sanders,30.0,2020-01-25
547,California,36.116203000000006,-119.681564,116358.0,63395.0,2020.0,1365.0,Change Research,1186,KQED,Change Research,48.0,Change Research,C,1190.0,lv,lv-d,Online,U.S. President,1/25/20,1/27/20,,False,,False,False,1/30/20 07:46,,https://www.changeresearch.com/post/kqed-change-research-california-poll-january,primary,DEM,Warren,13258.0,Elizabeth Warren,16.0,2020-01-25
548,California,36.116203000000006,-119.681564,116358.0,63395.0,2020.0,1365.0,Change Research,1186,KQED,Change Research,48.0,Change Research,C,1190.0,lv,lv-d,Online,U.S. President,1/25/20,1/27/20,,False,,False,False,1/30/20 07:46,,https://www.changeresearch.com/post/kqed-change-research-california-poll-january,primary,DEM,Biden,13256.0,Joseph R. Biden Jr.,15.0,2020-01-25
549,California,36.116203000000006,-119.681564,114267.0,63015.0,2020.0,1363.0,"University of California, Berkeley",300,LA Times,"University of California, Berkeley",457.0,"University of California, Berkeley",B/C,1694.0,lv,lv-d,Online,U.S. President,11/21/19,11/27/19,,False,,False,False,12/5/19 07:05,,https://escholarship.org/uc/item/4bn38460,primary,DEM,Klobuchar,13310.0,Amy Klobuchar,2.5,2019-11-21
550,California,36.116203000000006,-119.681564,99462.0,58681.0,2020.0,1491.0,Capitol Weekly,,,Capitol Weekly,510.0,Capitol Weekly,,703.0,lv,lv-d,Online,U.S. President,6/1/19,6/30/19,,False,,False,False,7/17/19 15:00,,https://public.tableau.com/profile/capitol.weekly#!/vizhome/2020PrimaryTrackingSurvey_15626518585990/CA120POLLSTORY,primary,DEM,Williamson,13350.0,Marianne Williamson,0.4,2019-06-01
551,California,36.116203000000006,-119.681564,99462.0,58681.0,2020.0,1491.0,Capitol Weekly,,,Capitol Weekly,510.0,Capitol Weekly,,703.0,lv,lv-d,Online,U.S. President,6/1/19,6/30/19,,False,,False,False,7/17/19 15:00,,https://public.tableau.com/profile/capitol.weekly#!/vizhome/2020PrimaryTrackingSurvey_15626518585990/CA120POLLSTORY,primary,DEM,Ryan,13358.0,Tim Ryan,0.1,2019-06-01
552,California,36.116203000000006,-119.681564,99462.0,58681.0,2020.0,1491.0,Capitol Weekly,,,Capitol Weekly,510.0,Capitol Weekly,,703.0,lv,lv-d,Online,U.S. President,6/1/19,6/30/19,,False,,False,False,7/17/19 15:00,,https://public.tableau.com/profile/capitol.weekly#!/vizhome/2020PrimaryTrackingSurvey_15626518585990/CA120POLLSTORY,primary,DEM,Castro,13316.0,Julián Castro,0.3,2019-06-01
553,California,36.116203000000006,-119.681564,104535.0,60094.0,2020.0,1491.0,Capitol Weekly,,,Capitol Weekly,510.0,Capitol Weekly,,590.0,lv,lv-d,Online,U.S. President,10/1/19,10/14/19,,False,,False,False,10/15/19 16:19,,https://www.dropbox.com/s/0e1g0eat9otgvpl/Oct%202019%20Presidential%20Primary%20Tracking%20Poll%20Toplines%20and%20Crosstabs.xlsx,primary,DEM,Gabbard,13343.0,Tulsi Gabbard,2.0,2019-10-01
554,California,36.116203000000006,-119.681564,104535.0,60094.0,2020.0,1491.0,Capitol Weekly,,,Capitol Weekly,510.0,Capitol Weekly,,590.0,lv,lv-d,Online,U.S. President,10/1/19,10/14/19,,False,,False,False,10/15/19 16:19,,https://www.dropbox.com/s/0e1g0eat9otgvpl/Oct%202019%20Presidential%20Primary%20Tracking%20Poll%20Toplines%20and%20Crosstabs.xlsx,primary,DEM,Castro,13316.0,Julián Castro,2.0,2019-10-01
555,California,36.116203000000006,-119.681564,104535.0,60094.0,2020.0,1491.0,Capitol Weekly,,,Capitol Weekly,510.0,Capitol Weekly,,590.0,lv,lv-d,Online,U.S. President,10/1/19,10/14/19,,False,,False,False,10/15/19 16:19,,https://www.dropbox.com/s/0e1g0eat9otgvpl/Oct%202019%20Presidential%20Primary%20Tracking%20Poll%20Toplines%20and%20Crosstabs.xlsx,primary,DEM,Williamson,13350.0,Marianne Williamson,1.0,2019-10-01
556,California,36.116203000000006,-119.681564,104535.0,60094.0,2020.0,1491.0,Capitol Weekly,,,Capitol Weekly,510.0,Capitol Weekly,,590.0,lv,lv-d,Online,U.S. President,10/1/19,10/14/19,,False,,False,False,10/15/19 16:19,,https://www.dropbox.com/s/0e1g0eat9otgvpl/Oct%202019%20Presidential%20Primary%20Tracking%20Poll%20Toplines%20and%20Crosstabs.xlsx,primary,DEM,Klobuchar,13310.0,Amy Klobuchar,1.0,2019-10-01
557,California,36.116203000000006,-119.681564,104535.0,60094.0,2020.0,1491.0,Capitol Weekly,,,Capitol Weekly,510.0,Capitol Weekly,,590.0,lv,lv-d,Online,U.S. President,10/1/19,10/14/19,,False,,False,False,10/15/19 16:19,,https://www.dropbox.com/s/0e1g0eat9otgvpl/Oct%202019%20Presidential%20Primary%20Tracking%20Poll%20Toplines%20and%20Crosstabs.xlsx,primary,DEM,Steyer,13327.0,Tom Steyer,1.0,2019-10-01
558,California,36.116203000000006,-119.681564,104535.0,60094.0,2020.0,1491.0,Capitol Weekly,,,Capitol Weekly,510.0,Capitol Weekly,,590.0,lv,lv-d,Online,U.S. President,10/1/19,10/14/19,,False,,False,False,10/15/19 16:19,,https://www.dropbox.com/s/0e1g0eat9otgvpl/Oct%202019%20Presidential%20Primary%20Tracking%20Poll%20Toplines%20and%20Crosstabs.xlsx,primary,DEM,Ryan,13358.0,Tim Ryan,0.0,2019-10-01
559,California,36.116203000000006,-119.681564,104535.0,60094.0,2020.0,1491.0,Capitol Weekly,,,Capitol Weekly,510.0,Capitol Weekly,,590.0,lv,lv-d,Online,U.S. President,10/1/19,10/14/19,,False,,False,False,10/15/19 16:19,,https://www.dropbox.com/s/0e1g0eat9otgvpl/Oct%202019%20Presidential%20Primary%20Tracking%20Poll%20Toplines%20and%20Crosstabs.xlsx,primary,DEM,Booker,13287.0,Cory A. Booker,2.0,2019-10-01
560,California,36.116203000000006,-119.681564,116200.0,63367.0,2020.0,1363.0,"University of California, Berkeley",300,LA Times,"University of California, Berkeley",457.0,"University of California, Berkeley",B/C,2895.0,lv,lv-d,Online,U.S. President,1/15/20,1/21/20,,False,,False,False,1/28/20 06:21,,https://escholarship.org/uc/item/1h8738br,primary,DEM,Sanders,13257.0,Bernard Sanders,26.3,2020-01-15
561,California,36.116203000000006,-119.681564,99460.0,58679.0,2020.0,1491.0,Capitol Weekly,,,Capitol Weekly,510.0,Capitol Weekly,,1041.0,lv,lv-d,Online,U.S. President,4/15/19,4/30/19,,False,,False,False,7/17/19 15:00,,https://public.tableau.com/profile/capitol.weekly#!/vizhome/2020PrimaryTrackingSurvey_15626518585990/CA120POLLSTORY,primary,DEM,Sanders,13257.0,Bernard Sanders,19.8,2019-04-15
562,California,36.116203000000006,-119.681564,99460.0,58679.0,2020.0,1491.0,Capitol Weekly,,,Capitol Weekly,510.0,Capitol Weekly,,1041.0,lv,lv-d,Online,U.S. President,4/15/19,4/30/19,,False,,False,False,7/17/19 15:00,,https://public.tableau.com/profile/capitol.weekly#!/vizhome/2020PrimaryTrackingSurvey_15626518585990/CA120POLLSTORY,primary,DEM,Harris,13288.0,Kamala D. Harris,16.8,2019-04-15
563,California,36.116203000000006,-119.681564,99460.0,58679.0,2020.0,1491.0,Capitol Weekly,,,Capitol Weekly,510.0,Capitol Weekly,,1041.0,lv,lv-d,Online,U.S. President,4/15/19,4/30/19,,False,,False,False,7/17/19 15:00,,https://public.tableau.com/profile/capitol.weekly#!/vizhome/2020PrimaryTrackingSurvey_15626518585990/CA120POLLSTORY,primary,DEM,Warren,13258.0,Elizabeth Warren,10.0,2019-04-15
564,California,36.116203000000006,-119.681564,99460.0,58679.0,2020.0,1491.0,Capitol Weekly,,,Capitol Weekly,510.0,Capitol Weekly,,1041.0,lv,lv-d,Online,U.S. President,4/15/19,4/30/19,,False,,False,False,7/17/19 15:00,,https://public.tableau.com/profile/capitol.weekly#!/vizhome/2020PrimaryTrackingSurvey_15626518585990/CA120POLLSTORY,primary,DEM,Buttigieg,13345.0,Pete Buttigieg,18.7,2019-04-15
565,California,36.116203000000006,-119.681564,99460.0,58679.0,2020.0,1491.0,Capitol Weekly,,,Capitol Weekly,510.0,Capitol Weekly,,1041.0,lv,lv-d,Online,U.S. President,4/15/19,4/30/19,,False,,False,False,7/17/19 15:00,,https://public.tableau.com/profile/capitol.weekly#!/vizhome/2020PrimaryTrackingSurvey_15626518585990/CA120POLLSTORY,primary,DEM,O'Rourke,13276.0,Beto O'Rourke,4.4,2019-04-15
566,California,36.116203000000006,-119.681564,99460.0,58679.0,2020.0,1491.0,Capitol Weekly,,,Capitol Weekly,510.0,Capitol Weekly,,1041.0,lv,lv-d,Online,U.S. President,4/15/19,4/30/19,,False,,False,False,7/17/19 15:00,,https://public.tableau.com/profile/capitol.weekly#!/vizhome/2020PrimaryTrackingSurvey_15626518585990/CA120POLLSTORY,primary,DEM,Booker,13287.0,Cory A. Booker,1.9,2019-04-15
567,California,36.116203000000006,-119.681564,99460.0,58679.0,2020.0,1491.0,Capitol Weekly,,,Capitol Weekly,510.0,Capitol Weekly,,1041.0,lv,lv-d,Online,U.S. President,4/15/19,4/30/19,,False,,False,False,7/17/19 15:00,,https://public.tableau.com/profile/capitol.weekly#!/vizhome/2020PrimaryTrackingSurvey_15626518585990/CA120POLLSTORY,primary,DEM,Biden,13256.0,Joseph R. Biden Jr.,20.4,2019-04-15
568,California,36.116203000000006,-119.681564,99460.0,58679.0,2020.0,1491.0,Capitol Weekly,,,Capitol Weekly,510.0,Capitol Weekly,,1041.0,lv,lv-d,Online,U.S. President,4/15/19,4/30/19,,False,,False,False,7/17/19 15:00,,https://public.tableau.com/profile/capitol.weekly#!/vizhome/2020PrimaryTrackingSurvey_15626518585990/CA120POLLSTORY,primary,DEM,Klobuchar,13310.0,Amy Klobuchar,2.6,2019-04-15
569,California,36.116203000000006,-119.681564,104535.0,60094.0,2020.0,1491.0,Capitol Weekly,,,Capitol Weekly,510.0,Capitol Weekly,,590.0,lv,lv-d,Online,U.S. President,10/1/19,10/14/19,,False,,False,False,10/15/19 16:19,,https://www.dropbox.com/s/0e1g0eat9otgvpl/Oct%202019%20Presidential%20Primary%20Tracking%20Poll%20Toplines%20and%20Crosstabs.xlsx,primary,DEM,Yang,13329.0,Andrew Yang,3.0,2019-10-01
570,California,36.116203000000006,-119.681564,104535.0,60094.0,2020.0,1491.0,Capitol Weekly,,,Capitol Weekly,510.0,Capitol Weekly,,590.0,lv,lv-d,Online,U.S. President,10/1/19,10/14/19,,False,,False,False,10/15/19 16:19,,https://www.dropbox.com/s/0e1g0eat9otgvpl/Oct%202019%20Presidential%20Primary%20Tracking%20Poll%20Toplines%20and%20Crosstabs.xlsx,primary,DEM,Harris,13288.0,Kamala D. Harris,8.0,2019-10-01
571,California,36.116203000000006,-119.681564,111112.0,62228.0,2020.0,460.0,SurveyUSA,"443,583,804",KGTV-TV (California) | KABC-TV (California) | San Diego Union-Tribune,SurveyUSA,325.0,SurveyUSA,A,553.0,lv,lv-d,Online,U.S. President,10/15/19,10/16/19,,False,,False,False,10/22/19 00:08,,http://www.surveyusa.com/client/PollReport.aspx?g=3662de7c-9fe8-4524-b39b-789835905d98,primary,DEM,Klobuchar,13310.0,Amy Klobuchar,1.0,2019-10-15
572,California,36.116203000000006,-119.681564,111112.0,62228.0,2020.0,460.0,SurveyUSA,"443,583,804",KGTV-TV (California) | KABC-TV (California) | San Diego Union-Tribune,SurveyUSA,325.0,SurveyUSA,A,553.0,lv,lv-d,Online,U.S. President,10/15/19,10/16/19,,False,,False,False,10/22/19 00:08,,http://www.surveyusa.com/client/PollReport.aspx?g=3662de7c-9fe8-4524-b39b-789835905d98,primary,DEM,Castro,13316.0,Julián Castro,1.0,2019-10-15
573,California,36.116203000000006,-119.681564,111112.0,62228.0,2020.0,460.0,SurveyUSA,"443,583,804",KGTV-TV (California) | KABC-TV (California) | San Diego Union-Tribune,SurveyUSA,325.0,SurveyUSA,A,553.0,lv,lv-d,Online,U.S. President,10/15/19,10/16/19,,False,,False,False,10/22/19 00:08,,http://www.surveyusa.com/client/PollReport.aspx?g=3662de7c-9fe8-4524-b39b-789835905d98,primary,DEM,Steyer,13327.0,Tom Steyer,1.0,2019-10-15
574,California,36.116203000000006,-119.681564,111112.0,62228.0,2020.0,460.0,SurveyUSA,"443,583,804",KGTV-TV (California) | KABC-TV (California) | San Diego Union-Tribune,SurveyUSA,325.0,SurveyUSA,A,553.0,lv,lv-d,Online,U.S. President,10/15/19,10/16/19,,False,,False,False,10/22/19 00:08,,http://www.surveyusa.com/client/PollReport.aspx?g=3662de7c-9fe8-4524-b39b-789835905d98,primary,DEM,Gabbard,13343.0,Tulsi Gabbard,1.0,2019-10-15
575,California,36.116203000000006,-119.681564,97880.0,58445.0,2020.0,1363.0,"University of California, Berkeley",300,LA Times,"University of California, Berkeley",457.0,"University of California, Berkeley",B/C,2131.0,lv,lv-d,Online,U.S. President,6/4/19,6/10/19,,False,,False,False,6/13/19 08:30,,https://escholarship.org/uc/item/1g43j6tj,primary,DEM,Gillibrand,13311.0,Kirsten E. Gillibrand,0.3,2019-06-04
576,California,36.116203000000006,-119.681564,97880.0,58445.0,2020.0,1363.0,"University of California, Berkeley",300,LA Times,"University of California, Berkeley",457.0,"University of California, Berkeley",B/C,2131.0,lv,lv-d,Online,U.S. President,6/4/19,6/10/19,,False,,False,False,6/13/19 08:30,,https://escholarship.org/uc/item/1g43j6tj,primary,DEM,Williamson,13350.0,Marianne Williamson,0.2,2019-06-04
577,California,36.116203000000006,-119.681564,104535.0,60094.0,2020.0,1491.0,Capitol Weekly,,,Capitol Weekly,510.0,Capitol Weekly,,590.0,lv,lv-d,Online,U.S. President,10/1/19,10/14/19,,False,,False,False,10/15/19 16:19,,https://www.dropbox.com/s/0e1g0eat9otgvpl/Oct%202019%20Presidential%20Primary%20Tracking%20Poll%20Toplines%20and%20Crosstabs.xlsx,primary,DEM,Buttigieg,13345.0,Pete Buttigieg,6.0,2019-10-01
578,California,36.116203000000006,-119.681564,97880.0,58445.0,2020.0,1363.0,"University of California, Berkeley",300,LA Times,"University of California, Berkeley",457.0,"University of California, Berkeley",B/C,2131.0,lv,lv-d,Online,U.S. President,6/4/19,6/10/19,,False,,False,False,6/13/19 08:30,,https://escholarship.org/uc/item/1g43j6tj,primary,DEM,Ryan,13358.0,Tim Ryan,0.2,2019-06-04
579,California,36.116203000000006,-119.681564,97880.0,58445.0,2020.0,1363.0,"University of California, Berkeley",300,LA Times,"University of California, Berkeley",457.0,"University of California, Berkeley",B/C,2131.0,lv,lv-d,Online,U.S. President,6/4/19,6/10/19,,False,,False,False,6/13/19 08:30,,https://escholarship.org/uc/item/1g43j6tj,primary,DEM,Hickenlooper,13326.0,John Hickenlooper,0.2,2019-06-04
580,California,36.116203000000006,-119.681564,97880.0,58445.0,2020.0,1363.0,"University of California, Berkeley",300,LA Times,"University of California, Berkeley",457.0,"University of California, Berkeley",B/C,2131.0,lv,lv-d,Online,U.S. President,6/4/19,6/10/19,,False,,False,False,6/13/19 08:30,,https://escholarship.org/uc/item/1g43j6tj,primary,DEM,Bullock,13320.0,Steve Bullock,0.2,2019-06-04
581,California,36.116203000000006,-119.681564,97880.0,58445.0,2020.0,1363.0,"University of California, Berkeley",300,LA Times,"University of California, Berkeley",457.0,"University of California, Berkeley",B/C,2131.0,lv,lv-d,Online,U.S. President,6/4/19,6/10/19,,False,,False,False,6/13/19 08:30,,https://escholarship.org/uc/item/1g43j6tj,primary,DEM,Delaney,13314.0,John K. Delaney,0.0,2019-06-04
582,California,36.116203000000006,-119.681564,104535.0,60094.0,2020.0,1491.0,Capitol Weekly,,,Capitol Weekly,510.0,Capitol Weekly,,590.0,lv,lv-d,Online,U.S. President,10/1/19,10/14/19,,False,,False,False,10/15/19 16:19,,https://www.dropbox.com/s/0e1g0eat9otgvpl/Oct%202019%20Presidential%20Primary%20Tracking%20Poll%20Toplines%20and%20Crosstabs.xlsx,primary,DEM,Warren,13258.0,Elizabeth Warren,35.0,2019-10-01
583,California,36.116203000000006,-119.681564,104535.0,60094.0,2020.0,1491.0,Capitol Weekly,,,Capitol Weekly,510.0,Capitol Weekly,,590.0,lv,lv-d,Online,U.S. President,10/1/19,10/14/19,,False,,False,False,10/15/19 16:19,,https://www.dropbox.com/s/0e1g0eat9otgvpl/Oct%202019%20Presidential%20Primary%20Tracking%20Poll%20Toplines%20and%20Crosstabs.xlsx,primary,DEM,Biden,13256.0,Joseph R. Biden Jr.,21.0,2019-10-01
584,California,36.116203000000006,-119.681564,104535.0,60094.0,2020.0,1491.0,Capitol Weekly,,,Capitol Weekly,510.0,Capitol Weekly,,590.0,lv,lv-d,Online,U.S. President,10/1/19,10/14/19,,False,,False,False,10/15/19 16:19,,https://www.dropbox.com/s/0e1g0eat9otgvpl/Oct%202019%20Presidential%20Primary%20Tracking%20Poll%20Toplines%20and%20Crosstabs.xlsx,primary,DEM,Sanders,13257.0,Bernard Sanders,15.0,2019-10-01
585,California,36.116203000000006,-119.681564,97880.0,58445.0,2020.0,1363.0,"University of California, Berkeley",300,LA Times,"University of California, Berkeley",457.0,"University of California, Berkeley",B/C,2131.0,lv,lv-d,Online,U.S. President,6/4/19,6/10/19,,False,,False,False,6/13/19 08:30,,https://escholarship.org/uc/item/1g43j6tj,primary,DEM,Inslee,13324.0,Jay Robert Inslee,0.2,2019-06-04
586,California,36.116203000000006,-119.681564,99460.0,58679.0,2020.0,1491.0,Capitol Weekly,,,Capitol Weekly,510.0,Capitol Weekly,,1041.0,lv,lv-d,Online,U.S. President,4/15/19,4/30/19,,False,,False,False,7/17/19 15:00,,https://public.tableau.com/profile/capitol.weekly#!/vizhome/2020PrimaryTrackingSurvey_15626518585990/CA120POLLSTORY,primary,DEM,Hickenlooper,13326.0,John Hickenlooper,0.8,2019-04-15
587,California,36.116203000000006,-119.681564,99460.0,58679.0,2020.0,1491.0,Capitol Weekly,,,Capitol Weekly,510.0,Capitol Weekly,,1041.0,lv,lv-d,Online,U.S. President,4/15/19,4/30/19,,False,,False,False,7/17/19 15:00,,https://public.tableau.com/profile/capitol.weekly#!/vizhome/2020PrimaryTrackingSurvey_15626518585990/CA120POLLSTORY,primary,DEM,Inslee,13324.0,Jay Robert Inslee,1.5,2019-04-15
588,California,36.116203000000006,-119.681564,99460.0,58679.0,2020.0,1491.0,Capitol Weekly,,,Capitol Weekly,510.0,Capitol Weekly,,1041.0,lv,lv-d,Online,U.S. President,4/15/19,4/30/19,,False,,False,False,7/17/19 15:00,,https://public.tableau.com/profile/capitol.weekly#!/vizhome/2020PrimaryTrackingSurvey_15626518585990/CA120POLLSTORY,primary,DEM,Gillibrand,13311.0,Kirsten E. Gillibrand,1.0,2019-04-15
589,California,36.116203000000006,-119.681564,115574.0,63243.0,2020.0,1491.0,Capitol Weekly,,,Capitol Weekly,510.0,Capitol Weekly,,1053.0,lv,lv-d,Online,U.S. President,1/3/20,1/9/20,,False,,False,False,1/9/20 15:50,,https://www.dropbox.com/s/5w1aofozhv4iwl5/Jan%202020%20Presidential%20Primary%20Tracking%20Poll%20Toplines%20and%20Crosstabs.xlsx,primary,DEM,Steyer,13327.0,Tom Steyer,2.0,2020-01-03
590,California,36.116203000000006,-119.681564,115574.0,63243.0,2020.0,1491.0,Capitol Weekly,,,Capitol Weekly,510.0,Capitol Weekly,,1053.0,lv,lv-d,Online,U.S. President,1/3/20,1/9/20,,False,,False,False,1/9/20 15:50,,https://www.dropbox.com/s/5w1aofozhv4iwl5/Jan%202020%20Presidential%20Primary%20Tracking%20Poll%20Toplines%20and%20Crosstabs.xlsx,primary,DEM,Gabbard,13343.0,Tulsi Gabbard,2.0,2020-01-03
591,California,36.116203000000006,-119.681564,118371.0,64352.0,2020.0,460.0,SurveyUSA,"443,583,804",KGTV-TV (California) | KABC-TV (California) | San Diego Union-Tribune,SurveyUSA,325.0,SurveyUSA,A,520.0,lv,lv-d,Online,U.S. President,2/13/20,2/16/20,,False,,False,False,2/18/20 21:20,,http://www.surveyusa.com/client/PollReport.aspx?g=00eb4f81-c6dd-4c7c-a22e-c32a3b4f2c7e,primary,DEM,Steyer,13327.0,Tom Steyer,3.0,2020-02-13
592,California,36.116203000000006,-119.681564,118371.0,64352.0,2020.0,460.0,SurveyUSA,"443,583,804",KGTV-TV (California) | KABC-TV (California) | San Diego Union-Tribune,SurveyUSA,325.0,SurveyUSA,A,520.0,lv,lv-d,Online,U.S. President,2/13/20,2/16/20,,False,,False,False,2/18/20 21:20,,http://www.surveyusa.com/client/PollReport.aspx?g=00eb4f81-c6dd-4c7c-a22e-c32a3b4f2c7e,primary,DEM,Klobuchar,13310.0,Amy Klobuchar,6.0,2020-02-13
593,California,36.116203000000006,-119.681564,118371.0,64352.0,2020.0,460.0,SurveyUSA,"443,583,804",KGTV-TV (California) | KABC-TV (California) | San Diego Union-Tribune,SurveyUSA,325.0,SurveyUSA,A,520.0,lv,lv-d,Online,U.S. President,2/13/20,2/16/20,,False,,False,False,2/18/20 21:20,,http://www.surveyusa.com/client/PollReport.aspx?g=00eb4f81-c6dd-4c7c-a22e-c32a3b4f2c7e,primary,DEM,Warren,13258.0,Elizabeth Warren,9.0,2020-02-13
594,California,36.116203000000006,-119.681564,118371.0,64352.0,2020.0,460.0,SurveyUSA,"443,583,804",KGTV-TV (California) | KABC-TV (California) | San Diego Union-Tribune,SurveyUSA,325.0,SurveyUSA,A,520.0,lv,lv-d,Online,U.S. President,2/13/20,2/16/20,,False,,False,False,2/18/20 21:20,,http://www.surveyusa.com/client/PollReport.aspx?g=00eb4f81-c6dd-4c7c-a22e-c32a3b4f2c7e,primary,DEM,Buttigieg,13345.0,Pete Buttigieg,12.0,2020-02-13
595,California,36.116203000000006,-119.681564,115574.0,63243.0,2020.0,1491.0,Capitol Weekly,,,Capitol Weekly,510.0,Capitol Weekly,,1053.0,lv,lv-d,Online,U.S. President,1/3/20,1/9/20,,False,,False,False,1/9/20 15:50,,https://www.dropbox.com/s/5w1aofozhv4iwl5/Jan%202020%20Presidential%20Primary%20Tracking%20Poll%20Toplines%20and%20Crosstabs.xlsx,primary,DEM,Booker,13287.0,Cory A. Booker,1.0,2020-01-03
596,California,36.116203000000006,-119.681564,118371.0,64352.0,2020.0,460.0,SurveyUSA,"443,583,804",KGTV-TV (California) | KABC-TV (California) | San Diego Union-Tribune,SurveyUSA,325.0,SurveyUSA,A,520.0,lv,lv-d,Online,U.S. President,2/13/20,2/16/20,,False,,False,False,2/18/20 21:20,,http://www.surveyusa.com/client/PollReport.aspx?g=00eb4f81-c6dd-4c7c-a22e-c32a3b4f2c7e,primary,DEM,Biden,13256.0,Joseph R. Biden Jr.,15.0,2020-02-13
597,California,36.116203000000006,-119.681564,118371.0,64352.0,2020.0,460.0,SurveyUSA,"443,583,804",KGTV-TV (California) | KABC-TV (California) | San Diego Union-Tribune,SurveyUSA,325.0,SurveyUSA,A,520.0,lv,lv-d,Online,U.S. President,2/13/20,2/16/20,,False,,False,False,2/18/20 21:20,,http://www.surveyusa.com/client/PollReport.aspx?g=00eb4f81-c6dd-4c7c-a22e-c32a3b4f2c7e,primary,DEM,Sanders,13257.0,Bernard Sanders,25.0,2020-02-13
598,California,36.116203000000006,-119.681564,115574.0,63243.0,2020.0,1491.0,Capitol Weekly,,,Capitol Weekly,510.0,Capitol Weekly,,1053.0,lv,lv-d,Online,U.S. President,1/3/20,1/9/20,,False,,False,False,1/9/20 15:50,,https://www.dropbox.com/s/5w1aofozhv4iwl5/Jan%202020%20Presidential%20Primary%20Tracking%20Poll%20Toplines%20and%20Crosstabs.xlsx,primary,DEM,Klobuchar,13310.0,Amy Klobuchar,5.0,2020-01-03
599,California,36.116203000000006,-119.681564,115574.0,63243.0,2020.0,1491.0,Capitol Weekly,,,Capitol Weekly,510.0,Capitol Weekly,,1053.0,lv,lv-d,Online,U.S. President,1/3/20,1/9/20,,False,,False,False,1/9/20 15:50,,https://www.dropbox.com/s/5w1aofozhv4iwl5/Jan%202020%20Presidential%20Primary%20Tracking%20Poll%20Toplines%20and%20Crosstabs.xlsx,primary,DEM,Bloomberg,13289.0,Michael Bloomberg,6.0,2020-01-03
600,California,36.116203000000006,-119.681564,115574.0,63243.0,2020.0,1491.0,Capitol Weekly,,,Capitol Weekly,510.0,Capitol Weekly,,1053.0,lv,lv-d,Online,U.S. President,1/3/20,1/9/20,,False,,False,False,1/9/20 15:50,,https://www.dropbox.com/s/5w1aofozhv4iwl5/Jan%202020%20Presidential%20Primary%20Tracking%20Poll%20Toplines%20and%20Crosstabs.xlsx,primary,DEM,Yang,13329.0,Andrew Yang,7.0,2020-01-03
601,California,36.116203000000006,-119.681564,115574.0,63243.0,2020.0,1491.0,Capitol Weekly,,,Capitol Weekly,510.0,Capitol Weekly,,1053.0,lv,lv-d,Online,U.S. President,1/3/20,1/9/20,,False,,False,False,1/9/20 15:50,,https://www.dropbox.com/s/5w1aofozhv4iwl5/Jan%202020%20Presidential%20Primary%20Tracking%20Poll%20Toplines%20and%20Crosstabs.xlsx,primary,DEM,Buttigieg,13345.0,Pete Buttigieg,11.0,2020-01-03
602,California,36.116203000000006,-119.681564,115574.0,63243.0,2020.0,1491.0,Capitol Weekly,,,Capitol Weekly,510.0,Capitol Weekly,,1053.0,lv,lv-d,Online,U.S. President,1/3/20,1/9/20,,False,,False,False,1/9/20 15:50,,https://www.dropbox.com/s/5w1aofozhv4iwl5/Jan%202020%20Presidential%20Primary%20Tracking%20Poll%20Toplines%20and%20Crosstabs.xlsx,primary,DEM,Biden,13256.0,Joseph R. Biden Jr.,20.0,2020-01-03
603,California,36.116203000000006,-119.681564,118371.0,64352.0,2020.0,460.0,SurveyUSA,"443,583,804",KGTV-TV (California) | KABC-TV (California) | San Diego Union-Tribune,SurveyUSA,325.0,SurveyUSA,A,520.0,lv,lv-d,Online,U.S. President,2/13/20,2/16/20,,False,,False,False,2/18/20 21:20,,http://www.surveyusa.com/client/PollReport.aspx?g=00eb4f81-c6dd-4c7c-a22e-c32a3b4f2c7e,primary,DEM,Bloomberg,13289.0,Michael Bloomberg,21.0,2020-02-13
604,California,36.116203000000006,-119.681564,115574.0,63243.0,2020.0,1491.0,Capitol Weekly,,,Capitol Weekly,510.0,Capitol Weekly,,1053.0,lv,lv-d,Online,U.S. President,1/3/20,1/9/20,,False,,False,False,1/9/20 15:50,,https://www.dropbox.com/s/5w1aofozhv4iwl5/Jan%202020%20Presidential%20Primary%20Tracking%20Poll%20Toplines%20and%20Crosstabs.xlsx,primary,DEM,Williamson,13350.0,Marianne Williamson,0.0,2020-01-03
605,California,36.116203000000006,-119.681564,115574.0,63243.0,2020.0,1491.0,Capitol Weekly,,,Capitol Weekly,510.0,Capitol Weekly,,1053.0,lv,lv-d,Online,U.S. President,1/3/20,1/9/20,,False,,False,False,1/9/20 15:50,,https://www.dropbox.com/s/5w1aofozhv4iwl5/Jan%202020%20Presidential%20Primary%20Tracking%20Poll%20Toplines%20and%20Crosstabs.xlsx,primary,DEM,Patrick,13315.0,Deval Patrick,0.0,2020-01-03
606,California,36.116203000000006,-119.681564,115574.0,63243.0,2020.0,1491.0,Capitol Weekly,,,Capitol Weekly,510.0,Capitol Weekly,,1053.0,lv,lv-d,Online,U.S. President,1/3/20,1/9/20,,False,,False,False,1/9/20 15:50,,https://www.dropbox.com/s/5w1aofozhv4iwl5/Jan%202020%20Presidential%20Primary%20Tracking%20Poll%20Toplines%20and%20Crosstabs.xlsx,primary,DEM,Delaney,13314.0,John K. Delaney,0.0,2020-01-03
607,California,36.116203000000006,-119.681564,99460.0,58679.0,2020.0,1491.0,Capitol Weekly,,,Capitol Weekly,510.0,Capitol Weekly,,1041.0,lv,lv-d,Online,U.S. President,4/15/19,4/30/19,,False,,False,False,7/17/19 15:00,,https://public.tableau.com/profile/capitol.weekly#!/vizhome/2020PrimaryTrackingSurvey_15626518585990/CA120POLLSTORY,primary,DEM,Swalwell,13328.0,Eric Swalwell,1.1,2019-04-15
608,California,36.116203000000006,-119.681564,99460.0,58679.0,2020.0,1491.0,Capitol Weekly,,,Capitol Weekly,510.0,Capitol Weekly,,1041.0,lv,lv-d,Online,U.S. President,4/15/19,4/30/19,,False,,False,False,7/17/19 15:00,,https://public.tableau.com/profile/capitol.weekly#!/vizhome/2020PrimaryTrackingSurvey_15626518585990/CA120POLLSTORY,primary,DEM,Castro,13316.0,Julián Castro,0.3,2019-04-15
609,California,36.116203000000006,-119.681564,99460.0,58679.0,2020.0,1491.0,Capitol Weekly,,,Capitol Weekly,510.0,Capitol Weekly,,1041.0,lv,lv-d,Online,U.S. President,4/15/19,4/30/19,,False,,False,False,7/17/19 15:00,,https://public.tableau.com/profile/capitol.weekly#!/vizhome/2020PrimaryTrackingSurvey_15626518585990/CA120POLLSTORY,primary,DEM,Ryan,13358.0,Tim Ryan,0.8,2019-04-15
610,California,36.116203000000006,-119.681564,118668.0,64478.0,2020.0,568.0,YouGov,"1241,1242",USC Price | USC Schwarzenegger,YouGov,391.0,YouGov,B-,803.0,lv,lv-d,Online,U.S. President,2/1/20,2/15/20,,False,,False,False,2/20/20 16:15,,https://priceschool.usc.edu/wp-content/uploads/2020/02/USC-Price-USC-Schwarzenegger-CA-Issues-Poll_Full.pdf,primary,DEM,Warren,13258.0,Elizabeth Warren,20.2,2020-02-01
611,California,36.116203000000006,-119.681564,118668.0,64478.0,2020.0,568.0,YouGov,"1241,1242",USC Price | USC Schwarzenegger,YouGov,391.0,YouGov,B-,803.0,lv,lv-d,Online,U.S. President,2/1/20,2/15/20,,False,,False,False,2/20/20 16:15,,https://priceschool.usc.edu/wp-content/uploads/2020/02/USC-Price-USC-Schwarzenegger-CA-Issues-Poll_Full.pdf,primary,DEM,Steyer,13327.0,Tom Steyer,2.1,2020-02-01
612,California,36.116203000000006,-119.681564,118668.0,64478.0,2020.0,568.0,YouGov,"1241,1242",USC Price | USC Schwarzenegger,YouGov,391.0,YouGov,B-,803.0,lv,lv-d,Online,U.S. President,2/1/20,2/15/20,,False,,False,False,2/20/20 16:15,,https://priceschool.usc.edu/wp-content/uploads/2020/02/USC-Price-USC-Schwarzenegger-CA-Issues-Poll_Full.pdf,primary,DEM,Sanders,13257.0,Bernard Sanders,29.2,2020-02-01
613,California,36.116203000000006,-119.681564,118668.0,64478.0,2020.0,568.0,YouGov,"1241,1242",USC Price | USC Schwarzenegger,YouGov,391.0,YouGov,B-,803.0,lv,lv-d,Online,U.S. President,2/1/20,2/15/20,,False,,False,False,2/20/20 16:15,,https://priceschool.usc.edu/wp-content/uploads/2020/02/USC-Price-USC-Schwarzenegger-CA-Issues-Poll_Full.pdf,primary,DEM,Klobuchar,13310.0,Amy Klobuchar,2.7,2020-02-01
614,California,36.116203000000006,-119.681564,118668.0,64478.0,2020.0,568.0,YouGov,"1241,1242",USC Price | USC Schwarzenegger,YouGov,391.0,YouGov,B-,803.0,lv,lv-d,Online,U.S. President,2/1/20,2/15/20,,False,,False,False,2/20/20 16:15,,https://priceschool.usc.edu/wp-content/uploads/2020/02/USC-Price-USC-Schwarzenegger-CA-Issues-Poll_Full.pdf,primary,DEM,Gabbard,13343.0,Tulsi Gabbard,1.5,2020-02-01
615,California,36.116203000000006,-119.681564,118668.0,64478.0,2020.0,568.0,YouGov,"1241,1242",USC Price | USC Schwarzenegger,YouGov,391.0,YouGov,B-,803.0,lv,lv-d,Online,U.S. President,2/1/20,2/15/20,,False,,False,False,2/20/20 16:15,,https://priceschool.usc.edu/wp-content/uploads/2020/02/USC-Price-USC-Schwarzenegger-CA-Issues-Poll_Full.pdf,primary,DEM,Buttigieg,13345.0,Pete Buttigieg,5.8,2020-02-01
616,California,36.116203000000006,-119.681564,118668.0,64478.0,2020.0,568.0,YouGov,"1241,1242",USC Price | USC Schwarzenegger,YouGov,391.0,YouGov,B-,803.0,lv,lv-d,Online,U.S. President,2/1/20,2/15/20,,False,,False,False,2/20/20 16:15,,https://priceschool.usc.edu/wp-content/uploads/2020/02/USC-Price-USC-Schwarzenegger-CA-Issues-Poll_Full.pdf,primary,DEM,Bloomberg,13289.0,Michael Bloomberg,7.7,2020-02-01
617,California,36.116203000000006,-119.681564,118668.0,64478.0,2020.0,568.0,YouGov,"1241,1242",USC Price | USC Schwarzenegger,YouGov,391.0,YouGov,B-,803.0,lv,lv-d,Online,U.S. President,2/1/20,2/15/20,,False,,False,False,2/20/20 16:15,,https://priceschool.usc.edu/wp-content/uploads/2020/02/USC-Price-USC-Schwarzenegger-CA-Issues-Poll_Full.pdf,primary,DEM,Biden,13256.0,Joseph R. Biden Jr.,21.4,2020-02-01
618,California,36.116203000000006,-119.681564,104535.0,60094.0,2020.0,1491.0,Capitol Weekly,,,Capitol Weekly,510.0,Capitol Weekly,,590.0,lv,lv-d,Online,U.S. President,10/1/19,10/14/19,,False,,False,False,10/15/19 16:19,,https://www.dropbox.com/s/0e1g0eat9otgvpl/Oct%202019%20Presidential%20Primary%20Tracking%20Poll%20Toplines%20and%20Crosstabs.xlsx,primary,DEM,O'Rourke,13276.0,Beto O'Rourke,0.0,2019-10-01
619,California,36.116203000000006,-119.681564,104535.0,60094.0,2020.0,1491.0,Capitol Weekly,,,Capitol Weekly,510.0,Capitol Weekly,,590.0,lv,lv-d,Online,U.S. President,10/1/19,10/14/19,,False,,False,False,10/15/19 16:19,,https://www.dropbox.com/s/0e1g0eat9otgvpl/Oct%202019%20Presidential%20Primary%20Tracking%20Poll%20Toplines%20and%20Crosstabs.xlsx,primary,DEM,Inslee,13324.0,Jay Robert Inslee,0.0,2019-10-01
620,California,36.116203000000006,-119.681564,104535.0,60094.0,2020.0,1491.0,Capitol Weekly,,,Capitol Weekly,510.0,Capitol Weekly,,590.0,lv,lv-d,Online,U.S. President,10/1/19,10/14/19,,False,,False,False,10/15/19 16:19,,https://www.dropbox.com/s/0e1g0eat9otgvpl/Oct%202019%20Presidential%20Primary%20Tracking%20Poll%20Toplines%20and%20Crosstabs.xlsx,primary,DEM,Delaney,13314.0,John K. Delaney,0.0,2019-10-01
621,California,36.116203000000006,-119.681564,115876.0,63296.0,2020.0,460.0,SurveyUSA,"443,583,804",KGTV-TV (California) | KABC-TV (California) | San Diego Union-Tribune,SurveyUSA,325.0,SurveyUSA,A,565.0,lv,lv-d,Online,U.S. President,1/14/20,1/16/20,,False,,False,False,1/17/20 19:26,,http://www.surveyusa.com/client/PollReport.aspx?g=9634c475-cb54-4a34-ab4b-c0d9a2b82759,primary,DEM,Biden,13256.0,Joseph R. Biden Jr.,30.0,2020-01-14
622,California,36.116203000000006,-119.681564,111112.0,62228.0,2020.0,460.0,SurveyUSA,"443,583,804",KGTV-TV (California) | KABC-TV (California) | San Diego Union-Tribune,SurveyUSA,325.0,SurveyUSA,A,553.0,lv,lv-d,Online,U.S. President,10/15/19,10/16/19,,False,,False,False,10/22/19 00:08,,http://www.surveyusa.com/client/PollReport.aspx?g=3662de7c-9fe8-4524-b39b-789835905d98,primary,DEM,O'Rourke,13276.0,Beto O'Rourke,2.0,2019-10-15
623,California,36.116203000000006,-119.681564,111112.0,62228.0,2020.0,460.0,SurveyUSA,"443,583,804",KGTV-TV (California) | KABC-TV (California) | San Diego Union-Tribune,SurveyUSA,325.0,SurveyUSA,A,553.0,lv,lv-d,Online,U.S. President,10/15/19,10/16/19,,False,,False,False,10/22/19 00:08,,http://www.surveyusa.com/client/PollReport.aspx?g=3662de7c-9fe8-4524-b39b-789835905d98,primary,DEM,Booker,13287.0,Cory A. Booker,2.0,2019-10-15
624,California,36.116203000000006,-119.681564,111112.0,62228.0,2020.0,460.0,SurveyUSA,"443,583,804",KGTV-TV (California) | KABC-TV (California) | San Diego Union-Tribune,SurveyUSA,325.0,SurveyUSA,A,553.0,lv,lv-d,Online,U.S. President,10/15/19,10/16/19,,False,,False,False,10/22/19 00:08,,http://www.surveyusa.com/client/PollReport.aspx?g=3662de7c-9fe8-4524-b39b-789835905d98,primary,DEM,Buttigieg,13345.0,Pete Buttigieg,4.0,2019-10-15
625,California,36.116203000000006,-119.681564,111112.0,62228.0,2020.0,460.0,SurveyUSA,"443,583,804",KGTV-TV (California) | KABC-TV (California) | San Diego Union-Tribune,SurveyUSA,325.0,SurveyUSA,A,553.0,lv,lv-d,Online,U.S. President,10/15/19,10/16/19,,False,,False,False,10/22/19 00:08,,http://www.surveyusa.com/client/PollReport.aspx?g=3662de7c-9fe8-4524-b39b-789835905d98,primary,DEM,Yang,13329.0,Andrew Yang,4.0,2019-10-15
626,California,36.116203000000006,-119.681564,114913.0,63130.0,2020.0,1365.0,Change Research,1186,KQED,Change Research,48.0,Change Research,C,862.0,lv,lv-d,Online,U.S. President,12/6/19,12/10/19,,False,,False,False,12/16/19 13:09,,https://www.changeresearch.com/post/change-research-kqed-california-poll-december,primary,DEM,Patrick,13315.0,Deval Patrick,0.0,2019-12-06
627,California,36.116203000000006,-119.681564,114913.0,63130.0,2020.0,1365.0,Change Research,1186,KQED,Change Research,48.0,Change Research,C,862.0,lv,lv-d,Online,U.S. President,12/6/19,12/10/19,,False,,False,False,12/16/19 13:09,,https://www.changeresearch.com/post/change-research-kqed-california-poll-december,primary,DEM,Delaney,13314.0,John K. Delaney,0.0,2019-12-06
628,California,36.116203000000006,-119.681564,116792.0,63508.0,2020.0,1491.0,Capitol Weekly,,,Capitol Weekly,510.0,Capitol Weekly,,843.0,lv,lv-d,Online,U.S. President,2/6/20,2/9/20,,False,,False,False,2/10/20 15:52,,https://www.dropbox.com/s/vwj05okmdrg2b8t/Feb%202020%20Presidential%20Primary%20Tracking%20Poll%20Toplines%20and%20Crosstabs.xlsx,primary,DEM,Delaney,13314.0,John K. Delaney,0.0,2020-02-06
629,California,36.116203000000006,-119.681564,116792.0,63508.0,2020.0,1491.0,Capitol Weekly,,,Capitol Weekly,510.0,Capitol Weekly,,843.0,lv,lv-d,Online,U.S. President,2/6/20,2/9/20,,False,,False,False,2/10/20 15:52,,https://www.dropbox.com/s/vwj05okmdrg2b8t/Feb%202020%20Presidential%20Primary%20Tracking%20Poll%20Toplines%20and%20Crosstabs.xlsx,primary,DEM,Patrick,13315.0,Deval Patrick,1.0,2020-02-06
630,California,36.116203000000006,-119.681564,116792.0,63508.0,2020.0,1491.0,Capitol Weekly,,,Capitol Weekly,510.0,Capitol Weekly,,843.0,lv,lv-d,Online,U.S. President,2/6/20,2/9/20,,False,,False,False,2/10/20 15:52,,https://www.dropbox.com/s/vwj05okmdrg2b8t/Feb%202020%20Presidential%20Primary%20Tracking%20Poll%20Toplines%20and%20Crosstabs.xlsx,primary,DEM,Williamson,13350.0,Marianne Williamson,1.0,2020-02-06
631,California,36.116203000000006,-119.681564,116792.0,63508.0,2020.0,1491.0,Capitol Weekly,,,Capitol Weekly,510.0,Capitol Weekly,,843.0,lv,lv-d,Online,U.S. President,2/6/20,2/9/20,,False,,False,False,2/10/20 15:52,,https://www.dropbox.com/s/vwj05okmdrg2b8t/Feb%202020%20Presidential%20Primary%20Tracking%20Poll%20Toplines%20and%20Crosstabs.xlsx,primary,DEM,Booker,13287.0,Cory A. Booker,1.0,2020-02-06
632,California,36.116203000000006,-119.681564,97880.0,58445.0,2020.0,1363.0,"University of California, Berkeley",300,LA Times,"University of California, Berkeley",457.0,"University of California, Berkeley",B/C,2131.0,lv,lv-d,Online,U.S. President,6/4/19,6/10/19,,False,,False,False,6/13/19 08:30,,https://escholarship.org/uc/item/1g43j6tj,primary,DEM,Swalwell,13328.0,Eric Swalwell,0.4,2019-06-04
633,California,36.116203000000006,-119.681564,116792.0,63508.0,2020.0,1491.0,Capitol Weekly,,,Capitol Weekly,510.0,Capitol Weekly,,843.0,lv,lv-d,Online,U.S. President,2/6/20,2/9/20,,False,,False,False,2/10/20 15:52,,https://www.dropbox.com/s/vwj05okmdrg2b8t/Feb%202020%20Presidential%20Primary%20Tracking%20Poll%20Toplines%20and%20Crosstabs.xlsx,primary,DEM,Steyer,13327.0,Tom Steyer,3.0,2020-02-06
634,California,36.116203000000006,-119.681564,116792.0,63508.0,2020.0,1491.0,Capitol Weekly,,,Capitol Weekly,510.0,Capitol Weekly,,843.0,lv,lv-d,Online,U.S. President,2/6/20,2/9/20,,False,,False,False,2/10/20 15:52,,https://www.dropbox.com/s/vwj05okmdrg2b8t/Feb%202020%20Presidential%20Primary%20Tracking%20Poll%20Toplines%20and%20Crosstabs.xlsx,primary,DEM,Yang,13329.0,Andrew Yang,4.0,2020-02-06
635,California,36.116203000000006,-119.681564,116792.0,63508.0,2020.0,1491.0,Capitol Weekly,,,Capitol Weekly,510.0,Capitol Weekly,,843.0,lv,lv-d,Online,U.S. President,2/6/20,2/9/20,,False,,False,False,2/10/20 15:52,,https://www.dropbox.com/s/vwj05okmdrg2b8t/Feb%202020%20Presidential%20Primary%20Tracking%20Poll%20Toplines%20and%20Crosstabs.xlsx,primary,DEM,Klobuchar,13310.0,Amy Klobuchar,5.0,2020-02-06
636,California,36.116203000000006,-119.681564,116792.0,63508.0,2020.0,1491.0,Capitol Weekly,,,Capitol Weekly,510.0,Capitol Weekly,,843.0,lv,lv-d,Online,U.S. President,2/6/20,2/9/20,,False,,False,False,2/10/20 15:52,,https://www.dropbox.com/s/vwj05okmdrg2b8t/Feb%202020%20Presidential%20Primary%20Tracking%20Poll%20Toplines%20and%20Crosstabs.xlsx,primary,DEM,Biden,13256.0,Joseph R. Biden Jr.,11.0,2020-02-06
637,California,36.116203000000006,-119.681564,116792.0,63508.0,2020.0,1491.0,Capitol Weekly,,,Capitol Weekly,510.0,Capitol Weekly,,843.0,lv,lv-d,Online,U.S. President,2/6/20,2/9/20,,False,,False,False,2/10/20 15:52,,https://www.dropbox.com/s/vwj05okmdrg2b8t/Feb%202020%20Presidential%20Primary%20Tracking%20Poll%20Toplines%20and%20Crosstabs.xlsx,primary,DEM,Bloomberg,13289.0,Michael Bloomberg,13.0,2020-02-06
638,California,36.116203000000006,-119.681564,116792.0,63508.0,2020.0,1491.0,Capitol Weekly,,,Capitol Weekly,510.0,Capitol Weekly,,843.0,lv,lv-d,Online,U.S. President,2/6/20,2/9/20,,False,,False,False,2/10/20 15:52,,https://www.dropbox.com/s/vwj05okmdrg2b8t/Feb%202020%20Presidential%20Primary%20Tracking%20Poll%20Toplines%20and%20Crosstabs.xlsx,primary,DEM,Buttigieg,13345.0,Pete Buttigieg,14.0,2020-02-06
639,California,36.116203000000006,-119.681564,116792.0,63508.0,2020.0,1491.0,Capitol Weekly,,,Capitol Weekly,510.0,Capitol Weekly,,843.0,lv,lv-d,Online,U.S. President,2/6/20,2/9/20,,False,,False,False,2/10/20 15:52,,https://www.dropbox.com/s/vwj05okmdrg2b8t/Feb%202020%20Presidential%20Primary%20Tracking%20Poll%20Toplines%20and%20Crosstabs.xlsx,primary,DEM,Warren,13258.0,Elizabeth Warren,16.0,2020-02-06
640,California,36.116203000000006,-119.681564,116792.0,63508.0,2020.0,1491.0,Capitol Weekly,,,Capitol Weekly,510.0,Capitol Weekly,,843.0,lv,lv-d,Online,U.S. President,2/6/20,2/9/20,,False,,False,False,2/10/20 15:52,,https://www.dropbox.com/s/vwj05okmdrg2b8t/Feb%202020%20Presidential%20Primary%20Tracking%20Poll%20Toplines%20and%20Crosstabs.xlsx,primary,DEM,Gabbard,13343.0,Tulsi Gabbard,3.0,2020-02-06
641,California,36.116203000000006,-119.681564,97880.0,58445.0,2020.0,1363.0,"University of California, Berkeley",300,LA Times,"University of California, Berkeley",457.0,"University of California, Berkeley",B/C,2131.0,lv,lv-d,Online,U.S. President,6/4/19,6/10/19,,False,,False,False,6/13/19 08:30,,https://escholarship.org/uc/item/1g43j6tj,primary,DEM,Castro,13316.0,Julián Castro,0.6,2019-06-04
642,California,36.116203000000006,-119.681564,97880.0,58445.0,2020.0,1363.0,"University of California, Berkeley",300,LA Times,"University of California, Berkeley",457.0,"University of California, Berkeley",B/C,2131.0,lv,lv-d,Online,U.S. President,6/4/19,6/10/19,,False,,False,False,6/13/19 08:30,,https://escholarship.org/uc/item/1g43j6tj,primary,DEM,Klobuchar,13310.0,Amy Klobuchar,0.6,2019-06-04
643,California,36.116203000000006,-119.681564,97880.0,58445.0,2020.0,1363.0,"University of California, Berkeley",300,LA Times,"University of California, Berkeley",457.0,"University of California, Berkeley",B/C,2131.0,lv,lv-d,Online,U.S. President,6/4/19,6/10/19,,False,,False,False,6/13/19 08:30,,https://escholarship.org/uc/item/1g43j6tj,primary,DEM,Yang,13329.0,Andrew Yang,0.9,2019-06-04
644,California,36.116203000000006,-119.681564,99462.0,58681.0,2020.0,1491.0,Capitol Weekly,,,Capitol Weekly,510.0,Capitol Weekly,,703.0,lv,lv-d,Online,U.S. President,6/1/19,6/30/19,,False,,False,False,7/17/19 15:00,,https://public.tableau.com/profile/capitol.weekly#!/vizhome/2020PrimaryTrackingSurvey_15626518585990/CA120POLLSTORY,primary,DEM,Gabbard,13343.0,Tulsi Gabbard,1.5,2019-06-01
645,California,36.116203000000006,-119.681564,99462.0,58681.0,2020.0,1491.0,Capitol Weekly,,,Capitol Weekly,510.0,Capitol Weekly,,703.0,lv,lv-d,Online,U.S. President,6/1/19,6/30/19,,False,,False,False,7/17/19 15:00,,https://public.tableau.com/profile/capitol.weekly#!/vizhome/2020PrimaryTrackingSurvey_15626518585990/CA120POLLSTORY,primary,DEM,Gillibrand,13311.0,Kirsten E. Gillibrand,0.7,2019-06-01
646,California,36.116203000000006,-119.681564,99462.0,58681.0,2020.0,1491.0,Capitol Weekly,,,Capitol Weekly,510.0,Capitol Weekly,,703.0,lv,lv-d,Online,U.S. President,6/1/19,6/30/19,,False,,False,False,7/17/19 15:00,,https://public.tableau.com/profile/capitol.weekly#!/vizhome/2020PrimaryTrackingSurvey_15626518585990/CA120POLLSTORY,primary,DEM,Inslee,13324.0,Jay Robert Inslee,0.1,2019-06-01
647,California,36.116203000000006,-119.681564,99462.0,58681.0,2020.0,1491.0,Capitol Weekly,,,Capitol Weekly,510.0,Capitol Weekly,,703.0,lv,lv-d,Online,U.S. President,6/1/19,6/30/19,,False,,False,False,7/17/19 15:00,,https://public.tableau.com/profile/capitol.weekly#!/vizhome/2020PrimaryTrackingSurvey_15626518585990/CA120POLLSTORY,primary,DEM,Yang,13329.0,Andrew Yang,2.4,2019-06-01
648,California,36.116203000000006,-119.681564,99462.0,58681.0,2020.0,1491.0,Capitol Weekly,,,Capitol Weekly,510.0,Capitol Weekly,,703.0,lv,lv-d,Online,U.S. President,6/1/19,6/30/19,,False,,False,False,7/17/19 15:00,,https://public.tableau.com/profile/capitol.weekly#!/vizhome/2020PrimaryTrackingSurvey_15626518585990/CA120POLLSTORY,primary,DEM,Hickenlooper,13326.0,John Hickenlooper,1.6,2019-06-01
649,California,36.116203000000006,-119.681564,99462.0,58681.0,2020.0,1491.0,Capitol Weekly,,,Capitol Weekly,510.0,Capitol Weekly,,703.0,lv,lv-d,Online,U.S. President,6/1/19,6/30/19,,False,,False,False,7/17/19 15:00,,https://public.tableau.com/profile/capitol.weekly#!/vizhome/2020PrimaryTrackingSurvey_15626518585990/CA120POLLSTORY,primary,DEM,Klobuchar,13310.0,Amy Klobuchar,1.0,2019-06-01
650,California,36.116203000000006,-119.681564,99462.0,58681.0,2020.0,1491.0,Capitol Weekly,,,Capitol Weekly,510.0,Capitol Weekly,,703.0,lv,lv-d,Online,U.S. President,6/1/19,6/30/19,,False,,False,False,7/17/19 15:00,,https://public.tableau.com/profile/capitol.weekly#!/vizhome/2020PrimaryTrackingSurvey_15626518585990/CA120POLLSTORY,primary,DEM,Booker,13287.0,Cory A. Booker,1.9,2019-06-01
651,California,36.116203000000006,-119.681564,99462.0,58681.0,2020.0,1491.0,Capitol Weekly,,,Capitol Weekly,510.0,Capitol Weekly,,703.0,lv,lv-d,Online,U.S. President,6/1/19,6/30/19,,False,,False,False,7/17/19 15:00,,https://public.tableau.com/profile/capitol.weekly#!/vizhome/2020PrimaryTrackingSurvey_15626518585990/CA120POLLSTORY,primary,DEM,O'Rourke,13276.0,Beto O'Rourke,1.5,2019-06-01
652,California,36.116203000000006,-119.681564,99462.0,58681.0,2020.0,1491.0,Capitol Weekly,,,Capitol Weekly,510.0,Capitol Weekly,,703.0,lv,lv-d,Online,U.S. President,6/1/19,6/30/19,,False,,False,False,7/17/19 15:00,,https://public.tableau.com/profile/capitol.weekly#!/vizhome/2020PrimaryTrackingSurvey_15626518585990/CA120POLLSTORY,primary,DEM,Buttigieg,13345.0,Pete Buttigieg,7.8,2019-06-01
653,California,36.116203000000006,-119.681564,99462.0,58681.0,2020.0,1491.0,Capitol Weekly,,,Capitol Weekly,510.0,Capitol Weekly,,703.0,lv,lv-d,Online,U.S. President,6/1/19,6/30/19,,False,,False,False,7/17/19 15:00,,https://public.tableau.com/profile/capitol.weekly#!/vizhome/2020PrimaryTrackingSurvey_15626518585990/CA120POLLSTORY,primary,DEM,Warren,13258.0,Elizabeth Warren,23.4,2019-06-01
654,California,36.116203000000006,-119.681564,99462.0,58681.0,2020.0,1491.0,Capitol Weekly,,,Capitol Weekly,510.0,Capitol Weekly,,703.0,lv,lv-d,Online,U.S. President,6/1/19,6/30/19,,False,,False,False,7/17/19 15:00,,https://public.tableau.com/profile/capitol.weekly#!/vizhome/2020PrimaryTrackingSurvey_15626518585990/CA120POLLSTORY,primary,DEM,Harris,13288.0,Kamala D. Harris,14.0,2019-06-01
655,California,36.116203000000006,-119.681564,99462.0,58681.0,2020.0,1491.0,Capitol Weekly,,,Capitol Weekly,510.0,Capitol Weekly,,703.0,lv,lv-d,Online,U.S. President,6/1/19,6/30/19,,False,,False,False,7/17/19 15:00,,https://public.tableau.com/profile/capitol.weekly#!/vizhome/2020PrimaryTrackingSurvey_15626518585990/CA120POLLSTORY,primary,DEM,Sanders,13257.0,Bernard Sanders,18.7,2019-06-01
656,California,36.116203000000006,-119.681564,99462.0,58681.0,2020.0,1491.0,Capitol Weekly,,,Capitol Weekly,510.0,Capitol Weekly,,703.0,lv,lv-d,Online,U.S. President,6/1/19,6/30/19,,False,,False,False,7/17/19 15:00,,https://public.tableau.com/profile/capitol.weekly#!/vizhome/2020PrimaryTrackingSurvey_15626518585990/CA120POLLSTORY,primary,DEM,Biden,13256.0,Joseph R. Biden Jr.,23.1,2019-06-01
657,California,36.116203000000006,-119.681564,97880.0,58445.0,2020.0,1363.0,"University of California, Berkeley",300,LA Times,"University of California, Berkeley",457.0,"University of California, Berkeley",B/C,2131.0,lv,lv-d,Online,U.S. President,6/4/19,6/10/19,,False,,False,False,6/13/19 08:30,,https://escholarship.org/uc/item/1g43j6tj,primary,DEM,O'Rourke,13276.0,Beto O'Rourke,3.2,2019-06-04
658,California,36.116203000000006,-119.681564,97880.0,58445.0,2020.0,1363.0,"University of California, Berkeley",300,LA Times,"University of California, Berkeley",457.0,"University of California, Berkeley",B/C,2131.0,lv,lv-d,Online,U.S. President,6/4/19,6/10/19,,False,,False,False,6/13/19 08:30,,https://escholarship.org/uc/item/1g43j6tj,primary,DEM,Booker,13287.0,Cory A. Booker,1.1,2019-06-04
659,California,36.116203000000006,-119.681564,116792.0,63508.0,2020.0,1491.0,Capitol Weekly,,,Capitol Weekly,510.0,Capitol Weekly,,843.0,lv,lv-d,Online,U.S. President,2/6/20,2/9/20,,False,,False,False,2/10/20 15:52,,https://www.dropbox.com/s/vwj05okmdrg2b8t/Feb%202020%20Presidential%20Primary%20Tracking%20Poll%20Toplines%20and%20Crosstabs.xlsx,primary,DEM,Sanders,13257.0,Bernard Sanders,29.0,2020-02-06
660,California,36.116203000000006,-119.681564,115574.0,63243.0,2020.0,1491.0,Capitol Weekly,,,Capitol Weekly,510.0,Capitol Weekly,,1053.0,lv,lv-d,Online,U.S. President,1/3/20,1/9/20,,False,,False,False,1/9/20 15:50,,https://www.dropbox.com/s/5w1aofozhv4iwl5/Jan%202020%20Presidential%20Primary%20Tracking%20Poll%20Toplines%20and%20Crosstabs.xlsx,primary,DEM,Sanders,13257.0,Bernard Sanders,24.0,2020-01-03
661,California,36.116203000000006,-119.681564,114913.0,63130.0,2020.0,1365.0,Change Research,1186,KQED,Change Research,48.0,Change Research,C,862.0,lv,lv-d,Online,U.S. President,12/6/19,12/10/19,,False,,False,False,12/16/19 13:09,,https://www.changeresearch.com/post/change-research-kqed-california-poll-december,primary,DEM,Bennet,13352.0,Michael F. Bennet,0.0,2019-12-06
662,California,36.116203000000006,-119.681564,111770.0,62442.0,2020.0,1365.0,Change Research,1186,KQED,Change Research,48.0,Change Research,C,1631.0,lv,lv-d,Online,U.S. President,10/15/19,10/18/19,,False,,False,False,10/24/19 06:24,,https://www.changeresearch.com/california-poll-october-15-18,primary,DEM,Warren,13258.0,Elizabeth Warren,28.0,2019-10-15
663,California,36.116203000000006,-119.681564,114913.0,63130.0,2020.0,1365.0,Change Research,1186,KQED,Change Research,48.0,Change Research,C,862.0,lv,lv-d,Online,U.S. President,12/6/19,12/10/19,,False,,False,False,12/16/19 13:09,,https://www.changeresearch.com/post/change-research-kqed-california-poll-december,primary,DEM,Steyer,13327.0,Tom Steyer,2.0,2019-12-06
664,California,36.116203000000006,-119.681564,114913.0,63130.0,2020.0,1365.0,Change Research,1186,KQED,Change Research,48.0,Change Research,C,862.0,lv,lv-d,Online,U.S. President,12/6/19,12/10/19,,False,,False,False,12/16/19 13:09,,https://www.changeresearch.com/post/change-research-kqed-california-poll-december,primary,DEM,Castro,13316.0,Julián Castro,3.0,2019-12-06
665,California,36.116203000000006,-119.681564,114913.0,63130.0,2020.0,1365.0,Change Research,1186,KQED,Change Research,48.0,Change Research,C,862.0,lv,lv-d,Online,U.S. President,12/6/19,12/10/19,,False,,False,False,12/16/19 13:09,,https://www.changeresearch.com/post/change-research-kqed-california-poll-december,primary,DEM,Booker,13287.0,Cory A. Booker,3.0,2019-12-06
666,California,36.116203000000006,-119.681564,114913.0,63130.0,2020.0,1365.0,Change Research,1186,KQED,Change Research,48.0,Change Research,C,862.0,lv,lv-d,Online,U.S. President,12/6/19,12/10/19,,False,,False,False,12/16/19 13:09,,https://www.changeresearch.com/post/change-research-kqed-california-poll-december,primary,DEM,Gabbard,13343.0,Tulsi Gabbard,3.0,2019-12-06
667,California,36.116203000000006,-119.681564,114913.0,63130.0,2020.0,1365.0,Change Research,1186,KQED,Change Research,48.0,Change Research,C,862.0,lv,lv-d,Online,U.S. President,12/6/19,12/10/19,,False,,False,False,12/16/19 13:09,,https://www.changeresearch.com/post/change-research-kqed-california-poll-december,primary,DEM,Bloomberg,13289.0,Michael Bloomberg,3.0,2019-12-06
668,California,36.116203000000006,-119.681564,114913.0,63130.0,2020.0,1365.0,Change Research,1186,KQED,Change Research,48.0,Change Research,C,862.0,lv,lv-d,Online,U.S. President,12/6/19,12/10/19,,False,,False,False,12/16/19 13:09,,https://www.changeresearch.com/post/change-research-kqed-california-poll-december,primary,DEM,Yang,13329.0,Andrew Yang,4.0,2019-12-06
669,California,36.116203000000006,-119.681564,114913.0,63130.0,2020.0,1365.0,Change Research,1186,KQED,Change Research,48.0,Change Research,C,862.0,lv,lv-d,Online,U.S. President,12/6/19,12/10/19,,False,,False,False,12/16/19 13:09,,https://www.changeresearch.com/post/change-research-kqed-california-poll-december,primary,DEM,Klobuchar,13310.0,Amy Klobuchar,1.0,2019-12-06
670,California,36.116203000000006,-119.681564,114913.0,63130.0,2020.0,1365.0,Change Research,1186,KQED,Change Research,48.0,Change Research,C,862.0,lv,lv-d,Online,U.S. President,12/6/19,12/10/19,,False,,False,False,12/16/19 13:09,,https://www.changeresearch.com/post/change-research-kqed-california-poll-december,primary,DEM,Buttigieg,13345.0,Pete Buttigieg,12.0,2019-12-06
671,California,36.116203000000006,-119.681564,114913.0,63130.0,2020.0,1365.0,Change Research,1186,KQED,Change Research,48.0,Change Research,C,862.0,lv,lv-d,Online,U.S. President,12/6/19,12/10/19,,False,,False,False,12/16/19 13:09,,https://www.changeresearch.com/post/change-research-kqed-california-poll-december,primary,DEM,Warren,13258.0,Elizabeth Warren,23.0,2019-12-06
672,California,36.116203000000006,-119.681564,114913.0,63130.0,2020.0,1365.0,Change Research,1186,KQED,Change Research,48.0,Change Research,C,862.0,lv,lv-d,Online,U.S. President,12/6/19,12/10/19,,False,,False,False,12/16/19 13:09,,https://www.changeresearch.com/post/change-research-kqed-california-poll-december,primary,DEM,Sanders,13257.0,Bernard Sanders,26.0,2019-12-06
673,California,36.116203000000006,-119.681564,111112.0,62228.0,2020.0,460.0,SurveyUSA,"443,583,804",KGTV-TV (California) | KABC-TV (California) | San Diego Union-Tribune,SurveyUSA,325.0,SurveyUSA,A,553.0,lv,lv-d,Online,U.S. President,10/15/19,10/16/19,,False,,False,False,10/22/19 00:08,,http://www.surveyusa.com/client/PollReport.aspx?g=3662de7c-9fe8-4524-b39b-789835905d98,primary,DEM,Biden,13256.0,Joseph R. Biden Jr.,33.0,2019-10-15
674,California,36.116203000000006,-119.681564,111112.0,62228.0,2020.0,460.0,SurveyUSA,"443,583,804",KGTV-TV (California) | KABC-TV (California) | San Diego Union-Tribune,SurveyUSA,325.0,SurveyUSA,A,553.0,lv,lv-d,Online,U.S. President,10/15/19,10/16/19,,False,,False,False,10/22/19 00:08,,http://www.surveyusa.com/client/PollReport.aspx?g=3662de7c-9fe8-4524-b39b-789835905d98,primary,DEM,Warren,13258.0,Elizabeth Warren,18.0,2019-10-15
675,California,36.116203000000006,-119.681564,111112.0,62228.0,2020.0,460.0,SurveyUSA,"443,583,804",KGTV-TV (California) | KABC-TV (California) | San Diego Union-Tribune,SurveyUSA,325.0,SurveyUSA,A,553.0,lv,lv-d,Online,U.S. President,10/15/19,10/16/19,,False,,False,False,10/22/19 00:08,,http://www.surveyusa.com/client/PollReport.aspx?g=3662de7c-9fe8-4524-b39b-789835905d98,primary,DEM,Sanders,13257.0,Bernard Sanders,17.0,2019-10-15
676,California,36.116203000000006,-119.681564,111112.0,62228.0,2020.0,460.0,SurveyUSA,"443,583,804",KGTV-TV (California) | KABC-TV (California) | San Diego Union-Tribune,SurveyUSA,325.0,SurveyUSA,A,553.0,lv,lv-d,Online,U.S. President,10/15/19,10/16/19,,False,,False,False,10/22/19 00:08,,http://www.surveyusa.com/client/PollReport.aspx?g=3662de7c-9fe8-4524-b39b-789835905d98,primary,DEM,Harris,13288.0,Kamala D. Harris,8.0,2019-10-15
677,California,36.116203000000006,-119.681564,114913.0,63130.0,2020.0,1365.0,Change Research,1186,KQED,Change Research,48.0,Change Research,C,862.0,lv,lv-d,Online,U.S. President,12/6/19,12/10/19,,False,,False,False,12/16/19 13:09,,https://www.changeresearch.com/post/change-research-kqed-california-poll-december,primary,DEM,Biden,13256.0,Joseph R. Biden Jr.,19.0,2019-12-06
678,California,36.116203000000006,-119.681564,111770.0,62442.0,2020.0,1365.0,Change Research,1186,KQED,Change Research,48.0,Change Research,C,1631.0,lv,lv-d,Online,U.S. President,10/15/19,10/18/19,,False,,False,False,10/24/19 06:24,,https://www.changeresearch.com/california-poll-october-15-18,primary,DEM,Sestak,13381.0,Joe Sestak,0.0,2019-10-15
679,California,36.116203000000006,-119.681564,111770.0,62442.0,2020.0,1365.0,Change Research,1186,KQED,Change Research,48.0,Change Research,C,1631.0,lv,lv-d,Online,U.S. President,10/15/19,10/18/19,,False,,False,False,10/24/19 06:24,,https://www.changeresearch.com/california-poll-october-15-18,primary,DEM,Delaney,13314.0,John K. Delaney,0.0,2019-10-15
680,California,36.116203000000006,-119.681564,111770.0,62442.0,2020.0,1365.0,Change Research,1186,KQED,Change Research,48.0,Change Research,C,1631.0,lv,lv-d,Online,U.S. President,10/15/19,10/18/19,,False,,False,False,10/24/19 06:24,,https://www.changeresearch.com/california-poll-october-15-18,primary,DEM,Bullock,13320.0,Steve Bullock,0.0,2019-10-15
681,California,36.116203000000006,-119.681564,111770.0,62442.0,2020.0,1365.0,Change Research,1186,KQED,Change Research,48.0,Change Research,C,1631.0,lv,lv-d,Online,U.S. President,10/15/19,10/18/19,,False,,False,False,10/24/19 06:24,,https://www.changeresearch.com/california-poll-october-15-18,primary,DEM,Sanders,13257.0,Bernard Sanders,24.0,2019-10-15
682,California,36.116203000000006,-119.681564,111770.0,62442.0,2020.0,1365.0,Change Research,1186,KQED,Change Research,48.0,Change Research,C,1631.0,lv,lv-d,Online,U.S. President,10/15/19,10/18/19,,False,,False,False,10/24/19 06:24,,https://www.changeresearch.com/california-poll-october-15-18,primary,DEM,Biden,13256.0,Joseph R. Biden Jr.,19.0,2019-10-15
683,California,36.116203000000006,-119.681564,111770.0,62442.0,2020.0,1365.0,Change Research,1186,KQED,Change Research,48.0,Change Research,C,1631.0,lv,lv-d,Online,U.S. President,10/15/19,10/18/19,,False,,False,False,10/24/19 06:24,,https://www.changeresearch.com/california-poll-october-15-18,primary,DEM,Buttigieg,13345.0,Pete Buttigieg,9.0,2019-10-15
684,California,36.116203000000006,-119.681564,111770.0,62442.0,2020.0,1365.0,Change Research,1186,KQED,Change Research,48.0,Change Research,C,1631.0,lv,lv-d,Online,U.S. President,10/15/19,10/18/19,,False,,False,False,10/24/19 06:24,,https://www.changeresearch.com/california-poll-october-15-18,primary,DEM,Harris,13288.0,Kamala D. Harris,8.0,2019-10-15
685,California,36.116203000000006,-119.681564,111770.0,62442.0,2020.0,1365.0,Change Research,1186,KQED,Change Research,48.0,Change Research,C,1631.0,lv,lv-d,Online,U.S. President,10/15/19,10/18/19,,False,,False,False,10/24/19 06:24,,https://www.changeresearch.com/california-poll-october-15-18,primary,DEM,Yang,13329.0,Andrew Yang,3.0,2019-10-15
686,California,36.116203000000006,-119.681564,111770.0,62442.0,2020.0,1365.0,Change Research,1186,KQED,Change Research,48.0,Change Research,C,1631.0,lv,lv-d,Online,U.S. President,10/15/19,10/18/19,,False,,False,False,10/24/19 06:24,,https://www.changeresearch.com/california-poll-october-15-18,primary,DEM,Gabbard,13343.0,Tulsi Gabbard,2.0,2019-10-15
687,California,36.116203000000006,-119.681564,111770.0,62442.0,2020.0,1365.0,Change Research,1186,KQED,Change Research,48.0,Change Research,C,1631.0,lv,lv-d,Online,U.S. President,10/15/19,10/18/19,,False,,False,False,10/24/19 06:24,,https://www.changeresearch.com/california-poll-october-15-18,primary,DEM,Klobuchar,13310.0,Amy Klobuchar,2.0,2019-10-15
688,California,36.116203000000006,-119.681564,111770.0,62442.0,2020.0,1365.0,Change Research,1186,KQED,Change Research,48.0,Change Research,C,1631.0,lv,lv-d,Online,U.S. President,10/15/19,10/18/19,,False,,False,False,10/24/19 06:24,,https://www.changeresearch.com/california-poll-october-15-18,primary,DEM,O'Rourke,13276.0,Beto O'Rourke,1.0,2019-10-15
689,California,36.116203000000006,-119.681564,111770.0,62442.0,2020.0,1365.0,Change Research,1186,KQED,Change Research,48.0,Change Research,C,1631.0,lv,lv-d,Online,U.S. President,10/15/19,10/18/19,,False,,False,False,10/24/19 06:24,,https://www.changeresearch.com/california-poll-october-15-18,primary,DEM,Williamson,13350.0,Marianne Williamson,1.0,2019-10-15
690,California,36.116203000000006,-119.681564,111770.0,62442.0,2020.0,1365.0,Change Research,1186,KQED,Change Research,48.0,Change Research,C,1631.0,lv,lv-d,Online,U.S. President,10/15/19,10/18/19,,False,,False,False,10/24/19 06:24,,https://www.changeresearch.com/california-poll-october-15-18,primary,DEM,Booker,13287.0,Cory A. Booker,1.0,2019-10-15
691,California,36.116203000000006,-119.681564,111770.0,62442.0,2020.0,1365.0,Change Research,1186,KQED,Change Research,48.0,Change Research,C,1631.0,lv,lv-d,Online,U.S. President,10/15/19,10/18/19,,False,,False,False,10/24/19 06:24,,https://www.changeresearch.com/california-poll-october-15-18,primary,DEM,Steyer,13327.0,Tom Steyer,1.0,2019-10-15
692,California,36.116203000000006,-119.681564,111770.0,62442.0,2020.0,1365.0,Change Research,1186,KQED,Change Research,48.0,Change Research,C,1631.0,lv,lv-d,Online,U.S. President,10/15/19,10/18/19,,False,,False,False,10/24/19 06:24,,https://www.changeresearch.com/california-poll-october-15-18,primary,DEM,Castro,13316.0,Julián Castro,0.0,2019-10-15
693,California,36.116203000000006,-119.681564,111770.0,62442.0,2020.0,1365.0,Change Research,1186,KQED,Change Research,48.0,Change Research,C,1631.0,lv,lv-d,Online,U.S. President,10/15/19,10/18/19,,False,,False,False,10/24/19 06:24,,https://www.changeresearch.com/california-poll-october-15-18,primary,DEM,Ryan,13358.0,Tim Ryan,0.0,2019-10-15
694,California,36.116203000000006,-119.681564,111770.0,62442.0,2020.0,1365.0,Change Research,1186,KQED,Change Research,48.0,Change Research,C,1631.0,lv,lv-d,Online,U.S. President,10/15/19,10/18/19,,False,,False,False,10/24/19 06:24,,https://www.changeresearch.com/california-poll-october-15-18,primary,DEM,Bennet,13352.0,Michael F. Bennet,0.0,2019-10-15
695,California,36.116203000000006,-119.681564,111770.0,62442.0,2020.0,1365.0,Change Research,1186,KQED,Change Research,48.0,Change Research,C,1631.0,lv,lv-d,Online,U.S. President,10/15/19,10/18/19,,False,,False,False,10/24/19 06:24,,https://www.changeresearch.com/california-poll-october-15-18,primary,DEM,Messam,13357.0,Wayne Messam,0.0,2019-10-15
696,California,36.116203000000006,-119.681564,114913.0,63130.0,2020.0,1365.0,Change Research,1186,KQED,Change Research,48.0,Change Research,C,862.0,lv,lv-d,Online,U.S. President,12/6/19,12/10/19,,False,,False,False,12/16/19 13:09,,https://www.changeresearch.com/post/change-research-kqed-california-poll-december,primary,DEM,Williamson,13350.0,Marianne Williamson,1.0,2019-12-06
697,California,36.116203000000006,-119.681564,116200.0,63367.0,2020.0,1363.0,"University of California, Berkeley",300,LA Times,"University of California, Berkeley",457.0,"University of California, Berkeley",B/C,2895.0,lv,lv-d,Online,U.S. President,1/15/20,1/21/20,,False,,False,False,1/28/20 06:21,,https://escholarship.org/uc/item/1h8738br,primary,DEM,Warren,13258.0,Elizabeth Warren,19.6,2020-01-15
698,California,36.116203000000006,-119.681564,114006.0,62980.0,2020.0,460.0,SurveyUSA,"443,804",KGTV-TV (California) | San Diego Union-Tribune,SurveyUSA,325.0,SurveyUSA,A,558.0,lv,lv-d,Online,U.S. President,11/20/19,11/22/19,,False,,False,False,11/26/19 21:22,,http://www.surveyusa.com/client/PollReport.aspx?g=bdcd277b-f00f-48eb-a393-bf59bb2a0fab,primary,DEM,Patrick,13315.0,Deval Patrick,0.0,2019-11-20
699,California,36.116203000000006,-119.681564,116200.0,63367.0,2020.0,1363.0,"University of California, Berkeley",300,LA Times,"University of California, Berkeley",457.0,"University of California, Berkeley",B/C,2895.0,lv,lv-d,Online,U.S. President,1/15/20,1/21/20,,False,,False,False,1/28/20 06:21,,https://escholarship.org/uc/item/1h8738br,primary,DEM,Buttigieg,13345.0,Pete Buttigieg,7.2,2020-01-15
700,California,36.116203000000006,-119.681564,100324.0,58836.0,2020.0,460.0,SurveyUSA,"443,804",KGTV-TV (California) | San Diego Union-Tribune,SurveyUSA,325.0,SurveyUSA,A,528.0,lv,lv-d,Online,U.S. President,8/1/19,8/5/19,,False,,False,False,8/7/19 19:28,,http://www.surveyusa.com/client/PollReport.aspx?g=949b0f46-a4a4-4480-b675-711e9d6fd657,primary,DEM,Gabbard,13343.0,Tulsi Gabbard,1.0,2019-08-01
701,California,36.116203000000006,-119.681564,100324.0,58836.0,2020.0,460.0,SurveyUSA,"443,804",KGTV-TV (California) | San Diego Union-Tribune,SurveyUSA,325.0,SurveyUSA,A,528.0,lv,lv-d,Online,U.S. President,8/1/19,8/5/19,,False,,False,False,8/7/19 19:28,,http://www.surveyusa.com/client/PollReport.aspx?g=949b0f46-a4a4-4480-b675-711e9d6fd657,primary,DEM,Yang,13329.0,Andrew Yang,1.0,2019-08-01
702,California,36.116203000000006,-119.681564,100324.0,58836.0,2020.0,460.0,SurveyUSA,"443,804",KGTV-TV (California) | San Diego Union-Tribune,SurveyUSA,325.0,SurveyUSA,A,528.0,lv,lv-d,Online,U.S. President,8/1/19,8/5/19,,False,,False,False,8/7/19 19:28,,http://www.surveyusa.com/client/PollReport.aspx?g=949b0f46-a4a4-4480-b675-711e9d6fd657,primary,DEM,Buttigieg,13345.0,Pete Buttigieg,6.0,2019-08-01
703,California,36.116203000000006,-119.681564,100324.0,58836.0,2020.0,460.0,SurveyUSA,"443,804",KGTV-TV (California) | San Diego Union-Tribune,SurveyUSA,325.0,SurveyUSA,A,528.0,lv,lv-d,Online,U.S. President,8/1/19,8/5/19,,False,,False,False,8/7/19 19:28,,http://www.surveyusa.com/client/PollReport.aspx?g=949b0f46-a4a4-4480-b675-711e9d6fd657,primary,DEM,Harris,13288.0,Kamala D. Harris,17.0,2019-08-01
704,California,36.116203000000006,-119.681564,100324.0,58836.0,2020.0,460.0,SurveyUSA,"443,804",KGTV-TV (California) | San Diego Union-Tribune,SurveyUSA,325.0,SurveyUSA,A,528.0,lv,lv-d,Online,U.S. President,8/1/19,8/5/19,,False,,False,False,8/7/19 19:28,,http://www.surveyusa.com/client/PollReport.aspx?g=949b0f46-a4a4-4480-b675-711e9d6fd657,primary,DEM,Sanders,13257.0,Bernard Sanders,18.0,2019-08-01
705,California,36.116203000000006,-119.681564,119475.0,64673.0,2020.0,1522.0,Swayable,,,Swayable,543.0,Swayable,,3388.0,lv,lv-d,Online,U.S. President,3/1/20,3/2/20,,False,,False,False,3/3/20 06:18,,https://swayable.com/insights/democratic-primaries-2020-super-tuesday-polling,primary,DEM,Klobuchar,13310.0,Amy Klobuchar,3.3,2020-03-01
706,California,36.116203000000006,-119.681564,119475.0,64673.0,2020.0,1522.0,Swayable,,,Swayable,543.0,Swayable,,3388.0,lv,lv-d,Online,U.S. President,3/1/20,3/2/20,,False,,False,False,3/3/20 06:18,,https://swayable.com/insights/democratic-primaries-2020-super-tuesday-polling,primary,DEM,Steyer,13327.0,Tom Steyer,4.0,2020-03-01
707,California,36.116203000000006,-119.681564,93145.0,57519.0,2020.0,1365.0,Change Research,,,Change Research,48.0,Change Research,C,948.0,lv,lv-d,Online,U.S. President,2/9/19,2/11/19,,False,,False,False,2/14/19 09:32,,https://docsend.com/view/mjz7a9j,primary,DEM,O'Rourke,13276.0,Beto O'Rourke,8.0,2019-02-09
708,California,36.116203000000006,-119.681564,93145.0,57519.0,2020.0,1365.0,Change Research,,,Change Research,48.0,Change Research,C,948.0,lv,lv-d,Online,U.S. President,2/9/19,2/11/19,,False,,False,False,2/14/19 09:32,,https://docsend.com/view/mjz7a9j,primary,DEM,Sanders,13257.0,Bernard Sanders,20.0,2019-02-09
709,California,36.116203000000006,-119.681564,93145.0,57519.0,2020.0,1365.0,Change Research,,,Change Research,48.0,Change Research,C,948.0,lv,lv-d,Online,U.S. President,2/9/19,2/11/19,,False,,False,False,2/14/19 09:32,,https://docsend.com/view/mjz7a9j,primary,DEM,Harris,13288.0,Kamala D. Harris,26.0,2019-02-09
710,California,36.116203000000006,-119.681564,119348.0,64644.0,2020.0,458.0,Suffolk University,135,USA Today,Suffolk University,323.0,Suffolk University,A-,500.0,lv,lv-d,Live Phone,U.S. President,2/26/20,2/29/20,,False,,False,False,3/1/20 16:45,,https://www.suffolk.edu/-/media/suffolk/documents/academics/research-at-suffolk/suprc/polls/other-states/2020/3-1-2020_final_ca_marginals.pdf,primary,DEM,Sanders,13257.0,Bernard Sanders,34.6,2020-02-26
711,California,36.116203000000006,-119.681564,119348.0,64644.0,2020.0,458.0,Suffolk University,135,USA Today,Suffolk University,323.0,Suffolk University,A-,500.0,lv,lv-d,Live Phone,U.S. President,2/26/20,2/29/20,,False,,False,False,3/1/20 16:45,,https://www.suffolk.edu/-/media/suffolk/documents/academics/research-at-suffolk/suprc/polls/other-states/2020/3-1-2020_final_ca_marginals.pdf,primary,DEM,Bloomberg,13289.0,Michael Bloomberg,16.0,2020-02-26
712,California,36.116203000000006,-119.681564,119348.0,64644.0,2020.0,458.0,Suffolk University,135,USA Today,Suffolk University,323.0,Suffolk University,A-,500.0,lv,lv-d,Live Phone,U.S. President,2/26/20,2/29/20,,False,,False,False,3/1/20 16:45,,https://www.suffolk.edu/-/media/suffolk/documents/academics/research-at-suffolk/suprc/polls/other-states/2020/3-1-2020_final_ca_marginals.pdf,primary,DEM,Biden,13256.0,Joseph R. Biden Jr.,14.0,2020-02-26
713,California,36.116203000000006,-119.681564,119348.0,64644.0,2020.0,458.0,Suffolk University,135,USA Today,Suffolk University,323.0,Suffolk University,A-,500.0,lv,lv-d,Live Phone,U.S. President,2/26/20,2/29/20,,False,,False,False,3/1/20 16:45,,https://www.suffolk.edu/-/media/suffolk/documents/academics/research-at-suffolk/suprc/polls/other-states/2020/3-1-2020_final_ca_marginals.pdf,primary,DEM,Warren,13258.0,Elizabeth Warren,12.0,2020-02-26
714,California,36.116203000000006,-119.681564,119348.0,64644.0,2020.0,458.0,Suffolk University,135,USA Today,Suffolk University,323.0,Suffolk University,A-,500.0,lv,lv-d,Live Phone,U.S. President,2/26/20,2/29/20,,False,,False,False,3/1/20 16:45,,https://www.suffolk.edu/-/media/suffolk/documents/academics/research-at-suffolk/suprc/polls/other-states/2020/3-1-2020_final_ca_marginals.pdf,primary,DEM,Buttigieg,13345.0,Pete Buttigieg,6.6,2020-02-26
715,California,36.116203000000006,-119.681564,119348.0,64644.0,2020.0,458.0,Suffolk University,135,USA Today,Suffolk University,323.0,Suffolk University,A-,500.0,lv,lv-d,Live Phone,U.S. President,2/26/20,2/29/20,,False,,False,False,3/1/20 16:45,,https://www.suffolk.edu/-/media/suffolk/documents/academics/research-at-suffolk/suprc/polls/other-states/2020/3-1-2020_final_ca_marginals.pdf,primary,DEM,Klobuchar,13310.0,Amy Klobuchar,4.6,2020-02-26
716,California,36.116203000000006,-119.681564,119348.0,64644.0,2020.0,458.0,Suffolk University,135,USA Today,Suffolk University,323.0,Suffolk University,A-,500.0,lv,lv-d,Live Phone,U.S. President,2/26/20,2/29/20,,False,,False,False,3/1/20 16:45,,https://www.suffolk.edu/-/media/suffolk/documents/academics/research-at-suffolk/suprc/polls/other-states/2020/3-1-2020_final_ca_marginals.pdf,primary,DEM,Steyer,13327.0,Tom Steyer,3.4,2020-02-26
717,California,36.116203000000006,-119.681564,119348.0,64644.0,2020.0,458.0,Suffolk University,135,USA Today,Suffolk University,323.0,Suffolk University,A-,500.0,lv,lv-d,Live Phone,U.S. President,2/26/20,2/29/20,,False,,False,False,3/1/20 16:45,,https://www.suffolk.edu/-/media/suffolk/documents/academics/research-at-suffolk/suprc/polls/other-states/2020/3-1-2020_final_ca_marginals.pdf,primary,DEM,Gabbard,13343.0,Tulsi Gabbard,2.8,2020-02-26
718,California,36.116203000000006,-119.681564,93145.0,57519.0,2020.0,1365.0,Change Research,,,Change Research,48.0,Change Research,C,948.0,lv,lv-d,Online,U.S. President,2/9/19,2/11/19,,False,,False,False,2/14/19 09:32,,https://docsend.com/view/mjz7a9j,primary,DEM,Biden,13256.0,Joseph R. Biden Jr.,26.0,2019-02-09
719,California,36.116203000000006,-119.681564,99518.0,58698.0,2020.0,568.0,YouGov,133,CBS News,YouGov,391.0,YouGov,B-,1404.0,lv,lv-d,Online,U.S. President,7/9/19,7/18/19,,False,,False,False,7/21/19 10:44,,https://d25d2506sfb94s.cloudfront.net/cumulus_uploads/document/h7ookmkwri/cbsnews_dems_20190721_final.pdf,primary,DEM,Castro,13316.0,Julián Castro,1.0,2019-07-09
720,California,36.116203000000006,-119.681564,119292.0,64627.0,2020.0,1539.0,Point Blank Political,,,Point Blank Political,550.0,Point Blank Political,,2276.0,lv,lv-d,Online/Text,U.S. President,2/26/20,2/28/20,,False,,False,False,2/29/20 09:28,,https://www.pointblankpolitical.com/2020-ca-dem-primary-post-debate/,primary,DEM,Sanders,13257.0,Bernard Sanders,34.1,2020-02-26
721,California,36.116203000000006,-119.681564,119292.0,64627.0,2020.0,1539.0,Point Blank Political,,,Point Blank Political,550.0,Point Blank Political,,2276.0,lv,lv-d,Online/Text,U.S. President,2/26/20,2/28/20,,False,,False,False,2/29/20 09:28,,https://www.pointblankpolitical.com/2020-ca-dem-primary-post-debate/,primary,DEM,Warren,13258.0,Elizabeth Warren,14.0,2020-02-26
722,California,36.116203000000006,-119.681564,119292.0,64627.0,2020.0,1539.0,Point Blank Political,,,Point Blank Political,550.0,Point Blank Political,,2276.0,lv,lv-d,Online/Text,U.S. President,2/26/20,2/28/20,,False,,False,False,2/29/20 09:28,,https://www.pointblankpolitical.com/2020-ca-dem-primary-post-debate/,primary,DEM,Biden,13256.0,Joseph R. Biden Jr.,14.0,2020-02-26
723,California,36.116203000000006,-119.681564,119292.0,64627.0,2020.0,1539.0,Point Blank Political,,,Point Blank Political,550.0,Point Blank Political,,2276.0,lv,lv-d,Online/Text,U.S. President,2/26/20,2/28/20,,False,,False,False,2/29/20 09:28,,https://www.pointblankpolitical.com/2020-ca-dem-primary-post-debate/,primary,DEM,Bloomberg,13289.0,Michael Bloomberg,11.7,2020-02-26
724,California,36.116203000000006,-119.681564,119292.0,64627.0,2020.0,1539.0,Point Blank Political,,,Point Blank Political,550.0,Point Blank Political,,2276.0,lv,lv-d,Online/Text,U.S. President,2/26/20,2/28/20,,False,,False,False,2/29/20 09:28,,https://www.pointblankpolitical.com/2020-ca-dem-primary-post-debate/,primary,DEM,Buttigieg,13345.0,Pete Buttigieg,8.8,2020-02-26
725,California,36.116203000000006,-119.681564,119292.0,64627.0,2020.0,1539.0,Point Blank Political,,,Point Blank Political,550.0,Point Blank Political,,2276.0,lv,lv-d,Online/Text,U.S. President,2/26/20,2/28/20,,False,,False,False,2/29/20 09:28,,https://www.pointblankpolitical.com/2020-ca-dem-primary-post-debate/,primary,DEM,Klobuchar,13310.0,Amy Klobuchar,3.3,2020-02-26
726,California,36.116203000000006,-119.681564,119292.0,64627.0,2020.0,1539.0,Point Blank Political,,,Point Blank Political,550.0,Point Blank Political,,2276.0,lv,lv-d,Online/Text,U.S. President,2/26/20,2/28/20,,False,,False,False,2/29/20 09:28,,https://www.pointblankpolitical.com/2020-ca-dem-primary-post-debate/,primary,DEM,Steyer,13327.0,Tom Steyer,2.5,2020-02-26
727,California,36.116203000000006,-119.681564,93145.0,57519.0,2020.0,1365.0,Change Research,,,Change Research,48.0,Change Research,C,948.0,lv,lv-d,Online,U.S. President,2/9/19,2/11/19,,False,,False,False,2/14/19 09:32,,https://docsend.com/view/mjz7a9j,primary,DEM,Warren,13258.0,Elizabeth Warren,7.0,2019-02-09
728,California,36.116203000000006,-119.681564,119292.0,64627.0,2020.0,1539.0,Point Blank Political,,,Point Blank Political,550.0,Point Blank Political,,2276.0,lv,lv-d,Online/Text,U.S. President,2/26/20,2/28/20,,False,,False,False,2/29/20 09:28,,https://www.pointblankpolitical.com/2020-ca-dem-primary-post-debate/,primary,DEM,Gabbard,13343.0,Tulsi Gabbard,1.0,2020-02-26
729,California,36.116203000000006,-119.681564,93145.0,57519.0,2020.0,1365.0,Change Research,,,Change Research,48.0,Change Research,C,948.0,lv,lv-d,Online,U.S. President,2/9/19,2/11/19,,False,,False,False,2/14/19 09:32,,https://docsend.com/view/mjz7a9j,primary,DEM,Booker,13287.0,Cory A. Booker,3.0,2019-02-09
730,California,36.116203000000006,-119.681564,93145.0,57519.0,2020.0,1365.0,Change Research,,,Change Research,48.0,Change Research,C,948.0,lv,lv-d,Online,U.S. President,2/9/19,2/11/19,,False,,False,False,2/14/19 09:32,,https://docsend.com/view/mjz7a9j,primary,DEM,Brown,13255.0,Sherrod Brown,1.0,2019-02-09
731,California,36.116203000000006,-119.681564,93145.0,57519.0,2020.0,1365.0,Change Research,,,Change Research,48.0,Change Research,C,948.0,lv,lv-d,Online,U.S. President,2/9/19,2/11/19,,False,,False,False,2/14/19 09:32,,https://docsend.com/view/mjz7a9j,primary,DEM,Inslee,13324.0,Jay Robert Inslee,0.0,2019-02-09
732,California,36.116203000000006,-119.681564,93145.0,57519.0,2020.0,1365.0,Change Research,,,Change Research,48.0,Change Research,C,948.0,lv,lv-d,Online,U.S. President,2/9/19,2/11/19,,False,,False,False,2/14/19 09:32,,https://docsend.com/view/mjz7a9j,primary,DEM,Delaney,13314.0,John K. Delaney,0.0,2019-02-09
733,California,36.116203000000006,-119.681564,93145.0,57519.0,2020.0,1365.0,Change Research,,,Change Research,48.0,Change Research,C,948.0,lv,lv-d,Online,U.S. President,2/9/19,2/11/19,,False,,False,False,2/14/19 09:32,,https://docsend.com/view/mjz7a9j,primary,DEM,Swalwell,13328.0,Eric Swalwell,0.0,2019-02-09
734,California,36.116203000000006,-119.681564,100324.0,58836.0,2020.0,460.0,SurveyUSA,"443,804",KGTV-TV (California) | San Diego Union-Tribune,SurveyUSA,325.0,SurveyUSA,A,528.0,lv,lv-d,Online,U.S. President,8/1/19,8/5/19,,False,,False,False,8/7/19 19:28,,http://www.surveyusa.com/client/PollReport.aspx?g=949b0f46-a4a4-4480-b675-711e9d6fd657,primary,DEM,Gillibrand,13311.0,Kirsten E. Gillibrand,0.0,2019-08-01
735,California,36.116203000000006,-119.681564,100324.0,58836.0,2020.0,460.0,SurveyUSA,"443,804",KGTV-TV (California) | San Diego Union-Tribune,SurveyUSA,325.0,SurveyUSA,A,528.0,lv,lv-d,Online,U.S. President,8/1/19,8/5/19,,False,,False,False,8/7/19 19:28,,http://www.surveyusa.com/client/PollReport.aspx?g=949b0f46-a4a4-4480-b675-711e9d6fd657,primary,DEM,Klobuchar,13310.0,Amy Klobuchar,0.0,2019-08-01
736,California,36.116203000000006,-119.681564,100324.0,58836.0,2020.0,460.0,SurveyUSA,"443,804",KGTV-TV (California) | San Diego Union-Tribune,SurveyUSA,325.0,SurveyUSA,A,528.0,lv,lv-d,Online,U.S. President,8/1/19,8/5/19,,False,,False,False,8/7/19 19:28,,http://www.surveyusa.com/client/PollReport.aspx?g=949b0f46-a4a4-4480-b675-711e9d6fd657,primary,DEM,Delaney,13314.0,John K. Delaney,0.0,2019-08-01
737,California,36.116203000000006,-119.681564,100324.0,58836.0,2020.0,460.0,SurveyUSA,"443,804",KGTV-TV (California) | San Diego Union-Tribune,SurveyUSA,325.0,SurveyUSA,A,528.0,lv,lv-d,Online,U.S. President,8/1/19,8/5/19,,False,,False,False,8/7/19 19:28,,http://www.surveyusa.com/client/PollReport.aspx?g=949b0f46-a4a4-4480-b675-711e9d6fd657,primary,DEM,de Blasio,13335.0,Bill de Blasio,0.0,2019-08-01
738,California,36.116203000000006,-119.681564,100324.0,58836.0,2020.0,460.0,SurveyUSA,"443,804",KGTV-TV (California) | San Diego Union-Tribune,SurveyUSA,325.0,SurveyUSA,A,528.0,lv,lv-d,Online,U.S. President,8/1/19,8/5/19,,False,,False,False,8/7/19 19:28,,http://www.surveyusa.com/client/PollReport.aspx?g=949b0f46-a4a4-4480-b675-711e9d6fd657,primary,DEM,O'Rourke,13276.0,Beto O'Rourke,0.0,2019-08-01
739,California,36.116203000000006,-119.681564,100324.0,58836.0,2020.0,460.0,SurveyUSA,"443,804",KGTV-TV (California) | San Diego Union-Tribune,SurveyUSA,325.0,SurveyUSA,A,528.0,lv,lv-d,Online,U.S. President,8/1/19,8/5/19,,False,,False,False,8/7/19 19:28,,http://www.surveyusa.com/client/PollReport.aspx?g=949b0f46-a4a4-4480-b675-711e9d6fd657,primary,DEM,Williamson,13350.0,Marianne Williamson,0.0,2019-08-01
740,California,36.116203000000006,-119.681564,100324.0,58836.0,2020.0,460.0,SurveyUSA,"443,804",KGTV-TV (California) | San Diego Union-Tribune,SurveyUSA,325.0,SurveyUSA,A,528.0,lv,lv-d,Online,U.S. President,8/1/19,8/5/19,,False,,False,False,8/7/19 19:28,,http://www.surveyusa.com/client/PollReport.aspx?g=949b0f46-a4a4-4480-b675-711e9d6fd657,primary,DEM,Castro,13316.0,Julián Castro,0.0,2019-08-01
741,California,36.116203000000006,-119.681564,100324.0,58836.0,2020.0,460.0,SurveyUSA,"443,804",KGTV-TV (California) | San Diego Union-Tribune,SurveyUSA,325.0,SurveyUSA,A,528.0,lv,lv-d,Online,U.S. President,8/1/19,8/5/19,,False,,False,False,8/7/19 19:28,,http://www.surveyusa.com/client/PollReport.aspx?g=949b0f46-a4a4-4480-b675-711e9d6fd657,primary,DEM,Booker,13287.0,Cory A. Booker,1.0,2019-08-01
742,California,36.116203000000006,-119.681564,93145.0,57519.0,2020.0,1365.0,Change Research,,,Change Research,48.0,Change Research,C,948.0,lv,lv-d,Online,U.S. President,2/9/19,2/11/19,,False,,False,False,2/14/19 09:32,,https://docsend.com/view/mjz7a9j,primary,DEM,Cuomo,13313.0,Andrew Cuomo,0.0,2019-02-09
743,California,36.116203000000006,-119.681564,93145.0,57519.0,2020.0,1365.0,Change Research,,,Change Research,48.0,Change Research,C,948.0,lv,lv-d,Online,U.S. President,2/9/19,2/11/19,,False,,False,False,2/14/19 09:32,,https://docsend.com/view/mjz7a9j,primary,DEM,Bloomberg,13289.0,Michael Bloomberg,0.0,2019-02-09
744,California,36.116203000000006,-119.681564,93145.0,57519.0,2020.0,1365.0,Change Research,,,Change Research,48.0,Change Research,C,948.0,lv,lv-d,Online,U.S. President,2/9/19,2/11/19,,False,,False,False,2/14/19 09:32,,https://docsend.com/view/mjz7a9j,primary,DEM,Klobuchar,13310.0,Amy Klobuchar,1.0,2019-02-09
745,California,36.116203000000006,-119.681564,93145.0,57519.0,2020.0,1365.0,Change Research,,,Change Research,48.0,Change Research,C,948.0,lv,lv-d,Online,U.S. President,2/9/19,2/11/19,,False,,False,False,2/14/19 09:32,,https://docsend.com/view/mjz7a9j,primary,DEM,Buttigieg,13345.0,Pete Buttigieg,1.0,2019-02-09
746,California,36.116203000000006,-119.681564,93145.0,57519.0,2020.0,1365.0,Change Research,,,Change Research,48.0,Change Research,C,948.0,lv,lv-d,Online,U.S. President,2/9/19,2/11/19,,False,,False,False,2/14/19 09:32,,https://docsend.com/view/mjz7a9j,primary,DEM,Holder,13312.0,Eric H. Holder,1.0,2019-02-09
747,California,36.116203000000006,-119.681564,93145.0,57519.0,2020.0,1365.0,Change Research,,,Change Research,48.0,Change Research,C,948.0,lv,lv-d,Online,U.S. President,2/9/19,2/11/19,,False,,False,False,2/14/19 09:32,,https://docsend.com/view/mjz7a9j,primary,DEM,Gillibrand,13311.0,Kirsten E. Gillibrand,1.0,2019-02-09
748,California,36.116203000000006,-119.681564,119346.0,64642.0,2020.0,568.0,YouGov,133,CBS News,YouGov,391.0,YouGov,B-,1411.0,lv,lv-d,Online,U.S. President,2/27/20,2/29/20,,False,,False,False,3/1/20 10:33,,https://drive.google.com/file/d/12inCh6uWKgHaqw6wpbLX-hewghd4H_np/view,primary,DEM,Sanders,13257.0,Bernard Sanders,31.0,2020-02-27
749,California,36.116203000000006,-119.681564,119346.0,64642.0,2020.0,568.0,YouGov,133,CBS News,YouGov,391.0,YouGov,B-,1411.0,lv,lv-d,Online,U.S. President,2/27/20,2/29/20,,False,,False,False,3/1/20 10:33,,https://drive.google.com/file/d/12inCh6uWKgHaqw6wpbLX-hewghd4H_np/view,primary,DEM,Biden,13256.0,Joseph R. Biden Jr.,19.0,2020-02-27
750,California,36.116203000000006,-119.681564,119346.0,64642.0,2020.0,568.0,YouGov,133,CBS News,YouGov,391.0,YouGov,B-,1411.0,lv,lv-d,Online,U.S. President,2/27/20,2/29/20,,False,,False,False,3/1/20 10:33,,https://drive.google.com/file/d/12inCh6uWKgHaqw6wpbLX-hewghd4H_np/view,primary,DEM,Warren,13258.0,Elizabeth Warren,18.0,2020-02-27
751,California,36.116203000000006,-119.681564,119346.0,64642.0,2020.0,568.0,YouGov,133,CBS News,YouGov,391.0,YouGov,B-,1411.0,lv,lv-d,Online,U.S. President,2/27/20,2/29/20,,False,,False,False,3/1/20 10:33,,https://drive.google.com/file/d/12inCh6uWKgHaqw6wpbLX-hewghd4H_np/view,primary,DEM,Bloomberg,13289.0,Michael Bloomberg,12.0,2020-02-27
752,California,36.116203000000006,-119.681564,119346.0,64642.0,2020.0,568.0,YouGov,133,CBS News,YouGov,391.0,YouGov,B-,1411.0,lv,lv-d,Online,U.S. President,2/27/20,2/29/20,,False,,False,False,3/1/20 10:33,,https://drive.google.com/file/d/12inCh6uWKgHaqw6wpbLX-hewghd4H_np/view,primary,DEM,Buttigieg,13345.0,Pete Buttigieg,9.0,2020-02-27
753,California,36.116203000000006,-119.681564,119346.0,64642.0,2020.0,568.0,YouGov,133,CBS News,YouGov,391.0,YouGov,B-,1411.0,lv,lv-d,Online,U.S. President,2/27/20,2/29/20,,False,,False,False,3/1/20 10:33,,https://drive.google.com/file/d/12inCh6uWKgHaqw6wpbLX-hewghd4H_np/view,primary,DEM,Klobuchar,13310.0,Amy Klobuchar,4.0,2020-02-27
754,California,36.116203000000006,-119.681564,119346.0,64642.0,2020.0,568.0,YouGov,133,CBS News,YouGov,391.0,YouGov,B-,1411.0,lv,lv-d,Online,U.S. President,2/27/20,2/29/20,,False,,False,False,3/1/20 10:33,,https://drive.google.com/file/d/12inCh6uWKgHaqw6wpbLX-hewghd4H_np/view,primary,DEM,Steyer,13327.0,Tom Steyer,3.0,2020-02-27
755,California,36.116203000000006,-119.681564,116200.0,63367.0,2020.0,1363.0,"University of California, Berkeley",300,LA Times,"University of California, Berkeley",457.0,"University of California, Berkeley",B/C,2895.0,lv,lv-d,Online,U.S. President,1/15/20,1/21/20,,False,,False,False,1/28/20 06:21,,https://escholarship.org/uc/item/1h8738br,primary,DEM,Biden,13256.0,Joseph R. Biden Jr.,15.0,2020-01-15
756,California,36.116203000000006,-119.681564,119346.0,64642.0,2020.0,568.0,YouGov,133,CBS News,YouGov,391.0,YouGov,B-,1411.0,lv,lv-d,Online,U.S. President,2/27/20,2/29/20,,False,,False,False,3/1/20 10:33,,https://drive.google.com/file/d/12inCh6uWKgHaqw6wpbLX-hewghd4H_np/view,primary,DEM,Gabbard,13343.0,Tulsi Gabbard,1.0,2020-02-27
757,California,36.116203000000006,-119.681564,93145.0,57519.0,2020.0,1365.0,Change Research,,,Change Research,48.0,Change Research,C,948.0,lv,lv-d,Online,U.S. President,2/9/19,2/11/19,,False,,False,False,2/14/19 09:32,,https://docsend.com/view/mjz7a9j,primary,DEM,Gabbard,13343.0,Tulsi Gabbard,1.0,2019-02-09
758,California,36.116203000000006,-119.681564,93145.0,57519.0,2020.0,1365.0,Change Research,,,Change Research,48.0,Change Research,C,948.0,lv,lv-d,Online,U.S. President,2/9/19,2/11/19,,False,,False,False,2/14/19 09:32,,https://docsend.com/view/mjz7a9j,primary,DEM,Castro,13316.0,Julián Castro,2.0,2019-02-09
759,California,36.116203000000006,-119.681564,93145.0,57519.0,2020.0,1365.0,Change Research,,,Change Research,48.0,Change Research,C,948.0,lv,lv-d,Online,U.S. President,2/9/19,2/11/19,,False,,False,False,2/14/19 09:32,,https://docsend.com/view/mjz7a9j,primary,DEM,Bullock,13320.0,Steve Bullock,0.0,2019-02-09
760,California,36.116203000000006,-119.681564,119293.0,64627.0,2020.0,1539.0,Point Blank Political,,,Point Blank Political,550.0,Point Blank Political,,2276.0,lv,lv-d,Online/Text,U.S. President,2/26/20,2/28/20,,False,,False,False,2/29/20 09:28,head-to-head poll,https://www.pointblankpolitical.com/2020-ca-dem-primary-post-debate/,primary,DEM,Sanders,13257.0,Bernard Sanders,49.6,2020-02-26
761,California,36.116203000000006,-119.681564,119294.0,64627.0,2020.0,1539.0,Point Blank Political,,,Point Blank Political,550.0,Point Blank Political,,2276.0,lv,lv-d,Online/Text,U.S. President,2/26/20,2/28/20,,False,,False,False,2/29/20 09:28,head-to-head poll,https://www.pointblankpolitical.com/2020-ca-dem-primary-post-debate/,primary,DEM,Sanders,13257.0,Bernard Sanders,57.2,2020-02-26
762,California,36.116203000000006,-119.681564,102779.0,59589.0,2020.0,1491.0,Capitol Weekly,,,Capitol Weekly,510.0,Capitol Weekly,,599.0,lv,lv-d,Online,U.S. President,9/1/19,9/13/19,,False,,False,False,9/17/19 08:50,,https://www.dropbox.com/s/svk9hn0dof8301b/Sept%202019%20Presidential%20Primary%20Tracking%20Poll%20Toplines%20and%20Crosstabs.xlsx,primary,DEM,de Blasio,13335.0,Bill de Blasio,0.0,2019-09-01
763,California,36.116203000000006,-119.681564,102779.0,59589.0,2020.0,1491.0,Capitol Weekly,,,Capitol Weekly,510.0,Capitol Weekly,,599.0,lv,lv-d,Online,U.S. President,9/1/19,9/13/19,,False,,False,False,9/17/19 08:50,,https://www.dropbox.com/s/svk9hn0dof8301b/Sept%202019%20Presidential%20Primary%20Tracking%20Poll%20Toplines%20and%20Crosstabs.xlsx,primary,DEM,Delaney,13314.0,John K. Delaney,0.0,2019-09-01
764,California,36.116203000000006,-119.681564,102779.0,59589.0,2020.0,1491.0,Capitol Weekly,,,Capitol Weekly,510.0,Capitol Weekly,,599.0,lv,lv-d,Online,U.S. President,9/1/19,9/13/19,,False,,False,False,9/17/19 08:50,,https://www.dropbox.com/s/svk9hn0dof8301b/Sept%202019%20Presidential%20Primary%20Tracking%20Poll%20Toplines%20and%20Crosstabs.xlsx,primary,DEM,Steyer,13327.0,Tom Steyer,0.0,2019-09-01
765,California,36.116203000000006,-119.681564,102779.0,59589.0,2020.0,1491.0,Capitol Weekly,,,Capitol Weekly,510.0,Capitol Weekly,,599.0,lv,lv-d,Online,U.S. President,9/1/19,9/13/19,,False,,False,False,9/17/19 08:50,,https://www.dropbox.com/s/svk9hn0dof8301b/Sept%202019%20Presidential%20Primary%20Tracking%20Poll%20Toplines%20and%20Crosstabs.xlsx,primary,DEM,Ryan,13358.0,Tim Ryan,0.0,2019-09-01
766,California,36.116203000000006,-119.681564,102779.0,59589.0,2020.0,1491.0,Capitol Weekly,,,Capitol Weekly,510.0,Capitol Weekly,,599.0,lv,lv-d,Online,U.S. President,9/1/19,9/13/19,,False,,False,False,9/17/19 08:50,,https://www.dropbox.com/s/svk9hn0dof8301b/Sept%202019%20Presidential%20Primary%20Tracking%20Poll%20Toplines%20and%20Crosstabs.xlsx,primary,DEM,Williamson,13350.0,Marianne Williamson,1.0,2019-09-01
767,California,36.116203000000006,-119.681564,102779.0,59589.0,2020.0,1491.0,Capitol Weekly,,,Capitol Weekly,510.0,Capitol Weekly,,599.0,lv,lv-d,Online,U.S. President,9/1/19,9/13/19,,False,,False,False,9/17/19 08:50,,https://www.dropbox.com/s/svk9hn0dof8301b/Sept%202019%20Presidential%20Primary%20Tracking%20Poll%20Toplines%20and%20Crosstabs.xlsx,primary,DEM,Castro,13316.0,Julián Castro,1.0,2019-09-01
768,California,36.116203000000006,-119.681564,102779.0,59589.0,2020.0,1491.0,Capitol Weekly,,,Capitol Weekly,510.0,Capitol Weekly,,599.0,lv,lv-d,Online,U.S. President,9/1/19,9/13/19,,False,,False,False,9/17/19 08:50,,https://www.dropbox.com/s/svk9hn0dof8301b/Sept%202019%20Presidential%20Primary%20Tracking%20Poll%20Toplines%20and%20Crosstabs.xlsx,primary,DEM,Gabbard,13343.0,Tulsi Gabbard,2.0,2019-09-01
769,California,36.116203000000006,-119.681564,102779.0,59589.0,2020.0,1491.0,Capitol Weekly,,,Capitol Weekly,510.0,Capitol Weekly,,599.0,lv,lv-d,Online,U.S. President,9/1/19,9/13/19,,False,,False,False,9/17/19 08:50,,https://www.dropbox.com/s/svk9hn0dof8301b/Sept%202019%20Presidential%20Primary%20Tracking%20Poll%20Toplines%20and%20Crosstabs.xlsx,primary,DEM,Klobuchar,13310.0,Amy Klobuchar,1.0,2019-09-01
770,California,36.116203000000006,-119.681564,102779.0,59589.0,2020.0,1491.0,Capitol Weekly,,,Capitol Weekly,510.0,Capitol Weekly,,599.0,lv,lv-d,Online,U.S. President,9/1/19,9/13/19,,False,,False,False,9/17/19 08:50,,https://www.dropbox.com/s/svk9hn0dof8301b/Sept%202019%20Presidential%20Primary%20Tracking%20Poll%20Toplines%20and%20Crosstabs.xlsx,primary,DEM,Yang,13329.0,Andrew Yang,4.0,2019-09-01
771,California,36.116203000000006,-119.681564,102779.0,59589.0,2020.0,1491.0,Capitol Weekly,,,Capitol Weekly,510.0,Capitol Weekly,,599.0,lv,lv-d,Online,U.S. President,9/1/19,9/13/19,,False,,False,False,9/17/19 08:50,,https://www.dropbox.com/s/svk9hn0dof8301b/Sept%202019%20Presidential%20Primary%20Tracking%20Poll%20Toplines%20and%20Crosstabs.xlsx,primary,DEM,Booker,13287.0,Cory A. Booker,1.0,2019-09-01
772,California,36.116203000000006,-119.681564,102779.0,59589.0,2020.0,1491.0,Capitol Weekly,,,Capitol Weekly,510.0,Capitol Weekly,,599.0,lv,lv-d,Online,U.S. President,9/1/19,9/13/19,,False,,False,False,9/17/19 08:50,,https://www.dropbox.com/s/svk9hn0dof8301b/Sept%202019%20Presidential%20Primary%20Tracking%20Poll%20Toplines%20and%20Crosstabs.xlsx,primary,DEM,O'Rourke,13276.0,Beto O'Rourke,2.0,2019-09-01
773,California,36.116203000000006,-119.681564,102779.0,59589.0,2020.0,1491.0,Capitol Weekly,,,Capitol Weekly,510.0,Capitol Weekly,,599.0,lv,lv-d,Online,U.S. President,9/1/19,9/13/19,,False,,False,False,9/17/19 08:50,,https://www.dropbox.com/s/svk9hn0dof8301b/Sept%202019%20Presidential%20Primary%20Tracking%20Poll%20Toplines%20and%20Crosstabs.xlsx,primary,DEM,Buttigieg,13345.0,Pete Buttigieg,7.0,2019-09-01
774,California,36.116203000000006,-119.681564,102779.0,59589.0,2020.0,1491.0,Capitol Weekly,,,Capitol Weekly,510.0,Capitol Weekly,,599.0,lv,lv-d,Online,U.S. President,9/1/19,9/13/19,,False,,False,False,9/17/19 08:50,,https://www.dropbox.com/s/svk9hn0dof8301b/Sept%202019%20Presidential%20Primary%20Tracking%20Poll%20Toplines%20and%20Crosstabs.xlsx,primary,DEM,Harris,13288.0,Kamala D. Harris,11.0,2019-09-01
775,California,36.116203000000006,-119.681564,102779.0,59589.0,2020.0,1491.0,Capitol Weekly,,,Capitol Weekly,510.0,Capitol Weekly,,599.0,lv,lv-d,Online,U.S. President,9/1/19,9/13/19,,False,,False,False,9/17/19 08:50,,https://www.dropbox.com/s/svk9hn0dof8301b/Sept%202019%20Presidential%20Primary%20Tracking%20Poll%20Toplines%20and%20Crosstabs.xlsx,primary,DEM,Sanders,13257.0,Bernard Sanders,21.0,2019-09-01
776,California,36.116203000000006,-119.681564,102779.0,59589.0,2020.0,1491.0,Capitol Weekly,,,Capitol Weekly,510.0,Capitol Weekly,,599.0,lv,lv-d,Online,U.S. President,9/1/19,9/13/19,,False,,False,False,9/17/19 08:50,,https://www.dropbox.com/s/svk9hn0dof8301b/Sept%202019%20Presidential%20Primary%20Tracking%20Poll%20Toplines%20and%20Crosstabs.xlsx,primary,DEM,Warren,13258.0,Elizabeth Warren,29.0,2019-09-01
777,California,36.116203000000006,-119.681564,102779.0,59589.0,2020.0,1491.0,Capitol Weekly,,,Capitol Weekly,510.0,Capitol Weekly,,599.0,lv,lv-d,Online,U.S. President,9/1/19,9/13/19,,False,,False,False,9/17/19 08:50,,https://www.dropbox.com/s/svk9hn0dof8301b/Sept%202019%20Presidential%20Primary%20Tracking%20Poll%20Toplines%20and%20Crosstabs.xlsx,primary,DEM,Biden,13256.0,Joseph R. Biden Jr.,18.0,2019-09-01
778,California,36.116203000000006,-119.681564,99518.0,58698.0,2020.0,568.0,YouGov,133,CBS News,YouGov,391.0,YouGov,B-,1404.0,lv,lv-d,Online,U.S. President,7/9/19,7/18/19,,False,,False,False,7/21/19 10:44,,https://d25d2506sfb94s.cloudfront.net/cumulus_uploads/document/h7ookmkwri/cbsnews_dems_20190721_final.pdf,primary,DEM,Hickenlooper,13326.0,John Hickenlooper,0.0,2019-07-09
779,California,36.116203000000006,-119.681564,99518.0,58698.0,2020.0,568.0,YouGov,133,CBS News,YouGov,391.0,YouGov,B-,1404.0,lv,lv-d,Online,U.S. President,7/9/19,7/18/19,,False,,False,False,7/21/19 10:44,,https://d25d2506sfb94s.cloudfront.net/cumulus_uploads/document/h7ookmkwri/cbsnews_dems_20190721_final.pdf,primary,DEM,Ryan,13358.0,Tim Ryan,0.0,2019-07-09
780,California,36.116203000000006,-119.681564,99518.0,58698.0,2020.0,568.0,YouGov,133,CBS News,YouGov,391.0,YouGov,B-,1404.0,lv,lv-d,Online,U.S. President,7/9/19,7/18/19,,False,,False,False,7/21/19 10:44,,https://d25d2506sfb94s.cloudfront.net/cumulus_uploads/document/h7ookmkwri/cbsnews_dems_20190721_final.pdf,primary,DEM,Messam,13357.0,Wayne Messam,0.0,2019-07-09
781,California,36.116203000000006,-119.681564,99518.0,58698.0,2020.0,568.0,YouGov,133,CBS News,YouGov,391.0,YouGov,B-,1404.0,lv,lv-d,Online,U.S. President,7/9/19,7/18/19,,False,,False,False,7/21/19 10:44,,https://d25d2506sfb94s.cloudfront.net/cumulus_uploads/document/h7ookmkwri/cbsnews_dems_20190721_final.pdf,primary,DEM,Moulton,13322.0,Seth Moulton,0.0,2019-07-09
782,California,36.116203000000006,-119.681564,99518.0,58698.0,2020.0,568.0,YouGov,133,CBS News,YouGov,391.0,YouGov,B-,1404.0,lv,lv-d,Online,U.S. President,7/9/19,7/18/19,,False,,False,False,7/21/19 10:44,,https://d25d2506sfb94s.cloudfront.net/cumulus_uploads/document/h7ookmkwri/cbsnews_dems_20190721_final.pdf,primary,DEM,Gillibrand,13311.0,Kirsten E. Gillibrand,0.0,2019-07-09
783,California,36.116203000000006,-119.681564,99518.0,58698.0,2020.0,568.0,YouGov,133,CBS News,YouGov,391.0,YouGov,B-,1404.0,lv,lv-d,Online,U.S. President,7/9/19,7/18/19,,False,,False,False,7/21/19 10:44,,https://d25d2506sfb94s.cloudfront.net/cumulus_uploads/document/h7ookmkwri/cbsnews_dems_20190721_final.pdf,primary,DEM,de Blasio,13335.0,Bill de Blasio,0.0,2019-07-09
784,California,36.116203000000006,-119.681564,99518.0,58698.0,2020.0,568.0,YouGov,133,CBS News,YouGov,391.0,YouGov,B-,1404.0,lv,lv-d,Online,U.S. President,7/9/19,7/18/19,,False,,False,False,7/21/19 10:44,,https://d25d2506sfb94s.cloudfront.net/cumulus_uploads/document/h7ookmkwri/cbsnews_dems_20190721_final.pdf,primary,DEM,Sestak,13381.0,Joe Sestak,0.0,2019-07-09
785,California,36.116203000000006,-119.681564,99461.0,58680.0,2020.0,1491.0,Capitol Weekly,,,Capitol Weekly,510.0,Capitol Weekly,,951.0,lv,lv-d,Online,U.S. President,5/1/19,5/31/19,,False,,False,False,7/17/19 15:00,,https://public.tableau.com/profile/capitol.weekly#!/vizhome/2020PrimaryTrackingSurvey_15626518585990/CA120POLLSTORY,primary,DEM,Buttigieg,13345.0,Pete Buttigieg,9.3,2019-05-01
786,California,36.116203000000006,-119.681564,99461.0,58680.0,2020.0,1491.0,Capitol Weekly,,,Capitol Weekly,510.0,Capitol Weekly,,951.0,lv,lv-d,Online,U.S. President,5/1/19,5/31/19,,False,,False,False,7/17/19 15:00,,https://public.tableau.com/profile/capitol.weekly#!/vizhome/2020PrimaryTrackingSurvey_15626518585990/CA120POLLSTORY,primary,DEM,O'Rourke,13276.0,Beto O'Rourke,4.4,2019-05-01
787,California,36.116203000000006,-119.681564,119475.0,64673.0,2020.0,1522.0,Swayable,,,Swayable,543.0,Swayable,,3388.0,lv,lv-d,Online,U.S. President,3/1/20,3/2/20,,False,,False,False,3/3/20 06:18,,https://swayable.com/insights/democratic-primaries-2020-super-tuesday-polling,primary,DEM,Gabbard,13343.0,Tulsi Gabbard,0.1,2020-03-01
788,California,36.116203000000006,-119.681564,102994.0,59618.0,2020.0,1365.0,Change Research,1186,KQED,Change Research,48.0,Change Research,C,3325.0,lv,lv-d,Online,U.S. President,9/12/19,9/15/19,,False,,False,False,9/19/19 12:43,,https://www.changeresearch.com/california-poll-sept-12-15,primary,DEM,Delaney,13314.0,John K. Delaney,0.0,2019-09-12
789,California,36.116203000000006,-119.681564,99518.0,58698.0,2020.0,568.0,YouGov,133,CBS News,YouGov,391.0,YouGov,B-,1404.0,lv,lv-d,Online,U.S. President,7/9/19,7/18/19,,False,,False,False,7/21/19 10:44,,https://d25d2506sfb94s.cloudfront.net/cumulus_uploads/document/h7ookmkwri/cbsnews_dems_20190721_final.pdf,primary,DEM,Delaney,13314.0,John K. Delaney,0.0,2019-07-09
790,California,36.116203000000006,-119.681564,119293.0,64627.0,2020.0,1539.0,Point Blank Political,,,Point Blank Political,550.0,Point Blank Political,,2276.0,lv,lv-d,Online/Text,U.S. President,2/26/20,2/28/20,,False,,False,False,2/29/20 09:28,head-to-head poll,https://www.pointblankpolitical.com/2020-ca-dem-primary-post-debate/,primary,DEM,Biden,13256.0,Joseph R. Biden Jr.,39.9,2020-02-26
791,California,36.116203000000006,-119.681564,99518.0,58698.0,2020.0,568.0,YouGov,133,CBS News,YouGov,391.0,YouGov,B-,1404.0,lv,lv-d,Online,U.S. President,7/9/19,7/18/19,,False,,False,False,7/21/19 10:44,,https://d25d2506sfb94s.cloudfront.net/cumulus_uploads/document/h7ookmkwri/cbsnews_dems_20190721_final.pdf,primary,DEM,Inslee,13324.0,Jay Robert Inslee,0.0,2019-07-09
792,California,36.116203000000006,-119.681564,99518.0,58698.0,2020.0,568.0,YouGov,133,CBS News,YouGov,391.0,YouGov,B-,1404.0,lv,lv-d,Online,U.S. President,7/9/19,7/18/19,,False,,False,False,7/21/19 10:44,,https://d25d2506sfb94s.cloudfront.net/cumulus_uploads/document/h7ookmkwri/cbsnews_dems_20190721_final.pdf,primary,DEM,Bennet,13352.0,Michael F. Bennet,1.0,2019-07-09
793,California,36.116203000000006,-119.681564,119294.0,64627.0,2020.0,1539.0,Point Blank Political,,,Point Blank Political,550.0,Point Blank Political,,2276.0,lv,lv-d,Online/Text,U.S. President,2/26/20,2/28/20,,False,,False,False,2/29/20 09:28,head-to-head poll,https://www.pointblankpolitical.com/2020-ca-dem-primary-post-debate/,primary,DEM,Bloomberg,13289.0,Michael Bloomberg,32.2,2020-02-26
794,California,36.116203000000006,-119.681564,119475.0,64673.0,2020.0,1522.0,Swayable,,,Swayable,543.0,Swayable,,3388.0,lv,lv-d,Online,U.S. President,3/1/20,3/2/20,,False,,False,False,3/3/20 06:18,,https://swayable.com/insights/democratic-primaries-2020-super-tuesday-polling,primary,DEM,Buttigieg,13345.0,Pete Buttigieg,8.4,2020-03-01
795,California,36.116203000000006,-119.681564,119475.0,64673.0,2020.0,1522.0,Swayable,,,Swayable,543.0,Swayable,,3388.0,lv,lv-d,Online,U.S. President,3/1/20,3/2/20,,False,,False,False,3/3/20 06:18,,https://swayable.com/insights/democratic-primaries-2020-super-tuesday-polling,primary,DEM,Warren,13258.0,Elizabeth Warren,9.6,2020-03-01
796,California,36.116203000000006,-119.681564,119475.0,64673.0,2020.0,1522.0,Swayable,,,Swayable,543.0,Swayable,,3388.0,lv,lv-d,Online,U.S. President,3/1/20,3/2/20,,False,,False,False,3/3/20 06:18,,https://swayable.com/insights/democratic-primaries-2020-super-tuesday-polling,primary,DEM,Bloomberg,13289.0,Michael Bloomberg,19.3,2020-03-01
797,California,36.116203000000006,-119.681564,119295.0,64627.0,2020.0,1539.0,Point Blank Political,,,Point Blank Political,550.0,Point Blank Political,,2276.0,lv,lv-d,Online/Text,U.S. President,2/26/20,2/28/20,,False,,False,False,2/29/20 09:28,head-to-head poll,https://www.pointblankpolitical.com/2020-ca-dem-primary-post-debate/,primary,DEM,Sanders,13257.0,Bernard Sanders,45.5,2020-02-26
798,California,36.116203000000006,-119.681564,100324.0,58836.0,2020.0,460.0,SurveyUSA,"443,804",KGTV-TV (California) | San Diego Union-Tribune,SurveyUSA,325.0,SurveyUSA,A,528.0,lv,lv-d,Online,U.S. President,8/1/19,8/5/19,,False,,False,False,8/7/19 19:28,,http://www.surveyusa.com/client/PollReport.aspx?g=949b0f46-a4a4-4480-b675-711e9d6fd657,primary,DEM,Warren,13258.0,Elizabeth Warren,21.0,2019-08-01
799,California,36.116203000000006,-119.681564,100324.0,58836.0,2020.0,460.0,SurveyUSA,"443,804",KGTV-TV (California) | San Diego Union-Tribune,SurveyUSA,325.0,SurveyUSA,A,528.0,lv,lv-d,Online,U.S. President,8/1/19,8/5/19,,False,,False,False,8/7/19 19:28,,http://www.surveyusa.com/client/PollReport.aspx?g=949b0f46-a4a4-4480-b675-711e9d6fd657,primary,DEM,Biden,13256.0,Joseph R. Biden Jr.,25.0,2019-08-01
800,California,36.116203000000006,-119.681564,119475.0,64673.0,2020.0,1522.0,Swayable,,,Swayable,543.0,Swayable,,3388.0,lv,lv-d,Online,U.S. President,3/1/20,3/2/20,,False,,False,False,3/3/20 06:18,,https://swayable.com/insights/democratic-primaries-2020-super-tuesday-polling,primary,DEM,Biden,13256.0,Joseph R. Biden Jr.,20.8,2020-03-01
801,California,36.116203000000006,-119.681564,119475.0,64673.0,2020.0,1522.0,Swayable,,,Swayable,543.0,Swayable,,3388.0,lv,lv-d,Online,U.S. President,3/1/20,3/2/20,,False,,False,False,3/3/20 06:18,,https://swayable.com/insights/democratic-primaries-2020-super-tuesday-polling,primary,DEM,Sanders,13257.0,Bernard Sanders,28.7,2020-03-01
802,California,36.116203000000006,-119.681564,99461.0,58680.0,2020.0,1491.0,Capitol Weekly,,,Capitol Weekly,510.0,Capitol Weekly,,951.0,lv,lv-d,Online,U.S. President,5/1/19,5/31/19,,False,,False,False,7/17/19 15:00,,https://public.tableau.com/profile/capitol.weekly#!/vizhome/2020PrimaryTrackingSurvey_15626518585990/CA120POLLSTORY,primary,DEM,Booker,13287.0,Cory A. Booker,1.7,2019-05-01
803,California,36.116203000000006,-119.681564,99461.0,58680.0,2020.0,1491.0,Capitol Weekly,,,Capitol Weekly,510.0,Capitol Weekly,,951.0,lv,lv-d,Online,U.S. President,5/1/19,5/31/19,,False,,False,False,7/17/19 15:00,,https://public.tableau.com/profile/capitol.weekly#!/vizhome/2020PrimaryTrackingSurvey_15626518585990/CA120POLLSTORY,primary,DEM,Hickenlooper,13326.0,John Hickenlooper,0.5,2019-05-01
804,California,36.116203000000006,-119.681564,119295.0,64627.0,2020.0,1539.0,Point Blank Political,,,Point Blank Political,550.0,Point Blank Political,,2276.0,lv,lv-d,Online/Text,U.S. President,2/26/20,2/28/20,,False,,False,False,2/29/20 09:28,head-to-head poll,https://www.pointblankpolitical.com/2020-ca-dem-primary-post-debate/,primary,DEM,Warren,13258.0,Elizabeth Warren,35.6,2020-02-26
805,California,36.116203000000006,-119.681564,119383.0,64651.0,2020.0,568.0,YouGov,603,Stanford University,YouGov,391.0,YouGov,B-,1020.0,lv,lv-d,Online,U.S. President,2/26/20,2/28/20,,False,,False,False,3/2/20 11:02,,https://www.hoover.org/sites/default/files/hoover_ca_primary_crosstabs_20200228.pdf,primary,DEM,Biden,13256.0,Joseph R. Biden Jr.,19.0,2020-02-26
806,California,36.116203000000006,-119.681564,119383.0,64651.0,2020.0,568.0,YouGov,603,Stanford University,YouGov,391.0,YouGov,B-,1020.0,lv,lv-d,Online,U.S. President,2/26/20,2/28/20,,False,,False,False,3/2/20 11:02,,https://www.hoover.org/sites/default/files/hoover_ca_primary_crosstabs_20200228.pdf,primary,DEM,Bloomberg,13289.0,Michael Bloomberg,13.0,2020-02-26
807,California,36.116203000000006,-119.681564,119383.0,64651.0,2020.0,568.0,YouGov,603,Stanford University,YouGov,391.0,YouGov,B-,1020.0,lv,lv-d,Online,U.S. President,2/26/20,2/28/20,,False,,False,False,3/2/20 11:02,,https://www.hoover.org/sites/default/files/hoover_ca_primary_crosstabs_20200228.pdf,primary,DEM,Buttigieg,13345.0,Pete Buttigieg,9.0,2020-02-26
808,California,36.116203000000006,-119.681564,119383.0,64651.0,2020.0,568.0,YouGov,603,Stanford University,YouGov,391.0,YouGov,B-,1020.0,lv,lv-d,Online,U.S. President,2/26/20,2/28/20,,False,,False,False,3/2/20 11:02,,https://www.hoover.org/sites/default/files/hoover_ca_primary_crosstabs_20200228.pdf,primary,DEM,Gabbard,13343.0,Tulsi Gabbard,3.0,2020-02-26
809,California,36.116203000000006,-119.681564,119383.0,64651.0,2020.0,568.0,YouGov,603,Stanford University,YouGov,391.0,YouGov,B-,1020.0,lv,lv-d,Online,U.S. President,2/26/20,2/28/20,,False,,False,False,3/2/20 11:02,,https://www.hoover.org/sites/default/files/hoover_ca_primary_crosstabs_20200228.pdf,primary,DEM,Klobuchar,13310.0,Amy Klobuchar,6.0,2020-02-26
810,California,36.116203000000006,-119.681564,119383.0,64651.0,2020.0,568.0,YouGov,603,Stanford University,YouGov,391.0,YouGov,B-,1020.0,lv,lv-d,Online,U.S. President,2/26/20,2/28/20,,False,,False,False,3/2/20 11:02,,https://www.hoover.org/sites/default/files/hoover_ca_primary_crosstabs_20200228.pdf,primary,DEM,Sanders,13257.0,Bernard Sanders,28.0,2020-02-26
811,California,36.116203000000006,-119.681564,119383.0,64651.0,2020.0,568.0,YouGov,603,Stanford University,YouGov,391.0,YouGov,B-,1020.0,lv,lv-d,Online,U.S. President,2/26/20,2/28/20,,False,,False,False,3/2/20 11:02,,https://www.hoover.org/sites/default/files/hoover_ca_primary_crosstabs_20200228.pdf,primary,DEM,Steyer,13327.0,Tom Steyer,4.0,2020-02-26
812,California,36.116203000000006,-119.681564,119383.0,64651.0,2020.0,568.0,YouGov,603,Stanford University,YouGov,391.0,YouGov,B-,1020.0,lv,lv-d,Online,U.S. President,2/26/20,2/28/20,,False,,False,False,3/2/20 11:02,,https://www.hoover.org/sites/default/files/hoover_ca_primary_crosstabs_20200228.pdf,primary,DEM,Warren,13258.0,Elizabeth Warren,18.0,2020-02-26
813,California,36.116203000000006,-119.681564,99518.0,58698.0,2020.0,568.0,YouGov,133,CBS News,YouGov,391.0,YouGov,B-,1404.0,lv,lv-d,Online,U.S. President,7/9/19,7/18/19,,False,,False,False,7/21/19 10:44,,https://d25d2506sfb94s.cloudfront.net/cumulus_uploads/document/h7ookmkwri/cbsnews_dems_20190721_final.pdf,primary,DEM,Yang,13329.0,Andrew Yang,1.0,2019-07-09
814,California,36.116203000000006,-119.681564,99518.0,58698.0,2020.0,568.0,YouGov,133,CBS News,YouGov,391.0,YouGov,B-,1404.0,lv,lv-d,Online,U.S. President,7/9/19,7/18/19,,False,,False,False,7/21/19 10:44,,https://d25d2506sfb94s.cloudfront.net/cumulus_uploads/document/h7ookmkwri/cbsnews_dems_20190721_final.pdf,primary,DEM,Steyer,13327.0,Tom Steyer,1.0,2019-07-09
815,California,36.116203000000006,-119.681564,99518.0,58698.0,2020.0,568.0,YouGov,133,CBS News,YouGov,391.0,YouGov,B-,1404.0,lv,lv-d,Online,U.S. President,7/9/19,7/18/19,,False,,False,False,7/21/19 10:44,,https://d25d2506sfb94s.cloudfront.net/cumulus_uploads/document/h7ookmkwri/cbsnews_dems_20190721_final.pdf,primary,DEM,Williamson,13350.0,Marianne Williamson,1.0,2019-07-09
816,California,36.116203000000006,-119.681564,99518.0,58698.0,2020.0,568.0,YouGov,133,CBS News,YouGov,391.0,YouGov,B-,1404.0,lv,lv-d,Online,U.S. President,7/9/19,7/18/19,,False,,False,False,7/21/19 10:44,,https://d25d2506sfb94s.cloudfront.net/cumulus_uploads/document/h7ookmkwri/cbsnews_dems_20190721_final.pdf,primary,DEM,Gravel,13359.0,Mike Gravel,1.0,2019-07-09
817,California,36.116203000000006,-119.681564,99518.0,58698.0,2020.0,568.0,YouGov,133,CBS News,YouGov,391.0,YouGov,B-,1404.0,lv,lv-d,Online,U.S. President,7/9/19,7/18/19,,False,,False,False,7/21/19 10:44,,https://d25d2506sfb94s.cloudfront.net/cumulus_uploads/document/h7ookmkwri/cbsnews_dems_20190721_final.pdf,primary,DEM,Booker,13287.0,Cory A. Booker,1.0,2019-07-09
818,California,36.116203000000006,-119.681564,99518.0,58698.0,2020.0,568.0,YouGov,133,CBS News,YouGov,391.0,YouGov,B-,1404.0,lv,lv-d,Online,U.S. President,7/9/19,7/18/19,,False,,False,False,7/21/19 10:44,,https://d25d2506sfb94s.cloudfront.net/cumulus_uploads/document/h7ookmkwri/cbsnews_dems_20190721_final.pdf,primary,DEM,Klobuchar,13310.0,Amy Klobuchar,1.0,2019-07-09
819,California,36.116203000000006,-119.681564,99518.0,58698.0,2020.0,568.0,YouGov,133,CBS News,YouGov,391.0,YouGov,B-,1404.0,lv,lv-d,Online,U.S. President,7/9/19,7/18/19,,False,,False,False,7/21/19 10:44,,https://d25d2506sfb94s.cloudfront.net/cumulus_uploads/document/h7ookmkwri/cbsnews_dems_20190721_final.pdf,primary,DEM,Gabbard,13343.0,Tulsi Gabbard,1.0,2019-07-09
820,California,36.116203000000006,-119.681564,99518.0,58698.0,2020.0,568.0,YouGov,133,CBS News,YouGov,391.0,YouGov,B-,1404.0,lv,lv-d,Online,U.S. President,7/9/19,7/18/19,,False,,False,False,7/21/19 10:44,,https://d25d2506sfb94s.cloudfront.net/cumulus_uploads/document/h7ookmkwri/cbsnews_dems_20190721_final.pdf,primary,DEM,Bullock,13320.0,Steve Bullock,0.0,2019-07-09
821,California,36.116203000000006,-119.681564,102994.0,59618.0,2020.0,1365.0,Change Research,1186,KQED,Change Research,48.0,Change Research,C,3325.0,lv,lv-d,Online,U.S. President,9/12/19,9/15/19,,False,,False,False,9/19/19 12:43,,https://www.changeresearch.com/california-poll-sept-12-15,primary,DEM,Ryan,13358.0,Tim Ryan,0.0,2019-09-12
822,California,36.116203000000006,-119.681564,93145.0,57519.0,2020.0,1365.0,Change Research,,,Change Research,48.0,Change Research,C,948.0,lv,lv-d,Online,U.S. President,2/9/19,2/11/19,,False,,False,False,2/14/19 09:32,,https://docsend.com/view/mjz7a9j,primary,DEM,Hickenlooper,13326.0,John Hickenlooper,0.0,2019-02-09
823,California,36.116203000000006,-119.681564,119355.0,64647.0,2020.0,1539.0,Point Blank Political,,,Point Blank Political,550.0,Point Blank Political,,1220.0,lv,lv-d,Online/Text,U.S. President,2/29/20,3/1/20,,False,,False,False,3/2/20 08:04,head-to-head poll,https://www.pointblankpolitical.com/2020-ca-dem-primary-post-sc/,primary,DEM,Warren,13258.0,Elizabeth Warren,40.0,2020-02-29
824,California,36.116203000000006,-119.681564,99463.0,58682.0,2020.0,1491.0,Capitol Weekly,,,Capitol Weekly,510.0,Capitol Weekly,,739.0,lv,lv-d,Online,U.S. President,7/1/19,7/31/19,,False,,False,False,7/17/19 15:00,,https://public.tableau.com/profile/capitol.weekly#!/vizhome/2020PrimaryTrackingSurvey_15626518585990/CA120POLLSTORY,primary,DEM,Buttigieg,13345.0,Pete Buttigieg,8.0,2019-07-01
825,California,36.116203000000006,-119.681564,99463.0,58682.0,2020.0,1491.0,Capitol Weekly,,,Capitol Weekly,510.0,Capitol Weekly,,739.0,lv,lv-d,Online,U.S. President,7/1/19,7/31/19,,False,,False,False,7/17/19 15:00,,https://public.tableau.com/profile/capitol.weekly#!/vizhome/2020PrimaryTrackingSurvey_15626518585990/CA120POLLSTORY,primary,DEM,O'Rourke,13276.0,Beto O'Rourke,2.2,2019-07-01
826,California,36.116203000000006,-119.681564,99463.0,58682.0,2020.0,1491.0,Capitol Weekly,,,Capitol Weekly,510.0,Capitol Weekly,,739.0,lv,lv-d,Online,U.S. President,7/1/19,7/31/19,,False,,False,False,7/17/19 15:00,,https://public.tableau.com/profile/capitol.weekly#!/vizhome/2020PrimaryTrackingSurvey_15626518585990/CA120POLLSTORY,primary,DEM,Booker,13287.0,Cory A. Booker,1.2,2019-07-01
827,California,36.116203000000006,-119.681564,99463.0,58682.0,2020.0,1491.0,Capitol Weekly,,,Capitol Weekly,510.0,Capitol Weekly,,739.0,lv,lv-d,Online,U.S. President,7/1/19,7/31/19,,False,,False,False,7/17/19 15:00,,https://public.tableau.com/profile/capitol.weekly#!/vizhome/2020PrimaryTrackingSurvey_15626518585990/CA120POLLSTORY,primary,DEM,Klobuchar,13310.0,Amy Klobuchar,0.9,2019-07-01
828,California,36.116203000000006,-119.681564,99463.0,58682.0,2020.0,1491.0,Capitol Weekly,,,Capitol Weekly,510.0,Capitol Weekly,,739.0,lv,lv-d,Online,U.S. President,7/1/19,7/31/19,,False,,False,False,7/17/19 15:00,,https://public.tableau.com/profile/capitol.weekly#!/vizhome/2020PrimaryTrackingSurvey_15626518585990/CA120POLLSTORY,primary,DEM,Hickenlooper,13326.0,John Hickenlooper,0.3,2019-07-01
829,California,36.116203000000006,-119.681564,99463.0,58682.0,2020.0,1491.0,Capitol Weekly,,,Capitol Weekly,510.0,Capitol Weekly,,739.0,lv,lv-d,Online,U.S. President,7/1/19,7/31/19,,False,,False,False,7/17/19 15:00,,https://public.tableau.com/profile/capitol.weekly#!/vizhome/2020PrimaryTrackingSurvey_15626518585990/CA120POLLSTORY,primary,DEM,Yang,13329.0,Andrew Yang,1.6,2019-07-01
830,California,36.116203000000006,-119.681564,99463.0,58682.0,2020.0,1491.0,Capitol Weekly,,,Capitol Weekly,510.0,Capitol Weekly,,739.0,lv,lv-d,Online,U.S. President,7/1/19,7/31/19,,False,,False,False,7/17/19 15:00,,https://public.tableau.com/profile/capitol.weekly#!/vizhome/2020PrimaryTrackingSurvey_15626518585990/CA120POLLSTORY,primary,DEM,Inslee,13324.0,Jay Robert Inslee,0.5,2019-07-01
831,California,36.116203000000006,-119.681564,99463.0,58682.0,2020.0,1491.0,Capitol Weekly,,,Capitol Weekly,510.0,Capitol Weekly,,739.0,lv,lv-d,Online,U.S. President,7/1/19,7/31/19,,False,,False,False,7/17/19 15:00,,https://public.tableau.com/profile/capitol.weekly#!/vizhome/2020PrimaryTrackingSurvey_15626518585990/CA120POLLSTORY,primary,DEM,Gillibrand,13311.0,Kirsten E. Gillibrand,0.5,2019-07-01
832,California,36.116203000000006,-119.681564,99463.0,58682.0,2020.0,1491.0,Capitol Weekly,,,Capitol Weekly,510.0,Capitol Weekly,,739.0,lv,lv-d,Online,U.S. President,7/1/19,7/31/19,,False,,False,False,7/17/19 15:00,,https://public.tableau.com/profile/capitol.weekly#!/vizhome/2020PrimaryTrackingSurvey_15626518585990/CA120POLLSTORY,primary,DEM,Gabbard,13343.0,Tulsi Gabbard,1.1,2019-07-01
833,California,36.116203000000006,-119.681564,99463.0,58682.0,2020.0,1491.0,Capitol Weekly,,,Capitol Weekly,510.0,Capitol Weekly,,739.0,lv,lv-d,Online,U.S. President,7/1/19,7/31/19,,False,,False,False,7/17/19 15:00,,https://public.tableau.com/profile/capitol.weekly#!/vizhome/2020PrimaryTrackingSurvey_15626518585990/CA120POLLSTORY,primary,DEM,Swalwell,13328.0,Eric Swalwell,0.1,2019-07-01
834,California,36.116203000000006,-119.681564,99463.0,58682.0,2020.0,1491.0,Capitol Weekly,,,Capitol Weekly,510.0,Capitol Weekly,,739.0,lv,lv-d,Online,U.S. President,7/1/19,7/31/19,,False,,False,False,7/17/19 15:00,,https://public.tableau.com/profile/capitol.weekly#!/vizhome/2020PrimaryTrackingSurvey_15626518585990/CA120POLLSTORY,primary,DEM,Castro,13316.0,Julián Castro,1.5,2019-07-01
835,California,36.116203000000006,-119.681564,99463.0,58682.0,2020.0,1491.0,Capitol Weekly,,,Capitol Weekly,510.0,Capitol Weekly,,739.0,lv,lv-d,Online,U.S. President,7/1/19,7/31/19,,False,,False,False,7/17/19 15:00,,https://public.tableau.com/profile/capitol.weekly#!/vizhome/2020PrimaryTrackingSurvey_15626518585990/CA120POLLSTORY,primary,DEM,Ryan,13358.0,Tim Ryan,0.3,2019-07-01
836,California,36.116203000000006,-119.681564,99463.0,58682.0,2020.0,1491.0,Capitol Weekly,,,Capitol Weekly,510.0,Capitol Weekly,,739.0,lv,lv-d,Online,U.S. President,7/1/19,7/31/19,,False,,False,False,7/17/19 15:00,,https://public.tableau.com/profile/capitol.weekly#!/vizhome/2020PrimaryTrackingSurvey_15626518585990/CA120POLLSTORY,primary,DEM,Williamson,13350.0,Marianne Williamson,0.4,2019-07-01
837,California,36.116203000000006,-119.681564,99463.0,58682.0,2020.0,1491.0,Capitol Weekly,,,Capitol Weekly,510.0,Capitol Weekly,,739.0,lv,lv-d,Online,U.S. President,7/1/19,7/31/19,,False,,False,False,7/17/19 15:00,,https://public.tableau.com/profile/capitol.weekly#!/vizhome/2020PrimaryTrackingSurvey_15626518585990/CA120POLLSTORY,primary,DEM,Bennet,13352.0,Michael F. Bennet,0.1,2019-07-01
838,California,36.116203000000006,-119.681564,99463.0,58682.0,2020.0,1491.0,Capitol Weekly,,,Capitol Weekly,510.0,Capitol Weekly,,739.0,lv,lv-d,Online,U.S. President,7/1/19,7/31/19,,False,,False,False,7/17/19 15:00,,https://public.tableau.com/profile/capitol.weekly#!/vizhome/2020PrimaryTrackingSurvey_15626518585990/CA120POLLSTORY,primary,DEM,Bullock,13320.0,Steve Bullock,0.3,2019-07-01
839,California,36.116203000000006,-119.681564,99463.0,58682.0,2020.0,1491.0,Capitol Weekly,,,Capitol Weekly,510.0,Capitol Weekly,,739.0,lv,lv-d,Online,U.S. President,7/1/19,7/31/19,,False,,False,False,7/17/19 15:00,,https://public.tableau.com/profile/capitol.weekly#!/vizhome/2020PrimaryTrackingSurvey_15626518585990/CA120POLLSTORY,primary,DEM,de Blasio,13335.0,Bill de Blasio,0.3,2019-07-01
840,California,36.116203000000006,-119.681564,99463.0,58682.0,2020.0,1491.0,Capitol Weekly,,,Capitol Weekly,510.0,Capitol Weekly,,739.0,lv,lv-d,Online,U.S. President,7/1/19,7/31/19,,False,,False,False,7/17/19 15:00,,https://public.tableau.com/profile/capitol.weekly#!/vizhome/2020PrimaryTrackingSurvey_15626518585990/CA120POLLSTORY,primary,DEM,Delaney,13314.0,John K. Delaney,0.1,2019-07-01
841,California,36.116203000000006,-119.681564,99463.0,58682.0,2020.0,1491.0,Capitol Weekly,,,Capitol Weekly,510.0,Capitol Weekly,,739.0,lv,lv-d,Online,U.S. President,7/1/19,7/31/19,,False,,False,False,7/17/19 15:00,,https://public.tableau.com/profile/capitol.weekly#!/vizhome/2020PrimaryTrackingSurvey_15626518585990/CA120POLLSTORY,primary,DEM,Steyer,13327.0,Tom Steyer,0.1,2019-07-01
842,California,36.116203000000006,-119.681564,102778.0,59588.0,2020.0,1491.0,Capitol Weekly,,,Capitol Weekly,510.0,Capitol Weekly,,728.0,lv,lv-d,Online,U.S. President,8/1/19,8/31/19,,False,,False,False,9/17/19 08:49,,https://public.tableau.com/profile/capitol.weekly#!/vizhome/2020PrimaryTrackingSurvey_15626518585990/CA120POLLSTORY,primary,DEM,Swalwell,13328.0,Eric Swalwell,0.3,2019-08-01
843,California,36.116203000000006,-119.681564,102778.0,59588.0,2020.0,1491.0,Capitol Weekly,,,Capitol Weekly,510.0,Capitol Weekly,,728.0,lv,lv-d,Online,U.S. President,8/1/19,8/31/19,,False,,False,False,9/17/19 08:49,,https://public.tableau.com/profile/capitol.weekly#!/vizhome/2020PrimaryTrackingSurvey_15626518585990/CA120POLLSTORY,primary,DEM,Ryan,13358.0,Tim Ryan,0.1,2019-08-01
844,California,36.116203000000006,-119.681564,102778.0,59588.0,2020.0,1491.0,Capitol Weekly,,,Capitol Weekly,510.0,Capitol Weekly,,728.0,lv,lv-d,Online,U.S. President,8/1/19,8/31/19,,False,,False,False,9/17/19 08:49,,https://public.tableau.com/profile/capitol.weekly#!/vizhome/2020PrimaryTrackingSurvey_15626518585990/CA120POLLSTORY,primary,DEM,Steyer,13327.0,Tom Steyer,0.8,2019-08-01
845,California,36.116203000000006,-119.681564,102778.0,59588.0,2020.0,1491.0,Capitol Weekly,,,Capitol Weekly,510.0,Capitol Weekly,,728.0,lv,lv-d,Online,U.S. President,8/1/19,8/31/19,,False,,False,False,9/17/19 08:49,,https://public.tableau.com/profile/capitol.weekly#!/vizhome/2020PrimaryTrackingSurvey_15626518585990/CA120POLLSTORY,primary,DEM,Delaney,13314.0,John K. Delaney,0.5,2019-08-01
846,California,36.116203000000006,-119.681564,102778.0,59588.0,2020.0,1491.0,Capitol Weekly,,,Capitol Weekly,510.0,Capitol Weekly,,728.0,lv,lv-d,Online,U.S. President,8/1/19,8/31/19,,False,,False,False,9/17/19 08:49,,https://public.tableau.com/profile/capitol.weekly#!/vizhome/2020PrimaryTrackingSurvey_15626518585990/CA120POLLSTORY,primary,DEM,de Blasio,13335.0,Bill de Blasio,0.3,2019-08-01
847,California,36.116203000000006,-119.681564,99461.0,58680.0,2020.0,1491.0,Capitol Weekly,,,Capitol Weekly,510.0,Capitol Weekly,,951.0,lv,lv-d,Online,U.S. President,5/1/19,5/31/19,,False,,False,False,7/17/19 15:00,,https://public.tableau.com/profile/capitol.weekly#!/vizhome/2020PrimaryTrackingSurvey_15626518585990/CA120POLLSTORY,primary,DEM,de Blasio,13335.0,Bill de Blasio,0.1,2019-05-01
848,California,36.116203000000006,-119.681564,99461.0,58680.0,2020.0,1491.0,Capitol Weekly,,,Capitol Weekly,510.0,Capitol Weekly,,951.0,lv,lv-d,Online,U.S. President,5/1/19,5/31/19,,False,,False,False,7/17/19 15:00,,https://public.tableau.com/profile/capitol.weekly#!/vizhome/2020PrimaryTrackingSurvey_15626518585990/CA120POLLSTORY,primary,DEM,Bullock,13320.0,Steve Bullock,0.2,2019-05-01
849,California,36.116203000000006,-119.681564,99461.0,58680.0,2020.0,1491.0,Capitol Weekly,,,Capitol Weekly,510.0,Capitol Weekly,,951.0,lv,lv-d,Online,U.S. President,5/1/19,5/31/19,,False,,False,False,7/17/19 15:00,,https://public.tableau.com/profile/capitol.weekly#!/vizhome/2020PrimaryTrackingSurvey_15626518585990/CA120POLLSTORY,primary,DEM,Williamson,13350.0,Marianne Williamson,0.1,2019-05-01
850,California,36.116203000000006,-119.681564,99461.0,58680.0,2020.0,1491.0,Capitol Weekly,,,Capitol Weekly,510.0,Capitol Weekly,,951.0,lv,lv-d,Online,U.S. President,5/1/19,5/31/19,,False,,False,False,7/17/19 15:00,,https://public.tableau.com/profile/capitol.weekly#!/vizhome/2020PrimaryTrackingSurvey_15626518585990/CA120POLLSTORY,primary,DEM,Ryan,13358.0,Tim Ryan,0.6,2019-05-01
851,California,36.116203000000006,-119.681564,99461.0,58680.0,2020.0,1491.0,Capitol Weekly,,,Capitol Weekly,510.0,Capitol Weekly,,951.0,lv,lv-d,Online,U.S. President,5/1/19,5/31/19,,False,,False,False,7/17/19 15:00,,https://public.tableau.com/profile/capitol.weekly#!/vizhome/2020PrimaryTrackingSurvey_15626518585990/CA120POLLSTORY,primary,DEM,Biden,13256.0,Joseph R. Biden Jr.,29.4,2019-05-01
852,California,36.116203000000006,-119.681564,99461.0,58680.0,2020.0,1491.0,Capitol Weekly,,,Capitol Weekly,510.0,Capitol Weekly,,951.0,lv,lv-d,Online,U.S. President,5/1/19,5/31/19,,False,,False,False,7/17/19 15:00,,https://public.tableau.com/profile/capitol.weekly#!/vizhome/2020PrimaryTrackingSurvey_15626518585990/CA120POLLSTORY,primary,DEM,Castro,13316.0,Julián Castro,0.5,2019-05-01
853,California,36.116203000000006,-119.681564,99461.0,58680.0,2020.0,1491.0,Capitol Weekly,,,Capitol Weekly,510.0,Capitol Weekly,,951.0,lv,lv-d,Online,U.S. President,5/1/19,5/31/19,,False,,False,False,7/17/19 15:00,,https://public.tableau.com/profile/capitol.weekly#!/vizhome/2020PrimaryTrackingSurvey_15626518585990/CA120POLLSTORY,primary,DEM,Sanders,13257.0,Bernard Sanders,22.4,2019-05-01
854,California,36.116203000000006,-119.681564,99461.0,58680.0,2020.0,1491.0,Capitol Weekly,,,Capitol Weekly,510.0,Capitol Weekly,,951.0,lv,lv-d,Online,U.S. President,5/1/19,5/31/19,,False,,False,False,7/17/19 15:00,,https://public.tableau.com/profile/capitol.weekly#!/vizhome/2020PrimaryTrackingSurvey_15626518585990/CA120POLLSTORY,primary,DEM,Warren,13258.0,Elizabeth Warren,10.7,2019-05-01
855,California,36.116203000000006,-119.681564,102778.0,59588.0,2020.0,1491.0,Capitol Weekly,,,Capitol Weekly,510.0,Capitol Weekly,,728.0,lv,lv-d,Online,U.S. President,8/1/19,8/31/19,,False,,False,False,9/17/19 08:49,,https://public.tableau.com/profile/capitol.weekly#!/vizhome/2020PrimaryTrackingSurvey_15626518585990/CA120POLLSTORY,primary,DEM,Williamson,13350.0,Marianne Williamson,1.8,2019-08-01
856,California,36.116203000000006,-119.681564,102778.0,59588.0,2020.0,1491.0,Capitol Weekly,,,Capitol Weekly,510.0,Capitol Weekly,,728.0,lv,lv-d,Online,U.S. President,8/1/19,8/31/19,,False,,False,False,9/17/19 08:49,,https://public.tableau.com/profile/capitol.weekly#!/vizhome/2020PrimaryTrackingSurvey_15626518585990/CA120POLLSTORY,primary,DEM,Gillibrand,13311.0,Kirsten E. Gillibrand,0.4,2019-08-01
857,California,36.116203000000006,-119.681564,102778.0,59588.0,2020.0,1491.0,Capitol Weekly,,,Capitol Weekly,510.0,Capitol Weekly,,728.0,lv,lv-d,Online,U.S. President,8/1/19,8/31/19,,False,,False,False,9/17/19 08:49,,https://public.tableau.com/profile/capitol.weekly#!/vizhome/2020PrimaryTrackingSurvey_15626518585990/CA120POLLSTORY,primary,DEM,Hickenlooper,13326.0,John Hickenlooper,0.3,2019-08-01
858,California,36.116203000000006,-119.681564,102778.0,59588.0,2020.0,1491.0,Capitol Weekly,,,Capitol Weekly,510.0,Capitol Weekly,,728.0,lv,lv-d,Online,U.S. President,8/1/19,8/31/19,,False,,False,False,9/17/19 08:49,,https://public.tableau.com/profile/capitol.weekly#!/vizhome/2020PrimaryTrackingSurvey_15626518585990/CA120POLLSTORY,primary,DEM,Inslee,13324.0,Jay Robert Inslee,0.4,2019-08-01
859,California,36.116203000000006,-119.681564,102778.0,59588.0,2020.0,1491.0,Capitol Weekly,,,Capitol Weekly,510.0,Capitol Weekly,,728.0,lv,lv-d,Online,U.S. President,8/1/19,8/31/19,,False,,False,False,9/17/19 08:49,,https://public.tableau.com/profile/capitol.weekly#!/vizhome/2020PrimaryTrackingSurvey_15626518585990/CA120POLLSTORY,primary,DEM,Castro,13316.0,Julián Castro,0.8,2019-08-01
860,California,36.116203000000006,-119.681564,102778.0,59588.0,2020.0,1491.0,Capitol Weekly,,,Capitol Weekly,510.0,Capitol Weekly,,728.0,lv,lv-d,Online,U.S. President,8/1/19,8/31/19,,False,,False,False,9/17/19 08:49,,https://public.tableau.com/profile/capitol.weekly#!/vizhome/2020PrimaryTrackingSurvey_15626518585990/CA120POLLSTORY,primary,DEM,Gabbard,13343.0,Tulsi Gabbard,3.3,2019-08-01
861,California,36.116203000000006,-119.681564,102778.0,59588.0,2020.0,1491.0,Capitol Weekly,,,Capitol Weekly,510.0,Capitol Weekly,,728.0,lv,lv-d,Online,U.S. President,8/1/19,8/31/19,,False,,False,False,9/17/19 08:49,,https://public.tableau.com/profile/capitol.weekly#!/vizhome/2020PrimaryTrackingSurvey_15626518585990/CA120POLLSTORY,primary,DEM,Klobuchar,13310.0,Amy Klobuchar,1.1,2019-08-01
862,California,36.116203000000006,-119.681564,102778.0,59588.0,2020.0,1491.0,Capitol Weekly,,,Capitol Weekly,510.0,Capitol Weekly,,728.0,lv,lv-d,Online,U.S. President,8/1/19,8/31/19,,False,,False,False,9/17/19 08:49,,https://public.tableau.com/profile/capitol.weekly#!/vizhome/2020PrimaryTrackingSurvey_15626518585990/CA120POLLSTORY,primary,DEM,Yang,13329.0,Andrew Yang,2.9,2019-08-01
863,California,36.116203000000006,-119.681564,102778.0,59588.0,2020.0,1491.0,Capitol Weekly,,,Capitol Weekly,510.0,Capitol Weekly,,728.0,lv,lv-d,Online,U.S. President,8/1/19,8/31/19,,False,,False,False,9/17/19 08:49,,https://public.tableau.com/profile/capitol.weekly#!/vizhome/2020PrimaryTrackingSurvey_15626518585990/CA120POLLSTORY,primary,DEM,Booker,13287.0,Cory A. Booker,1.4,2019-08-01
864,California,36.116203000000006,-119.681564,102778.0,59588.0,2020.0,1491.0,Capitol Weekly,,,Capitol Weekly,510.0,Capitol Weekly,,728.0,lv,lv-d,Online,U.S. President,8/1/19,8/31/19,,False,,False,False,9/17/19 08:49,,https://public.tableau.com/profile/capitol.weekly#!/vizhome/2020PrimaryTrackingSurvey_15626518585990/CA120POLLSTORY,primary,DEM,O'Rourke,13276.0,Beto O'Rourke,1.8,2019-08-01
865,California,36.116203000000006,-119.681564,102778.0,59588.0,2020.0,1491.0,Capitol Weekly,,,Capitol Weekly,510.0,Capitol Weekly,,728.0,lv,lv-d,Online,U.S. President,8/1/19,8/31/19,,False,,False,False,9/17/19 08:49,,https://public.tableau.com/profile/capitol.weekly#!/vizhome/2020PrimaryTrackingSurvey_15626518585990/CA120POLLSTORY,primary,DEM,Buttigieg,13345.0,Pete Buttigieg,8.7,2019-08-01
866,California,36.116203000000006,-119.681564,102778.0,59588.0,2020.0,1491.0,Capitol Weekly,,,Capitol Weekly,510.0,Capitol Weekly,,728.0,lv,lv-d,Online,U.S. President,8/1/19,8/31/19,,False,,False,False,9/17/19 08:49,,https://public.tableau.com/profile/capitol.weekly#!/vizhome/2020PrimaryTrackingSurvey_15626518585990/CA120POLLSTORY,primary,DEM,Harris,13288.0,Kamala D. Harris,11.8,2019-08-01
867,California,36.116203000000006,-119.681564,102778.0,59588.0,2020.0,1491.0,Capitol Weekly,,,Capitol Weekly,510.0,Capitol Weekly,,728.0,lv,lv-d,Online,U.S. President,8/1/19,8/31/19,,False,,False,False,9/17/19 08:49,,https://public.tableau.com/profile/capitol.weekly#!/vizhome/2020PrimaryTrackingSurvey_15626518585990/CA120POLLSTORY,primary,DEM,Sanders,13257.0,Bernard Sanders,13.6,2019-08-01
868,California,36.116203000000006,-119.681564,102778.0,59588.0,2020.0,1491.0,Capitol Weekly,,,Capitol Weekly,510.0,Capitol Weekly,,728.0,lv,lv-d,Online,U.S. President,8/1/19,8/31/19,,False,,False,False,9/17/19 08:49,,https://public.tableau.com/profile/capitol.weekly#!/vizhome/2020PrimaryTrackingSurvey_15626518585990/CA120POLLSTORY,primary,DEM,Warren,13258.0,Elizabeth Warren,23.2,2019-08-01
869,California,36.116203000000006,-119.681564,102778.0,59588.0,2020.0,1491.0,Capitol Weekly,,,Capitol Weekly,510.0,Capitol Weekly,,728.0,lv,lv-d,Online,U.S. President,8/1/19,8/31/19,,False,,False,False,9/17/19 08:49,,https://public.tableau.com/profile/capitol.weekly#!/vizhome/2020PrimaryTrackingSurvey_15626518585990/CA120POLLSTORY,primary,DEM,Biden,13256.0,Joseph R. Biden Jr.,26.5,2019-08-01
870,California,36.116203000000006,-119.681564,119487.0,64685.0,2020.0,1515.0,Data for Progress,,,Data for Progress,522.0,Data for Progress,B/C,516.0,lv,lv-d,Text,U.S. President,2/28/20,3/2/20,,False,,False,False,3/3/20 06:20,,https://www.dataforprogress.org/memos/super-tuesday-final-polling,primary,DEM,Klobuchar,13310.0,Amy Klobuchar,3.0,2020-02-28
871,California,36.116203000000006,-119.681564,119487.0,64685.0,2020.0,1515.0,Data for Progress,,,Data for Progress,522.0,Data for Progress,B/C,516.0,lv,lv-d,Text,U.S. President,2/28/20,3/2/20,,False,,False,False,3/3/20 06:20,,https://www.dataforprogress.org/memos/super-tuesday-final-polling,primary,DEM,Sanders,13257.0,Bernard Sanders,32.0,2020-02-28
872,California,36.116203000000006,-119.681564,119487.0,64685.0,2020.0,1515.0,Data for Progress,,,Data for Progress,522.0,Data for Progress,B/C,516.0,lv,lv-d,Text,U.S. President,2/28/20,3/2/20,,False,,False,False,3/3/20 06:20,,https://www.dataforprogress.org/memos/super-tuesday-final-polling,primary,DEM,Warren,13258.0,Elizabeth Warren,16.0,2020-02-28
873,California,36.116203000000006,-119.681564,119487.0,64685.0,2020.0,1515.0,Data for Progress,,,Data for Progress,522.0,Data for Progress,B/C,516.0,lv,lv-d,Text,U.S. President,2/28/20,3/2/20,,False,,False,False,3/3/20 06:20,,https://www.dataforprogress.org/memos/super-tuesday-final-polling,primary,DEM,Biden,13256.0,Joseph R. Biden Jr.,25.0,2020-02-28
874,California,36.116203000000006,-119.681564,119487.0,64685.0,2020.0,1515.0,Data for Progress,,,Data for Progress,522.0,Data for Progress,B/C,516.0,lv,lv-d,Text,U.S. President,2/28/20,3/2/20,,False,,False,False,3/3/20 06:20,,https://www.dataforprogress.org/memos/super-tuesday-final-polling,primary,DEM,Bloomberg,13289.0,Michael Bloomberg,17.0,2020-02-28
875,California,36.116203000000006,-119.681564,119487.0,64685.0,2020.0,1515.0,Data for Progress,,,Data for Progress,522.0,Data for Progress,B/C,516.0,lv,lv-d,Text,U.S. President,2/28/20,3/2/20,,False,,False,False,3/3/20 06:20,,https://www.dataforprogress.org/memos/super-tuesday-final-polling,primary,DEM,Buttigieg,13345.0,Pete Buttigieg,5.0,2020-02-28
876,California,36.116203000000006,-119.681564,119487.0,64685.0,2020.0,1515.0,Data for Progress,,,Data for Progress,522.0,Data for Progress,B/C,516.0,lv,lv-d,Text,U.S. President,2/28/20,3/2/20,,False,,False,False,3/3/20 06:20,,https://www.dataforprogress.org/memos/super-tuesday-final-polling,primary,DEM,Steyer,13327.0,Tom Steyer,0.0,2020-02-28
877,California,36.116203000000006,-119.681564,119487.0,64685.0,2020.0,1515.0,Data for Progress,,,Data for Progress,522.0,Data for Progress,B/C,516.0,lv,lv-d,Text,U.S. President,2/28/20,3/2/20,,False,,False,False,3/3/20 06:20,,https://www.dataforprogress.org/memos/super-tuesday-final-polling,primary,DEM,Gabbard,13343.0,Tulsi Gabbard,2.0,2020-02-28
878,California,36.116203000000006,-119.681564,99463.0,58682.0,2020.0,1491.0,Capitol Weekly,,,Capitol Weekly,510.0,Capitol Weekly,,739.0,lv,lv-d,Online,U.S. President,7/1/19,7/31/19,,False,,False,False,7/17/19 15:00,,https://public.tableau.com/profile/capitol.weekly#!/vizhome/2020PrimaryTrackingSurvey_15626518585990/CA120POLLSTORY,primary,DEM,Biden,13256.0,Joseph R. Biden Jr.,20.7,2019-07-01
879,California,36.116203000000006,-119.681564,99463.0,58682.0,2020.0,1491.0,Capitol Weekly,,,Capitol Weekly,510.0,Capitol Weekly,,739.0,lv,lv-d,Online,U.S. President,7/1/19,7/31/19,,False,,False,False,7/17/19 15:00,,https://public.tableau.com/profile/capitol.weekly#!/vizhome/2020PrimaryTrackingSurvey_15626518585990/CA120POLLSTORY,primary,DEM,Sanders,13257.0,Bernard Sanders,14.9,2019-07-01
880,California,36.116203000000006,-119.681564,99463.0,58682.0,2020.0,1491.0,Capitol Weekly,,,Capitol Weekly,510.0,Capitol Weekly,,739.0,lv,lv-d,Online,U.S. President,7/1/19,7/31/19,,False,,False,False,7/17/19 15:00,,https://public.tableau.com/profile/capitol.weekly#!/vizhome/2020PrimaryTrackingSurvey_15626518585990/CA120POLLSTORY,primary,DEM,Harris,13288.0,Kamala D. Harris,20.6,2019-07-01
881,California,36.116203000000006,-119.681564,99463.0,58682.0,2020.0,1491.0,Capitol Weekly,,,Capitol Weekly,510.0,Capitol Weekly,,739.0,lv,lv-d,Online,U.S. President,7/1/19,7/31/19,,False,,False,False,7/17/19 15:00,,https://public.tableau.com/profile/capitol.weekly#!/vizhome/2020PrimaryTrackingSurvey_15626518585990/CA120POLLSTORY,primary,DEM,Warren,13258.0,Elizabeth Warren,24.2,2019-07-01
882,California,36.116203000000006,-119.681564,99461.0,58680.0,2020.0,1491.0,Capitol Weekly,,,Capitol Weekly,510.0,Capitol Weekly,,951.0,lv,lv-d,Online,U.S. President,5/1/19,5/31/19,,False,,False,False,7/17/19 15:00,,https://public.tableau.com/profile/capitol.weekly#!/vizhome/2020PrimaryTrackingSurvey_15626518585990/CA120POLLSTORY,primary,DEM,Harris,13288.0,Kamala D. Harris,17.2,2019-05-01
883,California,36.116203000000006,-119.681564,93145.0,57519.0,2020.0,1365.0,Change Research,,,Change Research,48.0,Change Research,C,948.0,lv,lv-d,Online,U.S. President,2/9/19,2/11/19,,False,,False,False,2/14/19 09:32,,https://docsend.com/view/mjz7a9j,primary,DEM,Yang,13329.0,Andrew Yang,0.0,2019-02-09
884,California,36.116203000000006,-119.681564,99461.0,58680.0,2020.0,1491.0,Capitol Weekly,,,Capitol Weekly,510.0,Capitol Weekly,,951.0,lv,lv-d,Online,U.S. President,5/1/19,5/31/19,,False,,False,False,7/17/19 15:00,,https://public.tableau.com/profile/capitol.weekly#!/vizhome/2020PrimaryTrackingSurvey_15626518585990/CA120POLLSTORY,primary,DEM,Swalwell,13328.0,Eric Swalwell,0.6,2019-05-01
885,California,36.116203000000006,-119.681564,100324.0,58836.0,2020.0,460.0,SurveyUSA,"443,804",KGTV-TV (California) | San Diego Union-Tribune,SurveyUSA,325.0,SurveyUSA,A,528.0,lv,lv-d,Online,U.S. President,8/1/19,8/5/19,,False,,False,False,8/7/19 19:28,,http://www.surveyusa.com/client/PollReport.aspx?g=949b0f46-a4a4-4480-b675-711e9d6fd657,primary,DEM,Ryan,13358.0,Tim Ryan,0.0,2019-08-01
886,California,36.116203000000006,-119.681564,119350.0,64645.0,2020.0,1102.0,Emerson College,1185,Nexstar,Emerson College,88.0,Emerson College,A-,545.0,lv,lv-d,IVR/Online,U.S. President,2/29/20,3/1/20,,False,,False,False,3/2/20 00:01,,http://emersonpolling.com/2020/03/02/california-2020-sanders-positioned-to-capture-california-on-super-tuesday/,primary,DEM,Sanders,13257.0,Bernard Sanders,37.8,2020-02-29
887,California,36.116203000000006,-119.681564,119350.0,64645.0,2020.0,1102.0,Emerson College,1185,Nexstar,Emerson College,88.0,Emerson College,A-,545.0,lv,lv-d,IVR/Online,U.S. President,2/29/20,3/1/20,,False,,False,False,3/2/20 00:01,,http://emersonpolling.com/2020/03/02/california-2020-sanders-positioned-to-capture-california-on-super-tuesday/,primary,DEM,Bloomberg,13289.0,Michael Bloomberg,10.8,2020-02-29
888,California,36.116203000000006,-119.681564,119350.0,64645.0,2020.0,1102.0,Emerson College,1185,Nexstar,Emerson College,88.0,Emerson College,A-,545.0,lv,lv-d,IVR/Online,U.S. President,2/29/20,3/1/20,,False,,False,False,3/2/20 00:01,,http://emersonpolling.com/2020/03/02/california-2020-sanders-positioned-to-capture-california-on-super-tuesday/,primary,DEM,Klobuchar,13310.0,Amy Klobuchar,4.6,2020-02-29
889,California,36.116203000000006,-119.681564,119350.0,64645.0,2020.0,1102.0,Emerson College,1185,Nexstar,Emerson College,88.0,Emerson College,A-,545.0,lv,lv-d,IVR/Online,U.S. President,2/29/20,3/1/20,,False,,False,False,3/2/20 00:01,,http://emersonpolling.com/2020/03/02/california-2020-sanders-positioned-to-capture-california-on-super-tuesday/,primary,DEM,Gabbard,13343.0,Tulsi Gabbard,1.4,2020-02-29
890,California,36.116203000000006,-119.681564,119350.0,64645.0,2020.0,1102.0,Emerson College,1185,Nexstar,Emerson College,88.0,Emerson College,A-,545.0,lv,lv-d,IVR/Online,U.S. President,2/29/20,3/1/20,,False,,False,False,3/2/20 00:01,,http://emersonpolling.com/2020/03/02/california-2020-sanders-positioned-to-capture-california-on-super-tuesday/,primary,DEM,Warren,13258.0,Elizabeth Warren,16.1,2020-02-29
891,California,36.116203000000006,-119.681564,119350.0,64645.0,2020.0,1102.0,Emerson College,1185,Nexstar,Emerson College,88.0,Emerson College,A-,545.0,lv,lv-d,IVR/Online,U.S. President,2/29/20,3/1/20,,False,,False,False,3/2/20 00:01,,http://emersonpolling.com/2020/03/02/california-2020-sanders-positioned-to-capture-california-on-super-tuesday/,primary,DEM,Buttigieg,13345.0,Pete Buttigieg,6.6,2020-02-29
892,California,36.116203000000006,-119.681564,93146.0,57519.0,2020.0,1365.0,Change Research,,,Change Research,48.0,Change Research,C,948.0,lv,lv-d,Online,U.S. President,2/9/19,2/11/19,,False,,False,False,2/14/19 09:32,,https://docsend.com/view/mjz7a9j,primary,DEM,Delaney,13314.0,John K. Delaney,2.0,2019-02-09
893,California,36.116203000000006,-119.681564,93146.0,57519.0,2020.0,1365.0,Change Research,,,Change Research,48.0,Change Research,C,948.0,lv,lv-d,Online,U.S. President,2/9/19,2/11/19,,False,,False,False,2/14/19 09:32,,https://docsend.com/view/mjz7a9j,primary,DEM,Buttigieg,13345.0,Pete Buttigieg,2.0,2019-02-09
894,California,36.116203000000006,-119.681564,93146.0,57519.0,2020.0,1365.0,Change Research,,,Change Research,48.0,Change Research,C,948.0,lv,lv-d,Online,U.S. President,2/9/19,2/11/19,,False,,False,False,2/14/19 09:32,,https://docsend.com/view/mjz7a9j,primary,DEM,Gabbard,13343.0,Tulsi Gabbard,4.0,2019-02-09
895,California,36.116203000000006,-119.681564,93146.0,57519.0,2020.0,1365.0,Change Research,,,Change Research,48.0,Change Research,C,948.0,lv,lv-d,Online,U.S. President,2/9/19,2/11/19,,False,,False,False,2/14/19 09:32,,https://docsend.com/view/mjz7a9j,primary,DEM,Castro,13316.0,Julián Castro,6.0,2019-02-09
896,California,36.116203000000006,-119.681564,93146.0,57519.0,2020.0,1365.0,Change Research,,,Change Research,48.0,Change Research,C,948.0,lv,lv-d,Online,U.S. President,2/9/19,2/11/19,,False,,False,False,2/14/19 09:32,,https://docsend.com/view/mjz7a9j,primary,DEM,Booker,13287.0,Cory A. Booker,7.0,2019-02-09
897,California,36.116203000000006,-119.681564,93146.0,57519.0,2020.0,1365.0,Change Research,,,Change Research,48.0,Change Research,C,948.0,lv,lv-d,Online,U.S. President,2/9/19,2/11/19,,False,,False,False,2/14/19 09:32,,https://docsend.com/view/mjz7a9j,primary,DEM,Warren,13258.0,Elizabeth Warren,23.0,2019-02-09
898,California,36.116203000000006,-119.681564,93146.0,57519.0,2020.0,1365.0,Change Research,,,Change Research,48.0,Change Research,C,948.0,lv,lv-d,Online,U.S. President,2/9/19,2/11/19,,False,,False,False,2/14/19 09:32,,https://docsend.com/view/mjz7a9j,primary,DEM,Harris,13288.0,Kamala D. Harris,53.0,2019-02-09
899,California,36.116203000000006,-119.681564,93145.0,57519.0,2020.0,1365.0,Change Research,,,Change Research,48.0,Change Research,C,948.0,lv,lv-d,Online,U.S. President,2/9/19,2/11/19,,False,,False,False,2/14/19 09:32,,https://docsend.com/view/mjz7a9j,primary,DEM,Williamson,13350.0,Marianne Williamson,0.0,2019-02-09
900,California,36.116203000000006,-119.681564,119352.0,64647.0,2020.0,1539.0,Point Blank Political,,,Point Blank Political,550.0,Point Blank Political,,1220.0,lv,lv-d,Online/Text,U.S. President,2/29/20,3/1/20,,False,,False,False,3/2/20 08:04,,https://www.pointblankpolitical.com/2020-ca-dem-primary-post-sc/,primary,DEM,Sanders,13257.0,Bernard Sanders,33.9,2020-02-29
901,California,36.116203000000006,-119.681564,119352.0,64647.0,2020.0,1539.0,Point Blank Political,,,Point Blank Political,550.0,Point Blank Political,,1220.0,lv,lv-d,Online/Text,U.S. President,2/29/20,3/1/20,,False,,False,False,3/2/20 08:04,,https://www.pointblankpolitical.com/2020-ca-dem-primary-post-sc/,primary,DEM,Biden,13256.0,Joseph R. Biden Jr.,21.6,2020-02-29
902,California,36.116203000000006,-119.681564,119352.0,64647.0,2020.0,1539.0,Point Blank Political,,,Point Blank Political,550.0,Point Blank Political,,1220.0,lv,lv-d,Online/Text,U.S. President,2/29/20,3/1/20,,False,,False,False,3/2/20 08:04,,https://www.pointblankpolitical.com/2020-ca-dem-primary-post-sc/,primary,DEM,Warren,13258.0,Elizabeth Warren,14.3,2020-02-29
903,California,36.116203000000006,-119.681564,119352.0,64647.0,2020.0,1539.0,Point Blank Political,,,Point Blank Political,550.0,Point Blank Political,,1220.0,lv,lv-d,Online/Text,U.S. President,2/29/20,3/1/20,,False,,False,False,3/2/20 08:04,,https://www.pointblankpolitical.com/2020-ca-dem-primary-post-sc/,primary,DEM,Bloomberg,13289.0,Michael Bloomberg,9.8,2020-02-29
904,California,36.116203000000006,-119.681564,119352.0,64647.0,2020.0,1539.0,Point Blank Political,,,Point Blank Political,550.0,Point Blank Political,,1220.0,lv,lv-d,Online/Text,U.S. President,2/29/20,3/1/20,,False,,False,False,3/2/20 08:04,,https://www.pointblankpolitical.com/2020-ca-dem-primary-post-sc/,primary,DEM,Buttigieg,13345.0,Pete Buttigieg,5.6,2020-02-29
905,California,36.116203000000006,-119.681564,119352.0,64647.0,2020.0,1539.0,Point Blank Political,,,Point Blank Political,550.0,Point Blank Political,,1220.0,lv,lv-d,Online/Text,U.S. President,2/29/20,3/1/20,,False,,False,False,3/2/20 08:04,,https://www.pointblankpolitical.com/2020-ca-dem-primary-post-sc/,primary,DEM,Klobuchar,13310.0,Amy Klobuchar,2.9,2020-02-29
906,California,36.116203000000006,-119.681564,119352.0,64647.0,2020.0,1539.0,Point Blank Political,,,Point Blank Political,550.0,Point Blank Political,,1220.0,lv,lv-d,Online/Text,U.S. President,2/29/20,3/1/20,,False,,False,False,3/2/20 08:04,,https://www.pointblankpolitical.com/2020-ca-dem-primary-post-sc/,primary,DEM,Steyer,13327.0,Tom Steyer,1.3,2020-02-29
907,California,36.116203000000006,-119.681564,119352.0,64647.0,2020.0,1539.0,Point Blank Political,,,Point Blank Political,550.0,Point Blank Political,,1220.0,lv,lv-d,Online/Text,U.S. President,2/29/20,3/1/20,,False,,False,False,3/2/20 08:04,,https://www.pointblankpolitical.com/2020-ca-dem-primary-post-sc/,primary,DEM,Gabbard,13343.0,Tulsi Gabbard,0.9,2020-02-29
908,California,36.116203000000006,-119.681564,119353.0,64647.0,2020.0,1539.0,Point Blank Political,,,Point Blank Political,550.0,Point Blank Political,,1220.0,lv,lv-d,Online/Text,U.S. President,2/29/20,3/1/20,,False,,False,False,3/2/20 08:04,head-to-head poll,https://www.pointblankpolitical.com/2020-ca-dem-primary-post-sc/,primary,DEM,Sanders,13257.0,Bernard Sanders,48.1,2020-02-29
909,California,36.116203000000006,-119.681564,119353.0,64647.0,2020.0,1539.0,Point Blank Political,,,Point Blank Political,550.0,Point Blank Political,,1220.0,lv,lv-d,Online/Text,U.S. President,2/29/20,3/1/20,,False,,False,False,3/2/20 08:04,head-to-head poll,https://www.pointblankpolitical.com/2020-ca-dem-primary-post-sc/,primary,DEM,Biden,13256.0,Joseph R. Biden Jr.,40.6,2020-02-29
910,California,36.116203000000006,-119.681564,119354.0,64647.0,2020.0,1539.0,Point Blank Political,,,Point Blank Political,550.0,Point Blank Political,,1220.0,lv,lv-d,Online/Text,U.S. President,2/29/20,3/1/20,,False,,False,False,3/2/20 08:04,head-to-head poll,https://www.pointblankpolitical.com/2020-ca-dem-primary-post-sc/,primary,DEM,Sanders,13257.0,Bernard Sanders,55.9,2020-02-29
911,California,36.116203000000006,-119.681564,119354.0,64647.0,2020.0,1539.0,Point Blank Political,,,Point Blank Political,550.0,Point Blank Political,,1220.0,lv,lv-d,Online/Text,U.S. President,2/29/20,3/1/20,,False,,False,False,3/2/20 08:04,head-to-head poll,https://www.pointblankpolitical.com/2020-ca-dem-primary-post-sc/,primary,DEM,Bloomberg,13289.0,Michael Bloomberg,29.8,2020-02-29
912,California,36.116203000000006,-119.681564,119355.0,64647.0,2020.0,1539.0,Point Blank Political,,,Point Blank Political,550.0,Point Blank Political,,1220.0,lv,lv-d,Online/Text,U.S. President,2/29/20,3/1/20,,False,,False,False,3/2/20 08:04,head-to-head poll,https://www.pointblankpolitical.com/2020-ca-dem-primary-post-sc/,primary,DEM,Sanders,13257.0,Bernard Sanders,43.1,2020-02-29
913,California,36.116203000000006,-119.681564,119350.0,64645.0,2020.0,1102.0,Emerson College,1185,Nexstar,Emerson College,88.0,Emerson College,A-,545.0,lv,lv-d,IVR/Online,U.S. President,2/29/20,3/1/20,,False,,False,False,3/2/20 00:01,,http://emersonpolling.com/2020/03/02/california-2020-sanders-positioned-to-capture-california-on-super-tuesday/,primary,DEM,Biden,13256.0,Joseph R. Biden Jr.,21.0,2020-02-29
914,California,36.116203000000006,-119.681564,100324.0,58836.0,2020.0,460.0,SurveyUSA,"443,804",KGTV-TV (California) | San Diego Union-Tribune,SurveyUSA,325.0,SurveyUSA,A,528.0,lv,lv-d,Online,U.S. President,8/1/19,8/5/19,,False,,False,False,8/7/19 19:28,,http://www.surveyusa.com/client/PollReport.aspx?g=949b0f46-a4a4-4480-b675-711e9d6fd657,primary,DEM,Messam,13357.0,Wayne Messam,0.0,2019-08-01
915,California,36.116203000000006,-119.681564,119350.0,64645.0,2020.0,1102.0,Emerson College,1185,Nexstar,Emerson College,88.0,Emerson College,A-,545.0,lv,lv-d,IVR/Online,U.S. President,2/29/20,3/1/20,,False,,False,False,3/2/20 00:01,,http://emersonpolling.com/2020/03/02/california-2020-sanders-positioned-to-capture-california-on-super-tuesday/,primary,DEM,Steyer,13327.0,Tom Steyer,1.6,2020-02-29
916,California,36.116203000000006,-119.681564,93146.0,57519.0,2020.0,1365.0,Change Research,,,Change Research,48.0,Change Research,C,948.0,lv,lv-d,Online,U.S. President,2/9/19,2/11/19,,False,,False,False,2/14/19 09:32,,https://docsend.com/view/mjz7a9j,primary,DEM,Yang,13329.0,Andrew Yang,1.0,2019-02-09
917,California,36.116203000000006,-119.681564,100324.0,58836.0,2020.0,460.0,SurveyUSA,"443,804",KGTV-TV (California) | San Diego Union-Tribune,SurveyUSA,325.0,SurveyUSA,A,528.0,lv,lv-d,Online,U.S. President,8/1/19,8/5/19,,False,,False,False,8/7/19 19:28,,http://www.surveyusa.com/client/PollReport.aspx?g=949b0f46-a4a4-4480-b675-711e9d6fd657,primary,DEM,Bullock,13320.0,Steve Bullock,0.0,2019-08-01
918,California,36.116203000000006,-119.681564,100324.0,58836.0,2020.0,460.0,SurveyUSA,"443,804",KGTV-TV (California) | San Diego Union-Tribune,SurveyUSA,325.0,SurveyUSA,A,528.0,lv,lv-d,Online,U.S. President,8/1/19,8/5/19,,False,,False,False,8/7/19 19:28,,http://www.surveyusa.com/client/PollReport.aspx?g=949b0f46-a4a4-4480-b675-711e9d6fd657,primary,DEM,Moulton,13322.0,Seth Moulton,0.0,2019-08-01
919,California,36.116203000000006,-119.681564,100324.0,58836.0,2020.0,460.0,SurveyUSA,"443,804",KGTV-TV (California) | San Diego Union-Tribune,SurveyUSA,325.0,SurveyUSA,A,528.0,lv,lv-d,Online,U.S. President,8/1/19,8/5/19,,False,,False,False,8/7/19 19:28,,http://www.surveyusa.com/client/PollReport.aspx?g=949b0f46-a4a4-4480-b675-711e9d6fd657,primary,DEM,Gravel,13359.0,Mike Gravel,0.0,2019-08-01
920,California,36.116203000000006,-119.681564,100324.0,58836.0,2020.0,460.0,SurveyUSA,"443,804",KGTV-TV (California) | San Diego Union-Tribune,SurveyUSA,325.0,SurveyUSA,A,528.0,lv,lv-d,Online,U.S. President,8/1/19,8/5/19,,False,,False,False,8/7/19 19:28,,http://www.surveyusa.com/client/PollReport.aspx?g=949b0f46-a4a4-4480-b675-711e9d6fd657,primary,DEM,Bennet,13352.0,Michael F. Bennet,0.0,2019-08-01
921,California,36.116203000000006,-119.681564,100324.0,58836.0,2020.0,460.0,SurveyUSA,"443,804",KGTV-TV (California) | San Diego Union-Tribune,SurveyUSA,325.0,SurveyUSA,A,528.0,lv,lv-d,Online,U.S. President,8/1/19,8/5/19,,False,,False,False,8/7/19 19:28,,http://www.surveyusa.com/client/PollReport.aspx?g=949b0f46-a4a4-4480-b675-711e9d6fd657,primary,DEM,Sestak,13381.0,Joe Sestak,0.0,2019-08-01
922,California,36.116203000000006,-119.681564,100324.0,58836.0,2020.0,460.0,SurveyUSA,"443,804",KGTV-TV (California) | San Diego Union-Tribune,SurveyUSA,325.0,SurveyUSA,A,528.0,lv,lv-d,Online,U.S. President,8/1/19,8/5/19,,False,,False,False,8/7/19 19:28,,http://www.surveyusa.com/client/PollReport.aspx?g=949b0f46-a4a4-4480-b675-711e9d6fd657,primary,DEM,Inslee,13324.0,Jay Robert Inslee,0.0,2019-08-01
923,California,36.116203000000006,-119.681564,100324.0,58836.0,2020.0,460.0,SurveyUSA,"443,804",KGTV-TV (California) | San Diego Union-Tribune,SurveyUSA,325.0,SurveyUSA,A,528.0,lv,lv-d,Online,U.S. President,8/1/19,8/5/19,,False,,False,False,8/7/19 19:28,,http://www.surveyusa.com/client/PollReport.aspx?g=949b0f46-a4a4-4480-b675-711e9d6fd657,primary,DEM,Hickenlooper,13326.0,John Hickenlooper,0.0,2019-08-01
924,California,36.116203000000006,-119.681564,99846.0,58757.0,2020.0,382.0,Public Policy Institute of California,,,Public Policy Institute of California,262.0,Public Policy Institute of California,A/B,766.0,lv,lv-d,Live Phone,U.S. President,7/14/19,7/23/19,,False,,False,False,7/30/19 00:15,open-ended question,https://www.ppic.org/wp-content/uploads/ppic-statewide-survey-californians-and-the-environment-july-2019.pdf,primary,DEM,Harris,13288.0,Kamala D. Harris,19.0,2019-07-14
925,California,36.116203000000006,-119.681564,99846.0,58757.0,2020.0,382.0,Public Policy Institute of California,,,Public Policy Institute of California,262.0,Public Policy Institute of California,A/B,766.0,lv,lv-d,Live Phone,U.S. President,7/14/19,7/23/19,,False,,False,False,7/30/19 00:15,open-ended question,https://www.ppic.org/wp-content/uploads/ppic-statewide-survey-californians-and-the-environment-july-2019.pdf,primary,DEM,Warren,13258.0,Elizabeth Warren,15.0,2019-07-14
926,California,36.116203000000006,-119.681564,99846.0,58757.0,2020.0,382.0,Public Policy Institute of California,,,Public Policy Institute of California,262.0,Public Policy Institute of California,A/B,766.0,lv,lv-d,Live Phone,U.S. President,7/14/19,7/23/19,,False,,False,False,7/30/19 00:15,open-ended question,https://www.ppic.org/wp-content/uploads/ppic-statewide-survey-californians-and-the-environment-july-2019.pdf,primary,DEM,Sanders,13257.0,Bernard Sanders,12.0,2019-07-14
927,California,36.116203000000006,-119.681564,99846.0,58757.0,2020.0,382.0,Public Policy Institute of California,,,Public Policy Institute of California,262.0,Public Policy Institute of California,A/B,766.0,lv,lv-d,Live Phone,U.S. President,7/14/19,7/23/19,,False,,False,False,7/30/19 00:15,open-ended question,https://www.ppic.org/wp-content/uploads/ppic-statewide-survey-californians-and-the-environment-july-2019.pdf,primary,DEM,Biden,13256.0,Joseph R. Biden Jr.,11.0,2019-07-14
928,California,36.116203000000006,-119.681564,99846.0,58757.0,2020.0,382.0,Public Policy Institute of California,,,Public Policy Institute of California,262.0,Public Policy Institute of California,A/B,766.0,lv,lv-d,Live Phone,U.S. President,7/14/19,7/23/19,,False,,False,False,7/30/19 00:15,open-ended question,https://www.ppic.org/wp-content/uploads/ppic-statewide-survey-californians-and-the-environment-july-2019.pdf,primary,DEM,Buttigieg,13345.0,Pete Buttigieg,5.0,2019-07-14
929,California,36.116203000000006,-119.681564,99518.0,58698.0,2020.0,568.0,YouGov,133,CBS News,YouGov,391.0,YouGov,B-,1404.0,lv,lv-d,Online,U.S. President,7/9/19,7/18/19,,False,,False,False,7/21/19 10:44,,https://d25d2506sfb94s.cloudfront.net/cumulus_uploads/document/h7ookmkwri/cbsnews_dems_20190721_final.pdf,primary,DEM,Biden,13256.0,Joseph R. Biden Jr.,24.0,2019-07-09
930,California,36.116203000000006,-119.681564,99518.0,58698.0,2020.0,568.0,YouGov,133,CBS News,YouGov,391.0,YouGov,B-,1404.0,lv,lv-d,Online,U.S. President,7/9/19,7/18/19,,False,,False,False,7/21/19 10:44,,https://d25d2506sfb94s.cloudfront.net/cumulus_uploads/document/h7ookmkwri/cbsnews_dems_20190721_final.pdf,primary,DEM,Harris,13288.0,Kamala D. Harris,23.0,2019-07-09
931,California,36.116203000000006,-119.681564,99518.0,58698.0,2020.0,568.0,YouGov,133,CBS News,YouGov,391.0,YouGov,B-,1404.0,lv,lv-d,Online,U.S. President,7/9/19,7/18/19,,False,,False,False,7/21/19 10:44,,https://d25d2506sfb94s.cloudfront.net/cumulus_uploads/document/h7ookmkwri/cbsnews_dems_20190721_final.pdf,primary,DEM,Warren,13258.0,Elizabeth Warren,19.0,2019-07-09
932,California,36.116203000000006,-119.681564,99518.0,58698.0,2020.0,568.0,YouGov,133,CBS News,YouGov,391.0,YouGov,B-,1404.0,lv,lv-d,Online,U.S. President,7/9/19,7/18/19,,False,,False,False,7/21/19 10:44,,https://d25d2506sfb94s.cloudfront.net/cumulus_uploads/document/h7ookmkwri/cbsnews_dems_20190721_final.pdf,primary,DEM,Sanders,13257.0,Bernard Sanders,16.0,2019-07-09
933,California,36.116203000000006,-119.681564,99518.0,58698.0,2020.0,568.0,YouGov,133,CBS News,YouGov,391.0,YouGov,B-,1404.0,lv,lv-d,Online,U.S. President,7/9/19,7/18/19,,False,,False,False,7/21/19 10:44,,https://d25d2506sfb94s.cloudfront.net/cumulus_uploads/document/h7ookmkwri/cbsnews_dems_20190721_final.pdf,primary,DEM,Buttigieg,13345.0,Pete Buttigieg,6.0,2019-07-09
934,California,36.116203000000006,-119.681564,119430.0,64661.0,2020.0,1528.0,AtlasIntel,,,AtlasIntel,546.0,AtlasIntel,,727.0,lv,lv-d,Online,U.S. President,2/24/20,3/2/20,,False,,False,False,3/2/20 17:42,,https://projects.fivethirtyeight.com/polls/20200302_CA.pdf,primary,DEM,Sanders,13257.0,Bernard Sanders,34.0,2020-02-24
935,California,36.116203000000006,-119.681564,119430.0,64661.0,2020.0,1528.0,AtlasIntel,,,AtlasIntel,546.0,AtlasIntel,,727.0,lv,lv-d,Online,U.S. President,2/24/20,3/2/20,,False,,False,False,3/2/20 17:42,,https://projects.fivethirtyeight.com/polls/20200302_CA.pdf,primary,DEM,Biden,13256.0,Joseph R. Biden Jr.,26.0,2020-02-24
936,California,36.116203000000006,-119.681564,119430.0,64661.0,2020.0,1528.0,AtlasIntel,,,AtlasIntel,546.0,AtlasIntel,,727.0,lv,lv-d,Online,U.S. President,2/24/20,3/2/20,,False,,False,False,3/2/20 17:42,,https://projects.fivethirtyeight.com/polls/20200302_CA.pdf,primary,DEM,Warren,13258.0,Elizabeth Warren,15.0,2020-02-24
937,California,36.116203000000006,-119.681564,119430.0,64661.0,2020.0,1528.0,AtlasIntel,,,AtlasIntel,546.0,AtlasIntel,,727.0,lv,lv-d,Online,U.S. President,2/24/20,3/2/20,,False,,False,False,3/2/20 17:42,,https://projects.fivethirtyeight.com/polls/20200302_CA.pdf,primary,DEM,Bloomberg,13289.0,Michael Bloomberg,15.0,2020-02-24
938,California,36.116203000000006,-119.681564,119430.0,64661.0,2020.0,1528.0,AtlasIntel,,,AtlasIntel,546.0,AtlasIntel,,727.0,lv,lv-d,Online,U.S. President,2/24/20,3/2/20,,False,,False,False,3/2/20 17:42,,https://projects.fivethirtyeight.com/polls/20200302_CA.pdf,primary,DEM,Buttigieg,13345.0,Pete Buttigieg,3.0,2020-02-24
939,California,36.116203000000006,-119.681564,119430.0,64661.0,2020.0,1528.0,AtlasIntel,,,AtlasIntel,546.0,AtlasIntel,,727.0,lv,lv-d,Online,U.S. President,2/24/20,3/2/20,,False,,False,False,3/2/20 17:42,,https://projects.fivethirtyeight.com/polls/20200302_CA.pdf,primary,DEM,Klobuchar,13310.0,Amy Klobuchar,1.0,2020-02-24
940,California,36.116203000000006,-119.681564,119430.0,64661.0,2020.0,1528.0,AtlasIntel,,,AtlasIntel,546.0,AtlasIntel,,727.0,lv,lv-d,Online,U.S. President,2/24/20,3/2/20,,False,,False,False,3/2/20 17:42,,https://projects.fivethirtyeight.com/polls/20200302_CA.pdf,primary,DEM,Gabbard,13343.0,Tulsi Gabbard,1.0,2020-02-24
941,California,36.116203000000006,-119.681564,99518.0,58698.0,2020.0,568.0,YouGov,133,CBS News,YouGov,391.0,YouGov,B-,1404.0,lv,lv-d,Online,U.S. President,7/9/19,7/18/19,,False,,False,False,7/21/19 10:44,,https://d25d2506sfb94s.cloudfront.net/cumulus_uploads/document/h7ookmkwri/cbsnews_dems_20190721_final.pdf,primary,DEM,O'Rourke,13276.0,Beto O'Rourke,1.0,2019-07-09
942,California,36.116203000000006,-119.681564,100324.0,58836.0,2020.0,460.0,SurveyUSA,"443,804",KGTV-TV (California) | San Diego Union-Tribune,SurveyUSA,325.0,SurveyUSA,A,528.0,lv,lv-d,Online,U.S. President,8/1/19,8/5/19,,False,,False,False,8/7/19 19:28,,http://www.surveyusa.com/client/PollReport.aspx?g=949b0f46-a4a4-4480-b675-711e9d6fd657,primary,DEM,Steyer,13327.0,Tom Steyer,0.0,2019-08-01
943,California,36.116203000000006,-119.681564,93146.0,57519.0,2020.0,1365.0,Change Research,,,Change Research,48.0,Change Research,C,948.0,lv,lv-d,Online,U.S. President,2/9/19,2/11/19,,False,,False,False,2/14/19 09:32,,https://docsend.com/view/mjz7a9j,primary,DEM,Williamson,13350.0,Marianne Williamson,1.0,2019-02-09
944,California,36.116203000000006,-119.681564,93146.0,57519.0,2020.0,1365.0,Change Research,,,Change Research,48.0,Change Research,C,948.0,lv,lv-d,Online,U.S. President,2/9/19,2/11/19,,False,,False,False,2/14/19 09:32,,https://docsend.com/view/mjz7a9j,primary,DEM,Gillibrand,13311.0,Kirsten E. Gillibrand,1.0,2019-02-09
945,California,36.116203000000006,-119.681564,102994.0,59618.0,2020.0,1365.0,Change Research,1186,KQED,Change Research,48.0,Change Research,C,3325.0,lv,lv-d,Online,U.S. President,9/12/19,9/15/19,,False,,False,False,9/19/19 12:43,,https://www.changeresearch.com/california-poll-sept-12-15,primary,DEM,Bennet,13352.0,Michael F. Bennet,0.0,2019-09-12
946,California,36.116203000000006,-119.681564,99461.0,58680.0,2020.0,1491.0,Capitol Weekly,,,Capitol Weekly,510.0,Capitol Weekly,,951.0,lv,lv-d,Online,U.S. President,5/1/19,5/31/19,,False,,False,False,7/17/19 15:00,,https://public.tableau.com/profile/capitol.weekly#!/vizhome/2020PrimaryTrackingSurvey_15626518585990/CA120POLLSTORY,primary,DEM,Klobuchar,13310.0,Amy Klobuchar,0.9,2019-05-01
947,California,36.116203000000006,-119.681564,102994.0,59618.0,2020.0,1365.0,Change Research,1186,KQED,Change Research,48.0,Change Research,C,3325.0,lv,lv-d,Online,U.S. President,9/12/19,9/15/19,,False,,False,False,9/19/19 12:43,,https://www.changeresearch.com/california-poll-sept-12-15,primary,DEM,Messam,13357.0,Wayne Messam,0.0,2019-09-12
948,California,36.116203000000006,-119.681564,102782.0,59591.0,2020.0,1102.0,Emerson College,,,Emerson College,88.0,Emerson College,A-,424.0,lv,lv-d,IVR/Online,U.S. President,9/13/19,9/16/19,,False,,False,False,9/17/19 12:04,,http://emersonpolling.com/2019/09/17/biden-sanders-warren-in-statistical-tie-in-democratic-primary-harris-struggles-in-home-state/,primary,DEM,Biden,13256.0,Joseph R. Biden Jr.,25.8,2019-09-13
949,California,36.116203000000006,-119.681564,119181.0,64595.0,2020.0,1363.0,"University of California, Berkeley",300,LA Times,"University of California, Berkeley",457.0,"University of California, Berkeley",B/C,3002.0,lv,lv-d,Online,U.S. President,2/20/20,2/25/20,,False,,False,False,2/28/20 05:04,,https://escholarship.org/uc/item/40m769v7,primary,DEM,Sestak,13381.0,Joe Sestak,0.0,2020-02-20
950,California,36.116203000000006,-119.681564,119181.0,64595.0,2020.0,1363.0,"University of California, Berkeley",300,LA Times,"University of California, Berkeley",457.0,"University of California, Berkeley",B/C,3002.0,lv,lv-d,Online,U.S. President,2/20/20,2/25/20,,False,,False,False,2/28/20 05:04,,https://escholarship.org/uc/item/40m769v7,primary,DEM,Patrick,13315.0,Deval Patrick,0.0,2020-02-20
951,California,36.116203000000006,-119.681564,119181.0,64595.0,2020.0,1363.0,"University of California, Berkeley",300,LA Times,"University of California, Berkeley",457.0,"University of California, Berkeley",B/C,3002.0,lv,lv-d,Online,U.S. President,2/20/20,2/25/20,,False,,False,False,2/28/20 05:04,,https://escholarship.org/uc/item/40m769v7,primary,DEM,Stewart Greenstein,14094.0,Mark Stewart Greenstein,0.0,2020-02-20
952,California,36.116203000000006,-119.681564,119181.0,64595.0,2020.0,1363.0,"University of California, Berkeley",300,LA Times,"University of California, Berkeley",457.0,"University of California, Berkeley",B/C,3002.0,lv,lv-d,Online,U.S. President,2/20/20,2/25/20,,False,,False,False,2/28/20 05:04,,https://escholarship.org/uc/item/40m769v7,primary,DEM,Ellinger,14481.0,Michael Ellinger,0.0,2020-02-20
953,California,36.116203000000006,-119.681564,119181.0,64595.0,2020.0,1363.0,"University of California, Berkeley",300,LA Times,"University of California, Berkeley",457.0,"University of California, Berkeley",B/C,3002.0,lv,lv-d,Online,U.S. President,2/20/20,2/25/20,,False,,False,False,2/28/20 05:04,,https://escholarship.org/uc/item/40m769v7,primary,DEM,Boyd,14482.0,Mosie Boyd,0.0,2020-02-20
954,California,36.116203000000006,-119.681564,119181.0,64595.0,2020.0,1363.0,"University of California, Berkeley",300,LA Times,"University of California, Berkeley",457.0,"University of California, Berkeley",B/C,3002.0,lv,lv-d,Online,U.S. President,2/20/20,2/25/20,,False,,False,False,2/28/20 05:04,,https://escholarship.org/uc/item/40m769v7,primary,DEM,Castro,13316.0,Julián Castro,0.0,2020-02-20
955,California,36.116203000000006,-119.681564,102782.0,59591.0,2020.0,1102.0,Emerson College,,,Emerson College,88.0,Emerson College,A-,424.0,lv,lv-d,IVR/Online,U.S. President,9/13/19,9/16/19,,False,,False,False,9/17/19 12:04,,http://emersonpolling.com/2019/09/17/biden-sanders-warren-in-statistical-tie-in-democratic-primary-harris-struggles-in-home-state/,primary,DEM,Sanders,13257.0,Bernard Sanders,25.5,2019-09-13
956,California,36.116203000000006,-119.681564,119181.0,64595.0,2020.0,1363.0,"University of California, Berkeley",300,LA Times,"University of California, Berkeley",457.0,"University of California, Berkeley",B/C,3002.0,lv,lv-d,Online,U.S. President,2/20/20,2/25/20,,False,,False,False,2/28/20 05:04,,https://escholarship.org/uc/item/40m769v7,primary,DEM,Williamson,13350.0,Marianne Williamson,0.1,2020-02-20
957,California,36.116203000000006,-119.681564,119181.0,64595.0,2020.0,1363.0,"University of California, Berkeley",300,LA Times,"University of California, Berkeley",457.0,"University of California, Berkeley",B/C,3002.0,lv,lv-d,Online,U.S. President,2/20/20,2/25/20,,False,,False,False,2/28/20 05:04,,https://escholarship.org/uc/item/40m769v7,primary,DEM,Bennet,13352.0,Michael F. Bennet,0.1,2020-02-20
958,California,36.116203000000006,-119.681564,102782.0,59591.0,2020.0,1102.0,Emerson College,,,Emerson College,88.0,Emerson College,A-,424.0,lv,lv-d,IVR/Online,U.S. President,9/13/19,9/16/19,,False,,False,False,9/17/19 12:04,,http://emersonpolling.com/2019/09/17/biden-sanders-warren-in-statistical-tie-in-democratic-primary-harris-struggles-in-home-state/,primary,DEM,Steyer,13327.0,Tom Steyer,0.6,2019-09-13
959,California,36.116203000000006,-119.681564,102782.0,59591.0,2020.0,1102.0,Emerson College,,,Emerson College,88.0,Emerson College,A-,424.0,lv,lv-d,IVR/Online,U.S. President,9/13/19,9/16/19,,False,,False,False,9/17/19 12:04,,http://emersonpolling.com/2019/09/17/biden-sanders-warren-in-statistical-tie-in-democratic-primary-harris-struggles-in-home-state/,primary,DEM,Williamson,13350.0,Marianne Williamson,0.2,2019-09-13
960,California,36.116203000000006,-119.681564,102782.0,59591.0,2020.0,1102.0,Emerson College,,,Emerson College,88.0,Emerson College,A-,424.0,lv,lv-d,IVR/Online,U.S. President,9/13/19,9/16/19,,False,,False,False,9/17/19 12:04,,http://emersonpolling.com/2019/09/17/biden-sanders-warren-in-statistical-tie-in-democratic-primary-harris-struggles-in-home-state/,primary,DEM,de Blasio,13335.0,Bill de Blasio,0.0,2019-09-13
961,California,36.116203000000006,-119.681564,102782.0,59591.0,2020.0,1102.0,Emerson College,,,Emerson College,88.0,Emerson College,A-,424.0,lv,lv-d,IVR/Online,U.S. President,9/13/19,9/16/19,,False,,False,False,9/17/19 12:04,,http://emersonpolling.com/2019/09/17/biden-sanders-warren-in-statistical-tie-in-democratic-primary-harris-struggles-in-home-state/,primary,DEM,Sestak,13381.0,Joe Sestak,0.0,2019-09-13
962,California,36.116203000000006,-119.681564,119181.0,64595.0,2020.0,1363.0,"University of California, Berkeley",300,LA Times,"University of California, Berkeley",457.0,"University of California, Berkeley",B/C,3002.0,lv,lv-d,Online,U.S. President,2/20/20,2/25/20,,False,,False,False,2/28/20 05:04,,https://escholarship.org/uc/item/40m769v7,primary,DEM,De La Fuente,13656.0,Roque De La Fuente,0.2,2020-02-20
963,California,36.116203000000006,-119.681564,102795.0,59596.0,2020.0,460.0,SurveyUSA,"443,804",KGTV-TV (California) | San Diego Union-Tribune,SurveyUSA,325.0,SurveyUSA,A,547.0,lv,lv-d,Online,U.S. President,9/13/19,9/15/19,,False,,False,False,9/17/19 23:26,,http://www.surveyusa.com/client/PollReport.aspx?g=58e0ba48-d312-4f29-9007-67c41aa7d9a5,primary,DEM,Biden,13256.0,Joseph R. Biden Jr.,27.0,2019-09-13
964,California,36.116203000000006,-119.681564,119181.0,64595.0,2020.0,1363.0,"University of California, Berkeley",300,LA Times,"University of California, Berkeley",457.0,"University of California, Berkeley",B/C,3002.0,lv,lv-d,Online,U.S. President,2/20/20,2/25/20,,False,,False,False,2/28/20 05:04,,https://escholarship.org/uc/item/40m769v7,primary,DEM,Delaney,13314.0,John K. Delaney,0.1,2020-02-20
965,California,36.116203000000006,-119.681564,119181.0,64595.0,2020.0,1363.0,"University of California, Berkeley",300,LA Times,"University of California, Berkeley",457.0,"University of California, Berkeley",B/C,3002.0,lv,lv-d,Online,U.S. President,2/20/20,2/25/20,,False,,False,False,2/28/20 05:04,,https://escholarship.org/uc/item/40m769v7,primary,DEM,Booker,13287.0,Cory A. Booker,0.2,2020-02-20
966,California,36.116203000000006,-119.681564,102781.0,59591.0,2020.0,1102.0,Emerson College,,,Emerson College,88.0,Emerson College,A-,208.0,lv,lv-r,IVR/Online,U.S. President,9/13/19,9/16/19,,False,,False,False,9/17/19 12:04,,http://emersonpolling.com/2019/09/17/biden-sanders-warren-in-statistical-tie-in-democratic-primary-harris-struggles-in-home-state/,primary,REP,Sanford,13384.0,Mark Sanford,6.1,2019-09-13
967,California,36.116203000000006,-119.681564,102781.0,59591.0,2020.0,1102.0,Emerson College,,,Emerson College,88.0,Emerson College,A-,208.0,lv,lv-r,IVR/Online,U.S. President,9/13/19,9/16/19,,False,,False,False,9/17/19 12:04,,http://emersonpolling.com/2019/09/17/biden-sanders-warren-in-statistical-tie-in-democratic-primary-harris-struggles-in-home-state/,primary,REP,Weld,13351.0,William F. Weld,4.1,2019-09-13
968,California,36.116203000000006,-119.681564,115876.0,63296.0,2020.0,460.0,SurveyUSA,"443,583,804",KGTV-TV (California) | KABC-TV (California) | San Diego Union-Tribune,SurveyUSA,325.0,SurveyUSA,A,565.0,lv,lv-d,Online,U.S. President,1/14/20,1/16/20,,False,,False,False,1/17/20 19:26,,http://www.surveyusa.com/client/PollReport.aspx?g=9634c475-cb54-4a34-ab4b-c0d9a2b82759,primary,DEM,Steyer,13327.0,Tom Steyer,4.0,2020-01-14
969,California,36.116203000000006,-119.681564,102994.0,59618.0,2020.0,1365.0,Change Research,1186,KQED,Change Research,48.0,Change Research,C,3325.0,lv,lv-d,Online,U.S. President,9/12/19,9/15/19,,False,,False,False,9/19/19 12:43,,https://www.changeresearch.com/california-poll-sept-12-15,primary,DEM,Klobuchar,13310.0,Amy Klobuchar,1.0,2019-09-12
970,California,36.116203000000006,-119.681564,102994.0,59618.0,2020.0,1365.0,Change Research,1186,KQED,Change Research,48.0,Change Research,C,3325.0,lv,lv-d,Online,U.S. President,9/12/19,9/15/19,,False,,False,False,9/19/19 12:43,,https://www.changeresearch.com/california-poll-sept-12-15,primary,DEM,Castro,13316.0,Julián Castro,1.0,2019-09-12
971,California,36.116203000000006,-119.681564,102994.0,59618.0,2020.0,1365.0,Change Research,1186,KQED,Change Research,48.0,Change Research,C,3325.0,lv,lv-d,Online,U.S. President,9/12/19,9/15/19,,False,,False,False,9/19/19 12:43,,https://www.changeresearch.com/california-poll-sept-12-15,primary,DEM,Booker,13287.0,Cory A. Booker,2.0,2019-09-12
972,California,36.116203000000006,-119.681564,102994.0,59618.0,2020.0,1365.0,Change Research,1186,KQED,Change Research,48.0,Change Research,C,3325.0,lv,lv-d,Online,U.S. President,9/12/19,9/15/19,,False,,False,False,9/19/19 12:43,,https://www.changeresearch.com/california-poll-sept-12-15,primary,DEM,Gabbard,13343.0,Tulsi Gabbard,2.0,2019-09-12
973,California,36.116203000000006,-119.681564,102994.0,59618.0,2020.0,1365.0,Change Research,1186,KQED,Change Research,48.0,Change Research,C,3325.0,lv,lv-d,Online,U.S. President,9/12/19,9/15/19,,False,,False,False,9/19/19 12:43,,https://www.changeresearch.com/california-poll-sept-12-15,primary,DEM,O'Rourke,13276.0,Beto O'Rourke,2.0,2019-09-12
974,California,36.116203000000006,-119.681564,102994.0,59618.0,2020.0,1365.0,Change Research,1186,KQED,Change Research,48.0,Change Research,C,3325.0,lv,lv-d,Online,U.S. President,9/12/19,9/15/19,,False,,False,False,9/19/19 12:43,,https://www.changeresearch.com/california-poll-sept-12-15,primary,DEM,Yang,13329.0,Andrew Yang,3.0,2019-09-12
975,California,36.116203000000006,-119.681564,102781.0,59591.0,2020.0,1102.0,Emerson College,,,Emerson College,88.0,Emerson College,A-,208.0,lv,lv-r,IVR/Online,U.S. President,9/13/19,9/16/19,,False,,False,False,9/17/19 12:04,,http://emersonpolling.com/2019/09/17/biden-sanders-warren-in-statistical-tie-in-democratic-primary-harris-struggles-in-home-state/,primary,REP,Walsh,13482.0,Joe Walsh,4.0,2019-09-13
976,California,36.116203000000006,-119.681564,102994.0,59618.0,2020.0,1365.0,Change Research,1186,KQED,Change Research,48.0,Change Research,C,3325.0,lv,lv-d,Online,U.S. President,9/12/19,9/15/19,,False,,False,False,9/19/19 12:43,,https://www.changeresearch.com/california-poll-sept-12-15,primary,DEM,Buttigieg,13345.0,Pete Buttigieg,10.0,2019-09-12
977,California,36.116203000000006,-119.681564,102994.0,59618.0,2020.0,1365.0,Change Research,1186,KQED,Change Research,48.0,Change Research,C,3325.0,lv,lv-d,Online,U.S. President,9/12/19,9/15/19,,False,,False,False,9/19/19 12:43,,https://www.changeresearch.com/california-poll-sept-12-15,primary,DEM,Biden,13256.0,Joseph R. Biden Jr.,18.0,2019-09-12
978,California,36.116203000000006,-119.681564,102994.0,59618.0,2020.0,1365.0,Change Research,1186,KQED,Change Research,48.0,Change Research,C,3325.0,lv,lv-d,Online,U.S. President,9/12/19,9/15/19,,False,,False,False,9/19/19 12:43,,https://www.changeresearch.com/california-poll-sept-12-15,primary,DEM,Sanders,13257.0,Bernard Sanders,23.0,2019-09-12
979,California,36.116203000000006,-119.681564,102994.0,59618.0,2020.0,1365.0,Change Research,1186,KQED,Change Research,48.0,Change Research,C,3325.0,lv,lv-d,Online,U.S. President,9/12/19,9/15/19,,False,,False,False,9/19/19 12:43,,https://www.changeresearch.com/california-poll-sept-12-15,primary,DEM,Warren,13258.0,Elizabeth Warren,25.0,2019-09-12
980,California,36.116203000000006,-119.681564,118942.0,64533.0,2020.0,1539.0,Point Blank Political,,,Point Blank Political,550.0,Point Blank Political,,2098.0,lv,lv-d,Online/Text,U.S. President,2/23/20,2/25/20,,False,,False,False,2/26/20 09:41,,https://www.pointblankpolitical.com/2020-ca-dem-primary-pre-debate/,primary,DEM,Warren,13258.0,Elizabeth Warren,13.1,2020-02-23
981,California,36.116203000000006,-119.681564,118942.0,64533.0,2020.0,1539.0,Point Blank Political,,,Point Blank Political,550.0,Point Blank Political,,2098.0,lv,lv-d,Online/Text,U.S. President,2/23/20,2/25/20,,False,,False,False,2/26/20 09:41,,https://www.pointblankpolitical.com/2020-ca-dem-primary-pre-debate/,primary,DEM,Sanders,13257.0,Bernard Sanders,33.6,2020-02-23
982,California,36.116203000000006,-119.681564,115876.0,63296.0,2020.0,460.0,SurveyUSA,"443,583,804",KGTV-TV (California) | KABC-TV (California) | San Diego Union-Tribune,SurveyUSA,325.0,SurveyUSA,A,565.0,lv,lv-d,Online,U.S. President,1/14/20,1/16/20,,False,,False,False,1/17/20 19:26,,http://www.surveyusa.com/client/PollReport.aspx?g=9634c475-cb54-4a34-ab4b-c0d9a2b82759,primary,DEM,Klobuchar,13310.0,Amy Klobuchar,2.0,2020-01-14
983,California,36.116203000000006,-119.681564,102781.0,59591.0,2020.0,1102.0,Emerson College,,,Emerson College,88.0,Emerson College,A-,208.0,lv,lv-r,IVR/Online,U.S. President,9/13/19,9/16/19,,False,,False,False,9/17/19 12:04,,http://emersonpolling.com/2019/09/17/biden-sanders-warren-in-statistical-tie-in-democratic-primary-harris-struggles-in-home-state/,primary,REP,Trump,13254.0,Donald Trump,85.9,2019-09-13
984,California,36.116203000000006,-119.681564,102994.0,59618.0,2020.0,1365.0,Change Research,1186,KQED,Change Research,48.0,Change Research,C,3325.0,lv,lv-d,Online,U.S. President,9/12/19,9/15/19,,False,,False,False,9/19/19 12:43,,https://www.changeresearch.com/california-poll-sept-12-15,primary,DEM,Harris,13288.0,Kamala D. Harris,11.0,2019-09-12
985,California,36.116203000000006,-119.681564,119181.0,64595.0,2020.0,1363.0,"University of California, Berkeley",300,LA Times,"University of California, Berkeley",457.0,"University of California, Berkeley",B/C,3002.0,lv,lv-d,Online,U.S. President,2/20/20,2/25/20,,False,,False,False,2/28/20 05:04,,https://escholarship.org/uc/item/40m769v7,primary,DEM,Gabbard,13343.0,Tulsi Gabbard,0.6,2020-02-20
986,California,36.116203000000006,-119.681564,119181.0,64595.0,2020.0,1363.0,"University of California, Berkeley",300,LA Times,"University of California, Berkeley",457.0,"University of California, Berkeley",B/C,3002.0,lv,lv-d,Online,U.S. President,2/20/20,2/25/20,,False,,False,False,2/28/20 05:04,,https://escholarship.org/uc/item/40m769v7,primary,DEM,Yang,13329.0,Andrew Yang,1.1,2020-02-20
987,California,36.116203000000006,-119.681564,119181.0,64595.0,2020.0,1363.0,"University of California, Berkeley",300,LA Times,"University of California, Berkeley",457.0,"University of California, Berkeley",B/C,3002.0,lv,lv-d,Online,U.S. President,2/20/20,2/25/20,,False,,False,False,2/28/20 05:04,,https://escholarship.org/uc/item/40m769v7,primary,DEM,Steyer,13327.0,Tom Steyer,2.2,2020-02-20
988,California,36.116203000000006,-119.681564,102795.0,59596.0,2020.0,460.0,SurveyUSA,"443,804",KGTV-TV (California) | San Diego Union-Tribune,SurveyUSA,325.0,SurveyUSA,A,547.0,lv,lv-d,Online,U.S. President,9/13/19,9/15/19,,False,,False,False,9/17/19 23:26,,http://www.surveyusa.com/client/PollReport.aspx?g=58e0ba48-d312-4f29-9007-67c41aa7d9a5,primary,DEM,Warren,13258.0,Elizabeth Warren,16.0,2019-09-13
989,California,36.116203000000006,-119.681564,102795.0,59596.0,2020.0,460.0,SurveyUSA,"443,804",KGTV-TV (California) | San Diego Union-Tribune,SurveyUSA,325.0,SurveyUSA,A,547.0,lv,lv-d,Online,U.S. President,9/13/19,9/15/19,,False,,False,False,9/17/19 23:26,,http://www.surveyusa.com/client/PollReport.aspx?g=58e0ba48-d312-4f29-9007-67c41aa7d9a5,primary,DEM,Harris,13288.0,Kamala D. Harris,13.0,2019-09-13
990,California,36.116203000000006,-119.681564,102795.0,59596.0,2020.0,460.0,SurveyUSA,"443,804",KGTV-TV (California) | San Diego Union-Tribune,SurveyUSA,325.0,SurveyUSA,A,547.0,lv,lv-d,Online,U.S. President,9/13/19,9/15/19,,False,,False,False,9/17/19 23:26,,http://www.surveyusa.com/client/PollReport.aspx?g=58e0ba48-d312-4f29-9007-67c41aa7d9a5,primary,DEM,Yang,13329.0,Andrew Yang,7.0,2019-09-13
991,California,36.116203000000006,-119.681564,102795.0,59596.0,2020.0,460.0,SurveyUSA,"443,804",KGTV-TV (California) | San Diego Union-Tribune,SurveyUSA,325.0,SurveyUSA,A,547.0,lv,lv-d,Online,U.S. President,9/13/19,9/15/19,,False,,False,False,9/17/19 23:26,,http://www.surveyusa.com/client/PollReport.aspx?g=58e0ba48-d312-4f29-9007-67c41aa7d9a5,primary,DEM,Buttigieg,13345.0,Pete Buttigieg,3.0,2019-09-13
992,California,36.116203000000006,-119.681564,102795.0,59596.0,2020.0,460.0,SurveyUSA,"443,804",KGTV-TV (California) | San Diego Union-Tribune,SurveyUSA,325.0,SurveyUSA,A,547.0,lv,lv-d,Online,U.S. President,9/13/19,9/15/19,,False,,False,False,9/17/19 23:26,,http://www.surveyusa.com/client/PollReport.aspx?g=58e0ba48-d312-4f29-9007-67c41aa7d9a5,primary,DEM,O'Rourke,13276.0,Beto O'Rourke,2.0,2019-09-13
993,California,36.116203000000006,-119.681564,102795.0,59596.0,2020.0,460.0,SurveyUSA,"443,804",KGTV-TV (California) | San Diego Union-Tribune,SurveyUSA,325.0,SurveyUSA,A,547.0,lv,lv-d,Online,U.S. President,9/13/19,9/15/19,,False,,False,False,9/17/19 23:26,,http://www.surveyusa.com/client/PollReport.aspx?g=58e0ba48-d312-4f29-9007-67c41aa7d9a5,primary,DEM,Castro,13316.0,Julián Castro,2.0,2019-09-13
994,California,36.116203000000006,-119.681564,102795.0,59596.0,2020.0,460.0,SurveyUSA,"443,804",KGTV-TV (California) | San Diego Union-Tribune,SurveyUSA,325.0,SurveyUSA,A,547.0,lv,lv-d,Online,U.S. President,9/13/19,9/15/19,,False,,False,False,9/17/19 23:26,,http://www.surveyusa.com/client/PollReport.aspx?g=58e0ba48-d312-4f29-9007-67c41aa7d9a5,primary,DEM,Booker,13287.0,Cory A. Booker,2.0,2019-09-13
995,California,36.116203000000006,-119.681564,102994.0,59618.0,2020.0,1365.0,Change Research,1186,KQED,Change Research,48.0,Change Research,C,3325.0,lv,lv-d,Online,U.S. President,9/12/19,9/15/19,,False,,False,False,9/19/19 12:43,,https://www.changeresearch.com/california-poll-sept-12-15,primary,DEM,Sestak,13381.0,Joe Sestak,0.0,2019-09-12
996,California,36.116203000000006,-119.681564,102782.0,59591.0,2020.0,1102.0,Emerson College,,,Emerson College,88.0,Emerson College,A-,424.0,lv,lv-d,IVR/Online,U.S. President,9/13/19,9/16/19,,False,,False,False,9/17/19 12:04,,http://emersonpolling.com/2019/09/17/biden-sanders-warren-in-statistical-tie-in-democratic-primary-harris-struggles-in-home-state/,primary,DEM,O'Rourke,13276.0,Beto O'Rourke,4.8,2019-09-13
997,California,36.116203000000006,-119.681564,102782.0,59591.0,2020.0,1102.0,Emerson College,,,Emerson College,88.0,Emerson College,A-,424.0,lv,lv-d,IVR/Online,U.S. President,9/13/19,9/16/19,,False,,False,False,9/17/19 12:04,,http://emersonpolling.com/2019/09/17/biden-sanders-warren-in-statistical-tie-in-democratic-primary-harris-struggles-in-home-state/,primary,DEM,Booker,13287.0,Cory A. Booker,1.4,2019-09-13
998,California,36.116203000000006,-119.681564,99461.0,58680.0,2020.0,1491.0,Capitol Weekly,,,Capitol Weekly,510.0,Capitol Weekly,,951.0,lv,lv-d,Online,U.S. President,5/1/19,5/31/19,,False,,False,False,7/17/19 15:00,,https://public.tableau.com/profile/capitol.weekly#!/vizhome/2020PrimaryTrackingSurvey_15626518585990/CA120POLLSTORY,primary,DEM,Yang,13329.0,Andrew Yang,0.1,2019-05-01
999,California,36.116203000000006,-119.681564,99461.0,58680.0,2020.0,1491.0,Capitol Weekly,,,Capitol Weekly,510.0,Capitol Weekly,,951.0,lv,lv-d,Online,U.S. President,5/1/19,5/31/19,,False,,False,False,7/17/19 15:00,,https://public.tableau.com/profile/capitol.weekly#!/vizhome/2020PrimaryTrackingSurvey_15626518585990/CA120POLLSTORY,primary,DEM,Inslee,13324.0,Jay Robert Inslee,0.4,2019-05-01
1000,California,36.116203000000006,-119.681564,99461.0,58680.0,2020.0,1491.0,Capitol Weekly,,,Capitol Weekly,510.0,Capitol Weekly,,951.0,lv,lv-d,Online,U.S. President,5/1/19,5/31/19,,False,,False,False,7/17/19 15:00,,https://public.tableau.com/profile/capitol.weekly#!/vizhome/2020PrimaryTrackingSurvey_15626518585990/CA120POLLSTORY,primary,DEM,Gillibrand,13311.0,Kirsten E. Gillibrand,0.5,2019-05-01
1001,California,36.116203000000006,-119.681564,99461.0,58680.0,2020.0,1491.0,Capitol Weekly,,,Capitol Weekly,510.0,Capitol Weekly,,951.0,lv,lv-d,Online,U.S. President,5/1/19,5/31/19,,False,,False,False,7/17/19 15:00,,https://public.tableau.com/profile/capitol.weekly#!/vizhome/2020PrimaryTrackingSurvey_15626518585990/CA120POLLSTORY,primary,DEM,Gabbard,13343.0,Tulsi Gabbard,0.1,2019-05-01
1002,California,36.116203000000006,-119.681564,102782.0,59591.0,2020.0,1102.0,Emerson College,,,Emerson College,88.0,Emerson College,A-,424.0,lv,lv-d,IVR/Online,U.S. President,9/13/19,9/16/19,,False,,False,False,9/17/19 12:04,,http://emersonpolling.com/2019/09/17/biden-sanders-warren-in-statistical-tie-in-democratic-primary-harris-struggles-in-home-state/,primary,DEM,Castro,13316.0,Julián Castro,0.6,2019-09-13
1003,California,36.116203000000006,-119.681564,102795.0,59596.0,2020.0,460.0,SurveyUSA,"443,804",KGTV-TV (California) | San Diego Union-Tribune,SurveyUSA,325.0,SurveyUSA,A,547.0,lv,lv-d,Online,U.S. President,9/13/19,9/15/19,,False,,False,False,9/17/19 23:26,,http://www.surveyusa.com/client/PollReport.aspx?g=58e0ba48-d312-4f29-9007-67c41aa7d9a5,primary,DEM,Klobuchar,13310.0,Amy Klobuchar,1.0,2019-09-13
1004,California,36.116203000000006,-119.681564,102782.0,59591.0,2020.0,1102.0,Emerson College,,,Emerson College,88.0,Emerson College,A-,424.0,lv,lv-d,IVR/Online,U.S. President,9/13/19,9/16/19,,False,,False,False,9/17/19 12:04,,http://emersonpolling.com/2019/09/17/biden-sanders-warren-in-statistical-tie-in-democratic-primary-harris-struggles-in-home-state/,primary,DEM,Yang,13329.0,Andrew Yang,6.7,2019-09-13
1005,California,36.116203000000006,-119.681564,119207.0,64614.0,2020.0,1361.0,SSRS,143,CNN,CNN/SSRS,297.0,SSRS,A/B,488.0,lv,lv-d,Live Phone,U.S. President,2/22/20,2/26/20,,False,,False,False,2/28/20 12:13,,https://cdn.cnn.com/cnn/2020/images/02/28/rel1_ca.pdf,primary,DEM,Gabbard,13343.0,Tulsi Gabbard,1.0,2020-02-22
1006,California,36.116203000000006,-119.681564,119207.0,64614.0,2020.0,1361.0,SSRS,143,CNN,CNN/SSRS,297.0,SSRS,A/B,488.0,lv,lv-d,Live Phone,U.S. President,2/22/20,2/26/20,,False,,False,False,2/28/20 12:13,,https://cdn.cnn.com/cnn/2020/images/02/28/rel1_ca.pdf,primary,DEM,Steyer,13327.0,Tom Steyer,3.0,2020-02-22
1007,California,36.116203000000006,-119.681564,119207.0,64614.0,2020.0,1361.0,SSRS,143,CNN,CNN/SSRS,297.0,SSRS,A/B,488.0,lv,lv-d,Live Phone,U.S. President,2/22/20,2/26/20,,False,,False,False,2/28/20 12:13,,https://cdn.cnn.com/cnn/2020/images/02/28/rel1_ca.pdf,primary,DEM,Klobuchar,13310.0,Amy Klobuchar,6.0,2020-02-22
1008,California,36.116203000000006,-119.681564,119181.0,64595.0,2020.0,1363.0,"University of California, Berkeley",300,LA Times,"University of California, Berkeley",457.0,"University of California, Berkeley",B/C,3002.0,lv,lv-d,Online,U.S. President,2/20/20,2/25/20,,False,,False,False,2/28/20 05:04,,https://escholarship.org/uc/item/40m769v7,primary,DEM,Klobuchar,13310.0,Amy Klobuchar,6.0,2020-02-20
1009,California,36.116203000000006,-119.681564,119181.0,64595.0,2020.0,1363.0,"University of California, Berkeley",300,LA Times,"University of California, Berkeley",457.0,"University of California, Berkeley",B/C,3002.0,lv,lv-d,Online,U.S. President,2/20/20,2/25/20,,False,,False,False,2/28/20 05:04,,https://escholarship.org/uc/item/40m769v7,primary,DEM,Biden,13256.0,Joseph R. Biden Jr.,8.2,2020-02-20
1010,California,36.116203000000006,-119.681564,119181.0,64595.0,2020.0,1363.0,"University of California, Berkeley",300,LA Times,"University of California, Berkeley",457.0,"University of California, Berkeley",B/C,3002.0,lv,lv-d,Online,U.S. President,2/20/20,2/25/20,,False,,False,False,2/28/20 05:04,,https://escholarship.org/uc/item/40m769v7,primary,DEM,Buttigieg,13345.0,Pete Buttigieg,10.5,2020-02-20
1011,California,36.116203000000006,-119.681564,119181.0,64595.0,2020.0,1363.0,"University of California, Berkeley",300,LA Times,"University of California, Berkeley",457.0,"University of California, Berkeley",B/C,3002.0,lv,lv-d,Online,U.S. President,2/20/20,2/25/20,,False,,False,False,2/28/20 05:04,,https://escholarship.org/uc/item/40m769v7,primary,DEM,Bloomberg,13289.0,Michael Bloomberg,12.1,2020-02-20
1012,California,36.116203000000006,-119.681564,119181.0,64595.0,2020.0,1363.0,"University of California, Berkeley",300,LA Times,"University of California, Berkeley",457.0,"University of California, Berkeley",B/C,3002.0,lv,lv-d,Online,U.S. President,2/20/20,2/25/20,,False,,False,False,2/28/20 05:04,,https://escholarship.org/uc/item/40m769v7,primary,DEM,Warren,13258.0,Elizabeth Warren,17.3,2020-02-20
1013,California,36.116203000000006,-119.681564,119181.0,64595.0,2020.0,1363.0,"University of California, Berkeley",300,LA Times,"University of California, Berkeley",457.0,"University of California, Berkeley",B/C,3002.0,lv,lv-d,Online,U.S. President,2/20/20,2/25/20,,False,,False,False,2/28/20 05:04,,https://escholarship.org/uc/item/40m769v7,primary,DEM,Sanders,13257.0,Bernard Sanders,33.7,2020-02-20
1014,California,36.116203000000006,-119.681564,102782.0,59591.0,2020.0,1102.0,Emerson College,,,Emerson College,88.0,Emerson College,A-,424.0,lv,lv-d,IVR/Online,U.S. President,9/13/19,9/16/19,,False,,False,False,9/17/19 12:04,,http://emersonpolling.com/2019/09/17/biden-sanders-warren-in-statistical-tie-in-democratic-primary-harris-struggles-in-home-state/,primary,DEM,Warren,13258.0,Elizabeth Warren,20.4,2019-09-13
1015,California,36.116203000000006,-119.681564,102782.0,59591.0,2020.0,1102.0,Emerson College,,,Emerson College,88.0,Emerson College,A-,424.0,lv,lv-d,IVR/Online,U.S. President,9/13/19,9/16/19,,False,,False,False,9/17/19 12:04,,http://emersonpolling.com/2019/09/17/biden-sanders-warren-in-statistical-tie-in-democratic-primary-harris-struggles-in-home-state/,primary,DEM,Buttigieg,13345.0,Pete Buttigieg,4.3,2019-09-13
1016,California,36.116203000000006,-119.681564,102782.0,59591.0,2020.0,1102.0,Emerson College,,,Emerson College,88.0,Emerson College,A-,424.0,lv,lv-d,IVR/Online,U.S. President,9/13/19,9/16/19,,False,,False,False,9/17/19 12:04,,http://emersonpolling.com/2019/09/17/biden-sanders-warren-in-statistical-tie-in-democratic-primary-harris-struggles-in-home-state/,primary,DEM,Harris,13288.0,Kamala D. Harris,5.6,2019-09-13
1017,California,36.116203000000006,-119.681564,102782.0,59591.0,2020.0,1102.0,Emerson College,,,Emerson College,88.0,Emerson College,A-,424.0,lv,lv-d,IVR/Online,U.S. President,9/13/19,9/16/19,,False,,False,False,9/17/19 12:04,,http://emersonpolling.com/2019/09/17/biden-sanders-warren-in-statistical-tie-in-democratic-primary-harris-struggles-in-home-state/,primary,DEM,Gabbard,13343.0,Tulsi Gabbard,2.2,2019-09-13
1018,California,36.116203000000006,-119.681564,102782.0,59591.0,2020.0,1102.0,Emerson College,,,Emerson College,88.0,Emerson College,A-,424.0,lv,lv-d,IVR/Online,U.S. President,9/13/19,9/16/19,,False,,False,False,9/17/19 12:04,,http://emersonpolling.com/2019/09/17/biden-sanders-warren-in-statistical-tie-in-democratic-primary-harris-struggles-in-home-state/,primary,DEM,Klobuchar,13310.0,Amy Klobuchar,0.3,2019-09-13
1019,California,36.116203000000006,-119.681564,102795.0,59596.0,2020.0,460.0,SurveyUSA,"443,804",KGTV-TV (California) | San Diego Union-Tribune,SurveyUSA,325.0,SurveyUSA,A,547.0,lv,lv-d,Online,U.S. President,9/13/19,9/15/19,,False,,False,False,9/17/19 23:26,,http://www.surveyusa.com/client/PollReport.aspx?g=58e0ba48-d312-4f29-9007-67c41aa7d9a5,primary,DEM,Sanders,13257.0,Bernard Sanders,18.0,2019-09-13
1020,California,36.116203000000006,-119.681564,119207.0,64614.0,2020.0,1361.0,SSRS,143,CNN,CNN/SSRS,297.0,SSRS,A/B,488.0,lv,lv-d,Live Phone,U.S. President,2/22/20,2/26/20,,False,,False,False,2/28/20 12:13,,https://cdn.cnn.com/cnn/2020/images/02/28/rel1_ca.pdf,primary,DEM,Sanders,13257.0,Bernard Sanders,35.0,2020-02-22
1021,California,36.116203000000006,-119.681564,119207.0,64614.0,2020.0,1361.0,SSRS,143,CNN,CNN/SSRS,297.0,SSRS,A/B,488.0,lv,lv-d,Live Phone,U.S. President,2/22/20,2/26/20,,False,,False,False,2/28/20 12:13,,https://cdn.cnn.com/cnn/2020/images/02/28/rel1_ca.pdf,primary,DEM,Warren,13258.0,Elizabeth Warren,14.0,2020-02-22
1022,California,36.116203000000006,-119.681564,119207.0,64614.0,2020.0,1361.0,SSRS,143,CNN,CNN/SSRS,297.0,SSRS,A/B,488.0,lv,lv-d,Live Phone,U.S. President,2/22/20,2/26/20,,False,,False,False,2/28/20 12:13,,https://cdn.cnn.com/cnn/2020/images/02/28/rel1_ca.pdf,primary,DEM,Biden,13256.0,Joseph R. Biden Jr.,13.0,2020-02-22
1023,California,36.116203000000006,-119.681564,119207.0,64614.0,2020.0,1361.0,SSRS,143,CNN,CNN/SSRS,297.0,SSRS,A/B,488.0,lv,lv-d,Live Phone,U.S. President,2/22/20,2/26/20,,False,,False,False,2/28/20 12:13,,https://cdn.cnn.com/cnn/2020/images/02/28/rel1_ca.pdf,primary,DEM,Bloomberg,13289.0,Michael Bloomberg,12.0,2020-02-22
1024,California,36.116203000000006,-119.681564,119207.0,64614.0,2020.0,1361.0,SSRS,143,CNN,CNN/SSRS,297.0,SSRS,A/B,488.0,lv,lv-d,Live Phone,U.S. President,2/22/20,2/26/20,,False,,False,False,2/28/20 12:13,,https://cdn.cnn.com/cnn/2020/images/02/28/rel1_ca.pdf,primary,DEM,Buttigieg,13345.0,Pete Buttigieg,7.0,2020-02-22
1025,California,36.116203000000006,-119.681564,115876.0,63296.0,2020.0,460.0,SurveyUSA,"443,583,804",KGTV-TV (California) | KABC-TV (California) | San Diego Union-Tribune,SurveyUSA,325.0,SurveyUSA,A,565.0,lv,lv-d,Online,U.S. President,1/14/20,1/16/20,,False,,False,False,1/17/20 19:26,,http://www.surveyusa.com/client/PollReport.aspx?g=9634c475-cb54-4a34-ab4b-c0d9a2b82759,primary,DEM,Yang,13329.0,Andrew Yang,4.0,2020-01-14
1026,California,36.116203000000006,-119.681564,115876.0,63296.0,2020.0,460.0,SurveyUSA,"443,583,804",KGTV-TV (California) | KABC-TV (California) | San Diego Union-Tribune,SurveyUSA,325.0,SurveyUSA,A,565.0,lv,lv-d,Online,U.S. President,1/14/20,1/16/20,,False,,False,False,1/17/20 19:26,,http://www.surveyusa.com/client/PollReport.aspx?g=9634c475-cb54-4a34-ab4b-c0d9a2b82759,primary,DEM,Bloomberg,13289.0,Michael Bloomberg,6.0,2020-01-14
1027,California,36.116203000000006,-119.681564,115876.0,63296.0,2020.0,460.0,SurveyUSA,"443,583,804",KGTV-TV (California) | KABC-TV (California) | San Diego Union-Tribune,SurveyUSA,325.0,SurveyUSA,A,565.0,lv,lv-d,Online,U.S. President,1/14/20,1/16/20,,False,,False,False,1/17/20 19:26,,http://www.surveyusa.com/client/PollReport.aspx?g=9634c475-cb54-4a34-ab4b-c0d9a2b82759,primary,DEM,Gabbard,13343.0,Tulsi Gabbard,2.0,2020-01-14
1028,California,36.116203000000006,-119.681564,94682.0,58166.0,2020.0,1365.0,Change Research,,,Change Research,48.0,Change Research,C,1649.0,lv,lv-d,Online,U.S. President,5/25/19,5/28/19,,False,,False,False,5/31/19 10:39,,https://www.changeresearch.com/california-poll-may-25-28-2019,primary,DEM,O'Rourke,13276.0,Beto O'Rourke,3.0,2019-05-25
1029,California,36.116203000000006,-119.681564,116200.0,63367.0,2020.0,1363.0,"University of California, Berkeley",300,LA Times,"University of California, Berkeley",457.0,"University of California, Berkeley",B/C,2895.0,lv,lv-d,Online,U.S. President,1/15/20,1/21/20,,False,,False,False,1/28/20 06:21,,https://escholarship.org/uc/item/1h8738br,primary,DEM,Bloomberg,13289.0,Michael Bloomberg,6.0,2020-01-15
1030,California,36.116203000000006,-119.681564,116200.0,63367.0,2020.0,1363.0,"University of California, Berkeley",300,LA Times,"University of California, Berkeley",457.0,"University of California, Berkeley",B/C,2895.0,lv,lv-d,Online,U.S. President,1/15/20,1/21/20,,False,,False,False,1/28/20 06:21,,https://escholarship.org/uc/item/1h8738br,primary,DEM,Klobuchar,13310.0,Amy Klobuchar,4.9,2020-01-15
1031,California,36.116203000000006,-119.681564,116200.0,63367.0,2020.0,1363.0,"University of California, Berkeley",300,LA Times,"University of California, Berkeley",457.0,"University of California, Berkeley",B/C,2895.0,lv,lv-d,Online,U.S. President,1/15/20,1/21/20,,False,,False,False,1/28/20 06:21,,https://escholarship.org/uc/item/1h8738br,primary,DEM,Yang,13329.0,Andrew Yang,3.9,2020-01-15
1032,California,36.116203000000006,-119.681564,116200.0,63367.0,2020.0,1363.0,"University of California, Berkeley",300,LA Times,"University of California, Berkeley",457.0,"University of California, Berkeley",B/C,2895.0,lv,lv-d,Online,U.S. President,1/15/20,1/21/20,,False,,False,False,1/28/20 06:21,,https://escholarship.org/uc/item/1h8738br,primary,DEM,Steyer,13327.0,Tom Steyer,1.8,2020-01-15
1033,California,36.116203000000006,-119.681564,116200.0,63367.0,2020.0,1363.0,"University of California, Berkeley",300,LA Times,"University of California, Berkeley",457.0,"University of California, Berkeley",B/C,2895.0,lv,lv-d,Online,U.S. President,1/15/20,1/21/20,,False,,False,False,1/28/20 06:21,,https://escholarship.org/uc/item/1h8738br,primary,DEM,Gabbard,13343.0,Tulsi Gabbard,1.4,2020-01-15
1034,California,36.116203000000006,-119.681564,116200.0,63367.0,2020.0,1363.0,"University of California, Berkeley",300,LA Times,"University of California, Berkeley",457.0,"University of California, Berkeley",B/C,2895.0,lv,lv-d,Online,U.S. President,1/15/20,1/21/20,,False,,False,False,1/28/20 06:21,,https://escholarship.org/uc/item/1h8738br,primary,DEM,Bennet,13352.0,Michael F. Bennet,0.9,2020-01-15
1035,California,36.116203000000006,-119.681564,118942.0,64533.0,2020.0,1539.0,Point Blank Political,,,Point Blank Political,550.0,Point Blank Political,,2098.0,lv,lv-d,Online/Text,U.S. President,2/23/20,2/25/20,,False,,False,False,2/26/20 09:41,,https://www.pointblankpolitical.com/2020-ca-dem-primary-pre-debate/,primary,DEM,Steyer,13327.0,Tom Steyer,2.9,2020-02-23
1036,California,36.116203000000006,-119.681564,118942.0,64533.0,2020.0,1539.0,Point Blank Political,,,Point Blank Political,550.0,Point Blank Political,,2098.0,lv,lv-d,Online/Text,U.S. President,2/23/20,2/25/20,,False,,False,False,2/26/20 09:41,,https://www.pointblankpolitical.com/2020-ca-dem-primary-pre-debate/,primary,DEM,Gabbard,13343.0,Tulsi Gabbard,2.1,2020-02-23
1037,California,36.116203000000006,-119.681564,102782.0,59591.0,2020.0,1102.0,Emerson College,,,Emerson College,88.0,Emerson College,A-,424.0,lv,lv-d,IVR/Online,U.S. President,9/13/19,9/16/19,,False,,False,False,9/17/19 12:04,,http://emersonpolling.com/2019/09/17/biden-sanders-warren-in-statistical-tie-in-democratic-primary-harris-struggles-in-home-state/,primary,DEM,Messam,13357.0,Wayne Messam,0.1,2019-09-13
1038,California,36.116203000000006,-119.681564,115664.0,63266.0,2020.0,382.0,Public Policy Institute of California,,,Public Policy Institute of California,262.0,Public Policy Institute of California,A/B,530.0,lv,lv-d,Live Phone,U.S. President,1/3/20,1/12/20,,False,,False,False,1/13/20 19:42,,https://www.ppic.org/wp-content/uploads/ppic-statewide-survey-californians-and-their-government-january-2020.pdf,primary,DEM,Warren,13258.0,Elizabeth Warren,23.0,2020-01-03
1039,California,36.116203000000006,-119.681564,115664.0,63266.0,2020.0,382.0,Public Policy Institute of California,,,Public Policy Institute of California,262.0,Public Policy Institute of California,A/B,530.0,lv,lv-d,Live Phone,U.S. President,1/3/20,1/12/20,,False,,False,False,1/13/20 19:42,,https://www.ppic.org/wp-content/uploads/ppic-statewide-survey-californians-and-their-government-january-2020.pdf,primary,DEM,Buttigieg,13345.0,Pete Buttigieg,6.0,2020-01-03
1040,California,36.116203000000006,-119.681564,94679.0,58166.0,2020.0,1365.0,Change Research,,,Change Research,48.0,Change Research,C,989.0,lv,lv-r,Online,U.S. President,5/25/19,5/28/19,,False,,False,False,5/31/19 10:38,,https://www.changeresearch.com/california-poll-may-25-28-2019,primary,REP,Trump,13254.0,Donald Trump,90.0,2019-05-25
1041,California,36.116203000000006,-119.681564,94679.0,58166.0,2020.0,1365.0,Change Research,,,Change Research,48.0,Change Research,C,989.0,lv,lv-r,Online,U.S. President,5/25/19,5/28/19,,False,,False,False,5/31/19 10:38,,https://www.changeresearch.com/california-poll-may-25-28-2019,primary,REP,Kasich,13278.0,John Richard Kasich,3.0,2019-05-25
1042,California,36.116203000000006,-119.681564,94680.0,58166.0,2020.0,1365.0,Change Research,,,Change Research,48.0,Change Research,C,989.0,lv,lv-r,Online,U.S. President,5/25/19,5/28/19,,False,,False,False,5/31/19 10:38,,https://www.changeresearch.com/california-poll-may-25-28-2019,primary,REP,Trump,13254.0,Donald Trump,86.0,2019-05-25
1043,California,36.116203000000006,-119.681564,94680.0,58166.0,2020.0,1365.0,Change Research,,,Change Research,48.0,Change Research,C,989.0,lv,lv-r,Online,U.S. President,5/25/19,5/28/19,,False,,False,False,5/31/19 10:38,,https://www.changeresearch.com/california-poll-may-25-28-2019,primary,REP,Haley,13279.0,Nimrata R. Haley,5.0,2019-05-25
1044,California,36.116203000000006,-119.681564,94681.0,58166.0,2020.0,1365.0,Change Research,,,Change Research,48.0,Change Research,C,989.0,lv,lv-r,Online,U.S. President,5/25/19,5/28/19,,False,,False,False,5/31/19 10:39,,https://www.changeresearch.com/california-poll-may-25-28-2019,primary,REP,Trump,13254.0,Donald Trump,91.0,2019-05-25
1045,California,36.116203000000006,-119.681564,94681.0,58166.0,2020.0,1365.0,Change Research,,,Change Research,48.0,Change Research,C,989.0,lv,lv-r,Online,U.S. President,5/25/19,5/28/19,,False,,False,False,5/31/19 10:39,,https://www.changeresearch.com/california-poll-may-25-28-2019,primary,REP,Weld,13351.0,William F. Weld,3.0,2019-05-25
1046,California,36.116203000000006,-119.681564,94682.0,58166.0,2020.0,1365.0,Change Research,,,Change Research,48.0,Change Research,C,1649.0,lv,lv-d,Online,U.S. President,5/25/19,5/28/19,,False,,False,False,5/31/19 10:39,,https://www.changeresearch.com/california-poll-may-25-28-2019,primary,DEM,Biden,13256.0,Joseph R. Biden Jr.,30.0,2019-05-25
1047,California,36.116203000000006,-119.681564,94682.0,58166.0,2020.0,1365.0,Change Research,,,Change Research,48.0,Change Research,C,1649.0,lv,lv-d,Online,U.S. President,5/25/19,5/28/19,,False,,False,False,5/31/19 10:39,,https://www.changeresearch.com/california-poll-may-25-28-2019,primary,DEM,Sanders,13257.0,Bernard Sanders,23.0,2019-05-25
1048,California,36.116203000000006,-119.681564,94682.0,58166.0,2020.0,1365.0,Change Research,,,Change Research,48.0,Change Research,C,1649.0,lv,lv-d,Online,U.S. President,5/25/19,5/28/19,,False,,False,False,5/31/19 10:39,,https://www.changeresearch.com/california-poll-may-25-28-2019,primary,DEM,Harris,13288.0,Kamala D. Harris,15.0,2019-05-25
1049,California,36.116203000000006,-119.681564,116200.0,63367.0,2020.0,1363.0,"University of California, Berkeley",300,LA Times,"University of California, Berkeley",457.0,"University of California, Berkeley",B/C,2895.0,lv,lv-d,Online,U.S. President,1/15/20,1/21/20,,False,,False,False,1/28/20 06:21,,https://escholarship.org/uc/item/1h8738br,primary,DEM,Booker,13287.0,Cory A. Booker,0.8,2020-01-15
1050,California,36.116203000000006,-119.681564,94682.0,58166.0,2020.0,1365.0,Change Research,,,Change Research,48.0,Change Research,C,1649.0,lv,lv-d,Online,U.S. President,5/25/19,5/28/19,,False,,False,False,5/31/19 10:39,,https://www.changeresearch.com/california-poll-may-25-28-2019,primary,DEM,Yang,13329.0,Andrew Yang,1.0,2019-05-25
1051,California,36.116203000000006,-119.681564,94682.0,58166.0,2020.0,1365.0,Change Research,,,Change Research,48.0,Change Research,C,1649.0,lv,lv-d,Online,U.S. President,5/25/19,5/28/19,,False,,False,False,5/31/19 10:39,,https://www.changeresearch.com/california-poll-may-25-28-2019,primary,DEM,Gabbard,13343.0,Tulsi Gabbard,1.0,2019-05-25
1052,California,36.116203000000006,-119.681564,115876.0,63296.0,2020.0,460.0,SurveyUSA,"443,583,804",KGTV-TV (California) | KABC-TV (California) | San Diego Union-Tribune,SurveyUSA,325.0,SurveyUSA,A,565.0,lv,lv-d,Online,U.S. President,1/14/20,1/16/20,,False,,False,False,1/17/20 19:26,,http://www.surveyusa.com/client/PollReport.aspx?g=9634c475-cb54-4a34-ab4b-c0d9a2b82759,primary,DEM,Buttigieg,13345.0,Pete Buttigieg,8.0,2020-01-14
1053,California,36.116203000000006,-119.681564,94682.0,58166.0,2020.0,1365.0,Change Research,,,Change Research,48.0,Change Research,C,1649.0,lv,lv-d,Online,U.S. President,5/25/19,5/28/19,,False,,False,False,5/31/19 10:39,,https://www.changeresearch.com/california-poll-may-25-28-2019,primary,DEM,Warren,13258.0,Elizabeth Warren,12.0,2019-05-25
1054,California,36.116203000000006,-119.681564,102782.0,59591.0,2020.0,1102.0,Emerson College,,,Emerson College,88.0,Emerson College,A-,424.0,lv,lv-d,IVR/Online,U.S. President,9/13/19,9/16/19,,False,,False,False,9/17/19 12:04,,http://emersonpolling.com/2019/09/17/biden-sanders-warren-in-statistical-tie-in-democratic-primary-harris-struggles-in-home-state/,primary,DEM,Bennet,13352.0,Michael F. Bennet,0.1,2019-09-13
1055,California,36.116203000000006,-119.681564,102994.0,59618.0,2020.0,1365.0,Change Research,1186,KQED,Change Research,48.0,Change Research,C,3325.0,lv,lv-d,Online,U.S. President,9/12/19,9/15/19,,False,,False,False,9/19/19 12:43,,https://www.changeresearch.com/california-poll-sept-12-15,primary,DEM,Williamson,13350.0,Marianne Williamson,1.0,2019-09-12
1056,California,36.116203000000006,-119.681564,94682.0,58166.0,2020.0,1365.0,Change Research,,,Change Research,48.0,Change Research,C,1649.0,lv,lv-d,Online,U.S. President,5/25/19,5/28/19,,False,,False,False,5/31/19 10:39,,https://www.changeresearch.com/california-poll-may-25-28-2019,primary,DEM,Buttigieg,13345.0,Pete Buttigieg,12.0,2019-05-25
1057,California,36.116203000000006,-119.681564,115876.0,63296.0,2020.0,460.0,SurveyUSA,"443,583,804",KGTV-TV (California) | KABC-TV (California) | San Diego Union-Tribune,SurveyUSA,325.0,SurveyUSA,A,565.0,lv,lv-d,Online,U.S. President,1/14/20,1/16/20,,False,,False,False,1/17/20 19:26,,http://www.surveyusa.com/client/PollReport.aspx?g=9634c475-cb54-4a34-ab4b-c0d9a2b82759,primary,DEM,Warren,13258.0,Elizabeth Warren,20.0,2020-01-14
1058,California,36.116203000000006,-119.681564,118942.0,64533.0,2020.0,1539.0,Point Blank Political,,,Point Blank Political,550.0,Point Blank Political,,2098.0,lv,lv-d,Online/Text,U.S. President,2/23/20,2/25/20,,False,,False,False,2/26/20 09:41,,https://www.pointblankpolitical.com/2020-ca-dem-primary-pre-debate/,primary,DEM,Buttigieg,13345.0,Pete Buttigieg,8.9,2020-02-23
1059,California,36.116203000000006,-119.681564,118942.0,64533.0,2020.0,1539.0,Point Blank Political,,,Point Blank Political,550.0,Point Blank Political,,2098.0,lv,lv-d,Online/Text,U.S. President,2/23/20,2/25/20,,False,,False,False,2/26/20 09:41,,https://www.pointblankpolitical.com/2020-ca-dem-primary-pre-debate/,primary,DEM,Klobuchar,13310.0,Amy Klobuchar,3.7,2020-02-23
1060,California,36.116203000000006,-119.681564,102994.0,59618.0,2020.0,1365.0,Change Research,1186,KQED,Change Research,48.0,Change Research,C,3325.0,lv,lv-d,Online,U.S. President,9/12/19,9/15/19,,False,,False,False,9/19/19 12:43,,https://www.changeresearch.com/california-poll-sept-12-15,primary,DEM,Steyer,13327.0,Tom Steyer,0.0,2019-09-12
1061,California,36.116203000000006,-119.681564,115876.0,63296.0,2020.0,460.0,SurveyUSA,"443,583,804",KGTV-TV (California) | KABC-TV (California) | San Diego Union-Tribune,SurveyUSA,325.0,SurveyUSA,A,565.0,lv,lv-d,Online,U.S. President,1/14/20,1/16/20,,False,,False,False,1/17/20 19:26,,http://www.surveyusa.com/client/PollReport.aspx?g=9634c475-cb54-4a34-ab4b-c0d9a2b82759,primary,DEM,Sanders,13257.0,Bernard Sanders,20.0,2020-01-14
1062,California,36.116203000000006,-119.681564,115664.0,63266.0,2020.0,382.0,Public Policy Institute of California,,,Public Policy Institute of California,262.0,Public Policy Institute of California,A/B,530.0,lv,lv-d,Live Phone,U.S. President,1/3/20,1/12/20,,False,,False,False,1/13/20 19:42,,https://www.ppic.org/wp-content/uploads/ppic-statewide-survey-californians-and-their-government-january-2020.pdf,primary,DEM,Sanders,13257.0,Bernard Sanders,27.0,2020-01-03
1063,California,36.116203000000006,-119.681564,115664.0,63266.0,2020.0,382.0,Public Policy Institute of California,,,Public Policy Institute of California,262.0,Public Policy Institute of California,A/B,530.0,lv,lv-d,Live Phone,U.S. President,1/3/20,1/12/20,,False,,False,False,1/13/20 19:42,,https://www.ppic.org/wp-content/uploads/ppic-statewide-survey-californians-and-their-government-january-2020.pdf,primary,DEM,Biden,13256.0,Joseph R. Biden Jr.,24.0,2020-01-03
1064,California,36.116203000000006,-119.681564,102994.0,59618.0,2020.0,1365.0,Change Research,1186,KQED,Change Research,48.0,Change Research,C,3325.0,lv,lv-d,Online,U.S. President,9/12/19,9/15/19,,False,,False,False,9/19/19 12:43,,https://www.changeresearch.com/california-poll-sept-12-15,primary,DEM,de Blasio,13335.0,Bill de Blasio,0.0,2019-09-12
1065,California,36.116203000000006,-119.681564,102782.0,59591.0,2020.0,1102.0,Emerson College,,,Emerson College,88.0,Emerson College,A-,424.0,lv,lv-d,IVR/Online,U.S. President,9/13/19,9/16/19,,False,,False,False,9/17/19 12:04,,http://emersonpolling.com/2019/09/17/biden-sanders-warren-in-statistical-tie-in-democratic-primary-harris-struggles-in-home-state/,primary,DEM,Ryan,13358.0,Tim Ryan,0.1,2019-09-13
1066,California,36.116203000000006,-119.681564,102782.0,59591.0,2020.0,1102.0,Emerson College,,,Emerson College,88.0,Emerson College,A-,424.0,lv,lv-d,IVR/Online,U.S. President,9/13/19,9/16/19,,False,,False,False,9/17/19 12:04,,http://emersonpolling.com/2019/09/17/biden-sanders-warren-in-statistical-tie-in-democratic-primary-harris-struggles-in-home-state/,primary,DEM,Delaney,13314.0,John K. Delaney,0.2,2019-09-13
1067,California,36.116203000000006,-119.681564,102782.0,59591.0,2020.0,1102.0,Emerson College,,,Emerson College,88.0,Emerson College,A-,424.0,lv,lv-d,IVR/Online,U.S. President,9/13/19,9/16/19,,False,,False,False,9/17/19 12:04,,http://emersonpolling.com/2019/09/17/biden-sanders-warren-in-statistical-tie-in-democratic-primary-harris-struggles-in-home-state/,primary,DEM,Bullock,13320.0,Steve Bullock,0.3,2019-09-13
1068,California,36.116203000000006,-119.681564,118942.0,64533.0,2020.0,1539.0,Point Blank Political,,,Point Blank Political,550.0,Point Blank Political,,2098.0,lv,lv-d,Online/Text,U.S. President,2/23/20,2/25/20,,False,,False,False,2/26/20 09:41,,https://www.pointblankpolitical.com/2020-ca-dem-primary-pre-debate/,primary,DEM,Biden,13256.0,Joseph R. Biden Jr.,10.5,2020-02-23
1069,California,36.116203000000006,-119.681564,118942.0,64533.0,2020.0,1539.0,Point Blank Political,,,Point Blank Political,550.0,Point Blank Political,,2098.0,lv,lv-d,Online/Text,U.S. President,2/23/20,2/25/20,,False,,False,False,2/26/20 09:41,,https://www.pointblankpolitical.com/2020-ca-dem-primary-pre-debate/,primary,DEM,Bloomberg,13289.0,Michael Bloomberg,10.6,2020-02-23
1070,California,36.116203000000006,-119.681564,102994.0,59618.0,2020.0,1365.0,Change Research,1186,KQED,Change Research,48.0,Change Research,C,3325.0,lv,lv-d,Online,U.S. President,9/12/19,9/15/19,,False,,False,False,9/19/19 12:43,,https://www.changeresearch.com/california-poll-sept-12-15,primary,DEM,Bullock,13320.0,Steve Bullock,0.0,2019-09-12
1071,Colorado,39.059810999999996,-105.311104,119041.0,64573.0,2020.0,1515.0,Data for Progress,,,Data for Progress,522.0,Data for Progress,B/C,471.0,lv,lv-d,Text,U.S. President,2/23/20,2/25/20,,False,,False,False,2/26/20 16:25,,https://www.dataforprogress.org/blog/2020/2/26/sanders-ahead-in-virginia-and-colorado,primary,DEM,Gabbard,13343.0,Tulsi Gabbard,1.0,2020-02-23
1072,Colorado,39.059810999999996,-105.311104,119041.0,64573.0,2020.0,1515.0,Data for Progress,,,Data for Progress,522.0,Data for Progress,B/C,471.0,lv,lv-d,Text,U.S. President,2/23/20,2/25/20,,False,,False,False,2/26/20 16:25,,https://www.dataforprogress.org/blog/2020/2/26/sanders-ahead-in-virginia-and-colorado,primary,DEM,Biden,13256.0,Joseph R. Biden Jr.,10.0,2020-02-23
1073,Colorado,39.059810999999996,-105.311104,119041.0,64573.0,2020.0,1515.0,Data for Progress,,,Data for Progress,522.0,Data for Progress,B/C,471.0,lv,lv-d,Text,U.S. President,2/23/20,2/25/20,,False,,False,False,2/26/20 16:25,,https://www.dataforprogress.org/blog/2020/2/26/sanders-ahead-in-virginia-and-colorado,primary,DEM,Warren,13258.0,Elizabeth Warren,20.0,2020-02-23
1074,Colorado,39.059810999999996,-105.311104,119041.0,64573.0,2020.0,1515.0,Data for Progress,,,Data for Progress,522.0,Data for Progress,B/C,471.0,lv,lv-d,Text,U.S. President,2/23/20,2/25/20,,False,,False,False,2/26/20 16:25,,https://www.dataforprogress.org/blog/2020/2/26/sanders-ahead-in-virginia-and-colorado,primary,DEM,Sanders,13257.0,Bernard Sanders,34.0,2020-02-23
1075,Colorado,39.059810999999996,-105.311104,119067.0,64580.0,2020.0,270.0,Magellan Strategies,,,Magellan Strategies,179.0,Magellan Strategies,B/C,500.0,lv,lv-d,Live Phone,U.S. President,2/24/20,2/25/20,,False,,False,False,2/27/20 00:07,,https://magellanstrategies.com/magellan-strategies-colorado-democratic-presidential-primary/,primary,DEM,Sanders,13257.0,Bernard Sanders,27.2,2020-02-24
1076,Colorado,39.059810999999996,-105.311104,119067.0,64580.0,2020.0,270.0,Magellan Strategies,,,Magellan Strategies,179.0,Magellan Strategies,B/C,500.0,lv,lv-d,Live Phone,U.S. President,2/24/20,2/25/20,,False,,False,False,2/27/20 00:07,,https://magellanstrategies.com/magellan-strategies-colorado-democratic-presidential-primary/,primary,DEM,Warren,13258.0,Elizabeth Warren,14.9,2020-02-24
1077,Colorado,39.059810999999996,-105.311104,119067.0,64580.0,2020.0,270.0,Magellan Strategies,,,Magellan Strategies,179.0,Magellan Strategies,B/C,500.0,lv,lv-d,Live Phone,U.S. President,2/24/20,2/25/20,,False,,False,False,2/27/20 00:07,,https://magellanstrategies.com/magellan-strategies-colorado-democratic-presidential-primary/,primary,DEM,Buttigieg,13345.0,Pete Buttigieg,11.6,2020-02-24
1078,Colorado,39.059810999999996,-105.311104,119067.0,64580.0,2020.0,270.0,Magellan Strategies,,,Magellan Strategies,179.0,Magellan Strategies,B/C,500.0,lv,lv-d,Live Phone,U.S. President,2/24/20,2/25/20,,False,,False,False,2/27/20 00:07,,https://magellanstrategies.com/magellan-strategies-colorado-democratic-presidential-primary/,primary,DEM,Bloomberg,13289.0,Michael Bloomberg,11.1,2020-02-24
1079,Colorado,39.059810999999996,-105.311104,119067.0,64580.0,2020.0,270.0,Magellan Strategies,,,Magellan Strategies,179.0,Magellan Strategies,B/C,500.0,lv,lv-d,Live Phone,U.S. President,2/24/20,2/25/20,,False,,False,False,2/27/20 00:07,,https://magellanstrategies.com/magellan-strategies-colorado-democratic-presidential-primary/,primary,DEM,Biden,13256.0,Joseph R. Biden Jr.,11.1,2020-02-24
1080,Colorado,39.059810999999996,-105.311104,119041.0,64573.0,2020.0,1515.0,Data for Progress,,,Data for Progress,522.0,Data for Progress,B/C,471.0,lv,lv-d,Text,U.S. President,2/23/20,2/25/20,,False,,False,False,2/26/20 16:25,,https://www.dataforprogress.org/blog/2020/2/26/sanders-ahead-in-virginia-and-colorado,primary,DEM,Klobuchar,13310.0,Amy Klobuchar,6.0,2020-02-23
1081,Colorado,39.059810999999996,-105.311104,119041.0,64573.0,2020.0,1515.0,Data for Progress,,,Data for Progress,522.0,Data for Progress,B/C,471.0,lv,lv-d,Text,U.S. President,2/23/20,2/25/20,,False,,False,False,2/26/20 16:25,,https://www.dataforprogress.org/blog/2020/2/26/sanders-ahead-in-virginia-and-colorado,primary,DEM,Steyer,13327.0,Tom Steyer,0.0,2020-02-23
1082,Colorado,39.059810999999996,-105.311104,119476.0,64674.0,2020.0,1522.0,Swayable,,,Swayable,543.0,Swayable,,921.0,lv,lv-d,Online,U.S. President,3/1/20,3/2/20,,False,,False,False,3/3/20 06:19,,https://swayable.com/insights/democratic-primaries-2020-super-tuesday-polling,primary,DEM,Gabbard,13343.0,Tulsi Gabbard,0.1,2020-03-01
1083,Colorado,39.059810999999996,-105.311104,119476.0,64674.0,2020.0,1522.0,Swayable,,,Swayable,543.0,Swayable,,921.0,lv,lv-d,Online,U.S. President,3/1/20,3/2/20,,False,,False,False,3/3/20 06:19,,https://swayable.com/insights/democratic-primaries-2020-super-tuesday-polling,primary,DEM,Biden,13256.0,Joseph R. Biden Jr.,19.7,2020-03-01
1084,Colorado,39.059810999999996,-105.311104,119476.0,64674.0,2020.0,1522.0,Swayable,,,Swayable,543.0,Swayable,,921.0,lv,lv-d,Online,U.S. President,3/1/20,3/2/20,,False,,False,False,3/3/20 06:19,,https://swayable.com/insights/democratic-primaries-2020-super-tuesday-polling,primary,DEM,Bloomberg,13289.0,Michael Bloomberg,19.0,2020-03-01
1085,Colorado,39.059810999999996,-105.311104,119476.0,64674.0,2020.0,1522.0,Swayable,,,Swayable,543.0,Swayable,,921.0,lv,lv-d,Online,U.S. President,3/1/20,3/2/20,,False,,False,False,3/3/20 06:19,,https://swayable.com/insights/democratic-primaries-2020-super-tuesday-polling,primary,DEM,Buttigieg,13345.0,Pete Buttigieg,12.3,2020-03-01
1086,Colorado,39.059810999999996,-105.311104,119476.0,64674.0,2020.0,1522.0,Swayable,,,Swayable,543.0,Swayable,,921.0,lv,lv-d,Online,U.S. President,3/1/20,3/2/20,,False,,False,False,3/3/20 06:19,,https://swayable.com/insights/democratic-primaries-2020-super-tuesday-polling,primary,DEM,Warren,13258.0,Elizabeth Warren,12.2,2020-03-01
1087,Colorado,39.059810999999996,-105.311104,119476.0,64674.0,2020.0,1522.0,Swayable,,,Swayable,543.0,Swayable,,921.0,lv,lv-d,Online,U.S. President,3/1/20,3/2/20,,False,,False,False,3/3/20 06:19,,https://swayable.com/insights/democratic-primaries-2020-super-tuesday-polling,primary,DEM,Klobuchar,13310.0,Amy Klobuchar,4.2,2020-03-01
1088,Colorado,39.059810999999996,-105.311104,119476.0,64674.0,2020.0,1522.0,Swayable,,,Swayable,543.0,Swayable,,921.0,lv,lv-d,Online,U.S. President,3/1/20,3/2/20,,False,,False,False,3/3/20 06:19,,https://swayable.com/insights/democratic-primaries-2020-super-tuesday-polling,primary,DEM,Steyer,13327.0,Tom Steyer,0.4,2020-03-01
1089,Colorado,39.059810999999996,-105.311104,100756.0,58930.0,2020.0,1102.0,Emerson College,,,Emerson College,88.0,Emerson College,A-,403.0,lv,lv-d,IVR/Online,U.S. President,8/16/19,8/19/19,,False,,False,False,8/20/19 08:29,,http://emersonpolling.com/2019/08/20/colorado-2020-sanders-biden-and-warren-lead-democratic-field-democrats-look-to-gain-senate-seat/,primary,DEM,Bennet,13352.0,Michael F. Bennet,1.0,2019-08-16
1090,Colorado,39.059810999999996,-105.311104,100756.0,58930.0,2020.0,1102.0,Emerson College,,,Emerson College,88.0,Emerson College,A-,403.0,lv,lv-d,IVR/Online,U.S. President,8/16/19,8/19/19,,False,,False,False,8/20/19 08:29,,http://emersonpolling.com/2019/08/20/colorado-2020-sanders-biden-and-warren-lead-democratic-field-democrats-look-to-gain-senate-seat/,primary,DEM,Williamson,13350.0,Marianne Williamson,0.5,2019-08-16
1091,Colorado,39.059810999999996,-105.311104,119067.0,64580.0,2020.0,270.0,Magellan Strategies,,,Magellan Strategies,179.0,Magellan Strategies,B/C,500.0,lv,lv-d,Live Phone,U.S. President,2/24/20,2/25/20,,False,,False,False,2/27/20 00:07,,https://magellanstrategies.com/magellan-strategies-colorado-democratic-presidential-primary/,primary,DEM,Klobuchar,13310.0,Amy Klobuchar,5.9,2020-02-24
1092,Colorado,39.059810999999996,-105.311104,100756.0,58930.0,2020.0,1102.0,Emerson College,,,Emerson College,88.0,Emerson College,A-,403.0,lv,lv-d,IVR/Online,U.S. President,8/16/19,8/19/19,,False,,False,False,8/20/19 08:29,,http://emersonpolling.com/2019/08/20/colorado-2020-sanders-biden-and-warren-lead-democratic-field-democrats-look-to-gain-senate-seat/,primary,DEM,Castro,13316.0,Julián Castro,0.0,2019-08-16
1093,Colorado,39.059810999999996,-105.311104,100756.0,58930.0,2020.0,1102.0,Emerson College,,,Emerson College,88.0,Emerson College,A-,403.0,lv,lv-d,IVR/Online,U.S. President,8/16/19,8/19/19,,False,,False,False,8/20/19 08:29,,http://emersonpolling.com/2019/08/20/colorado-2020-sanders-biden-and-warren-lead-democratic-field-democrats-look-to-gain-senate-seat/,primary,DEM,Bullock,13320.0,Steve Bullock,0.0,2019-08-16
1094,Colorado,39.059810999999996,-105.311104,100756.0,58930.0,2020.0,1102.0,Emerson College,,,Emerson College,88.0,Emerson College,A-,403.0,lv,lv-d,IVR/Online,U.S. President,8/16/19,8/19/19,,False,,False,False,8/20/19 08:29,,http://emersonpolling.com/2019/08/20/colorado-2020-sanders-biden-and-warren-lead-democratic-field-democrats-look-to-gain-senate-seat/,primary,DEM,Moulton,13322.0,Seth Moulton,0.0,2019-08-16
1095,Colorado,39.059810999999996,-105.311104,100756.0,58930.0,2020.0,1102.0,Emerson College,,,Emerson College,88.0,Emerson College,A-,403.0,lv,lv-d,IVR/Online,U.S. President,8/16/19,8/19/19,,False,,False,False,8/20/19 08:29,,http://emersonpolling.com/2019/08/20/colorado-2020-sanders-biden-and-warren-lead-democratic-field-democrats-look-to-gain-senate-seat/,primary,DEM,Steyer,13327.0,Tom Steyer,0.0,2019-08-16
1096,Colorado,39.059810999999996,-105.311104,100756.0,58930.0,2020.0,1102.0,Emerson College,,,Emerson College,88.0,Emerson College,A-,403.0,lv,lv-d,IVR/Online,U.S. President,8/16/19,8/19/19,,False,,False,False,8/20/19 08:29,,http://emersonpolling.com/2019/08/20/colorado-2020-sanders-biden-and-warren-lead-democratic-field-democrats-look-to-gain-senate-seat/,primary,DEM,Messam,13357.0,Wayne Messam,0.0,2019-08-16
1097,Colorado,39.059810999999996,-105.311104,119476.0,64674.0,2020.0,1522.0,Swayable,,,Swayable,543.0,Swayable,,921.0,lv,lv-d,Online,U.S. President,3/1/20,3/2/20,,False,,False,False,3/3/20 06:19,,https://swayable.com/insights/democratic-primaries-2020-super-tuesday-polling,primary,DEM,Sanders,13257.0,Bernard Sanders,28.6,2020-03-01
1098,Colorado,39.059810999999996,-105.311104,100756.0,58930.0,2020.0,1102.0,Emerson College,,,Emerson College,88.0,Emerson College,A-,403.0,lv,lv-d,IVR/Online,U.S. President,8/16/19,8/19/19,,False,,False,False,8/20/19 08:29,,http://emersonpolling.com/2019/08/20/colorado-2020-sanders-biden-and-warren-lead-democratic-field-democrats-look-to-gain-senate-seat/,primary,DEM,Sestak,13381.0,Joe Sestak,0.1,2019-08-16
1099,Colorado,39.059810999999996,-105.311104,100756.0,58930.0,2020.0,1102.0,Emerson College,,,Emerson College,88.0,Emerson College,A-,403.0,lv,lv-d,IVR/Online,U.S. President,8/16/19,8/19/19,,False,,False,False,8/20/19 08:29,,http://emersonpolling.com/2019/08/20/colorado-2020-sanders-biden-and-warren-lead-democratic-field-democrats-look-to-gain-senate-seat/,primary,DEM,Ryan,13358.0,Tim Ryan,0.4,2019-08-16
1100,Colorado,39.059810999999996,-105.311104,119041.0,64573.0,2020.0,1515.0,Data for Progress,,,Data for Progress,522.0,Data for Progress,B/C,471.0,lv,lv-d,Text,U.S. President,2/23/20,2/25/20,,False,,False,False,2/26/20 16:25,,https://www.dataforprogress.org/blog/2020/2/26/sanders-ahead-in-virginia-and-colorado,primary,DEM,Buttigieg,13345.0,Pete Buttigieg,14.0,2020-02-23
1101,Colorado,39.059810999999996,-105.311104,119435.0,64662.0,2020.0,1529.0,Elucd,,,Elucd,549.0,Elucd,,561.0,lv,lv-d,Online,U.S. President,2/26/20,3/1/20,,False,,False,False,3/2/20 19:05,,https://elucd.ghost.io/elucd-super-tuesday-democratic-primary-results-3-2-20/,primary,DEM,Sanders,13257.0,Bernard Sanders,34.0,2020-02-26
1102,Colorado,39.059810999999996,-105.311104,100756.0,58930.0,2020.0,1102.0,Emerson College,,,Emerson College,88.0,Emerson College,A-,403.0,lv,lv-d,IVR/Online,U.S. President,8/16/19,8/19/19,,False,,False,False,8/20/19 08:29,,http://emersonpolling.com/2019/08/20/colorado-2020-sanders-biden-and-warren-lead-democratic-field-democrats-look-to-gain-senate-seat/,primary,DEM,O'Rourke,13276.0,Beto O'Rourke,0.9,2019-08-16
1103,Colorado,39.059810999999996,-105.311104,99509.0,58697.0,2020.0,383.0,Public Policy Polling,918,DEM,Public Policy Polling,263.0,Public Policy Polling,B,561.0,v,v-d,,U.S. President,7/12/19,7/14/19,,True,DEM,False,False,7/19/19 11:29,,https://www.documentcloud.org/documents/6207605-Colorado-Prez-Senate-primary-poll.html,primary,DEM,Warren,13258.0,Elizabeth Warren,19.0,2019-07-12
1104,Colorado,39.059810999999996,-105.311104,99509.0,58697.0,2020.0,383.0,Public Policy Polling,918,DEM,Public Policy Polling,263.0,Public Policy Polling,B,561.0,v,v-d,,U.S. President,7/12/19,7/14/19,,True,DEM,False,False,7/19/19 11:29,,https://www.documentcloud.org/documents/6207605-Colorado-Prez-Senate-primary-poll.html,primary,DEM,Harris,13288.0,Kamala D. Harris,9.0,2019-07-12
1105,Colorado,39.059810999999996,-105.311104,119435.0,64662.0,2020.0,1529.0,Elucd,,,Elucd,549.0,Elucd,,561.0,lv,lv-d,Online,U.S. President,2/26/20,3/1/20,,False,,False,False,3/2/20 19:05,,https://elucd.ghost.io/elucd-super-tuesday-democratic-primary-results-3-2-20/,primary,DEM,Klobuchar,13310.0,Amy Klobuchar,5.0,2020-02-26
1106,Colorado,39.059810999999996,-105.311104,119435.0,64662.0,2020.0,1529.0,Elucd,,,Elucd,549.0,Elucd,,561.0,lv,lv-d,Online,U.S. President,2/26/20,3/1/20,,False,,False,False,3/2/20 19:05,,https://elucd.ghost.io/elucd-super-tuesday-democratic-primary-results-3-2-20/,primary,DEM,Bloomberg,13289.0,Michael Bloomberg,9.0,2020-02-26
1107,Colorado,39.059810999999996,-105.311104,119435.0,64662.0,2020.0,1529.0,Elucd,,,Elucd,549.0,Elucd,,561.0,lv,lv-d,Online,U.S. President,2/26/20,3/1/20,,False,,False,False,3/2/20 19:05,,https://elucd.ghost.io/elucd-super-tuesday-democratic-primary-results-3-2-20/,primary,DEM,Biden,13256.0,Joseph R. Biden Jr.,10.0,2020-02-26
1108,Colorado,39.059810999999996,-105.311104,119435.0,64662.0,2020.0,1529.0,Elucd,,,Elucd,549.0,Elucd,,561.0,lv,lv-d,Online,U.S. President,2/26/20,3/1/20,,False,,False,False,3/2/20 19:05,,https://elucd.ghost.io/elucd-super-tuesday-democratic-primary-results-3-2-20/,primary,DEM,Buttigieg,13345.0,Pete Buttigieg,10.0,2020-02-26
1109,Colorado,39.059810999999996,-105.311104,119492.0,64690.0,2020.0,1515.0,Data for Progress,,,Data for Progress,522.0,Data for Progress,B/C,464.0,lv,lv-d,Text,U.S. President,2/28/20,3/2/20,,False,,False,False,3/3/20 06:21,,https://www.dataforprogress.org/memos/super-tuesday-final-polling,primary,DEM,Gabbard,13343.0,Tulsi Gabbard,2.0,2020-02-28
1110,Colorado,39.059810999999996,-105.311104,119492.0,64690.0,2020.0,1515.0,Data for Progress,,,Data for Progress,522.0,Data for Progress,B/C,464.0,lv,lv-d,Text,U.S. President,2/28/20,3/2/20,,False,,False,False,3/3/20 06:21,,https://www.dataforprogress.org/memos/super-tuesday-final-polling,primary,DEM,Steyer,13327.0,Tom Steyer,0.0,2020-02-28
1111,Colorado,39.059810999999996,-105.311104,119492.0,64690.0,2020.0,1515.0,Data for Progress,,,Data for Progress,522.0,Data for Progress,B/C,464.0,lv,lv-d,Text,U.S. President,2/28/20,3/2/20,,False,,False,False,3/3/20 06:21,,https://www.dataforprogress.org/memos/super-tuesday-final-polling,primary,DEM,Buttigieg,13345.0,Pete Buttigieg,8.0,2020-02-28
1112,Colorado,39.059810999999996,-105.311104,119492.0,64690.0,2020.0,1515.0,Data for Progress,,,Data for Progress,522.0,Data for Progress,B/C,464.0,lv,lv-d,Text,U.S. President,2/28/20,3/2/20,,False,,False,False,3/3/20 06:21,,https://www.dataforprogress.org/memos/super-tuesday-final-polling,primary,DEM,Bloomberg,13289.0,Michael Bloomberg,16.0,2020-02-28
1113,Colorado,39.059810999999996,-105.311104,119492.0,64690.0,2020.0,1515.0,Data for Progress,,,Data for Progress,522.0,Data for Progress,B/C,464.0,lv,lv-d,Text,U.S. President,2/28/20,3/2/20,,False,,False,False,3/3/20 06:21,,https://www.dataforprogress.org/memos/super-tuesday-final-polling,primary,DEM,Biden,13256.0,Joseph R. Biden Jr.,18.0,2020-02-28
1114,Colorado,39.059810999999996,-105.311104,119492.0,64690.0,2020.0,1515.0,Data for Progress,,,Data for Progress,522.0,Data for Progress,B/C,464.0,lv,lv-d,Text,U.S. President,2/28/20,3/2/20,,False,,False,False,3/3/20 06:21,,https://www.dataforprogress.org/memos/super-tuesday-final-polling,primary,DEM,Warren,13258.0,Elizabeth Warren,21.0,2020-02-28
1115,Colorado,39.059810999999996,-105.311104,119492.0,64690.0,2020.0,1515.0,Data for Progress,,,Data for Progress,522.0,Data for Progress,B/C,464.0,lv,lv-d,Text,U.S. President,2/28/20,3/2/20,,False,,False,False,3/3/20 06:21,,https://www.dataforprogress.org/memos/super-tuesday-final-polling,primary,DEM,Sanders,13257.0,Bernard Sanders,32.0,2020-02-28
1116,Colorado,39.059810999999996,-105.311104,119492.0,64690.0,2020.0,1515.0,Data for Progress,,,Data for Progress,522.0,Data for Progress,B/C,464.0,lv,lv-d,Text,U.S. President,2/28/20,3/2/20,,False,,False,False,3/3/20 06:21,,https://www.dataforprogress.org/memos/super-tuesday-final-polling,primary,DEM,Klobuchar,13310.0,Amy Klobuchar,4.0,2020-02-28
1117,Colorado,39.059810999999996,-105.311104,119435.0,64662.0,2020.0,1529.0,Elucd,,,Elucd,549.0,Elucd,,561.0,lv,lv-d,Online,U.S. President,2/26/20,3/1/20,,False,,False,False,3/2/20 19:05,,https://elucd.ghost.io/elucd-super-tuesday-democratic-primary-results-3-2-20/,primary,DEM,Warren,13258.0,Elizabeth Warren,14.0,2020-02-26
1118,Colorado,39.059810999999996,-105.311104,99509.0,58697.0,2020.0,383.0,Public Policy Polling,918,DEM,Public Policy Polling,263.0,Public Policy Polling,B,561.0,v,v-d,,U.S. President,7/12/19,7/14/19,,True,DEM,False,False,7/19/19 11:29,,https://www.documentcloud.org/documents/6207605-Colorado-Prez-Senate-primary-poll.html,primary,DEM,Buttigieg,13345.0,Pete Buttigieg,7.0,2019-07-12
1119,Colorado,39.059810999999996,-105.311104,99509.0,58697.0,2020.0,383.0,Public Policy Polling,918,DEM,Public Policy Polling,263.0,Public Policy Polling,B,561.0,v,v-d,,U.S. President,7/12/19,7/14/19,,True,DEM,False,False,7/19/19 11:29,,https://www.documentcloud.org/documents/6207605-Colorado-Prez-Senate-primary-poll.html,primary,DEM,Hickenlooper,13326.0,John Hickenlooper,7.0,2019-07-12
1120,Colorado,39.059810999999996,-105.311104,99509.0,58697.0,2020.0,383.0,Public Policy Polling,918,DEM,Public Policy Polling,263.0,Public Policy Polling,B,561.0,v,v-d,,U.S. President,7/12/19,7/14/19,,True,DEM,False,False,7/19/19 11:29,,https://www.documentcloud.org/documents/6207605-Colorado-Prez-Senate-primary-poll.html,primary,DEM,Bennet,13352.0,Michael F. Bennet,5.0,2019-07-12
1121,Colorado,39.059810999999996,-105.311104,99509.0,58697.0,2020.0,383.0,Public Policy Polling,918,DEM,Public Policy Polling,263.0,Public Policy Polling,B,561.0,v,v-d,,U.S. President,7/12/19,7/14/19,,True,DEM,False,False,7/19/19 11:29,,https://www.documentcloud.org/documents/6207605-Colorado-Prez-Senate-primary-poll.html,primary,DEM,O'Rourke,13276.0,Beto O'Rourke,1.0,2019-07-12
1122,Colorado,39.059810999999996,-105.311104,100756.0,58930.0,2020.0,1102.0,Emerson College,,,Emerson College,88.0,Emerson College,A-,403.0,lv,lv-d,IVR/Online,U.S. President,8/16/19,8/19/19,,False,,False,False,8/20/19 08:29,,http://emersonpolling.com/2019/08/20/colorado-2020-sanders-biden-and-warren-lead-democratic-field-democrats-look-to-gain-senate-seat/,primary,DEM,Booker,13287.0,Cory A. Booker,2.3,2019-08-16
1123,Colorado,39.059810999999996,-105.311104,100756.0,58930.0,2020.0,1102.0,Emerson College,,,Emerson College,88.0,Emerson College,A-,403.0,lv,lv-d,IVR/Online,U.S. President,8/16/19,8/19/19,,False,,False,False,8/20/19 08:29,,http://emersonpolling.com/2019/08/20/colorado-2020-sanders-biden-and-warren-lead-democratic-field-democrats-look-to-gain-senate-seat/,primary,DEM,Yang,13329.0,Andrew Yang,3.6,2019-08-16
1124,Colorado,39.059810999999996,-105.311104,119067.0,64580.0,2020.0,270.0,Magellan Strategies,,,Magellan Strategies,179.0,Magellan Strategies,B/C,500.0,lv,lv-d,Live Phone,U.S. President,2/24/20,2/25/20,,False,,False,False,2/27/20 00:07,,https://magellanstrategies.com/magellan-strategies-colorado-democratic-presidential-primary/,primary,DEM,Gabbard,13343.0,Tulsi Gabbard,0.6,2020-02-24
1125,Colorado,39.059810999999996,-105.311104,99509.0,58697.0,2020.0,383.0,Public Policy Polling,918,DEM,Public Policy Polling,263.0,Public Policy Polling,B,561.0,v,v-d,,U.S. President,7/12/19,7/14/19,,True,DEM,False,False,7/19/19 11:29,,https://www.documentcloud.org/documents/6207605-Colorado-Prez-Senate-primary-poll.html,primary,DEM,Sanders,13257.0,Bernard Sanders,15.0,2019-07-12
1126,Colorado,39.059810999999996,-105.311104,100756.0,58930.0,2020.0,1102.0,Emerson College,,,Emerson College,88.0,Emerson College,A-,403.0,lv,lv-d,IVR/Online,U.S. President,8/16/19,8/19/19,,False,,False,False,8/20/19 08:29,,http://emersonpolling.com/2019/08/20/colorado-2020-sanders-biden-and-warren-lead-democratic-field-democrats-look-to-gain-senate-seat/,primary,DEM,Warren,13258.0,Elizabeth Warren,20.4,2019-08-16
1127,Colorado,39.059810999999996,-105.311104,100756.0,58930.0,2020.0,1102.0,Emerson College,,,Emerson College,88.0,Emerson College,A-,403.0,lv,lv-d,IVR/Online,U.S. President,8/16/19,8/19/19,,False,,False,False,8/20/19 08:29,,http://emersonpolling.com/2019/08/20/colorado-2020-sanders-biden-and-warren-lead-democratic-field-democrats-look-to-gain-senate-seat/,primary,DEM,Klobuchar,13310.0,Amy Klobuchar,0.1,2019-08-16
1128,Colorado,39.059810999999996,-105.311104,100756.0,58930.0,2020.0,1102.0,Emerson College,,,Emerson College,88.0,Emerson College,A-,403.0,lv,lv-d,IVR/Online,U.S. President,8/16/19,8/19/19,,False,,False,False,8/20/19 08:29,,http://emersonpolling.com/2019/08/20/colorado-2020-sanders-biden-and-warren-lead-democratic-field-democrats-look-to-gain-senate-seat/,primary,DEM,Sanders,13257.0,Bernard Sanders,25.7,2019-08-16
1129,Colorado,39.059810999999996,-105.311104,100756.0,58930.0,2020.0,1102.0,Emerson College,,,Emerson College,88.0,Emerson College,A-,403.0,lv,lv-d,IVR/Online,U.S. President,8/16/19,8/19/19,,False,,False,False,8/20/19 08:29,,http://emersonpolling.com/2019/08/20/colorado-2020-sanders-biden-and-warren-lead-democratic-field-democrats-look-to-gain-senate-seat/,primary,DEM,Biden,13256.0,Joseph R. Biden Jr.,24.5,2019-08-16
1130,Colorado,39.059810999999996,-105.311104,100756.0,58930.0,2020.0,1102.0,Emerson College,,,Emerson College,88.0,Emerson College,A-,403.0,lv,lv-d,IVR/Online,U.S. President,8/16/19,8/19/19,,False,,False,False,8/20/19 08:29,,http://emersonpolling.com/2019/08/20/colorado-2020-sanders-biden-and-warren-lead-democratic-field-democrats-look-to-gain-senate-seat/,primary,DEM,Harris,13288.0,Kamala D. Harris,12.9,2019-08-16
1131,Colorado,39.059810999999996,-105.311104,100756.0,58930.0,2020.0,1102.0,Emerson College,,,Emerson College,88.0,Emerson College,A-,403.0,lv,lv-d,IVR/Online,U.S. President,8/16/19,8/19/19,,False,,False,False,8/20/19 08:29,,http://emersonpolling.com/2019/08/20/colorado-2020-sanders-biden-and-warren-lead-democratic-field-democrats-look-to-gain-senate-seat/,primary,DEM,Buttigieg,13345.0,Pete Buttigieg,4.7,2019-08-16
1132,Colorado,39.059810999999996,-105.311104,99509.0,58697.0,2020.0,383.0,Public Policy Polling,918,DEM,Public Policy Polling,263.0,Public Policy Polling,B,561.0,v,v-d,,U.S. President,7/12/19,7/14/19,,True,DEM,False,False,7/19/19 11:29,,https://www.documentcloud.org/documents/6207605-Colorado-Prez-Senate-primary-poll.html,primary,DEM,Biden,13256.0,Joseph R. Biden Jr.,22.0,2019-07-12
1133,Colorado,39.059810999999996,-105.311104,100749.0,58930.0,2020.0,1102.0,Emerson College,,,Emerson College,88.0,Emerson College,A-,339.0,lv,lv-r,IVR/Online,U.S. President,8/16/19,8/19/19,,False,,False,False,8/20/19 08:28,,http://emersonpolling.com/2019/08/20/colorado-2020-sanders-biden-and-warren-lead-democratic-field-democrats-look-to-gain-senate-seat/,primary,REP,Trump,13254.0,Donald Trump,85.6,2019-08-16
1134,Colorado,39.059810999999996,-105.311104,119041.0,64573.0,2020.0,1515.0,Data for Progress,,,Data for Progress,522.0,Data for Progress,B/C,471.0,lv,lv-d,Text,U.S. President,2/23/20,2/25/20,,False,,False,False,2/26/20 16:25,,https://www.dataforprogress.org/blog/2020/2/26/sanders-ahead-in-virginia-and-colorado,primary,DEM,Bloomberg,13289.0,Michael Bloomberg,14.0,2020-02-23
1135,Colorado,39.059810999999996,-105.311104,100756.0,58930.0,2020.0,1102.0,Emerson College,,,Emerson College,88.0,Emerson College,A-,403.0,lv,lv-d,IVR/Online,U.S. President,8/16/19,8/19/19,,False,,False,False,8/20/19 08:29,,http://emersonpolling.com/2019/08/20/colorado-2020-sanders-biden-and-warren-lead-democratic-field-democrats-look-to-gain-senate-seat/,primary,DEM,Gabbard,13343.0,Tulsi Gabbard,1.1,2019-08-16
1136,Colorado,39.059810999999996,-105.311104,100749.0,58930.0,2020.0,1102.0,Emerson College,,,Emerson College,88.0,Emerson College,A-,339.0,lv,lv-r,IVR/Online,U.S. President,8/16/19,8/19/19,,False,,False,False,8/20/19 08:28,,http://emersonpolling.com/2019/08/20/colorado-2020-sanders-biden-and-warren-lead-democratic-field-democrats-look-to-gain-senate-seat/,primary,REP,Weld,13351.0,William F. Weld,14.4,2019-08-16
1137,Colorado,39.059810999999996,-105.311104,119067.0,64580.0,2020.0,270.0,Magellan Strategies,,,Magellan Strategies,179.0,Magellan Strategies,B/C,500.0,lv,lv-d,Live Phone,U.S. President,2/24/20,2/25/20,,False,,False,False,2/27/20 00:07,,https://magellanstrategies.com/magellan-strategies-colorado-democratic-presidential-primary/,primary,DEM,Steyer,13327.0,Tom Steyer,1.4,2020-02-24
1138,Colorado,39.059810999999996,-105.311104,100756.0,58930.0,2020.0,1102.0,Emerson College,,,Emerson College,88.0,Emerson College,A-,403.0,lv,lv-d,IVR/Online,U.S. President,8/16/19,8/19/19,,False,,False,False,8/20/19 08:29,,http://emersonpolling.com/2019/08/20/colorado-2020-sanders-biden-and-warren-lead-democratic-field-democrats-look-to-gain-senate-seat/,primary,DEM,Gillibrand,13311.0,Kirsten E. Gillibrand,0.3,2019-08-16
1139,Colorado,39.059810999999996,-105.311104,100756.0,58930.0,2020.0,1102.0,Emerson College,,,Emerson College,88.0,Emerson College,A-,403.0,lv,lv-d,IVR/Online,U.S. President,8/16/19,8/19/19,,False,,False,False,8/20/19 08:29,,http://emersonpolling.com/2019/08/20/colorado-2020-sanders-biden-and-warren-lead-democratic-field-democrats-look-to-gain-senate-seat/,primary,DEM,Inslee,13324.0,Jay Robert Inslee,0.3,2019-08-16
1140,Colorado,39.059810999999996,-105.311104,100756.0,58930.0,2020.0,1102.0,Emerson College,,,Emerson College,88.0,Emerson College,A-,403.0,lv,lv-d,IVR/Online,U.S. President,8/16/19,8/19/19,,False,,False,False,8/20/19 08:29,,http://emersonpolling.com/2019/08/20/colorado-2020-sanders-biden-and-warren-lead-democratic-field-democrats-look-to-gain-senate-seat/,primary,DEM,de Blasio,13335.0,Bill de Blasio,0.5,2019-08-16
1141,Colorado,39.059810999999996,-105.311104,100756.0,58930.0,2020.0,1102.0,Emerson College,,,Emerson College,88.0,Emerson College,A-,403.0,lv,lv-d,IVR/Online,U.S. President,8/16/19,8/19/19,,False,,False,False,8/20/19 08:29,,http://emersonpolling.com/2019/08/20/colorado-2020-sanders-biden-and-warren-lead-democratic-field-democrats-look-to-gain-senate-seat/,primary,DEM,Delaney,13314.0,John K. Delaney,0.1,2019-08-16
1142,Connecticut,41.597782,-72.755371,115612.0,63255.0,2020.0,425.0,Sacred Heart University,,,Sacred Heart University,453.0,Sacred Heart University,B/C,348.0,rv,rv-d,Live Phone/Online,U.S. President,12/16/19,1/2/20,,False,,False,False,1/12/20 09:21,,https://www.sacredheart.edu/media/sacredheart/instituteforpublicpolicy/GreatBlue--Sacred-Heart-University-Pioneer-Poll-Report-Q4-2019-MONDAY-(Presidential-CandidatesImpeachment).pdf,primary,DEM,Biden,13256.0,Joseph R. Biden Jr.,33.0,2019-12-16
1143,Connecticut,41.597782,-72.755371,115612.0,63255.0,2020.0,425.0,Sacred Heart University,,,Sacred Heart University,453.0,Sacred Heart University,B/C,348.0,rv,rv-d,Live Phone/Online,U.S. President,12/16/19,1/2/20,,False,,False,False,1/12/20 09:21,,https://www.sacredheart.edu/media/sacredheart/instituteforpublicpolicy/GreatBlue--Sacred-Heart-University-Pioneer-Poll-Report-Q4-2019-MONDAY-(Presidential-CandidatesImpeachment).pdf,primary,DEM,Sanders,13257.0,Bernard Sanders,19.3,2019-12-16
1144,Connecticut,41.597782,-72.755371,115612.0,63255.0,2020.0,425.0,Sacred Heart University,,,Sacred Heart University,453.0,Sacred Heart University,B/C,348.0,rv,rv-d,Live Phone/Online,U.S. President,12/16/19,1/2/20,,False,,False,False,1/12/20 09:21,,https://www.sacredheart.edu/media/sacredheart/instituteforpublicpolicy/GreatBlue--Sacred-Heart-University-Pioneer-Poll-Report-Q4-2019-MONDAY-(Presidential-CandidatesImpeachment).pdf,primary,DEM,Warren,13258.0,Elizabeth Warren,17.8,2019-12-16
1145,Connecticut,41.597782,-72.755371,115612.0,63255.0,2020.0,425.0,Sacred Heart University,,,Sacred Heart University,453.0,Sacred Heart University,B/C,348.0,rv,rv-d,Live Phone/Online,U.S. President,12/16/19,1/2/20,,False,,False,False,1/12/20 09:21,,https://www.sacredheart.edu/media/sacredheart/instituteforpublicpolicy/GreatBlue--Sacred-Heart-University-Pioneer-Poll-Report-Q4-2019-MONDAY-(Presidential-CandidatesImpeachment).pdf,primary,DEM,Buttigieg,13345.0,Pete Buttigieg,11.2,2019-12-16
1146,Delaware,39.318523,-75.507141,114562.0,63063.0,2020.0,1515.0,Data for Progress,,,Data for Progress,522.0,Data for Progress,B/C,528.0,lv,lv-d,Text,U.S. President,11/15/19,11/25/19,,False,,False,False,12/11/19 07:52,,http://filesforprogress.org/datasets/2019/12/de/VITMS-de.pdf,primary,DEM,Bullock,13320.0,Steve Bullock,0.0,2019-11-15
1147,Delaware,39.318523,-75.507141,114562.0,63063.0,2020.0,1515.0,Data for Progress,,,Data for Progress,522.0,Data for Progress,B/C,528.0,lv,lv-d,Text,U.S. President,11/15/19,11/25/19,,False,,False,False,12/11/19 07:52,,http://filesforprogress.org/datasets/2019/12/de/VITMS-de.pdf,primary,DEM,Steyer,13327.0,Tom Steyer,0.0,2019-11-15
1148,Delaware,39.318523,-75.507141,114562.0,63063.0,2020.0,1515.0,Data for Progress,,,Data for Progress,522.0,Data for Progress,B/C,528.0,lv,lv-d,Text,U.S. President,11/15/19,11/25/19,,False,,False,False,12/11/19 07:52,,http://filesforprogress.org/datasets/2019/12/de/VITMS-de.pdf,primary,DEM,Bennet,13352.0,Michael F. Bennet,0.0,2019-11-15
1149,Delaware,39.318523,-75.507141,114562.0,63063.0,2020.0,1515.0,Data for Progress,,,Data for Progress,522.0,Data for Progress,B/C,528.0,lv,lv-d,Text,U.S. President,11/15/19,11/25/19,,False,,False,False,12/11/19 07:52,,http://filesforprogress.org/datasets/2019/12/de/VITMS-de.pdf,primary,DEM,Messam,13357.0,Wayne Messam,0.0,2019-11-15
1150,Delaware,39.318523,-75.507141,114562.0,63063.0,2020.0,1515.0,Data for Progress,,,Data for Progress,522.0,Data for Progress,B/C,528.0,lv,lv-d,Text,U.S. President,11/15/19,11/25/19,,False,,False,False,12/11/19 07:52,,http://filesforprogress.org/datasets/2019/12/de/VITMS-de.pdf,primary,DEM,Booker,13287.0,Cory A. Booker,3.0,2019-11-15
1151,Delaware,39.318523,-75.507141,114562.0,63063.0,2020.0,1515.0,Data for Progress,,,Data for Progress,522.0,Data for Progress,B/C,528.0,lv,lv-d,Text,U.S. President,11/15/19,11/25/19,,False,,False,False,12/11/19 07:52,,http://filesforprogress.org/datasets/2019/12/de/VITMS-de.pdf,primary,DEM,Patrick,13315.0,Deval Patrick,0.0,2019-11-15
1152,Delaware,39.318523,-75.507141,114562.0,63063.0,2020.0,1515.0,Data for Progress,,,Data for Progress,522.0,Data for Progress,B/C,528.0,lv,lv-d,Text,U.S. President,11/15/19,11/25/19,,False,,False,False,12/11/19 07:52,,http://filesforprogress.org/datasets/2019/12/de/VITMS-de.pdf,primary,DEM,Castro,13316.0,Julián Castro,0.0,2019-11-15
1153,Delaware,39.318523,-75.507141,114562.0,63063.0,2020.0,1515.0,Data for Progress,,,Data for Progress,522.0,Data for Progress,B/C,528.0,lv,lv-d,Text,U.S. President,11/15/19,11/25/19,,False,,False,False,12/11/19 07:52,,http://filesforprogress.org/datasets/2019/12/de/VITMS-de.pdf,primary,DEM,Williamson,13350.0,Marianne Williamson,1.0,2019-11-15
1154,Delaware,39.318523,-75.507141,114562.0,63063.0,2020.0,1515.0,Data for Progress,,,Data for Progress,522.0,Data for Progress,B/C,528.0,lv,lv-d,Text,U.S. President,11/15/19,11/25/19,,False,,False,False,12/11/19 07:52,,http://filesforprogress.org/datasets/2019/12/de/VITMS-de.pdf,primary,DEM,Sestak,13381.0,Joe Sestak,0.0,2019-11-15
1155,Delaware,39.318523,-75.507141,114562.0,63063.0,2020.0,1515.0,Data for Progress,,,Data for Progress,522.0,Data for Progress,B/C,528.0,lv,lv-d,Text,U.S. President,11/15/19,11/25/19,,False,,False,False,12/11/19 07:52,,http://filesforprogress.org/datasets/2019/12/de/VITMS-de.pdf,primary,DEM,Harris,13288.0,Kamala D. Harris,1.0,2019-11-15
1156,Delaware,39.318523,-75.507141,114562.0,63063.0,2020.0,1515.0,Data for Progress,,,Data for Progress,522.0,Data for Progress,B/C,528.0,lv,lv-d,Text,U.S. President,11/15/19,11/25/19,,False,,False,False,12/11/19 07:52,,http://filesforprogress.org/datasets/2019/12/de/VITMS-de.pdf,primary,DEM,Yang,13329.0,Andrew Yang,1.0,2019-11-15
1157,Delaware,39.318523,-75.507141,114562.0,63063.0,2020.0,1515.0,Data for Progress,,,Data for Progress,522.0,Data for Progress,B/C,528.0,lv,lv-d,Text,U.S. President,11/15/19,11/25/19,,False,,False,False,12/11/19 07:52,,http://filesforprogress.org/datasets/2019/12/de/VITMS-de.pdf,primary,DEM,Bloomberg,13289.0,Michael Bloomberg,1.0,2019-11-15
1158,Delaware,39.318523,-75.507141,114562.0,63063.0,2020.0,1515.0,Data for Progress,,,Data for Progress,522.0,Data for Progress,B/C,528.0,lv,lv-d,Text,U.S. President,11/15/19,11/25/19,,False,,False,False,12/11/19 07:52,,http://filesforprogress.org/datasets/2019/12/de/VITMS-de.pdf,primary,DEM,Delaney,13314.0,John K. Delaney,1.0,2019-11-15
1159,Delaware,39.318523,-75.507141,114562.0,63063.0,2020.0,1515.0,Data for Progress,,,Data for Progress,522.0,Data for Progress,B/C,528.0,lv,lv-d,Text,U.S. President,11/15/19,11/25/19,,False,,False,False,12/11/19 07:52,,http://filesforprogress.org/datasets/2019/12/de/VITMS-de.pdf,primary,DEM,Klobuchar,13310.0,Amy Klobuchar,1.0,2019-11-15
1160,Delaware,39.318523,-75.507141,114562.0,63063.0,2020.0,1515.0,Data for Progress,,,Data for Progress,522.0,Data for Progress,B/C,528.0,lv,lv-d,Text,U.S. President,11/15/19,11/25/19,,False,,False,False,12/11/19 07:52,,http://filesforprogress.org/datasets/2019/12/de/VITMS-de.pdf,primary,DEM,Buttigieg,13345.0,Pete Buttigieg,8.0,2019-11-15
1161,Delaware,39.318523,-75.507141,114562.0,63063.0,2020.0,1515.0,Data for Progress,,,Data for Progress,522.0,Data for Progress,B/C,528.0,lv,lv-d,Text,U.S. President,11/15/19,11/25/19,,False,,False,False,12/11/19 07:52,,http://filesforprogress.org/datasets/2019/12/de/VITMS-de.pdf,primary,DEM,Warren,13258.0,Elizabeth Warren,11.0,2019-11-15
1162,Delaware,39.318523,-75.507141,114562.0,63063.0,2020.0,1515.0,Data for Progress,,,Data for Progress,522.0,Data for Progress,B/C,528.0,lv,lv-d,Text,U.S. President,11/15/19,11/25/19,,False,,False,False,12/11/19 07:52,,http://filesforprogress.org/datasets/2019/12/de/VITMS-de.pdf,primary,DEM,Sanders,13257.0,Bernard Sanders,13.0,2019-11-15
1163,Delaware,39.318523,-75.507141,114562.0,63063.0,2020.0,1515.0,Data for Progress,,,Data for Progress,522.0,Data for Progress,B/C,528.0,lv,lv-d,Text,U.S. President,11/15/19,11/25/19,,False,,False,False,12/11/19 07:52,,http://filesforprogress.org/datasets/2019/12/de/VITMS-de.pdf,primary,DEM,Biden,13256.0,Joseph R. Biden Jr.,35.0,2019-11-15
1164,Delaware,39.318523,-75.507141,114562.0,63063.0,2020.0,1515.0,Data for Progress,,,Data for Progress,522.0,Data for Progress,B/C,528.0,lv,lv-d,Text,U.S. President,11/15/19,11/25/19,,False,,False,False,12/11/19 07:52,,http://filesforprogress.org/datasets/2019/12/de/VITMS-de.pdf,primary,DEM,Gabbard,13343.0,Tulsi Gabbard,3.0,2019-11-15
1165,District of Columbia,38.897438,-77.02681700000001,,,,,,,,,,,,,,,,,,,,,,,,,,,,,,,,,
1166,Florida,27.766278999999997,-81.68678299999999,103224.0,59706.0,2020.0,473.0,Tel Opinion Research,1143,Let's Preserve The American Dream,Tel Opinion Research,334.0,Tel Opinion Research,B/C,800.0,lv,lv-d,Live Phone,U.S. President,9/15/19,9/18/19,,False,,False,False,9/25/19 07:30,open-ended question,https://www.politico.com/f/?id=0000016d-6569-d966-ad6d-e77d28f90001,primary,DEM,Biden,13256.0,Joseph R. Biden Jr.,24.0,2019-09-15
1167,Florida,27.766278999999997,-81.68678299999999,98066.0,58488.0,2020.0,396.0,Quinnipiac University,,,Quinnipiac University,267.0,Quinnipiac University,B+,417.0,rv,rv-d,Live Phone,U.S. President,6/12/19,6/17/19,,False,,False,False,6/18/19 13:53,,https://poll.qu.edu/national/release-detail?ReleaseID=2629,primary,DEM,Gillibrand,13311.0,Kirsten E. Gillibrand,0.0,2019-06-12
1168,Florida,27.766278999999997,-81.68678299999999,116450.0,63419.0,2020.0,473.0,Tel Opinion Research,1143,Let's Preserve The American Dream,Tel Opinion Research,334.0,Tel Opinion Research,B/C,600.0,lv,lv-d,Live Phone,U.S. President,1/21/20,1/23/20,,False,,False,False,2/1/20 09:21,open-ended question,https://www.politico.com/f/?id=0000016f-f3f6-d6d6-abff-f3f713770000,primary,DEM,Buttigieg,13345.0,Pete Buttigieg,4.0,2020-01-21
1169,Florida,27.766278999999997,-81.68678299999999,94422.0,58041.0,2020.0,473.0,Tel Opinion Research,1143,Let's Preserve The American Dream,Tel Opinion Research,334.0,Tel Opinion Research,B/C,800.0,lv,lv-d,Live Phone,U.S. President,5/8/19,5/8/19,,False,,False,False,5/11/19 08:37,open-ended question,https://www.politico.com/f/?id=0000016a-a480-dbd0-ad7e-e6ef4b840001,primary,DEM,Buttigieg,13345.0,Pete Buttigieg,3.0,2019-05-08
1170,Florida,27.766278999999997,-81.68678299999999,94558.0,58117.0,2020.0,1218.0,Florida Atlantic University,,,Florida Atlantic University,97.0,Florida Atlantic University,B/C,403.0,lv,lv-d,IVR/Online,U.S. President,5/16/19,5/19/19,,False,,False,False,5/22/19 13:00,,https://business.fau.edu/departments/economics/business-economics-polling/bepi-polls/bepi-polls-2019/florida-poll-finds-trump-popular-in-the-sunshine-state-while-biden-dominates-democratic-field.php,primary,DEM,Booker,13287.0,Cory A. Booker,0.9,2019-05-16
1171,Florida,27.766278999999997,-81.68678299999999,103230.0,59706.0,2020.0,473.0,Tel Opinion Research,1143,Let's Preserve The American Dream,Tel Opinion Research,334.0,Tel Opinion Research,B/C,800.0,lv,lv-d,Live Phone,U.S. President,9/15/19,9/18/19,,False,,False,False,9/25/19 07:31,,https://www.politico.com/f/?id=0000016d-6569-d966-ad6d-e77d28f90001,primary,DEM,Warren,13258.0,Elizabeth Warren,26.0,2019-09-15
1172,Florida,27.766278999999997,-81.68678299999999,103230.0,59706.0,2020.0,473.0,Tel Opinion Research,1143,Let's Preserve The American Dream,Tel Opinion Research,334.0,Tel Opinion Research,B/C,800.0,lv,lv-d,Live Phone,U.S. President,9/15/19,9/18/19,,False,,False,False,9/25/19 07:31,,https://www.politico.com/f/?id=0000016d-6569-d966-ad6d-e77d28f90001,primary,DEM,Sanders,13257.0,Bernard Sanders,10.0,2019-09-15
1173,Florida,27.766278999999997,-81.68678299999999,103230.0,59706.0,2020.0,473.0,Tel Opinion Research,1143,Let's Preserve The American Dream,Tel Opinion Research,334.0,Tel Opinion Research,B/C,800.0,lv,lv-d,Live Phone,U.S. President,9/15/19,9/18/19,,False,,False,False,9/25/19 07:31,,https://www.politico.com/f/?id=0000016d-6569-d966-ad6d-e77d28f90001,primary,DEM,Biden,13256.0,Joseph R. Biden Jr.,43.0,2019-09-15
1174,Florida,27.766278999999997,-81.68678299999999,116450.0,63419.0,2020.0,473.0,Tel Opinion Research,1143,Let's Preserve The American Dream,Tel Opinion Research,334.0,Tel Opinion Research,B/C,600.0,lv,lv-d,Live Phone,U.S. President,1/21/20,1/23/20,,False,,False,False,2/1/20 09:21,open-ended question,https://www.politico.com/f/?id=0000016f-f3f6-d6d6-abff-f3f713770000,primary,DEM,Biden,13256.0,Joseph R. Biden Jr.,29.0,2020-01-21
1175,Florida,27.766278999999997,-81.68678299999999,116450.0,63419.0,2020.0,473.0,Tel Opinion Research,1143,Let's Preserve The American Dream,Tel Opinion Research,334.0,Tel Opinion Research,B/C,600.0,lv,lv-d,Live Phone,U.S. President,1/21/20,1/23/20,,False,,False,False,2/1/20 09:21,open-ended question,https://www.politico.com/f/?id=0000016f-f3f6-d6d6-abff-f3f713770000,primary,DEM,Sanders,13257.0,Bernard Sanders,17.0,2020-01-21
1176,Florida,27.766278999999997,-81.68678299999999,116450.0,63419.0,2020.0,473.0,Tel Opinion Research,1143,Let's Preserve The American Dream,Tel Opinion Research,334.0,Tel Opinion Research,B/C,600.0,lv,lv-d,Live Phone,U.S. President,1/21/20,1/23/20,,False,,False,False,2/1/20 09:21,open-ended question,https://www.politico.com/f/?id=0000016f-f3f6-d6d6-abff-f3f713770000,primary,DEM,Warren,13258.0,Elizabeth Warren,12.0,2020-01-21
1177,Florida,27.766278999999997,-81.68678299999999,103229.0,59706.0,2020.0,473.0,Tel Opinion Research,1143,Let's Preserve The American Dream,Tel Opinion Research,334.0,Tel Opinion Research,B/C,800.0,lv,lv-d,Live Phone,U.S. President,9/15/19,9/18/19,,False,,False,False,9/25/19 07:31,,https://www.politico.com/f/?id=0000016d-6569-d966-ad6d-e77d28f90001,primary,DEM,Yang,13329.0,Andrew Yang,2.0,2019-09-15
1178,Florida,27.766278999999997,-81.68678299999999,103229.0,59706.0,2020.0,473.0,Tel Opinion Research,1143,Let's Preserve The American Dream,Tel Opinion Research,334.0,Tel Opinion Research,B/C,800.0,lv,lv-d,Live Phone,U.S. President,9/15/19,9/18/19,,False,,False,False,9/25/19 07:31,,https://www.politico.com/f/?id=0000016d-6569-d966-ad6d-e77d28f90001,primary,DEM,Buttigieg,13345.0,Pete Buttigieg,5.0,2019-09-15
1179,Florida,27.766278999999997,-81.68678299999999,103229.0,59706.0,2020.0,473.0,Tel Opinion Research,1143,Let's Preserve The American Dream,Tel Opinion Research,334.0,Tel Opinion Research,B/C,800.0,lv,lv-d,Live Phone,U.S. President,9/15/19,9/18/19,,False,,False,False,9/25/19 07:31,,https://www.politico.com/f/?id=0000016d-6569-d966-ad6d-e77d28f90001,primary,DEM,Harris,13288.0,Kamala D. Harris,6.0,2019-09-15
1180,Florida,27.766278999999997,-81.68678299999999,103229.0,59706.0,2020.0,473.0,Tel Opinion Research,1143,Let's Preserve The American Dream,Tel Opinion Research,334.0,Tel Opinion Research,B/C,800.0,lv,lv-d,Live Phone,U.S. President,9/15/19,9/18/19,,False,,False,False,9/25/19 07:31,,https://www.politico.com/f/?id=0000016d-6569-d966-ad6d-e77d28f90001,primary,DEM,Sanders,13257.0,Bernard Sanders,9.0,2019-09-15
1181,Florida,27.766278999999997,-81.68678299999999,103229.0,59706.0,2020.0,473.0,Tel Opinion Research,1143,Let's Preserve The American Dream,Tel Opinion Research,334.0,Tel Opinion Research,B/C,800.0,lv,lv-d,Live Phone,U.S. President,9/15/19,9/18/19,,False,,False,False,9/25/19 07:31,,https://www.politico.com/f/?id=0000016d-6569-d966-ad6d-e77d28f90001,primary,DEM,Warren,13258.0,Elizabeth Warren,18.0,2019-09-15
1182,Florida,27.766278999999997,-81.68678299999999,103229.0,59706.0,2020.0,473.0,Tel Opinion Research,1143,Let's Preserve The American Dream,Tel Opinion Research,334.0,Tel Opinion Research,B/C,800.0,lv,lv-d,Live Phone,U.S. President,9/15/19,9/18/19,,False,,False,False,9/25/19 07:31,,https://www.politico.com/f/?id=0000016d-6569-d966-ad6d-e77d28f90001,primary,DEM,Biden,13256.0,Joseph R. Biden Jr.,37.0,2019-09-15
1183,Florida,27.766278999999997,-81.68678299999999,103224.0,59706.0,2020.0,473.0,Tel Opinion Research,1143,Let's Preserve The American Dream,Tel Opinion Research,334.0,Tel Opinion Research,B/C,800.0,lv,lv-d,Live Phone,U.S. President,9/15/19,9/18/19,,False,,False,False,9/25/19 07:30,open-ended question,https://www.politico.com/f/?id=0000016d-6569-d966-ad6d-e77d28f90001,primary,DEM,Yang,13329.0,Andrew Yang,1.0,2019-09-15
1184,Florida,27.766278999999997,-81.68678299999999,103224.0,59706.0,2020.0,473.0,Tel Opinion Research,1143,Let's Preserve The American Dream,Tel Opinion Research,334.0,Tel Opinion Research,B/C,800.0,lv,lv-d,Live Phone,U.S. President,9/15/19,9/18/19,,False,,False,False,9/25/19 07:30,open-ended question,https://www.politico.com/f/?id=0000016d-6569-d966-ad6d-e77d28f90001,primary,DEM,Buttigieg,13345.0,Pete Buttigieg,2.0,2019-09-15
1185,Florida,27.766278999999997,-81.68678299999999,103224.0,59706.0,2020.0,473.0,Tel Opinion Research,1143,Let's Preserve The American Dream,Tel Opinion Research,334.0,Tel Opinion Research,B/C,800.0,lv,lv-d,Live Phone,U.S. President,9/15/19,9/18/19,,False,,False,False,9/25/19 07:30,open-ended question,https://www.politico.com/f/?id=0000016d-6569-d966-ad6d-e77d28f90001,primary,DEM,Harris,13288.0,Kamala D. Harris,3.0,2019-09-15
1186,Florida,27.766278999999997,-81.68678299999999,103224.0,59706.0,2020.0,473.0,Tel Opinion Research,1143,Let's Preserve The American Dream,Tel Opinion Research,334.0,Tel Opinion Research,B/C,800.0,lv,lv-d,Live Phone,U.S. President,9/15/19,9/18/19,,False,,False,False,9/25/19 07:30,open-ended question,https://www.politico.com/f/?id=0000016d-6569-d966-ad6d-e77d28f90001,primary,DEM,Sanders,13257.0,Bernard Sanders,5.0,2019-09-15
1187,Florida,27.766278999999997,-81.68678299999999,103224.0,59706.0,2020.0,473.0,Tel Opinion Research,1143,Let's Preserve The American Dream,Tel Opinion Research,334.0,Tel Opinion Research,B/C,800.0,lv,lv-d,Live Phone,U.S. President,9/15/19,9/18/19,,False,,False,False,9/25/19 07:30,open-ended question,https://www.politico.com/f/?id=0000016d-6569-d966-ad6d-e77d28f90001,primary,DEM,Warren,13258.0,Elizabeth Warren,11.0,2019-09-15
1188,Florida,27.766278999999997,-81.68678299999999,94558.0,58117.0,2020.0,1218.0,Florida Atlantic University,,,Florida Atlantic University,97.0,Florida Atlantic University,B/C,403.0,lv,lv-d,IVR/Online,U.S. President,5/16/19,5/19/19,,False,,False,False,5/22/19 13:00,,https://business.fau.edu/departments/economics/business-economics-polling/bepi-polls/bepi-polls-2019/florida-poll-finds-trump-popular-in-the-sunshine-state-while-biden-dominates-democratic-field.php,primary,DEM,Buttigieg,13345.0,Pete Buttigieg,8.8,2019-05-16
1189,Florida,27.766278999999997,-81.68678299999999,94558.0,58117.0,2020.0,1218.0,Florida Atlantic University,,,Florida Atlantic University,97.0,Florida Atlantic University,B/C,403.0,lv,lv-d,IVR/Online,U.S. President,5/16/19,5/19/19,,False,,False,False,5/22/19 13:00,,https://business.fau.edu/departments/economics/business-economics-polling/bepi-polls/bepi-polls-2019/florida-poll-finds-trump-popular-in-the-sunshine-state-while-biden-dominates-democratic-field.php,primary,DEM,Sanders,13257.0,Bernard Sanders,11.6,2019-05-16
1190,Florida,27.766278999999997,-81.68678299999999,94558.0,58117.0,2020.0,1218.0,Florida Atlantic University,,,Florida Atlantic University,97.0,Florida Atlantic University,B/C,403.0,lv,lv-d,IVR/Online,U.S. President,5/16/19,5/19/19,,False,,False,False,5/22/19 13:00,,https://business.fau.edu/departments/economics/business-economics-polling/bepi-polls/bepi-polls-2019/florida-poll-finds-trump-popular-in-the-sunshine-state-while-biden-dominates-democratic-field.php,primary,DEM,Warren,13258.0,Elizabeth Warren,11.9,2019-05-16
1191,Florida,27.766278999999997,-81.68678299999999,94422.0,58041.0,2020.0,473.0,Tel Opinion Research,1143,Let's Preserve The American Dream,Tel Opinion Research,334.0,Tel Opinion Research,B/C,800.0,lv,lv-d,Live Phone,U.S. President,5/8/19,5/8/19,,False,,False,False,5/11/19 08:37,open-ended question,https://www.politico.com/f/?id=0000016a-a480-dbd0-ad7e-e6ef4b840001,primary,DEM,Harris,13288.0,Kamala D. Harris,5.0,2019-05-08
1192,Florida,27.766278999999997,-81.68678299999999,94558.0,58117.0,2020.0,1218.0,Florida Atlantic University,,,Florida Atlantic University,97.0,Florida Atlantic University,B/C,403.0,lv,lv-d,IVR/Online,U.S. President,5/16/19,5/19/19,,False,,False,False,5/22/19 13:00,,https://business.fau.edu/departments/economics/business-economics-polling/bepi-polls/bepi-polls-2019/florida-poll-finds-trump-popular-in-the-sunshine-state-while-biden-dominates-democratic-field.php,primary,DEM,Harris,13288.0,Kamala D. Harris,6.7,2019-05-16
1193,Florida,27.766278999999997,-81.68678299999999,94558.0,58117.0,2020.0,1218.0,Florida Atlantic University,,,Florida Atlantic University,97.0,Florida Atlantic University,B/C,403.0,lv,lv-d,IVR/Online,U.S. President,5/16/19,5/19/19,,False,,False,False,5/22/19 13:00,,https://business.fau.edu/departments/economics/business-economics-polling/bepi-polls/bepi-polls-2019/florida-poll-finds-trump-popular-in-the-sunshine-state-while-biden-dominates-democratic-field.php,primary,DEM,Castro,13316.0,Julián Castro,1.8,2019-05-16
1194,Florida,27.766278999999997,-81.68678299999999,94558.0,58117.0,2020.0,1218.0,Florida Atlantic University,,,Florida Atlantic University,97.0,Florida Atlantic University,B/C,403.0,lv,lv-d,IVR/Online,U.S. President,5/16/19,5/19/19,,False,,False,False,5/22/19 13:00,,https://business.fau.edu/departments/economics/business-economics-polling/bepi-polls/bepi-polls-2019/florida-poll-finds-trump-popular-in-the-sunshine-state-while-biden-dominates-democratic-field.php,primary,DEM,Gillibrand,13311.0,Kirsten E. Gillibrand,1.4,2019-05-16
1195,Florida,27.766278999999997,-81.68678299999999,94558.0,58117.0,2020.0,1218.0,Florida Atlantic University,,,Florida Atlantic University,97.0,Florida Atlantic University,B/C,403.0,lv,lv-d,IVR/Online,U.S. President,5/16/19,5/19/19,,False,,False,False,5/22/19 13:00,,https://business.fau.edu/departments/economics/business-economics-polling/bepi-polls/bepi-polls-2019/florida-poll-finds-trump-popular-in-the-sunshine-state-while-biden-dominates-democratic-field.php,primary,DEM,Biden,13256.0,Joseph R. Biden Jr.,39.2,2019-05-16
1196,Florida,27.766278999999997,-81.68678299999999,98293.0,58536.0,2020.0,1357.0,St. Pete Polls,972,Florida Politics,St. Pete Polls,314.0,St. Pete Polls,C+,2022.0,lv,lv-d,Automated Phone,U.S. President,6/22/19,6/23/19,,False,,False,False,6/25/19 08:08,,http://stpetepolls.org/files/StPetePolls_2019_State_DEM_Pres_June23_I63R.pdf,primary,DEM,Buttigieg,13345.0,Pete Buttigieg,8.4,2019-06-22
1197,Florida,27.766278999999997,-81.68678299999999,115770.0,63280.0,2020.0,1218.0,Florida Atlantic University,,,Florida Atlantic University,97.0,Florida Atlantic University,B/C,488.0,lv,lv-r,IVR/Online,U.S. President,1/9/20,1/12/20,,False,,False,False,1/15/20 12:15,,https://business.fau.edu/departments/economics/business-economics-polling/bepi-polls/bepi-polls-2020/biden-widening-lead-in-florida-where-trunp-has-fallen-behind.php,primary,REP,Trump,13254.0,Donald Trump,80.4,2020-01-09
1198,Florida,27.766278999999997,-81.68678299999999,97912.0,58456.0,2020.0,573.0,Zogby Interactive/JZ Analytics,,,Zogby Analytics,395.0,Zogby Interactive/JZ Analytics,C,228.0,lv,lv-d,Online,U.S. President,5/23/19,5/29/19,,False,,False,False,6/14/19 12:13,,https://projects.fivethirtyeight.com/polls/20190615_National.xlsx,primary,DEM,O'Rourke,13276.0,Beto O'Rourke,3.6,2019-05-23
1199,Florida,27.766278999999997,-81.68678299999999,97912.0,58456.0,2020.0,573.0,Zogby Interactive/JZ Analytics,,,Zogby Analytics,395.0,Zogby Interactive/JZ Analytics,C,228.0,lv,lv-d,Online,U.S. President,5/23/19,5/29/19,,False,,False,False,6/14/19 12:13,,https://projects.fivethirtyeight.com/polls/20190615_National.xlsx,primary,DEM,Booker,13287.0,Cory A. Booker,1.5,2019-05-23
1200,Florida,27.766278999999997,-81.68678299999999,97912.0,58456.0,2020.0,573.0,Zogby Interactive/JZ Analytics,,,Zogby Analytics,395.0,Zogby Interactive/JZ Analytics,C,228.0,lv,lv-d,Online,U.S. President,5/23/19,5/29/19,,False,,False,False,6/14/19 12:13,,https://projects.fivethirtyeight.com/polls/20190615_National.xlsx,primary,DEM,Klobuchar,13310.0,Amy Klobuchar,0.5,2019-05-23
1201,Florida,27.766278999999997,-81.68678299999999,94558.0,58117.0,2020.0,1218.0,Florida Atlantic University,,,Florida Atlantic University,97.0,Florida Atlantic University,B/C,403.0,lv,lv-d,IVR/Online,U.S. President,5/16/19,5/19/19,,False,,False,False,5/22/19 13:00,,https://business.fau.edu/departments/economics/business-economics-polling/bepi-polls/bepi-polls-2019/florida-poll-finds-trump-popular-in-the-sunshine-state-while-biden-dominates-democratic-field.php,primary,DEM,Ryan,13358.0,Tim Ryan,0.3,2019-05-16
1202,Florida,27.766278999999997,-81.68678299999999,94558.0,58117.0,2020.0,1218.0,Florida Atlantic University,,,Florida Atlantic University,97.0,Florida Atlantic University,B/C,403.0,lv,lv-d,IVR/Online,U.S. President,5/16/19,5/19/19,,False,,False,False,5/22/19 13:00,,https://business.fau.edu/departments/economics/business-economics-polling/bepi-polls/bepi-polls-2019/florida-poll-finds-trump-popular-in-the-sunshine-state-while-biden-dominates-democratic-field.php,primary,DEM,Hickenlooper,13326.0,John Hickenlooper,0.1,2019-05-16
1203,Florida,27.766278999999997,-81.68678299999999,94558.0,58117.0,2020.0,1218.0,Florida Atlantic University,,,Florida Atlantic University,97.0,Florida Atlantic University,B/C,403.0,lv,lv-d,IVR/Online,U.S. President,5/16/19,5/19/19,,False,,False,False,5/22/19 13:00,,https://business.fau.edu/departments/economics/business-economics-polling/bepi-polls/bepi-polls-2019/florida-poll-finds-trump-popular-in-the-sunshine-state-while-biden-dominates-democratic-field.php,primary,DEM,Williamson,13350.0,Marianne Williamson,0.1,2019-05-16
1204,Florida,27.766278999999997,-81.68678299999999,94558.0,58117.0,2020.0,1218.0,Florida Atlantic University,,,Florida Atlantic University,97.0,Florida Atlantic University,B/C,403.0,lv,lv-d,IVR/Online,U.S. President,5/16/19,5/19/19,,False,,False,False,5/22/19 13:00,,https://business.fau.edu/departments/economics/business-economics-polling/bepi-polls/bepi-polls-2019/florida-poll-finds-trump-popular-in-the-sunshine-state-while-biden-dominates-democratic-field.php,primary,DEM,Gabbard,13343.0,Tulsi Gabbard,0.0,2019-05-16
1205,Florida,27.766278999999997,-81.68678299999999,94558.0,58117.0,2020.0,1218.0,Florida Atlantic University,,,Florida Atlantic University,97.0,Florida Atlantic University,B/C,403.0,lv,lv-d,IVR/Online,U.S. President,5/16/19,5/19/19,,False,,False,False,5/22/19 13:00,,https://business.fau.edu/departments/economics/business-economics-polling/bepi-polls/bepi-polls-2019/florida-poll-finds-trump-popular-in-the-sunshine-state-while-biden-dominates-democratic-field.php,primary,DEM,Inslee,13324.0,Jay Robert Inslee,0.0,2019-05-16
1206,Florida,27.766278999999997,-81.68678299999999,94558.0,58117.0,2020.0,1218.0,Florida Atlantic University,,,Florida Atlantic University,97.0,Florida Atlantic University,B/C,403.0,lv,lv-d,IVR/Online,U.S. President,5/16/19,5/19/19,,False,,False,False,5/22/19 13:00,,https://business.fau.edu/departments/economics/business-economics-polling/bepi-polls/bepi-polls-2019/florida-poll-finds-trump-popular-in-the-sunshine-state-while-biden-dominates-democratic-field.php,primary,DEM,Messam,13357.0,Wayne Messam,0.2,2019-05-16
1207,Florida,27.766278999999997,-81.68678299999999,94558.0,58117.0,2020.0,1218.0,Florida Atlantic University,,,Florida Atlantic University,97.0,Florida Atlantic University,B/C,403.0,lv,lv-d,IVR/Online,U.S. President,5/16/19,5/19/19,,False,,False,False,5/22/19 13:00,,https://business.fau.edu/departments/economics/business-economics-polling/bepi-polls/bepi-polls-2019/florida-poll-finds-trump-popular-in-the-sunshine-state-while-biden-dominates-democratic-field.php,primary,DEM,Swalwell,13328.0,Eric Swalwell,0.2,2019-05-16
1208,Florida,27.766278999999997,-81.68678299999999,94558.0,58117.0,2020.0,1218.0,Florida Atlantic University,,,Florida Atlantic University,97.0,Florida Atlantic University,B/C,403.0,lv,lv-d,IVR/Online,U.S. President,5/16/19,5/19/19,,False,,False,False,5/22/19 13:00,,https://business.fau.edu/departments/economics/business-economics-polling/bepi-polls/bepi-polls-2019/florida-poll-finds-trump-popular-in-the-sunshine-state-while-biden-dominates-democratic-field.php,primary,DEM,Delaney,13314.0,John K. Delaney,0.2,2019-05-16
1209,Florida,27.766278999999997,-81.68678299999999,94570.0,58117.0,2020.0,1218.0,Florida Atlantic University,,,Florida Atlantic University,97.0,Florida Atlantic University,B/C,394.0,lv,lv-r,IVR/Online,U.S. President,5/16/19,5/19/19,,False,,False,False,5/22/19 19:49,,https://business.fau.edu/departments/economics/business-economics-polling/bepi-polls/bepi-polls-2019/florida-poll-finds-trump-popular-in-the-sunshine-state-while-biden-dominates-democratic-field.php,primary,REP,Trump,13254.0,Donald Trump,84.6,2019-05-16
1210,Florida,27.766278999999997,-81.68678299999999,116267.0,63383.0,2020.0,1357.0,St. Pete Polls,972,Florida Politics,St. Pete Polls,314.0,St. Pete Polls,C+,2590.0,lv,lv-d,Automated Phone,U.S. President,1/27/20,1/28/20,,False,,False,False,1/29/20 06:02,,http://stpetepolls.org/files/StPetePolls_2020_State_DEMprimary_January28_WN2A.pdf,primary,DEM,Yang,13329.0,Andrew Yang,2.3,2020-01-27
1211,Florida,27.766278999999997,-81.68678299999999,116267.0,63383.0,2020.0,1357.0,St. Pete Polls,972,Florida Politics,St. Pete Polls,314.0,St. Pete Polls,C+,2590.0,lv,lv-d,Automated Phone,U.S. President,1/27/20,1/28/20,,False,,False,False,1/29/20 06:02,,http://stpetepolls.org/files/StPetePolls_2020_State_DEMprimary_January28_WN2A.pdf,primary,DEM,Warren,13258.0,Elizabeth Warren,6.9,2020-01-27
1212,Florida,27.766278999999997,-81.68678299999999,112852.0,62549.0,2020.0,1424.0,Siena College/New York Times Upshot,,,Siena College/New York Times Upshot,448.0,Siena College/New York Times Upshot,A+,236.0,rv,rv-d,Live Phone,U.S. President,10/13/19,10/26/19,,False,,False,False,11/8/19 07:59,,https://scri.siena.edu/wp-content/uploads/2019/11/FL1019-CrosstabsALL.pdf,primary,DEM,Biden,13256.0,Joseph R. Biden Jr.,27.0,2019-10-13
1213,Florida,27.766278999999997,-81.68678299999999,97912.0,58456.0,2020.0,573.0,Zogby Interactive/JZ Analytics,,,Zogby Analytics,395.0,Zogby Interactive/JZ Analytics,C,228.0,lv,lv-d,Online,U.S. President,5/23/19,5/29/19,,False,,False,False,6/14/19 12:13,,https://projects.fivethirtyeight.com/polls/20190615_National.xlsx,primary,DEM,Harris,13288.0,Kamala D. Harris,2.2,2019-05-23
1214,Florida,27.766278999999997,-81.68678299999999,97912.0,58456.0,2020.0,573.0,Zogby Interactive/JZ Analytics,,,Zogby Analytics,395.0,Zogby Interactive/JZ Analytics,C,228.0,lv,lv-d,Online,U.S. President,5/23/19,5/29/19,,False,,False,False,6/14/19 12:13,,https://projects.fivethirtyeight.com/polls/20190615_National.xlsx,primary,DEM,Buttigieg,13345.0,Pete Buttigieg,5.7,2019-05-23
1215,Florida,27.766278999999997,-81.68678299999999,97912.0,58456.0,2020.0,573.0,Zogby Interactive/JZ Analytics,,,Zogby Analytics,395.0,Zogby Interactive/JZ Analytics,C,228.0,lv,lv-d,Online,U.S. President,5/23/19,5/29/19,,False,,False,False,6/14/19 12:13,,https://projects.fivethirtyeight.com/polls/20190615_National.xlsx,primary,DEM,Warren,13258.0,Elizabeth Warren,6.5,2019-05-23
1216,Florida,27.766278999999997,-81.68678299999999,97912.0,58456.0,2020.0,573.0,Zogby Interactive/JZ Analytics,,,Zogby Analytics,395.0,Zogby Interactive/JZ Analytics,C,228.0,lv,lv-d,Online,U.S. President,5/23/19,5/29/19,,False,,False,False,6/14/19 12:13,,https://projects.fivethirtyeight.com/polls/20190615_National.xlsx,primary,DEM,Sanders,13257.0,Bernard Sanders,18.3,2019-05-23
1217,Florida,27.766278999999997,-81.68678299999999,98299.0,58537.0,2020.0,1486.0,Climate Nexus,,,Climate Nexus,506.0,Climate Nexus,,676.0,rv,rv-d,Online,U.S. President,6/7/19,6/11/19,,False,,False,False,6/25/19 09:10,,https://climatenexus.org/wp-content/uploads/Florida-Poll-Toplines-6_17_19.pdf,primary,DEM,Biden,13256.0,Joseph R. Biden Jr.,32.0,2019-06-07
1218,Florida,27.766278999999997,-81.68678299999999,98299.0,58537.0,2020.0,1486.0,Climate Nexus,,,Climate Nexus,506.0,Climate Nexus,,676.0,rv,rv-d,Online,U.S. President,6/7/19,6/11/19,,False,,False,False,6/25/19 09:10,,https://climatenexus.org/wp-content/uploads/Florida-Poll-Toplines-6_17_19.pdf,primary,DEM,Delaney,13314.0,John K. Delaney,2.0,2019-06-07
1219,Florida,27.766278999999997,-81.68678299999999,98299.0,58537.0,2020.0,1486.0,Climate Nexus,,,Climate Nexus,506.0,Climate Nexus,,676.0,rv,rv-d,Online,U.S. President,6/7/19,6/11/19,,False,,False,False,6/25/19 09:10,,https://climatenexus.org/wp-content/uploads/Florida-Poll-Toplines-6_17_19.pdf,primary,DEM,Hickenlooper,13326.0,John Hickenlooper,1.0,2019-06-07
1220,Florida,27.766278999999997,-81.68678299999999,98299.0,58537.0,2020.0,1486.0,Climate Nexus,,,Climate Nexus,506.0,Climate Nexus,,676.0,rv,rv-d,Online,U.S. President,6/7/19,6/11/19,,False,,False,False,6/25/19 09:10,,https://climatenexus.org/wp-content/uploads/Florida-Poll-Toplines-6_17_19.pdf,primary,DEM,Castro,13316.0,Julián Castro,0.0,2019-06-07
1221,Florida,27.766278999999997,-81.68678299999999,98299.0,58537.0,2020.0,1486.0,Climate Nexus,,,Climate Nexus,506.0,Climate Nexus,,676.0,rv,rv-d,Online,U.S. President,6/7/19,6/11/19,,False,,False,False,6/25/19 09:10,,https://climatenexus.org/wp-content/uploads/Florida-Poll-Toplines-6_17_19.pdf,primary,DEM,Harris,13288.0,Kamala D. Harris,6.0,2019-06-07
1222,Florida,27.766278999999997,-81.68678299999999,98299.0,58537.0,2020.0,1486.0,Climate Nexus,,,Climate Nexus,506.0,Climate Nexus,,676.0,rv,rv-d,Online,U.S. President,6/7/19,6/11/19,,False,,False,False,6/25/19 09:10,,https://climatenexus.org/wp-content/uploads/Florida-Poll-Toplines-6_17_19.pdf,primary,DEM,Gillibrand,13311.0,Kirsten E. Gillibrand,0.0,2019-06-07
1223,Florida,27.766278999999997,-81.68678299999999,98299.0,58537.0,2020.0,1486.0,Climate Nexus,,,Climate Nexus,506.0,Climate Nexus,,676.0,rv,rv-d,Online,U.S. President,6/7/19,6/11/19,,False,,False,False,6/25/19 09:10,,https://climatenexus.org/wp-content/uploads/Florida-Poll-Toplines-6_17_19.pdf,primary,DEM,Williamson,13350.0,Marianne Williamson,0.0,2019-06-07
1224,Florida,27.766278999999997,-81.68678299999999,112852.0,62549.0,2020.0,1424.0,Siena College/New York Times Upshot,,,Siena College/New York Times Upshot,448.0,Siena College/New York Times Upshot,A+,236.0,rv,rv-d,Live Phone,U.S. President,10/13/19,10/26/19,,False,,False,False,11/8/19 07:59,,https://scri.siena.edu/wp-content/uploads/2019/11/FL1019-CrosstabsALL.pdf,primary,DEM,Warren,13258.0,Elizabeth Warren,19.0,2019-10-13
1225,Florida,27.766278999999997,-81.68678299999999,98299.0,58537.0,2020.0,1486.0,Climate Nexus,,,Climate Nexus,506.0,Climate Nexus,,676.0,rv,rv-d,Online,U.S. President,6/7/19,6/11/19,,False,,False,False,6/25/19 09:10,,https://climatenexus.org/wp-content/uploads/Florida-Poll-Toplines-6_17_19.pdf,primary,DEM,Bennet,13352.0,Michael F. Bennet,1.0,2019-06-07
1226,Florida,27.766278999999997,-81.68678299999999,98299.0,58537.0,2020.0,1486.0,Climate Nexus,,,Climate Nexus,506.0,Climate Nexus,,676.0,rv,rv-d,Online,U.S. President,6/7/19,6/11/19,,False,,False,False,6/25/19 09:10,,https://climatenexus.org/wp-content/uploads/Florida-Poll-Toplines-6_17_19.pdf,primary,DEM,Buttigieg,13345.0,Pete Buttigieg,6.0,2019-06-07
1227,Florida,27.766278999999997,-81.68678299999999,98299.0,58537.0,2020.0,1486.0,Climate Nexus,,,Climate Nexus,506.0,Climate Nexus,,676.0,rv,rv-d,Online,U.S. President,6/7/19,6/11/19,,False,,False,False,6/25/19 09:10,,https://climatenexus.org/wp-content/uploads/Florida-Poll-Toplines-6_17_19.pdf,primary,DEM,Moulton,13322.0,Seth Moulton,0.0,2019-06-07
1228,Florida,27.766278999999997,-81.68678299999999,98299.0,58537.0,2020.0,1486.0,Climate Nexus,,,Climate Nexus,506.0,Climate Nexus,,676.0,rv,rv-d,Online,U.S. President,6/7/19,6/11/19,,False,,False,False,6/25/19 09:10,,https://climatenexus.org/wp-content/uploads/Florida-Poll-Toplines-6_17_19.pdf,primary,DEM,Bullock,13320.0,Steve Bullock,0.0,2019-06-07
1229,Florida,27.766278999999997,-81.68678299999999,98299.0,58537.0,2020.0,1486.0,Climate Nexus,,,Climate Nexus,506.0,Climate Nexus,,676.0,rv,rv-d,Online,U.S. President,6/7/19,6/11/19,,False,,False,False,6/25/19 09:10,,https://climatenexus.org/wp-content/uploads/Florida-Poll-Toplines-6_17_19.pdf,primary,DEM,Ryan,13358.0,Tim Ryan,1.0,2019-06-07
1230,Florida,27.766278999999997,-81.68678299999999,98299.0,58537.0,2020.0,1486.0,Climate Nexus,,,Climate Nexus,506.0,Climate Nexus,,676.0,rv,rv-d,Online,U.S. President,6/7/19,6/11/19,,False,,False,False,6/25/19 09:10,,https://climatenexus.org/wp-content/uploads/Florida-Poll-Toplines-6_17_19.pdf,primary,DEM,Gabbard,13343.0,Tulsi Gabbard,0.0,2019-06-07
1231,Florida,27.766278999999997,-81.68678299999999,98299.0,58537.0,2020.0,1486.0,Climate Nexus,,,Climate Nexus,506.0,Climate Nexus,,676.0,rv,rv-d,Online,U.S. President,6/7/19,6/11/19,,False,,False,False,6/25/19 09:10,,https://climatenexus.org/wp-content/uploads/Florida-Poll-Toplines-6_17_19.pdf,primary,DEM,Messam,13357.0,Wayne Messam,0.0,2019-06-07
1232,Florida,27.766278999999997,-81.68678299999999,97912.0,58456.0,2020.0,573.0,Zogby Interactive/JZ Analytics,,,Zogby Analytics,395.0,Zogby Interactive/JZ Analytics,C,228.0,lv,lv-d,Online,U.S. President,5/23/19,5/29/19,,False,,False,False,6/14/19 12:13,,https://projects.fivethirtyeight.com/polls/20190615_National.xlsx,primary,DEM,Biden,13256.0,Joseph R. Biden Jr.,34.4,2019-05-23
1233,Florida,27.766278999999997,-81.68678299999999,98299.0,58537.0,2020.0,1486.0,Climate Nexus,,,Climate Nexus,506.0,Climate Nexus,,676.0,rv,rv-d,Online,U.S. President,6/7/19,6/11/19,,False,,False,False,6/25/19 09:10,,https://climatenexus.org/wp-content/uploads/Florida-Poll-Toplines-6_17_19.pdf,primary,DEM,Gravel,13359.0,Mike Gravel,0.0,2019-06-07
1234,Florida,27.766278999999997,-81.68678299999999,112852.0,62549.0,2020.0,1424.0,Siena College/New York Times Upshot,,,Siena College/New York Times Upshot,448.0,Siena College/New York Times Upshot,A+,236.0,rv,rv-d,Live Phone,U.S. President,10/13/19,10/26/19,,False,,False,False,11/8/19 07:59,,https://scri.siena.edu/wp-content/uploads/2019/11/FL1019-CrosstabsALL.pdf,primary,DEM,Sanders,13257.0,Bernard Sanders,13.0,2019-10-13
1235,Florida,27.766278999999997,-81.68678299999999,112852.0,62549.0,2020.0,1424.0,Siena College/New York Times Upshot,,,Siena College/New York Times Upshot,448.0,Siena College/New York Times Upshot,A+,236.0,rv,rv-d,Live Phone,U.S. President,10/13/19,10/26/19,,False,,False,False,11/8/19 07:59,,https://scri.siena.edu/wp-content/uploads/2019/11/FL1019-CrosstabsALL.pdf,primary,DEM,Buttigieg,13345.0,Pete Buttigieg,5.0,2019-10-13
1236,Florida,27.766278999999997,-81.68678299999999,112852.0,62549.0,2020.0,1424.0,Siena College/New York Times Upshot,,,Siena College/New York Times Upshot,448.0,Siena College/New York Times Upshot,A+,236.0,rv,rv-d,Live Phone,U.S. President,10/13/19,10/26/19,,False,,False,False,11/8/19 07:59,,https://scri.siena.edu/wp-content/uploads/2019/11/FL1019-CrosstabsALL.pdf,primary,DEM,Klobuchar,13310.0,Amy Klobuchar,2.0,2019-10-13
1237,Florida,27.766278999999997,-81.68678299999999,119399.0,64657.0,2020.0,1027.0,Saint Leo University,,,Saint Leo University,299.0,Saint Leo University,C/D,342.0,lv,lv-d,Online,U.S. President,2/17/20,2/22/20,,False,,False,False,3/2/20 14:10,,http://polls.saintleo.edu/new-saint-leo-university-poll-confirms-narrowing-of-democratic-primary-field-to-three-candidates-just-ahead-of-super-tuesday/,primary,DEM,Klobuchar,13310.0,Amy Klobuchar,4.7,2020-02-17
1238,Florida,27.766278999999997,-81.68678299999999,119399.0,64657.0,2020.0,1027.0,Saint Leo University,,,Saint Leo University,299.0,Saint Leo University,C/D,342.0,lv,lv-d,Online,U.S. President,2/17/20,2/22/20,,False,,False,False,3/2/20 14:10,,http://polls.saintleo.edu/new-saint-leo-university-poll-confirms-narrowing-of-democratic-primary-field-to-three-candidates-just-ahead-of-super-tuesday/,primary,DEM,Gabbard,13343.0,Tulsi Gabbard,1.5,2020-02-17
1239,Florida,27.766278999999997,-81.68678299999999,94422.0,58041.0,2020.0,473.0,Tel Opinion Research,1143,Let's Preserve The American Dream,Tel Opinion Research,334.0,Tel Opinion Research,B/C,800.0,lv,lv-d,Live Phone,U.S. President,5/8/19,5/8/19,,False,,False,False,5/11/19 08:37,open-ended question,https://www.politico.com/f/?id=0000016a-a480-dbd0-ad7e-e6ef4b840001,primary,DEM,Klobuchar,13310.0,Amy Klobuchar,1.0,2019-05-08
1240,Florida,27.766278999999997,-81.68678299999999,94422.0,58041.0,2020.0,473.0,Tel Opinion Research,1143,Let's Preserve The American Dream,Tel Opinion Research,334.0,Tel Opinion Research,B/C,800.0,lv,lv-d,Live Phone,U.S. President,5/8/19,5/8/19,,False,,False,False,5/11/19 08:37,open-ended question,https://www.politico.com/f/?id=0000016a-a480-dbd0-ad7e-e6ef4b840001,primary,DEM,Booker,13287.0,Cory A. Booker,1.0,2019-05-08
1241,Florida,27.766278999999997,-81.68678299999999,94422.0,58041.0,2020.0,473.0,Tel Opinion Research,1143,Let's Preserve The American Dream,Tel Opinion Research,334.0,Tel Opinion Research,B/C,800.0,lv,lv-d,Live Phone,U.S. President,5/8/19,5/8/19,,False,,False,False,5/11/19 08:37,open-ended question,https://www.politico.com/f/?id=0000016a-a480-dbd0-ad7e-e6ef4b840001,primary,DEM,O'Rourke,13276.0,Beto O'Rourke,1.0,2019-05-08
1242,Florida,27.766278999999997,-81.68678299999999,94558.0,58117.0,2020.0,1218.0,Florida Atlantic University,,,Florida Atlantic University,97.0,Florida Atlantic University,B/C,403.0,lv,lv-d,IVR/Online,U.S. President,5/16/19,5/19/19,,False,,False,False,5/22/19 13:00,,https://business.fau.edu/departments/economics/business-economics-polling/bepi-polls/bepi-polls-2019/florida-poll-finds-trump-popular-in-the-sunshine-state-while-biden-dominates-democratic-field.php,primary,DEM,Moulton,13322.0,Seth Moulton,0.5,2019-05-16
1243,Florida,27.766278999999997,-81.68678299999999,94558.0,58117.0,2020.0,1218.0,Florida Atlantic University,,,Florida Atlantic University,97.0,Florida Atlantic University,B/C,403.0,lv,lv-d,IVR/Online,U.S. President,5/16/19,5/19/19,,False,,False,False,5/22/19 13:00,,https://business.fau.edu/departments/economics/business-economics-polling/bepi-polls/bepi-polls-2019/florida-poll-finds-trump-popular-in-the-sunshine-state-while-biden-dominates-democratic-field.php,primary,DEM,Yang,13329.0,Andrew Yang,0.5,2019-05-16
1244,Florida,27.766278999999997,-81.68678299999999,119399.0,64657.0,2020.0,1027.0,Saint Leo University,,,Saint Leo University,299.0,Saint Leo University,C/D,342.0,lv,lv-d,Online,U.S. President,2/17/20,2/22/20,,False,,False,False,3/2/20 14:10,,http://polls.saintleo.edu/new-saint-leo-university-poll-confirms-narrowing-of-democratic-primary-field-to-three-candidates-just-ahead-of-super-tuesday/,primary,DEM,Buttigieg,13345.0,Pete Buttigieg,11.4,2020-02-17
1245,Florida,27.766278999999997,-81.68678299999999,94558.0,58117.0,2020.0,1218.0,Florida Atlantic University,,,Florida Atlantic University,97.0,Florida Atlantic University,B/C,403.0,lv,lv-d,IVR/Online,U.S. President,5/16/19,5/19/19,,False,,False,False,5/22/19 13:00,,https://business.fau.edu/departments/economics/business-economics-polling/bepi-polls/bepi-polls-2019/florida-poll-finds-trump-popular-in-the-sunshine-state-while-biden-dominates-democratic-field.php,primary,DEM,Klobuchar,13310.0,Amy Klobuchar,0.8,2019-05-16
1246,Florida,27.766278999999997,-81.68678299999999,116267.0,63383.0,2020.0,1357.0,St. Pete Polls,972,Florida Politics,St. Pete Polls,314.0,St. Pete Polls,C+,2590.0,lv,lv-d,Automated Phone,U.S. President,1/27/20,1/28/20,,False,,False,False,1/29/20 06:02,,http://stpetepolls.org/files/StPetePolls_2020_State_DEMprimary_January28_WN2A.pdf,primary,DEM,Steyer,13327.0,Tom Steyer,1.9,2020-01-27
1247,Florida,27.766278999999997,-81.68678299999999,116267.0,63383.0,2020.0,1357.0,St. Pete Polls,972,Florida Politics,St. Pete Polls,314.0,St. Pete Polls,C+,2590.0,lv,lv-d,Automated Phone,U.S. President,1/27/20,1/28/20,,False,,False,False,1/29/20 06:02,,http://stpetepolls.org/files/StPetePolls_2020_State_DEMprimary_January28_WN2A.pdf,primary,DEM,Sanders,13257.0,Bernard Sanders,9.4,2020-01-27
1248,Florida,27.766278999999997,-81.68678299999999,116267.0,63383.0,2020.0,1357.0,St. Pete Polls,972,Florida Politics,St. Pete Polls,314.0,St. Pete Polls,C+,2590.0,lv,lv-d,Automated Phone,U.S. President,1/27/20,1/28/20,,False,,False,False,1/29/20 06:02,,http://stpetepolls.org/files/StPetePolls_2020_State_DEMprimary_January28_WN2A.pdf,primary,DEM,Klobuchar,13310.0,Amy Klobuchar,5.3,2020-01-27
1249,Florida,27.766278999999997,-81.68678299999999,116267.0,63383.0,2020.0,1357.0,St. Pete Polls,972,Florida Politics,St. Pete Polls,314.0,St. Pete Polls,C+,2590.0,lv,lv-d,Automated Phone,U.S. President,1/27/20,1/28/20,,False,,False,False,1/29/20 06:02,,http://stpetepolls.org/files/StPetePolls_2020_State_DEMprimary_January28_WN2A.pdf,primary,DEM,Buttigieg,13345.0,Pete Buttigieg,5.7,2020-01-27
1250,Florida,27.766278999999997,-81.68678299999999,116267.0,63383.0,2020.0,1357.0,St. Pete Polls,972,Florida Politics,St. Pete Polls,314.0,St. Pete Polls,C+,2590.0,lv,lv-d,Automated Phone,U.S. President,1/27/20,1/28/20,,False,,False,False,1/29/20 06:02,,http://stpetepolls.org/files/StPetePolls_2020_State_DEMprimary_January28_WN2A.pdf,primary,DEM,Bloomberg,13289.0,Michael Bloomberg,17.3,2020-01-27
1251,Florida,27.766278999999997,-81.68678299999999,116267.0,63383.0,2020.0,1357.0,St. Pete Polls,972,Florida Politics,St. Pete Polls,314.0,St. Pete Polls,C+,2590.0,lv,lv-d,Automated Phone,U.S. President,1/27/20,1/28/20,,False,,False,False,1/29/20 06:02,,http://stpetepolls.org/files/StPetePolls_2020_State_DEMprimary_January28_WN2A.pdf,primary,DEM,Biden,13256.0,Joseph R. Biden Jr.,41.3,2020-01-27
1252,Florida,27.766278999999997,-81.68678299999999,115770.0,63280.0,2020.0,1218.0,Florida Atlantic University,,,Florida Atlantic University,97.0,Florida Atlantic University,B/C,488.0,lv,lv-r,IVR/Online,U.S. President,1/9/20,1/12/20,,False,,False,False,1/15/20 12:15,,https://business.fau.edu/departments/economics/business-economics-polling/bepi-polls/bepi-polls-2020/biden-widening-lead-in-florida-where-trunp-has-fallen-behind.php,primary,REP,Walsh,13482.0,Joe Walsh,14.2,2020-01-09
1253,Florida,27.766278999999997,-81.68678299999999,94558.0,58117.0,2020.0,1218.0,Florida Atlantic University,,,Florida Atlantic University,97.0,Florida Atlantic University,B/C,403.0,lv,lv-d,IVR/Online,U.S. President,5/16/19,5/19/19,,False,,False,False,5/22/19 13:00,,https://business.fau.edu/departments/economics/business-economics-polling/bepi-polls/bepi-polls-2019/florida-poll-finds-trump-popular-in-the-sunshine-state-while-biden-dominates-democratic-field.php,primary,DEM,Gravel,13359.0,Mike Gravel,0.5,2019-05-16
1254,Florida,27.766278999999997,-81.68678299999999,119399.0,64657.0,2020.0,1027.0,Saint Leo University,,,Saint Leo University,299.0,Saint Leo University,C/D,342.0,lv,lv-d,Online,U.S. President,2/17/20,2/22/20,,False,,False,False,3/2/20 14:10,,http://polls.saintleo.edu/new-saint-leo-university-poll-confirms-narrowing-of-democratic-primary-field-to-three-candidates-just-ahead-of-super-tuesday/,primary,DEM,Steyer,13327.0,Tom Steyer,0.6,2020-02-17
1255,Florida,27.766278999999997,-81.68678299999999,119399.0,64657.0,2020.0,1027.0,Saint Leo University,,,Saint Leo University,299.0,Saint Leo University,C/D,342.0,lv,lv-d,Online,U.S. President,2/17/20,2/22/20,,False,,False,False,3/2/20 14:10,,http://polls.saintleo.edu/new-saint-leo-university-poll-confirms-narrowing-of-democratic-primary-field-to-three-candidates-just-ahead-of-super-tuesday/,primary,DEM,Warren,13258.0,Elizabeth Warren,7.0,2020-02-17
1256,Florida,27.766278999999997,-81.68678299999999,119399.0,64657.0,2020.0,1027.0,Saint Leo University,,,Saint Leo University,299.0,Saint Leo University,C/D,342.0,lv,lv-d,Online,U.S. President,2/17/20,2/22/20,,False,,False,False,3/2/20 14:10,,http://polls.saintleo.edu/new-saint-leo-university-poll-confirms-narrowing-of-democratic-primary-field-to-three-candidates-just-ahead-of-super-tuesday/,primary,DEM,Biden,13256.0,Joseph R. Biden Jr.,24.6,2020-02-17
1257,Florida,27.766278999999997,-81.68678299999999,112852.0,62549.0,2020.0,1424.0,Siena College/New York Times Upshot,,,Siena College/New York Times Upshot,448.0,Siena College/New York Times Upshot,A+,236.0,rv,rv-d,Live Phone,U.S. President,10/13/19,10/26/19,,False,,False,False,11/8/19 07:59,,https://scri.siena.edu/wp-content/uploads/2019/11/FL1019-CrosstabsALL.pdf,primary,DEM,Harris,13288.0,Kamala D. Harris,1.0,2019-10-13
1258,Florida,27.766278999999997,-81.68678299999999,112852.0,62549.0,2020.0,1424.0,Siena College/New York Times Upshot,,,Siena College/New York Times Upshot,448.0,Siena College/New York Times Upshot,A+,236.0,rv,rv-d,Live Phone,U.S. President,10/13/19,10/26/19,,False,,False,False,11/8/19 07:59,,https://scri.siena.edu/wp-content/uploads/2019/11/FL1019-CrosstabsALL.pdf,primary,DEM,Gabbard,13343.0,Tulsi Gabbard,1.0,2019-10-13
1259,Florida,27.766278999999997,-81.68678299999999,112852.0,62549.0,2020.0,1424.0,Siena College/New York Times Upshot,,,Siena College/New York Times Upshot,448.0,Siena College/New York Times Upshot,A+,236.0,rv,rv-d,Live Phone,U.S. President,10/13/19,10/26/19,,False,,False,False,11/8/19 07:59,,https://scri.siena.edu/wp-content/uploads/2019/11/FL1019-CrosstabsALL.pdf,primary,DEM,Yang,13329.0,Andrew Yang,0.0,2019-10-13
1260,Florida,27.766278999999997,-81.68678299999999,112852.0,62549.0,2020.0,1424.0,Siena College/New York Times Upshot,,,Siena College/New York Times Upshot,448.0,Siena College/New York Times Upshot,A+,236.0,rv,rv-d,Live Phone,U.S. President,10/13/19,10/26/19,,False,,False,False,11/8/19 07:59,,https://scri.siena.edu/wp-content/uploads/2019/11/FL1019-CrosstabsALL.pdf,primary,DEM,Booker,13287.0,Cory A. Booker,0.0,2019-10-13
1261,Florida,27.766278999999997,-81.68678299999999,112852.0,62549.0,2020.0,1424.0,Siena College/New York Times Upshot,,,Siena College/New York Times Upshot,448.0,Siena College/New York Times Upshot,A+,236.0,rv,rv-d,Live Phone,U.S. President,10/13/19,10/26/19,,False,,False,False,11/8/19 07:59,,https://scri.siena.edu/wp-content/uploads/2019/11/FL1019-CrosstabsALL.pdf,primary,DEM,O'Rourke,13276.0,Beto O'Rourke,0.0,2019-10-13
1262,Florida,27.766278999999997,-81.68678299999999,112852.0,62549.0,2020.0,1424.0,Siena College/New York Times Upshot,,,Siena College/New York Times Upshot,448.0,Siena College/New York Times Upshot,A+,236.0,rv,rv-d,Live Phone,U.S. President,10/13/19,10/26/19,,False,,False,False,11/8/19 07:59,,https://scri.siena.edu/wp-content/uploads/2019/11/FL1019-CrosstabsALL.pdf,primary,DEM,Steyer,13327.0,Tom Steyer,0.0,2019-10-13
1263,Florida,27.766278999999997,-81.68678299999999,112852.0,62549.0,2020.0,1424.0,Siena College/New York Times Upshot,,,Siena College/New York Times Upshot,448.0,Siena College/New York Times Upshot,A+,236.0,rv,rv-d,Live Phone,U.S. President,10/13/19,10/26/19,,False,,False,False,11/8/19 07:59,,https://scri.siena.edu/wp-content/uploads/2019/11/FL1019-CrosstabsALL.pdf,primary,DEM,Castro,13316.0,Julián Castro,0.0,2019-10-13
1264,Florida,27.766278999999997,-81.68678299999999,119399.0,64657.0,2020.0,1027.0,Saint Leo University,,,Saint Leo University,299.0,Saint Leo University,C/D,342.0,lv,lv-d,Online,U.S. President,2/17/20,2/22/20,,False,,False,False,3/2/20 14:10,,http://polls.saintleo.edu/new-saint-leo-university-poll-confirms-narrowing-of-democratic-primary-field-to-three-candidates-just-ahead-of-super-tuesday/,primary,DEM,Bloomberg,13289.0,Michael Bloomberg,25.1,2020-02-17
1265,Florida,27.766278999999997,-81.68678299999999,98293.0,58536.0,2020.0,1357.0,St. Pete Polls,972,Florida Politics,St. Pete Polls,314.0,St. Pete Polls,C+,2022.0,lv,lv-d,Automated Phone,U.S. President,6/22/19,6/23/19,,False,,False,False,6/25/19 08:08,,http://stpetepolls.org/files/StPetePolls_2019_State_DEM_Pres_June23_I63R.pdf,primary,DEM,Warren,13258.0,Elizabeth Warren,11.8,2019-06-22
1266,Florida,27.766278999999997,-81.68678299999999,98293.0,58536.0,2020.0,1357.0,St. Pete Polls,972,Florida Politics,St. Pete Polls,314.0,St. Pete Polls,C+,2022.0,lv,lv-d,Automated Phone,U.S. President,6/22/19,6/23/19,,False,,False,False,6/25/19 08:08,,http://stpetepolls.org/files/StPetePolls_2019_State_DEM_Pres_June23_I63R.pdf,primary,DEM,O'Rourke,13276.0,Beto O'Rourke,1.8,2019-06-22
1267,Florida,27.766278999999997,-81.68678299999999,98293.0,58536.0,2020.0,1357.0,St. Pete Polls,972,Florida Politics,St. Pete Polls,314.0,St. Pete Polls,C+,2022.0,lv,lv-d,Automated Phone,U.S. President,6/22/19,6/23/19,,False,,False,False,6/25/19 08:08,,http://stpetepolls.org/files/StPetePolls_2019_State_DEM_Pres_June23_I63R.pdf,primary,DEM,Harris,13288.0,Kamala D. Harris,6.2,2019-06-22
1268,Florida,27.766278999999997,-81.68678299999999,116450.0,63419.0,2020.0,473.0,Tel Opinion Research,1143,Let's Preserve The American Dream,Tel Opinion Research,334.0,Tel Opinion Research,B/C,600.0,lv,lv-d,Live Phone,U.S. President,1/21/20,1/23/20,,False,,False,False,2/1/20 09:21,open-ended question,https://www.politico.com/f/?id=0000016f-f3f6-d6d6-abff-f3f713770000,primary,DEM,Klobuchar,13310.0,Amy Klobuchar,4.0,2020-01-21
1269,Florida,27.766278999999997,-81.68678299999999,98293.0,58536.0,2020.0,1357.0,St. Pete Polls,972,Florida Politics,St. Pete Polls,314.0,St. Pete Polls,C+,2022.0,lv,lv-d,Automated Phone,U.S. President,6/22/19,6/23/19,,False,,False,False,6/25/19 08:08,,http://stpetepolls.org/files/StPetePolls_2019_State_DEM_Pres_June23_I63R.pdf,primary,DEM,Booker,13287.0,Cory A. Booker,3.2,2019-06-22
1270,Florida,27.766278999999997,-81.68678299999999,98293.0,58536.0,2020.0,1357.0,St. Pete Polls,972,Florida Politics,St. Pete Polls,314.0,St. Pete Polls,C+,2022.0,lv,lv-d,Automated Phone,U.S. President,6/22/19,6/23/19,,False,,False,False,6/25/19 08:08,,http://stpetepolls.org/files/StPetePolls_2019_State_DEM_Pres_June23_I63R.pdf,primary,DEM,Biden,13256.0,Joseph R. Biden Jr.,47.4,2019-06-22
1271,Florida,27.766278999999997,-81.68678299999999,98299.0,58537.0,2020.0,1486.0,Climate Nexus,,,Climate Nexus,506.0,Climate Nexus,,676.0,rv,rv-d,Online,U.S. President,6/7/19,6/11/19,,False,,False,False,6/25/19 09:10,,https://climatenexus.org/wp-content/uploads/Florida-Poll-Toplines-6_17_19.pdf,primary,DEM,Warren,13258.0,Elizabeth Warren,10.0,2019-06-07
1272,Florida,27.766278999999997,-81.68678299999999,119399.0,64657.0,2020.0,1027.0,Saint Leo University,,,Saint Leo University,299.0,Saint Leo University,C/D,342.0,lv,lv-d,Online,U.S. President,2/17/20,2/22/20,,False,,False,False,3/2/20 14:10,,http://polls.saintleo.edu/new-saint-leo-university-poll-confirms-narrowing-of-democratic-primary-field-to-three-candidates-just-ahead-of-super-tuesday/,primary,DEM,Sanders,13257.0,Bernard Sanders,16.7,2020-02-17
1273,Florida,27.766278999999997,-81.68678299999999,98293.0,58536.0,2020.0,1357.0,St. Pete Polls,972,Florida Politics,St. Pete Polls,314.0,St. Pete Polls,C+,2022.0,lv,lv-d,Automated Phone,U.S. President,6/22/19,6/23/19,,False,,False,False,6/25/19 08:08,,http://stpetepolls.org/files/StPetePolls_2019_State_DEM_Pres_June23_I63R.pdf,primary,DEM,Sanders,13257.0,Bernard Sanders,8.0,2019-06-22
1274,Florida,27.766278999999997,-81.68678299999999,116450.0,63419.0,2020.0,473.0,Tel Opinion Research,1143,Let's Preserve The American Dream,Tel Opinion Research,334.0,Tel Opinion Research,B/C,600.0,lv,lv-d,Live Phone,U.S. President,1/21/20,1/23/20,,False,,False,False,2/1/20 09:21,open-ended question,https://www.politico.com/f/?id=0000016f-f3f6-d6d6-abff-f3f713770000,primary,DEM,Bloomberg,13289.0,Michael Bloomberg,4.0,2020-01-21
1275,Florida,27.766278999999997,-81.68678299999999,98066.0,58488.0,2020.0,396.0,Quinnipiac University,,,Quinnipiac University,267.0,Quinnipiac University,B+,417.0,rv,rv-d,Live Phone,U.S. President,6/12/19,6/17/19,,False,,False,False,6/18/19 13:53,,https://poll.qu.edu/national/release-detail?ReleaseID=2629,primary,DEM,Hickenlooper,13326.0,John Hickenlooper,0.0,2019-06-12
1276,Florida,27.766278999999997,-81.68678299999999,116450.0,63419.0,2020.0,473.0,Tel Opinion Research,1143,Let's Preserve The American Dream,Tel Opinion Research,334.0,Tel Opinion Research,B/C,600.0,lv,lv-d,Live Phone,U.S. President,1/21/20,1/23/20,,False,,False,False,2/1/20 09:21,open-ended question,https://www.politico.com/f/?id=0000016f-f3f6-d6d6-abff-f3f713770000,primary,DEM,Steyer,13327.0,Tom Steyer,2.0,2020-01-21
1277,Florida,27.766278999999997,-81.68678299999999,98184.0,58511.0,2020.0,1365.0,Change Research,,,Change Research,48.0,Change Research,C,1130.0,lv,lv-d,Online,U.S. President,6/16/19,6/17/19,,False,,False,False,6/20/19 11:44,,https://www.changeresearch.com/florida-poll-june-16-17-2019,primary,DEM,Yang,13329.0,Andrew Yang,3.0,2019-06-16
1278,Florida,27.766278999999997,-81.68678299999999,98184.0,58511.0,2020.0,1365.0,Change Research,,,Change Research,48.0,Change Research,C,1130.0,lv,lv-d,Online,U.S. President,6/16/19,6/17/19,,False,,False,False,6/20/19 11:44,,https://www.changeresearch.com/florida-poll-june-16-17-2019,primary,DEM,O'Rourke,13276.0,Beto O'Rourke,3.0,2019-06-16
1279,Florida,27.766278999999997,-81.68678299999999,102919.0,59604.0,2020.0,1218.0,Florida Atlantic University,,,Florida Atlantic University,97.0,Florida Atlantic University,B/C,407.0,lv,lv-d,IVR/Online,U.S. President,9/12/19,9/15/19,,False,,False,False,9/18/19 13:17,,https://business.fau.edu/departments/economics/business-economics-polling/bepi-polls/bepi-polls-2019/warren-cutting-into-bidens-lead-in-florida.php,primary,DEM,Yang,13329.0,Andrew Yang,1.5,2019-09-12
1280,Florida,27.766278999999997,-81.68678299999999,102919.0,59604.0,2020.0,1218.0,Florida Atlantic University,,,Florida Atlantic University,97.0,Florida Atlantic University,B/C,407.0,lv,lv-d,IVR/Online,U.S. President,9/12/19,9/15/19,,False,,False,False,9/18/19 13:17,,https://business.fau.edu/departments/economics/business-economics-polling/bepi-polls/bepi-polls-2019/warren-cutting-into-bidens-lead-in-florida.php,primary,DEM,de Blasio,13335.0,Bill de Blasio,1.2,2019-09-12
1281,Florida,27.766278999999997,-81.68678299999999,102919.0,59604.0,2020.0,1218.0,Florida Atlantic University,,,Florida Atlantic University,97.0,Florida Atlantic University,B/C,407.0,lv,lv-d,IVR/Online,U.S. President,9/12/19,9/15/19,,False,,False,False,9/18/19 13:17,,https://business.fau.edu/departments/economics/business-economics-polling/bepi-polls/bepi-polls-2019/warren-cutting-into-bidens-lead-in-florida.php,primary,DEM,Gabbard,13343.0,Tulsi Gabbard,1.4,2019-09-12
1282,Florida,27.766278999999997,-81.68678299999999,102919.0,59604.0,2020.0,1218.0,Florida Atlantic University,,,Florida Atlantic University,97.0,Florida Atlantic University,B/C,407.0,lv,lv-d,IVR/Online,U.S. President,9/12/19,9/15/19,,False,,False,False,9/18/19 13:17,,https://business.fau.edu/departments/economics/business-economics-polling/bepi-polls/bepi-polls-2019/warren-cutting-into-bidens-lead-in-florida.php,primary,DEM,Bullock,13320.0,Steve Bullock,0.9,2019-09-12
1283,Florida,27.766278999999997,-81.68678299999999,102919.0,59604.0,2020.0,1218.0,Florida Atlantic University,,,Florida Atlantic University,97.0,Florida Atlantic University,B/C,407.0,lv,lv-d,IVR/Online,U.S. President,9/12/19,9/15/19,,False,,False,False,9/18/19 13:17,,https://business.fau.edu/departments/economics/business-economics-polling/bepi-polls/bepi-polls-2019/warren-cutting-into-bidens-lead-in-florida.php,primary,DEM,Steyer,13327.0,Tom Steyer,0.2,2019-09-12
1284,Florida,27.766278999999997,-81.68678299999999,102919.0,59604.0,2020.0,1218.0,Florida Atlantic University,,,Florida Atlantic University,97.0,Florida Atlantic University,B/C,407.0,lv,lv-d,IVR/Online,U.S. President,9/12/19,9/15/19,,False,,False,False,9/18/19 13:17,,https://business.fau.edu/departments/economics/business-economics-polling/bepi-polls/bepi-polls-2019/warren-cutting-into-bidens-lead-in-florida.php,primary,DEM,Ryan,13358.0,Tim Ryan,1.1,2019-09-12
1285,Florida,27.766278999999997,-81.68678299999999,102919.0,59604.0,2020.0,1218.0,Florida Atlantic University,,,Florida Atlantic University,97.0,Florida Atlantic University,B/C,407.0,lv,lv-d,IVR/Online,U.S. President,9/12/19,9/15/19,,False,,False,False,9/18/19 13:17,,https://business.fau.edu/departments/economics/business-economics-polling/bepi-polls/bepi-polls-2019/warren-cutting-into-bidens-lead-in-florida.php,primary,DEM,Bennet,13352.0,Michael F. Bennet,0.6,2019-09-12
1286,Florida,27.766278999999997,-81.68678299999999,98184.0,58511.0,2020.0,1365.0,Change Research,,,Change Research,48.0,Change Research,C,1130.0,lv,lv-d,Online,U.S. President,6/16/19,6/17/19,,False,,False,False,6/20/19 11:44,,https://www.changeresearch.com/florida-poll-june-16-17-2019,primary,DEM,Booker,13287.0,Cory A. Booker,2.0,2019-06-16
1287,Florida,27.766278999999997,-81.68678299999999,102919.0,59604.0,2020.0,1218.0,Florida Atlantic University,,,Florida Atlantic University,97.0,Florida Atlantic University,B/C,407.0,lv,lv-d,IVR/Online,U.S. President,9/12/19,9/15/19,,False,,False,False,9/18/19 13:17,,https://business.fau.edu/departments/economics/business-economics-polling/bepi-polls/bepi-polls-2019/warren-cutting-into-bidens-lead-in-florida.php,primary,DEM,Messam,13357.0,Wayne Messam,3.1,2019-09-12
1288,Florida,27.766278999999997,-81.68678299999999,102919.0,59604.0,2020.0,1218.0,Florida Atlantic University,,,Florida Atlantic University,97.0,Florida Atlantic University,B/C,407.0,lv,lv-d,IVR/Online,U.S. President,9/12/19,9/15/19,,False,,False,False,9/18/19 13:17,,https://business.fau.edu/departments/economics/business-economics-polling/bepi-polls/bepi-polls-2019/warren-cutting-into-bidens-lead-in-florida.php,primary,DEM,Klobuchar,13310.0,Amy Klobuchar,0.0,2019-09-12
1289,Florida,27.766278999999997,-81.68678299999999,102919.0,59604.0,2020.0,1218.0,Florida Atlantic University,,,Florida Atlantic University,97.0,Florida Atlantic University,B/C,407.0,lv,lv-d,IVR/Online,U.S. President,9/12/19,9/15/19,,False,,False,False,9/18/19 13:17,,https://business.fau.edu/departments/economics/business-economics-polling/bepi-polls/bepi-polls-2019/warren-cutting-into-bidens-lead-in-florida.php,primary,DEM,Delaney,13314.0,John K. Delaney,0.0,2019-09-12
1290,Florida,27.766278999999997,-81.68678299999999,102919.0,59604.0,2020.0,1218.0,Florida Atlantic University,,,Florida Atlantic University,97.0,Florida Atlantic University,B/C,407.0,lv,lv-d,IVR/Online,U.S. President,9/12/19,9/15/19,,False,,False,False,9/18/19 13:17,,https://business.fau.edu/departments/economics/business-economics-polling/bepi-polls/bepi-polls-2019/warren-cutting-into-bidens-lead-in-florida.php,primary,DEM,Sestak,13381.0,Joe Sestak,0.0,2019-09-12
1291,Florida,27.766278999999997,-81.68678299999999,102919.0,59604.0,2020.0,1218.0,Florida Atlantic University,,,Florida Atlantic University,97.0,Florida Atlantic University,B/C,407.0,lv,lv-d,IVR/Online,U.S. President,9/12/19,9/15/19,,False,,False,False,9/18/19 13:17,,https://business.fau.edu/departments/economics/business-economics-polling/bepi-polls/bepi-polls-2019/warren-cutting-into-bidens-lead-in-florida.php,primary,DEM,Williamson,13350.0,Marianne Williamson,0.0,2019-09-12
1292,Florida,27.766278999999997,-81.68678299999999,115770.0,63280.0,2020.0,1218.0,Florida Atlantic University,,,Florida Atlantic University,97.0,Florida Atlantic University,B/C,488.0,lv,lv-r,IVR/Online,U.S. President,1/9/20,1/12/20,,False,,False,False,1/15/20 12:15,,https://business.fau.edu/departments/economics/business-economics-polling/bepi-polls/bepi-polls-2020/biden-widening-lead-in-florida-where-trunp-has-fallen-behind.php,primary,REP,Weld,13351.0,William F. Weld,5.4,2020-01-09
1293,Florida,27.766278999999997,-81.68678299999999,115771.0,63280.0,2020.0,1218.0,Florida Atlantic University,,,Florida Atlantic University,97.0,Florida Atlantic University,B/C,494.0,lv,lv-d,IVR/Online,U.S. President,1/9/20,1/12/20,,False,,False,False,1/15/20 12:15,,https://business.fau.edu/departments/economics/business-economics-polling/bepi-polls/bepi-polls-2020/biden-widening-lead-in-florida-where-trunp-has-fallen-behind.php,primary,DEM,Bennet,13352.0,Michael F. Bennet,1.2,2020-01-09
1294,Florida,27.766278999999997,-81.68678299999999,115771.0,63280.0,2020.0,1218.0,Florida Atlantic University,,,Florida Atlantic University,97.0,Florida Atlantic University,B/C,494.0,lv,lv-d,IVR/Online,U.S. President,1/9/20,1/12/20,,False,,False,False,1/15/20 12:15,,https://business.fau.edu/departments/economics/business-economics-polling/bepi-polls/bepi-polls-2020/biden-widening-lead-in-florida-where-trunp-has-fallen-behind.php,primary,DEM,Biden,13256.0,Joseph R. Biden Jr.,41.5,2020-01-09
1295,Florida,27.766278999999997,-81.68678299999999,97912.0,58456.0,2020.0,573.0,Zogby Interactive/JZ Analytics,,,Zogby Analytics,395.0,Zogby Interactive/JZ Analytics,C,228.0,lv,lv-d,Online,U.S. President,5/23/19,5/29/19,,False,,False,False,6/14/19 12:13,,https://projects.fivethirtyeight.com/polls/20190615_National.xlsx,primary,DEM,Hickenlooper,13326.0,John Hickenlooper,0.3,2019-05-23
1296,Florida,27.766278999999997,-81.68678299999999,97912.0,58456.0,2020.0,573.0,Zogby Interactive/JZ Analytics,,,Zogby Analytics,395.0,Zogby Interactive/JZ Analytics,C,228.0,lv,lv-d,Online,U.S. President,5/23/19,5/29/19,,False,,False,False,6/14/19 12:13,,https://projects.fivethirtyeight.com/polls/20190615_National.xlsx,primary,DEM,Yang,13329.0,Andrew Yang,1.2,2019-05-23
1297,Florida,27.766278999999997,-81.68678299999999,102919.0,59604.0,2020.0,1218.0,Florida Atlantic University,,,Florida Atlantic University,97.0,Florida Atlantic University,B/C,407.0,lv,lv-d,IVR/Online,U.S. President,9/12/19,9/15/19,,False,,False,False,9/18/19 13:17,,https://business.fau.edu/departments/economics/business-economics-polling/bepi-polls/bepi-polls-2019/warren-cutting-into-bidens-lead-in-florida.php,primary,DEM,Castro,13316.0,Julián Castro,0.0,2019-09-12
1298,Florida,27.766278999999997,-81.68678299999999,98184.0,58511.0,2020.0,1365.0,Change Research,,,Change Research,48.0,Change Research,C,1130.0,lv,lv-d,Online,U.S. President,6/16/19,6/17/19,,False,,False,False,6/20/19 11:44,,https://www.changeresearch.com/florida-poll-june-16-17-2019,primary,DEM,Klobuchar,13310.0,Amy Klobuchar,2.0,2019-06-16
